username,datatime,tweet_text,retweeted_text,likes,retweets,comments,language
Hell's Library,20210105,Every mmo ever #ps4 #playstation5 #hl # #playstation #mmorpg #ps #ps5 #pc #pcgaming #psp #pcgames #indiangamer #pcgamer #xboxseriesx #xboxone #xbox #gamesmemes #redditmemes #reddit #redditmeme #redditmemesdaily #redditfunny #gamers #gamers #gamerlife #gamingmem…,,1,1,0,english
Video Game Almanac,20210105,August 2020 PS Plus Games | News - #Action #Adventure #Arcade #Batman #Competition #Competitive #Fighter #FPS #GamePlay #Games #Gaming #Greedfall #Indie #IndieGame #IndieGaming #Maneater #OpenWorld #Playstation #Playstation4 #Playstation5 #PlaystationPlus #PS4 ...,,2,1,0,english
Nvanchev,20210105,I’m in love with the new ps5 #PS5 #ps5restock #Playstation #Playstation5 #Twitter #Tweet,,3,2,1,english
KaioteWulf,20210105,Just finished w Assassin’s Creed Valhalla and trying to figure out what to play next. Thoughts or other input appreciated! #PS5 #AssassinsCreedValhalla #GhostofTsusima #Playstation,,0,0,0,english
Lavenderapple,20210105,Replaying Sniper Elite 3 on the PS4. Sniper Elite difficulty wasn’t so bad. Authentic difficulty has no save points though so I’m not sure if I can do it hmmmmm #PS4 #playstation #videogame #gamer #gaming #sony #psn #SniperElite #SniperElite3,,4,3,2,english
DaPaPaJJ,20210105,Ummm say what?! I'm down. Let's get some traction on this #PlayStation #PlayStation5 #HorizonForbiddenWest #DeadbyDaylight #GhostofTsusima #DeathStranding,"Lord FoxxLord Foxx@LordFoxxGlobalJan 2Heads up, next stream we are doing a #ps5#ps5 giveaway! Starting the new year right.",1,0,0,english
Aussie VP,20210105,"""In the eye of the storm"" @Naughty_Dog @playstation #thelastofus #thelastofus2 #naughtydog #videogames #gaming #virtualphotography #gamingphotography #gamingphotographer #gamingscreenshot #tlou2 #psexclusive #gamer #thecapturedcollective. #playstation5 #playstation #ellie #ps5",,2,0,0,english
Aussie VP,20210105,Off to meet the Wizard... Well Meredith Stout.. @cyberpunkgame @cdpred @playstation #cyberpunk #cyberpunkart #cyberpunkaesthetic #sony #cyberpunkstyle #cyberpunkers #playstation #cosplay #scifi #cyberpunkcity #gaming #cyberpunkfashion #ps5 #virtualphotography #cdprojektred #gamer,,2,2,0,english
PS5 Underground,20210105,The wins and good news just keep coming!!! #PlayStation5 #playstation,"daniel rodriguezdaniel rodriguez@danielr10260884Jan 5thanks to you for all your support blessings brothers, my ps5 arrived on December 31, preorder gamestop 12/18, @ps5underground@ps5underground @SupplyNinja@SupplyNinja @YtNextGenGaming@YtNextGenGaming",2,0,0,english
Tash_I @MyRightGift.com,20210105,Secret boss in GoW 2 confirmed. #GodofWar #gow2 #PlayStation5 #playstation,Cory Barlog Cory Barlog @corybarlogJan 5how does a banana get a better seat than a demigod? FURIOUS! twitter.com/Ivan28807705/s…,0,0,0,english
esportzgeeks,20210105,When you are the friendly neighborhood Spiderman but you have got a class to attend. #SpiderManPS4 #SpiderManMilesMorales #Spiderman #SpiderManRemastered #Playstation4 #playstation #PS4 #PS5 #PlayStation5 #games #game #gaming_news #gaming #news #gamingchannel #gamers #gamer,Insomniac GamesInsomniac Games@insomniacgamesJan 4When you run out of Web Fluid and forgot your spare at the lab. #SpiderManPS4#SpiderManPS4,1,0,0,english
Tash_I @MyRightGift.com,20210105,"general users. Best advise I ever got was: ""Focus on the main and release. Add small things later. Users more prone to notice the updates than the original content."" @CDPROJEKTRED #Cyberpunk2077 #PlayStation5 #XboxSeriesX #playstation #xbox",,0,1,1,english
Michael Eric Brown,20210105,No. 60: Days Gone (PS4) #playstation #platinumtrophy,,1,0,0,english
chucksterinc,20210105,The Last of Us Part II (PS5 - 4K) - Walkthrough Gameplay Part 4 | SEATTLE DAY 1 #PS5 #naughtydog #thelastofuspart2 #PS4 #Playstation #Walkthrough #videogames #4k #GameOfTheYear2020 @playstation @Naughty_Dog,,1,1,0,english
Diesel Driven,20210105,The Playstation 4 menu music is the greatest music composition in history please @ me #PS4 #Playstation #game @BlazedRTs @sme_rt,,2,3,0,english
Julesmoon,20210105,Zombie fun on ps4 #callofdutycoldwar. Just wondering how I get that present? Lol #playstation #PS4,,0,0,0,english
Stitch,20210105,Here is a fun #Playstation fact! pro evolution soccer 2014 was the last #ps2 game made it came out in 2014 and shakedown hawaii was the last #ps3 game to be released it came out in 2020. So could we still see anouter ps3 game this year 2021 I mean who knows at this point lol,,1,0,1,english
Mojoswoptops,20210105,I made a scene from The Last of Us in Far Cry 5! (PS4) #thelastofus #lastofus #PS4 #Playstation #gamer #gamers #gaming #zombieapocalypse #survivalhorror #farcry #farcry3 #farcry4 #FarCry5 #farcry6 #Ubisoft #gamedev #leveldesign,,3,0,2,english
Daniel Dadashazar,20210105,1 nomad 2 street kid and last picture corpo #Cyberpunk2077 #Playstation4 #Playstation,,2,0,0,english
LadyBalls,20210105,Roackstarrrrrr why can't I pick up whores in my Weevil?! Why must you do dis to meeeeee?! WHYYY?! @RockstarGames #GrandTheftAutoOnline #GTAVOnline #GTAV #GTA #GrandTheftAutoV #GrandTheftAuto #RockstarGames #Gaming #Gamer #Playstation5 #PS5 #Playstation #FML,,3,2,1,english
Skystruck,20210105,"I Chainlink"" Leave A Comment Below. #eth2 #Ethereum #bitcoin #btc #eth #PlayStation5 #PlayStation","JunkoSuzukiJunkoSuzuki@JunkoSu22993224Dec 5, 2020Limited Edition #Chainlink#Chainlink Playstation 5 Giveaway I'm Giving Away a #PS5#PS5. To Celebrate @PlayStation@PlayStation partnership with Chainlink VRF. To Win the giveaway. Like Retweet ""I Chainlink"" Leave A Comment Below. #eth2#eth2 #Ethereum#Ethereum #bitcoin#bitcoin #btc#btc #eth#eth #PlayStation5#PlayStation5 #PlayStation#PlayStation",1,1,1,english
I1AXEL1I#DOGECOIN,20210105,Both of these are on sale atm. Immortals Fenyx Rising is $40 and Watch Dogs Legion is $30... What should I do?? #PS5 #PlayStation5 #PlayHasNoLimits #ImmortalsFenyxRising #WatchDogsLegion #Sony #Playstation,,3,0,3,english
David Drysdale,20210105,Jesus Christ!!! There's way too many wounds!!! #TheLastOfUsPart2 #PS4 #Playstation,,3,0,0,english
LadyBalls,20210105,Cayo Perico Heistin' on GTA with my new Mexican buddy P.S no I did not pick that repulsive shirt/chinos outfit (it was a pre chosen heist one) #GrandTheftAutoOnline #GTAVOnline #GTAV #GrandTheftAutoV #GrandTheftAuto #RockstarGames #Gaming #Gamer #Playstation5 #PS5 #Playstation,,2,2,0,english
Dmanthemoonman,20210105,Cyber punk 2077 but not gonna play it until I get the ps5!! #cyberpunk #Playstation #gaming,,0,0,1,english
davion pharaoh𓂀,20210105,I be waiting on y’all to come out the store i be playing dmx music when i wait for my new playstation #RegularShow #Playstation #PS5,,0,0,0,english
REBELLIOUS__ONE,20210105,#playstation #playapex #ApexLegends come watch the most chill player in apex grind (PS4) Sub games??? !social !yt !discord (55K Octane),,0,0,0,english
Tash_I @MyRightGift.com,20210105,PS5 thoughts after 2 weeks time: Simple packaging. No cheap feel Console or controller. Impressive OS so fast and clean - crasy! data transfer from ps4 to ps5. @PlayStation @sony - #PlayStation5 #PlayStation #game,,1,1,0,english
XxMajinBxX,20210105,This is one game psnow has that I wish game pass or Xbox store had. #PS5 #Xbox #PlayStation #XboxSeriesX #XboxSeriesS #MortalKombat,,0,3,0,english
PS This is Awesome!,20210105,"In case you missed it, Episode 163 dropped today! Go take it in. Subscribe to the show on your preferred podcast platform! We love ya. #gaming #podcast #playstation #playstationpodcast #ps5",,1,1,0,english
Eugene,20210105,Sony PlayStation just being lazy nobody is going to buy PlayStation 4 because of the PlayStation 5 is out I am still waiting to get my hands on the PlayStation 5 #sony #PlayStation #just #being #lazy #nobody #is #going #to #buy #PlayStation4 #because #of #the #PlayStation5 #,,0,0,0,english
Lavenderapple,20210105,Sometimes it's all so quiet........#videogame #gaming #gamer #ps4 #Sony #Playstation #survivalhorror #survivalhorrorgame #Dyinglight #DylingLighttheFollowing,,0,1,0,english
Lavenderapple,20210105,Camouflage is useful but I dislike the yellow screen XD #videogame #gaming #gamer #ps4 #Sony #Playstation #survivalhorror #survivalhorrorgame #Dyinglight #DylingLighttheFollowing,,0,0,0,english
Jiggy Jack,20210105,Anyone got a extra 2k21 ps4 current gen account i could use for a bit? Just tryna get back into the game and have some fun #schoolsreopening #2k #2kCommunity #PlayStation5 #2k21 #2k20 #2k21nextgen #2ktv #xbox #playstation #University,,1,1,0,english
Lavenderapple,20210105,This game was extremely difficult at the beginning #videogame #gaming #gamer #ps4 #Sony #Playstation #survivalhorror #survivalhorrorgame #Dyinglight #DylingLighttheFollowing,,0,0,0,english
LadyBalls,20210105,Upgraded my Vapid Peyote into a Benny's Vehicle..Happy Birthday to meeee #GrandTheftAutoOnline #GTAVOnline #GTAV #GTA #GrandTheftAutoV #GrandTheftAuto #RockstarGames #Gaming #Gamer #Playstation5 #PS5 #Playstation,,5,2,0,english
Lavenderapple,20210105,Night time horror #videogame #gaming #gamer #ps4 #Sony #Playstation #survivalhorror #survivalhorrorgame #Dyinglight #DylingLighttheFollowing,,2,1,0,english
Lost At Sea Gaming: A Podcast,20210105,#paulbunyan ain't got nothing on #eivor the #wolfkissed #lumberjack #allinadayswork #assassin #assassinscreedvalhalla #assassinscreed #xboxseriesx #xboxone #xbox #ps5 #ps4 #playstation #gaming #lostatsea #jointhecrew,,3,3,0,english
Unclequan_thegamer,20210105,45 kills #CallofDuty #CallOfDutyBlackOpsColdWar #PlayStation5 #Playstation #PS5 #gaming #onlinegaming #gamingcommunity @PlayStation @CallofDuty,,1,2,0,english
Lavenderapple,20210105,Swim away. #ps4 #gaming #gamer #abzu #playstation #sony #psn #videogame,,0,0,0,english
LadyBalls,20210105,"Apparently according to that blonde GTA whore I ""Wore her pussy out"" Her words not mine...lmaoo #GrandTheftAutoOnline #GTAVOnline #GTAV #GTA #GrandTheftAutoV #GrandTheftAuto #RockstarGames #Gaming #Gamer #Playstation5 #PS5 #Playstation",,0,0,0,english
HOLYONE The Ultimate Gamer,20210105,sony has a 5- 10 year plan.. What's microsoft's? #Playstation #PlayStation5 #Xbox #XboxSeriesX #XboxSeries #ps5restock,,0,1,0,english
Lavenderapple,20210105,Beat Shady Part of me recently. What a great game. #PS4 #playstation #videogame #gaming #gamer #PSN #Sony #ShadyPartofMe,,1,1,0,english
Randi Athenas,20210105,♚♛✸▬❉ GREAT DEAL! ❉▬✸♛♚ PlayStation 5 Digital Edition ● #Gaming #Playstation #PS5 #Sony ,,0,0,0,english
Uncharted Land,20210105,"Explain yourself, Nathan Drake! Explique-se, Nathan Drake! #ElenaFisher #Uncharted #Uncharted4 #UC #UC4 #PlayStation #PlayStation4 #PS4 #エレナフィッシャー #アンチャーテッド #アンチャーテッド4 #アンチャーテッド海賊王と最後の秘宝 #プレイステーション #プレイステーション4",,3,1,0,english
GiveMeSport,20210105,Just imagine that as part of your gaming set-up... #PS5 #PlayStation #PlayStation5,,0,0,0,english
Uncharted Land,20210105,She gets so gorgeous with the loose hair. Ela fica muito linda de cabelo solto. #NadineRoss #Uncharted #UnchartedTheLostLegacy #UC #UCTLL #PlayStation #PlayStation4 #PS4 #ナディーンロス #アンチャーテッド #アンチャーテッド古代神の秘宝 #プレイステーション #プレイステーション4,,6,0,0,portuguese
unknown,20210104,So desperate for a new #PlayStation buying a #ps3 almost seems like a good idea,,1,0,0,english
iAmDjGamer,20210104,Expanding on my podcast building a PC for my podcast good things are coming #iamdjgamer #gamer #gaming #ps #game #videogames #playstation #games #gamers #streamer #videogame #instagamer #geek #callofduty #nerd #ps4 #liveforthis #gwa,,4,0,0,english
Tpindell,20210104,"Them cheeks still got clapped, go cry to ya momma #gaming #gamer #ps5 #xbox #partychat #loser #L #playstation #reels #tiktok #shorts",,52,11,2,english
VPSharingPanda,20210104,VALKYRIE #GodofWar #santamonicastudio #Playstation #PlayStation5,,2,1,0,english
Seasoned Gaming,20210104,"Of these major titles expected to release in 2021, which is your most anticipated? #PS5 #XboxSeriesX #Xbox #PlayStation #NintendoSwitch",,75,24,26,english
𓄂 ʟᴀ ꜱᴘʜɪɴx 𓆃,20210104,"""How can this world be so beautiful yet so corrupted?"" × Here is my entry for the #IAmFenyx photomode contest! @FenyxRising @FenyxRisingFR × × #VirtualPhotography #PhotoMode #ThePhotoMode #PlayStation #PS4 #ImmortalsFenyxRising #Fenyx #Ubisoft #TheCapturedCollective #VGPUnite",,16,1,0,english
Fernando Mendoza R.,20210104,"OMFG, I was so excited to be back home to meet my new baby , it's bigger than I thought #lol Thanks! @YtNextGenGaming @BrozSir @PS5StockUpdates @spieltimes @Wario64 #ps5 #gamer #gaymer #playstation #platystation5",,12,0,2,english
MyScrewsLoose,20210104,Anyone else loving Combined Arms? Normally I'm a 6v6 type of player but I'm addicted to this now! 200+ bomb! #CallofDuty #ColdWar #Callofdutycoldwar #Multiplayer #fps #ps4 #ps5 #Playstation #COD #twitchstreamer,,5,1,0,english
AustinJocelynn Corcoran,20210104,"Big ""W"" for my Daughter and I. Thank you @PS5StockAlerts & @PSNSource. Copped on Amazon last week and it finally arrived today. #blessed #playstation #playstation5 #PS5 #Amazon #dedication #fatherdaughter #happiness",,2,0,0,english
WDragonX,20210104,When you should be playing the story but the scenery is so good you spend all your time taking photos... #playstation #ps5 #photomode #ubisoft #AssassinsCreedValhalla #ac #sony #valhalla #eivor #ingamephotography #scenery #distractions #environmentart,,2,0,1,english
Stacy Morgan (MMSportsPod),20210104,Okay #PlayStation owners. I am now wanting to collect all PS consoles. For starters I have the following: Launch PS5 Fat PS4 God of War PSP2000 Edition Which console will be better to collect? The fat editions or the slim editions(PS2/PS3) and PlayStation 1 or PS ONE.,,0,0,0,english
Ayoka Systems,20210104,Retail store Ikea has mock consoles in their stores for the PS5 and Xbox Series X to help purchasers buying a media cabinet. #Ikea #gamedev #PS5 #Xbox #XboxSeriesX #PlayStation5 #PlayStation #Microsoft #Sony,,2,4,0,english
Ethystsis,20210104,Cute might organize later #giantmicrobes #Pokemon #FinalFantasyVII #etsy #Aliens #xenomorph #minecraft #PS4 #Playstation,,2,0,0,english
Tash_I @MyRightGift.com,20210104,Aka no kill my Exs no sex. #Cyberpunk2077 #PlayStation5 #playstation #xbox #XboxSeriesX,best of video gamesbest of video games@bestofvidgamesJan 4panam palmer — cyberpunk 2077,0,1,0,english
Cult of Vergil,20210104,"The power of the sun, in the palm of (my son’s) hand! #DevilMayCry #Vergil #DMC #DMC5 #DMC5SE #PlayStation #PS5",,1,0,0,english
Mojoswoptops,20210104,I made the Tatooine sunset scene from Star Wars in Far Cry 5! (PS4) #StarWars #space #farcry #Playstation #PS4 #games #videogames #lukeskywalker #DarthVader #sunset #tatooine #leveldesign #gamedev #gameart #gamesdesign #georgelucas #Mandalorian #harrisonford,,2,0,1,english
Callum E,20210104,Am I the only one who thinks some of the ps5 pages on here chat bullshit!#ps5stockuk #ps5 #ps5restock #Playstation,,20,0,3,english
H24 News UK,20210104,Customers have been frantically searching stores online for updates after the PS5 console sold out within hours of its release across several major retailer sites #Ps5 #Playstation #OnlineShopping,,0,0,0,english
RedLineRacer48,20210104,Assassin's Creed Odyssey Episode 25 The Legend of The Minotaur part 2 #assassinscreed #AssassinsCreedOdyssey #ubisoft #ps5 #ps4 #playstation #sony #videogames #youtubegames,,0,0,0,english
Wesley Hall,20210104,"Got a ps5, turned my none gamer girlfriend into an obsessed gamer in a month, sack boy, ps plus ratchet and clank and spiderman mm are the culprits. Keep up the good work. Gaming is huge mind relief these days. #PS5 #playstation",,2,0,0,english
CrazyGamerDome,20210104,Happy New Year Gamers! Let’s kick it off with a new game added to our game list. Ghost of Tsushima is now available to play at Crazy Gamer Dome. Come on down today and experience this amazing samurai game! #Playstation #Playstation4 #Playstation5 #PS5 #GhostofTsusima,,1,1,0,english
PS5 RESTOCK AND STOCKS ,20210104,If there is a direct drop today it will be from 2-5 more than likely. So keep that tab open during the day. Will be a queue so you will have good chances of getting in :)! #PS5 #Playstation,,24,2,11,english
WarSaw ,20210104,Nice!!! #ps4 #Playstation,"DX TerrariaDX Terraria@DxTerrariaDec 31, 2020携帯型PS4 遂に完成しました！Show this thread",0,0,0,english
GG Jaykins,20210104,LET THE THWAPPENING COMMENCE! . . #thethwappening #thwappening #thotlife #cyberpunk2077 #achievement #achievements #achievementhunter #cyberpunk #ps4 #PlayStation #consolegaming #gamergirl #gamergirls #gaming #gamingCommunity #gamingposts #gamingphotography #videogames,,1,0,0,english
@Zuby_Tech,20210104,"Hearing reports PS5 being restocked keep your eyes peeled online retailers, within the next few days. #PS5 #PlayHasNoLimits #PlayStation5 #DualSense #PlayStation",,12,2,3,english
Frank JS Chiefari,20210104, Christmas gift from the best girlfriend in the world! @khmerqu3en #Uncharted #NathanDrakeCollection #Shooter #Action #ActionAdventure #NaughtyDog #SonyInteractiveEntertainment #Sony #Playstation #PS4 #Geek #Videogames #Gaming #Collector...,,0,0,0,english
Owl,20210104,So SUP3R5 is releasing 500 black PS5's on January 8th. Pros: PS2 retro look Cons: Controller $99 Digital console $649 Disc console $749 #gaming #gamer #PS5 #playstation #sony #COVID19 #Sales,,0,0,0,english
Morcis,20210104,GUYS!!! I GOT MY FIRST PLATINUM TROPHY LAST NIGHT!!! #GhostOfTsushima #PS4 #Playstation,,0,0,0,english
Gameplay Tv,20210104,"Atelier Ryza 2: Lost Legends e the Secret Fairy (26 de Janeiro - PC, Nintendo Switch, PS4, PS5) #AtelierRyza #NintendoSwitch #Playstation",,3,1,0,english
WelcomePlayer2,20210104,What’s the best game you’ve played so far on your new gen console? #WP2Gamers #gamer #gamingcommunity #game #gaming #console #consolegamers #vr #vrgamer #xbox #playstation #dadgamer #mumgamer #girlgamer #gamerdude #gamingsetup #ps5 #xboxxseries #xboxsseriers #nextgen #newgen,,2,1,0,english
Gameplay Tv,20210104,"Bladed Fury (22 de Janeiro - PC, Nintendo Switch, PS4,Xbox One) #BladedFury #NintendoSwitch #Playstation #Xbox",,1,0,0,english
Uncharted Land,20210104,"Happy birthday, Graham Mctavish! Best wishes! #GrahamMcTavish #CharlieCutter #ZoranLazarevic #Uncharted #UC #PlayStation #PlayStation4 #PS4 #グラハムマクタビッシュ #チャーリーカッター #ゾランラザレビッ #アンチャーテッド #プレイステーション #プレイステーション4",,7,0,1,english
Gameplay Tv,20210104,"Hitman 3 (20 de Janeiro - PC, Nintendo Switch, PS4, PS5, Xbox One e Xbox Series X/S) #Hitman #NintendoSwitch #Playstation #Xbox",,3,0,0,english
Abbernaffy Customs,20210104,2. Here’s a look at the upcoming Miles Morales Game pops! These look great. Pic cred from a reliable source #spiderman #spidermanmilesmorales #milesmorales #ps5 #playstation #funko #funkonews,,16,3,2,english
Abbernaffy Customs,20210104,Here’s a look at the upcoming Miles Morales Game pops! These look great. Pic cred from a reliable source #spiderman #spidermanmilesmorales #milesmorales #ps5 #playstation #funko #funkonews,,24,4,3,english
Gameplay Tv,20210104,"Scott Pilgrim vs The World:The Game Complete Edition (14 de Janeiro - PS4, Xbox One, Nintendo Switch e PC) #ScottPilgrim #Playstation #Xbox #NintendoSwitch",,6,1,0,english
Rus Weeks,20210104,We need more of this kind of consideration! #TrophyHunter #PlayStation #PlayStation5 #PS5 #Gamer #Gamers #GamersUnite #Xbox #XboxSeriesX #XboxSeriesS #MondayThoughts,GAMINGbibleGAMINGbible@gamingbibleJan 4IKEA now has cardboard cutouts of the Xbox Series X and PS5 so you can see if they fit in TV units etc...,2,1,0,english
Lillian . Mowen,20210104,The NCAA will play all of the men's basketball tournament in Indiana It's official: All 67 games of March Madness will be hosted by the Hoosier state. Selection Sunday is still set for March 14.#PlayStation5 #PlayOn #PlayStation5restock #playstation #basketball #BasketAlDia,,1,0,1,english
K1nG_En3Ru,20210104,Can't say this wasn't Dope #callofduty #callofdutymodernwarfare #modernwarfare #playstation #ps4 #streaming #guns #playstation4 #warzone #CallofDutyWarzone #gaming #gamer #videogames #firstpersonshooter #pc #pcgaming #CoD #FOLLLOW #trends #CoDBOCW #activision #treyarch,,7,2,0,english
S“Retrogaming“LB,20210104,...playing CRASH BANDICOOT 4 - IT‘S ABOUT TIME Year: Platform: Xbox (Series X) Fantastic game by @Activision #XboxSeriesX #XboxOne #CrashBandicoot #console #Playstation #game #gamers #gaming #pixelart #retrogames #Gamerlife #platformer #gamergirl #PS5,,3,2,1,english
Olivia Ellen (PerceptionASMR),20210104,"Considering buying a PS5 (when there's one in stock!) but I haven't owned a play station since the PS2 and I have no idea about games... I like fantasy/RP games and Sickboy looks fun, but no ideas otherwise... Any suggestions? #Playstation #PS5 #ps5ukstock",,2,0,3,english
Skrimachi,20210104,"Maybe @Ghostof_Mozart is right....maybe I do make horror games look silly Back with more TLOU tonight, in bio . . . #thelastofus #twitchstreamer #playstation #playstation5 #firstplay #horror #funny",,5,1,1,english
The Person,20210104,"Hey @SonyUK @Sony @PlayStationUK @PlayStation @Ask_PSUK . Now that it's 2021, time to give us a heads up when more #PS5 stock will be arriving in stores and online retailers. #PS5stock #PlayStation5 #PlayStation",,3,1,1,english
Mojoswoptops,20210104,I made The Burrow from Harry Potter in Far Cry 5! (PS4) #HarryPotter #HarryPotterWorld #DanielRadcliffe #gamer #gaming #games #videogames #leveldesign #gamedev #gameart #worldbuilding #wizardry #magic #Hogwarts #Playstation #PS4 #Xbox #Nintendo #pcgaming #art #movies #films,,2,1,1,english
Razabattang °o°,20210104,It's finally here! See our PS5 unboxing! #PS5 #Playstation,,2,0,0,english
rockaberryx,20210104,"Oh don’t mind me, I’m just thinking about all the obscure ps2/3 ips that Sony owns that should be rebooted for ps5 but Sony decides to sit on them like dragons on gold #Playstation #ps5 #playstation5",,0,1,1,english
Amazon Deals 4 U,20210104,♛●●▬▬▬۩ ℭнε¢к Їт üт ۩▬▬▬●●♛ PlayStation Store Gift Card [Digital Code] ● #PlayStation #GiftCard #PS4 #PS5 #Gaming $10.00 - $100.00 ,,0,0,0,english
The Blake Of Us,20210104,Today’s search for a #PlayStation is brought to you my my Spotify #nerd playlist of @kirbykrackle. #NerdHerd #Ps5 #Spotify,,0,0,0,english
Benjoel ,20210104,"I sometimes wonder why I continued gaming since childhood, then I look where I’ve travelled, the stories I’ve heard, the achievements, the gaming community friendships, the needed escapism during the pandemic #gamer #Gamerlife #Playstation #Playstation5 #ImmortalsFenyxRising",,2,1,0,english
Lady WitchWøłf ☾ ⚢,20210104,Episode 2 of my journey through #MetalGearSolidV Is premiering 5th Jan 2021 at 6pm GMT Link is in the bio! #youtuber #geek #ps4 #gaminglife #girlswhogame #geeky #playstation #videogames #playstation4 #geekgirl #videogamer #gamergirls #player #LadyWitchWolf #VVitchWolf #lgbtq,,2,0,0,english
Thegame344,20210104,Un remake de GTA sur PlayStation ? #PlayStation5 #Playstation #GTAV,,0,0,0,chinese (simplified)
Daniel Spiece,20210104,@AskPlayStation @PlayStationCA @PlayStation any word on when the refunds will be processed for cyberpunk 2077 I put the request in day of option to request #PlayStation5 #Playstation #Cyberpunk2077 #gaming,,2,0,0,english
Solidrak,20210104,"""EIVOR"" Basic/Edit : #AssassinsCreedValhalla : @Ubisoft_Spain : #PS4 #LikeAViking #Viking #eivor #Photography #PhotoMode #PhotoGame #VirtualPhotography #VirtualReality #ArtistOfSociety #PhotographyIsArt #VGPUnite #TheCapturedCollective #Playstation",,7,2,1,english
Ayoka Systems,20210104,There are rumors from a Twitter account that Sony PlayStation 5 may be in stock at Best Buy today at 11 a.m. CST. Good luck and keep an eye out to see if a #PS5restock is there at #BestBuy #PS5 #PlayStation #PlayStation5 #Sony,,0,0,1,english
Pierre GTI,20210104,First Monday of the year.. ..Power to the people #gamer #gaming #playstation #ps4 #ubisoft #ubisoftconnect #ghostrecon #wildlands,,0,0,0,english
Its_AK ,20210104,This might not be right but whoever ordered it on December 17 from Walmart a PS5 it’ll start shipping hopefully Wednesday there is a teeny tiny chance tmrw but it’ll take probably 2-3 to get to you #PS5 #playstation #Walmart #walmartps5 @Jake_Randall_YT @TheSiteSupply @Walmart,,2,0,2,english
MVRK,20210104,Hopefully the same is going for Sony and the #PS5! I’ve heard lots of rumours that a large consignment is due in to the UK and part of Europe this week so we’ll keep our fingers crossed! #Xbox #XboxSeriesXrestock #Sony #PlayStation,,6,1,1,english
CJ's not so professional account,20210104,The direct approach isn't always the best approach. #DemonsSouls #ps5 #playstation #pvp #GamingLife @PlayStationCA,,0,0,0,english
Mojoswoptops,20210104,I made Pride Rock from The Lion King in Far Cry 5! (PS4) #lionking #lions #wildlife #gamers #gamer #Playstation #PS4 #farcry5 #FarCry6 #Africa #leveldesign #gameart #Ubisoft #gamedev #priderock #worldbuilding #Disney #thelionking #simba,,3,0,1,english
zobe70 ॐ,20210104,Phil Spencer has a 3- 10 year plan.. What's Sony's? #Playstation #PlayStation5 #Xbox #XboxSeriesX #XboxSeries #PS5,,8,1,2,english
eric,20210104,Ps5 for sale 500. Comes with 1 game. #PS5 #ps5restock #ps5forsale #PlayStation5 #Playstation #ps5ukstock #explore,,1,4,3,english
