username,datatime,tweet_text,retweeted_text,likes,retweets,comments,language
CODE GAMINGFFCTWITCH ,20210201,"A #PlayStation look back at #2020 , Where they let the scalpers run riot over them! #PlayStation5",,0,0,0,english
Layman Video Gamer,20210201,EDIT: Hallelujah! I was finally able to get my hands on the Sony #PS5 DualSense Charging Station @GameStop! (not Best Buy) #gaming #gamer #playstation #playstation5 #PlayStation5restock #dualsense,,0,0,0,english
lvl_hed,20210201,Satisfaction guaranteed @CDPROJEKTRED @CyberpunkGame #Cyberpunk2077 #JudyAlvarez #PS5 #PSshare #PlayStation #PlayStation5 #VirtualPhotography #VideogamePhotography #PhotoMode #PhotoModeMonday #VGPUnite #GamerGram,,5,3,0,english
Elijah_Ace,20210201,Imagine DeadRising 5 and/or a DeadRising 1 Remake by @CapcomUSA_ with the RE Engine. A boy can dream. #videogames #deadrising #playstation #xbox #gaming #gaming #ResidentEvil @DeadRising @TheSphereHunter #ps5 #XboxSeriesX #dreams,,1,1,0,english
michael,20210201,@ChitoGaminYT I say there more open to @Microsoft cause they are and I’ve never owned a #Xbox just #playstation and have a PS5 now just don’t don’t like merging games for us to compete vs each other,,0,1,0,english
@Zuby_Tech,20210201,PlayStation in Review 2020! The best gaming experiences only on PlayStation! #PS5 #PlayStation5 #PlayStation #DualSense #PlayHasNoLimits Must read:,,6,2,1,english
Brezzy,20210201,Im Locked out my account because i changed numbes and Sony support is no help what so ever they ended my chat 3 times IN A ROW THEN MADE IT SO I CANT EVEN CHAT WITH THEM ANYMORE DONT EVEN WANT A PS5 IF THIS HOW YALL TREAT YALL COMMUNITY #Sony #PlayStation,,0,0,0,english
DoctorCowSlice,20210201,Finally have one of these beauties to keep me organised. #ps5 #playstation,,0,1,0,english
Andre Lauzon,20210201,Hey ⁦⁦@PlayStationCA⁩ ! We’re still looking for a #PS5! Got any hints for a family of diehard #Playstation fans? #Need_A_PS5,,2,1,1,english
Liyakate Davet,20210201,No Argos or Smyths! Only Amazon UK! Only 2 left Playstation 5 in stock on Amazon UK (United Kingdom) #ps5uk #ps5ukstock #ps5stockuk #ps5restockuk #PS5ukrestock #ps5 #PlayStation5 #UK #PlayStation #PlayStation5,,1,0,0,english
GamezSlayer,20210201,They Are No Match Against Spider-Man on Marvel's Spider-Man Ps4 #MarvelsSpiderMan #Ps4 #Playstation #Gamer #Gaming,,0,1,0,english
Sunny Midnight.,20210201,Is it wrong I don't want to play my Ps4 no more because I want the ps5? I'm lookin at this fuckin box like you peasant. #gamer #ps4 #gamers #videogames #gaming #gamergirl #playstation #ps5 #gamingcommunity #videogame,,1,0,0,english
Matt,20210201,Thanks to seeing @LouKingSharpUK post on Instagram a few days ago I got this gem. Cheers Lou! @luchalibreaaa @PlayStationUK #TripleA #AAA #LuchaLibre #PS3 #Playstation3 #Playstation,,0,0,0,english
Mojoswoptops,20210201,I made a Skyrim scene in Far Cry 5! (PS4) #skyrim #PS4 #Playstation #farcry5 #farcry6 #gamedev #leveldesign #gameart #Xbox #PS5 #XboxOne #Ubisoft #farcry #elderscrolls #ElderScrollsOnline #Bethesda #toddhoward #gaming #videogames #gamer #gamers,,2,0,1,english
Calvin 124,20210201,Got my PlayStation 5 #PS5 #PlayStation5 #PlayStation @PlayStation,,3,1,0,english
Zohaib Ali,20210201,Decade #Videogames history of #Playstation #PS5 good things of gamers men,,1,0,0,english
@Zuby_Tech,20210201,For Russian fans: Don't miss the opportunity to win one of 50 #PS5 consoles or one of 100 #PSPlus subscriptions in joint promotion with @burgerkingrus Starting today and until March 2! #PS5 #PlayStation5 #PlayStation #DualSense #PlayHasNoLimits,,3,0,0,english
Marty Kottick ,20210201,Tomorrow will be a good #PS5 day : #ControlUltimateEdition #DestructionAllStars #ConcreteGenie #PSPlus #PlayStation,,0,1,0,english
 RoyalWarHouse ,20210201,Rising Up!!! #GTSport #PlayStation #PlayStation5 #PS5 #PS5Live #TrophyHunter #Racing #MotorSport,,0,0,0,english
TheXboxHub,20210201,Prepare to slay the Gods as Eldest Souls is confirmed for #Xbox and #Playstation #XboxOne #XboxSeriesX #PS4 #PS5,,1,2,0,english
PS5 - Mania,20210201,N.27 / 28 #PS5collection + n.28/28 Madden 21 en chemin (Madden 21 on the way ) #Ride4 @MilestoneItaly #FullsetPS5 #jeuxvideo #Ps5 #videogamecollection #collection #PlayStation5 #Sony #Playstation #gamecollection #gamecollecting #videogames #gamers #ps5collection,,0,0,0,english
VideogamesHub,20210201,"#MLBTheShow21 #Xbox cover with the #PlayStation studios logo on it, is one of the strangest things you'll see today... #PS5 #PS4 #XboxSeriesX #XboxOne #MLB #MLB2021",,3,4,1,english
Ray,20210201,It's #PhotoModeMonday baby #HorizonZeroDawn #HorizonForbiddenWest #guerilla #aloy #videogames #photography #virtualphotography #PhotoMode #gaming #ps4 #playstation,,15,4,1,english
VideoGamesCanada,20210201,[PS4 & Xbox] MLB the show 21 coming to both systems in April. #MLBTheShow21 #gaming_news #PlayStation #Xbox,,0,0,0,english
Hit Start To Play,20210201,Control Ultimate Edition is free on PSPlus tomorrow! One of the Game of The Year contenders for 2019! Who's excited for it?! #PlayStation5 #PlayStation #PSPlus #podcast #PodcastRecommendations #PodernFamily #podcasting #podcaster #GamingNews #videogames #FreeGame #podcasters,,1,2,0,english
Dan Clews | RetroManDan,20210201,"Decided to tackle one from the backlog today. And what a choice, I feel bad I haven't given this a go before! Absolutely beautiful story telling and a perfect reason to dust off the PSVR and PS Move! #Gaming #PlayStation #PS4 #PSVR",,1,1,0,english
eXtremeRate,20210201,DECADE Tournament Controller Upgrade Kit - Chameleon Purple Blue #ps4 #playstation #dualshock4 #dualshock #ps4mods #rgbsetup #gaming #ps4gaming #playstationgaming #playstation4life #ps4game #ps5 #playstation5 #extremerate ⁣,,5,2,0,english
UKGamingNetwork,20210201,Game Review: #MXGP2020 on #PS5 from developer Milestone #MXGPvideogame #PlayStation #RacingGame #Gaming,,0,0,0,english
unforeseen_creations,20210201,Seeing a PlayStation Studios game on xbox is soo cursed loool #ps5 #xbox #games #mlb #MLB2021 #XboxSeriesX #Playstation #videogames,,1,2,0,english
MarcTheLlama91,20210201,NEW STEELBOOK COMING! Pre order @BestBuy Exclusive Steelbook Free with pre order. $19.99 without pre order @OnlySteelBook #residentevil #residentevilvillage #zombie #game #gamer #gamergirl #gamerlife #bestbuy #switch #xbox #xboxone #xboxseriesx #ps5 #playstation #ps4 #steelbook,,3,3,0,english
DoMinik™ ,20210201,Happy 22nd birthday to my favorite game ever made! #SilentHill #Playstation #PS5,,9,0,0,english
Unclequan_thegamer,20210201,“Love is that condition in which the happiness of another person is essential to your own.” —Robert A. Heinlein #goodmorning #MondayMotivation #DaysGone #gaming #PlayStation5 #Playstation #PS5 #photooftheday @PlayStation @BendStudio,,0,1,0,english
Playstation Classics,20210201,Watch all the Xbox players denying buying MLB the show 2021 because of their 70$ game narrative. #ps5 #PlayStation5 #Playstation #XboxSeries #XboxSeriesX #XboxSeriesS,,3,3,1,english
@Zuby_Tech,20210201,1st time in history officially PlayStation code is on Xbox. #MLBTheShow21 #MLB #BaseBall #MLBTheShow #XboxOne #XboxSeriesX #XboxSeries #PS4 #PS5 #PlayStation,,7,1,2,english
Seasoned Gaming,20210201,"Bitcast 139 is now available in all podcast formats! The crew discusses Xbox's growth and future expansion, Sony's direction with PS Plus, Biomutant returning, April/May releases, and more! #Xbox #PlayStation #Nintendo #PS5 #XboxSeriesX Links:",,12,8,0,english
IRISO U.S.A. Inc.,20210201,#IRISO has proudly had our #connectors in #PlayStation models for the past 12 years. That includes the new #PS5! What is your favorite generation of the @Sony PlayStation?,,0,0,0,english
Callum Munro,20210201,"Me and @FONZEPANTZ spoke in depth about Killzone 2, as we continued our Playstation Book Club! Make sure you give it a watch to see how we feel it has aged and what we thought of that infamous Radec boss fight. #Playstation #PS5 #PSNow #Killzone",,1,1,0,english
unknown,20210201,Something slight with Scortch on @RogueCompany #playstation #ps4 #gamer #ps4,,0,0,0,english
GamersMove,20210201,The PC version has fixed a common crash issue and will now also take a better guess at system hardware resulting in a smoother experience. #avengers #marvel #gaming #playstation #xbox #ps4 #ps5 #pc #pcgaming #ps #videogames #news #gamingnews,,1,0,0,english
TheRealSockey99,20210201,@AskPS_UK @PSACCESSFANS @giantsparrow someone owes me a Platinum trophy...#PS4 #Playstation4 #PlayStation #WhatRemainsOfEdithFinch #PSTrophies,,3,2,2,english
Photomode of Tsushima,20210201,Final batch from last night Game: #JediFallenOrder Dev: @Respawn #PMF #photomode #Gametography #VGPUnite #virtualphotography #gaming #playstation #ps4 #TheCapturedCollective #gamergram #ThePhotoMode #shareoftheweek #vpcontext #jedi #starwars #FallenOrder,,11,3,0,english
Photomode of Tsushima,20210201,Scenic views of Kashyyyk Game: #JediFallenOrder Dev: @Respawn #PMF #photomode #Gametography #VGPUnite #virtualphotography #gaming #playstation #ps4 #TheCapturedCollective #gamergram #ThePhotoMode #shareoftheweek #vpcontext #jedi #starwars #FallenOrder,,16,2,0,english
Photomode of Tsushima,20210201,Ninth Sister Game: #JediFallenOrder Dev: @Respawn #PMF #photomode #Gametography #VGPUnite #virtualphotography #gaming #playstation #ps4 #TheCapturedCollective #gamergram #ThePhotoMode #shareoftheweek #vpcontext #jedi #starwars #FallenOrder,,24,4,0,english
brian,20210201,Just blew our son’s mind #PS5 #PlayStation5 #Playstation,,1,2,0,english
S.M.P.V.Drake Valken,20210201,Perfect Creation! #playstation #PS5 #XboxSeriesX #Xbox #Ubisoft #AssassinsCreed #AssassinsCreedValhalla #gamedev #gamer #gamingcommunity,,5,4,0,english
S.M.P.V.Drake Valken,20210201,Control Runs On 1440p with Ray Tracing and using all of the dualsense features. @GermanStrands @xMBGx @TCMF2 #playstation #PS5 #ControlUltimateEdition #PSPlus,,1,0,0,english
THE KOPITE,20210201,@AskPlayStation £175 to fix my PS4 Pro really. I bought it for £200+ #PS4 #ps4gamer #Playstation,,0,0,0,english
Mike Mckenna,20210201,Sunday night was spent getting 100% District completion on this awesome game. Tonight will consist of running through NG+ for the Platinum Trophy. What are you playing? #playstation5 #playstation #ps5 #MilesMoralesPS5 #SpiderManPS5 #gamer @insomniacgames,,3,1,1,english
Dale Garratt,20210201,"Ok, who is still purchasing GTA V in 2021? Who? How are there so many people that haven't played this game yet? #PlayStation #PlayStation3 #PlayStation4 #PlayStation5 #PS3 #PS4 #PS5 #Xbox #XboxSeriesX",,0,2,0,english
GamezSlayer,20210201,Can They Catch Streets on Madden NFL 20 on Ps4 #MaddenNFL20 #Ps4 #NFL #Playstation #Gamer #Gaming,,0,1,0,english
Rus Weeks,20210201,I've had my chair stolen! I bet he's not even asleep! #TrophyHunter #PlayStation #PlayStation5 #PS5 #Gamer #Gamers #GamersUnite #WorkingFromHome #Cat #CatsOfTwitter,,1,1,0,english
ShotsFromTheStation,20210201,Ghost of Tsushima - PS4 #suckerpunch #suckerpunchproductions #ghostoftsushima #ghost #tsushima #got #playstation #ps4 #ps #playstation4 #ps5 #PlayStation5 #games #Videogame #gamers #VP #VirtualPhotography #photomode #sony #play4 #play4share #Japan #Samurai #shinobi #ninja,,15,3,0,japanese
Tushar Srivastava,20210201,The Very First Game you have played or will play on securing the #PS5? Like If you have a #ps5 and RT if not! #PlayStation5 #playstation #ps5india #ps5restock #gamer #SpiderManMilesMorales #DemonsSouls #sackboyabigadventure #HITMAN3 #NextGen,,1,0,3,english
KI,20210201,Target has the Sony Pulse 3D wireless gaming headphones for the PlayStation 5 back in stock! #thankmelater #gamer #ps5restock #ps5 #Playstation #target #target #sony,,0,1,0,english
Loukas Gaming,20210201,BIG gas plays to get a 13 kill #warzone win! #CallofDuty #CallofDutyModernWarfare #Playstation #PS4,,5,0,0,english
CRYPTEK,20210201,CLIP 25 #BlackOpsColdWar #blackops #CallofDuty #cod #codwarzone #CallOfDutyBlackOpsColdWar #Montage #sniper #Sniping #snipingmontage #tiktok #PS4 #playstation #snipingclips #warzone #meilleuraction #videogames #jeuxvideo #jeuxvideos,,4,0,0,english
childface,20210201,COD Black Ops Cold War!! #playstation #playstation5 #ps5 #callofduty #callofdutyblackops #callofdutyblackopscoldwar #cod #activision #treyarch #raven #activisionshanghaistudio #binkvideo #sledgehammergames #demonware #highmoon #beenox #childface #pablochildface,,3,1,0,english
zbudgetdirector ,20210201,"ElSapoBlanco: RT @WrongSpaceFilms: On Zoom: Playstation 5 ⁠ #ps5 #playstation #zoomhappyhour #zoommeets #watchonzoom #relatable #playstation5 ⁠ Director: @ShintatheGoat ⁠ Writer: @iamryanredmond ⁠ ""Producer"" : @jamieldavenport⁠",,2,1,0,english
TheGebs24  #Team24,20210201,#GamingMemory w/ Castlevania Lords of Shadows 2 Console: PS3 Initial release: 2014 #RT if you’ve played it #gaming #Playstation #PS3,,2,2,0,english
Mojoswoptops,20210201,I made the Great Wall of China in Far Cry 5! (PS4) #greatwallofchina #greatwall #greatwallofchina #China #chinese #imperialchina #farcry5 #farcry6 #gamedev #leveldesign #gameart #Xbox #PS4 #Playstation #gamer #gamers #gaming #Ubisoft #videogames #XboxOne #PlayStation5 #History,,8,2,1,english
Rus Weeks,20210201,"Reign of Fire is set in 2020... of course, what other year would it be set in? #TrophyHunter #PlayStation #PlayStation5 #PS5 #Gamer #Gamers #GamersUnite #Dragon #Fire",,3,1,0,english
Soulrakk,20210201,Am I the only one who sees this when accessing the #PlayStationStore? What did @PlayStation do?? #PlayStation #PS5 #PSN,,0,0,0,english
Thumbsticks,20210201,"Destruction AllStars, #Control, and The Nioh Collection headline this week's lineup of new #PS5 and #PS4 releases. #PSStore #PlayStation",,0,0,0,english
AJ,20210201,Lil buck 4K #gaming #console #ps4 #xbox #pc #r6 #r6s #RainbowSixSiege #streamer #gamer #PlayStation #Rainbow6,,4,0,0,english
Bluegeek_eyes,20210201,To everyone who is buying all the ps5 and xbox stock in bulk go suck a wet fart I have tried to get one for ages and will refuse to pay£900 for them #PS5 #Playstation #Microsoft #xboxseriersx #annoyed #shopping,,0,1,0,english
ThinkTree Media House,20210201,"First salary of the year in! Who else has pulled out an old notebook to make a budget? And on a completely unrelated note, how much does the PS5 cost? #Budget2021 #MondayMotivation #PadDay #Salary #PS5 #Playstation",,3,0,0,english
Tushar Srivastava,20210201,Just one more day to go for the most awaited console launch in India > #PS5 #PlayStation5 #playstation #gaming #ps5india #Playa #Flipkart #MondayMotivation,,2,0,1,english
Fouad Hashem,20210201,"Is my ps4 slow, or is it just a bug ..@PlayStation_ME #Playstation",,0,0,0,english
Charles,20210201,"Play Station 5 Console , Comes With One Controller And Five Games Come with $600 and it’s yours #PlayStation5 #Playstation",,0,1,0,english
AguS,20210201,Ohh Sh*t #Fallout4 #PS4 #Playstation,,0,0,0,slovak
WDragonX,20210201,Fox 1: Peek a Boo! Fox 2: This is not the time Phil. #foxes #wildlife #gaming #ingamephotography #cute #winter #AssassinsCreedValhalla #ubisoft #snow #ps5 #playstation,,3,0,0,english
Sony #TheOneandOnly,20210201,"$SNE SONY PT $1,000 Stevie is probably buying bunch of $SNE SONY TVs for his penthouse and beach house and #PlayStation5 #ps5 of course #NIKKEI $AAPL $DDAIF $GME $BB $FB $NFLX $GOOG $INTC $AMC #StayHome #StayAtHome #PlayStation #PlayHasNoLimits",,0,0,1,english
Zeddemore82,20210201,Oh Emerald Weapon was a nightmare but finally beat him (with the help of a strategy guide that helped me get to a decent level and pick up the proper items) Also knights of the round and omnislash was boss!!!! #FF7_24thanniversary #ff7 #square #playstation #ps5,,0,0,0,english
xxChaos71xx,20210201,What was the last game that you bought ?? #xbox #xboxone #xboxonex #xboxones #ps #ps4 #Ps4Pro #playstation #playstation4 #nintendo #NintendoSwitch #gamer #gamers #gamergirl #gamergirls #videogame #videogames #gaming #twitchgaming #twitchgamer,,1,1,1,english
Marcus Malleus,20210201,@PlayStation With a slider keyboard #playstation #ps5,,0,0,0,english
Marcus Malleus,20210201,This thing was ahead of it’s time. @PlayStation let’s make it happen... 2021 PSP phone #playstation #ps5,,1,0,0,english
xxChaos71xx,20210201,What was your favorite Call of Duty game ?? Let me know in the comments. #CallofDuty #ModernWarfare #ColdWar #xbox #xboxone #xboxonex #xboxones #ps #ps4 #playstation #playstation4 #videogame #videogames #gamer #gamers #gaming #blackops #BlackOpsColdWar,,4,3,2,english
Ps5Sales!!,20210201,If you need a PS5 still message me. Have a few left from my personal stock they just got delivered #PS5 #playstation5 #playstation,,5,1,2,english
xxChaos71xx,20210201,"If you had $300 to buy any games that you wanted for any console, what games would you buy ?? #xbox #xboxone #xboxonex #xboxones #XboxSeries #XboxSeriesS #xboxseriesx #ps #playstation #ps4 #playstation4 #ps5 #PlayStation5 #nintendo #NintendoSwitch",,2,2,1,english
Amanda,20210201,She’s Beautiful #ps5 #PlayStation5 #Playstation #gamer #Sony #girlgamer #streamer #smallstreamer,,5,0,1,english
Mickey,20210201,Yeah..... I carry sometimes #apex #apexlegends #apexlegendscommunity #twitchstreamer #lifeline #caustic #bloodhound #gamergirl #ps4 #playstation,,0,0,0,english
RedLineRacer48,20210201,Assassin's Creed Valhalla Episode 13 Welcome To Asgard #AssassinsCreedValhalla #AssassinsCreed #Ubisoft #vikings #ps4 #ps5 #Playstation #videogames #youtubegaming,,2,0,0,english
Epic Noob Empire,20210201,Auto chess on PS4. I’m in love!! #autochess #ps4 #Playstation #FTP #freetoplay,,0,0,0,english
Edith,20210201,The #Sony #PlayStation 5 should be renamed #scalpers PlayStation 5. #gaming #PS5 #ps4 #gamergirl #gamer #gamers,,0,0,0,english
RedSquirrel,20210201,Control: The Movie #ps4 #Playstation #XboxSeriesX #movies #PSPlus #psfree,,0,0,0,english
Adam Roffel,20210201,Going to pick up #HarvestMoon on #PS5 and get #StoryOfSeasons on #NintendoSwitch. That means I might do a let's play series (my first ever) on #PlayStation! Any tips!?,,5,1,1,english
@Zuby_Tech,20210131,Nioh Box Art for PS5! #PS5 #PlayStation5 #PlayStation #DualSense #PlayHasNoLimits,,18,5,0,english
Razkaii,20210131,What’s the worst thing about PlayStation?... Trying to decide your favourite game!! #Playstation #PS5 #gaming,,20,3,3,english
cody hoffman,20210131,"A bit of modern gaming today with #TombRaider on the #playstation #PS4. Not a whole lot of retro inspired influence here minus the property itself, sorry @Pixel_Gaiden. But a great game so far none the less.",,2,0,0,english
depressed introvert,20210131,Finally watching Mortal! Been itchin’ to watch this!! High expectations here. #Gamer #Gaming #GamersBloc #Epic #Fun #InstaGamer #NintendoSwitch #MarioKart #RetroFreak #RetroGaming #Nintendo #GamingLife #PCGaming #PS4 #Playstation #Love #Youtuber #Movie #Mortal #MovieBuff,,2,4,0,english
The East Coast Retro Gamer,20210131,Dragon Ball Sagas for the Sony PlayStation 2 complete in box. #retro #retrogame #retrogames #retrogamer #retrogamers #retrogaming #retrogaminglife #sony #playstation #playstation1 #playstation2 #playstation3 #playstation4 #playstation5 #playstationgames #playstation2games #ps2,,2,6,0,english
x_amelaa,20210131,We won our first tournament #rocketleauge #tournament #cup @RocketLeague #Playstation #ps4gamer #PS4 #Fortnite,,0,0,0,english
PS5 PLUG,20210131,Still looking for a ps5? Message us!! Only a few left!! #PS5 #ps5restocks #PlayStation5 #Playstation,,1,0,0,english
LadyBalls,20210131,Just got Platinum Trophy for Spyro Year of The Dragon...I've now officially Platinum'd all 3 Spyro games! Woohoo!#Spyro #SpyroYearOfTheDragon #SpyroReignitedTrilogy #PlaystationPlatinum #PlaystationTrophies #Gaming #Playstation4 #PS4 #Playstation #Playstation5 #PS5,,1,0,1,english
Game with Casper,20210131,Any of these hit the spot? #PS5 #PlayStation5 @PlayStation #gaming #gamingcommunity #gamer #PSone #PS4 #playstation #gamestonk #SilentHill #List #thoughts #future,,0,0,0,english
Biff,20210131,"Finished Days Gone & liked it more than I expected to. I could've handled less cut scenes & Deacon yelling but overall I think that game is underrated. Now onto Shadow of the Tomb Raider, it's my first time playing a Tomb Raider & so far it's pretty impressive. #PS5 #Playstation",,0,0,0,english
carson keller,20210131,Selling a ps5 digital version! Hmu for price #ps5 #playstation #playstation5,,0,0,0,english
Gameplay,20210131,PS4 Pros consoles available now in store! Open everyday 11-7pm. (310) 842-7776 #ps4 #playstation #dualshock4 #godofwar #uncharted #horizonzerodawn #spiderman #infamous #psn #callofduty #playstation4 #buyselltrade #losangeles #gameplayla #gameplay #la,,1,0,0,english
Daniel JRF,20210131,@PlayStationUK @PlayStationEU any reason why you’re asking for 10 grand on my monthly games? #Playstation #monthlygames #Greedfall #PS4,,0,0,0,english
craig ashworth,20210131,Finally got all the bits! #PS5 #Playstation #PlayStation5,,1,3,0,english
C H,20210131,Dear @Activision why would you think that anyone would want to download a game in multiple parts? Why the fuck is #ColdWar campaign not one single download file? Am I downloading each level separately? SO FUCKING DUMB. Last #CallofDuty I buy. #PSN #PS4 #AntiConsumer #PlayStation,,1,0,0,english
PS5ReStockAlerter,20210131,If you need a PS5 still message me. #PS5 #playstation5 #playstation,,1,1,2,english
Ren The MultiViewer,20210131,Marvel Spider-Man -Trust Issues!- [Part 50] W/ Ren The MultiViewer is now up! #PS4 #LetsPlay #walkthrough #Sony #PlayStation #gameplay #Marvel #SpiderManPS4 @Marvel @insomniacgames,,0,0,0,english
McyMole,20210131,Triple kill. #darksouls #remastered #soulsbourne #gaming #games #game #ps4 #playstation #playstation4,,1,0,0,english
Black Desert Console,20210131,We thought you could use a cute little Shai to brighten up your day! Happy #ScreenshotSunday *Player Photo Credit: Cloudz #PlayBlackDesert #BlackDesertConsole #PlayStation #PS5 #PS4 #Xbox #XboxOne #XboxSeriesX #XboxSeriesS,,75,11,15,english
Michael Milor,20210131,@Cex you bad. #ps5stockuk #CEX #Sony #Ps5 #Playstation #Xbox #Console @PlayStationUK @Sony @Microsoft @Xbox @guardian @guardiantech,"HeatherHeather@westcoastgingeJan 31This is sickening @Cex@Cex how can you justify this? No better than your average scalper on the street , you've lost my business , and I hope the business of any other self respecting gamer who is having difficulty getting their hands on a #PS5#PS5 #ps5stockuk#ps5stockuk #PlayStation5restock#PlayStation5restock",4,2,0,english
Angrysausagetv,20210131,"So I did a thing That resident evil survivor 2 code veronica, some absolute BANGERS PS3 COLLECTION HOPEFULLY NEXT ITS A BIG ONE Is 21 yrs retro yet #Playstation @retrogaminggeek @RetroGameGeeks @PlayStationUK @gamesyouloved",,7,1,1,english
LadyBalls,20210131,This Spyro Year of the Dragon Sparx 'Spider Town' mission is doing my head in #Spyro #SpyroYearOfTheDragon #SpyroTriology #Gaming #Gamer #Playstation5 #PS5 #Playstation #Playstation4 #PS4 #GameRage #SpyroReignited,,0,1,0,english
Pony Up,20210131,The relationship we need Feel free to tag your gf :P . . . . . #ps5 #gamer #gamergf #gamerboy #gamerbf #playstation #playstation5 #sony #gaminglife #gamingcommunity #games #gamergift #relationshipgoals #relationship,,0,1,0,english
Pete,20210131,Platinum trophy number 28! @telltalegames #PlayStationTrophy #PlayStation #ps4 #ps5,,2,0,0,english
MENDEKU,20210131,#TheCrew #PLAYSTATION #CALLOFDUTY #PLAYSTATION5 #GTAV #WarZone The Crew 2: RUMBO A FLORIDA,,0,1,0,english
Mojoswoptops,20210131,I made Angkor Wat in Far Cry 5! (PS4) #angkorwat #Cambodia #SoutheastAsia #farcry5 #farcry6 #gamedev #leveldesign #gameart #Xbox #PS4 #Playstation #gamer #gamers #gaming #Ubisoft #XboxOne #Buddhism #iconicbuildings #Temple,,3,2,1,english
KaamKaaji Musaafir,20210131,I need to do some Gadget Shaanti Pooja Paath. First Camera now my playstation is dead. @Sony - Would you like to Gift me a PS5 as a new year Gift #playstation #Sonyindia #PlayStation5,,0,1,0,english
Game News Kinetics,20210131,The New Tesla Model S Can Run Cyberpunk 2077 and Witcher 3. Most advance feature in Tesla #PlayStation5 #playstation #Tesla #ElonMusk #Gaming #Gamers #Games #gamedev #gamestonk #Xbox #XboxLiveGold #XboxSeriesS #Cyberpunk2077 #cyberpunk,,0,1,0,english
juixe,20210131,filler player for @TenseAcademy #fortnite #fortnitegame #epicgames #fortniteedit #fortniteclips #ps4fortnite #ps4 #playstation #playstation4 #playstationgames #ps4games #controller #controllerplayer #playstationlplayer #videogames #onlinevideogames #shooter #aimassist,,2,0,1,english
Uncharted Land,20210131,I Miss Amy so much.Sinto muita a falta da Amy. #NathanDrake #AmyHennig #NeilDruckmann #Uncharted #UC #PlayStation #PlayStation4 #ネイサンドレイク #アンチャーテッド #プレイステーション #プレイステーション4 #エイミーヘニグ #ニールドラックマン,,9,1,0,portuguese
Truthe,20210131,My mom made me some jewelry #Ps4 #Playstation #jewelry #Gamergirl #blackgamergirl #blackgamer #BlackWomenGamer,,0,0,0,english
CMwalsh,20210131,"Man, even after spending 70 hours or so playing #TheLastofUsPartII with how incredible that game looks #TheLastOfUs still looks great! The initial release on #PS3 really pushed that console to its absolute limit! #PlayStation #PS4 #PS5",,0,0,0,english
Matschi Balboa,20210131,Everybody is Welcome #conanexiles #ps4 #PS4 #conan #gaming #Server #PlayStation,,0,0,0,english
GameForgeX ,20210131,Hey... HEY EVERYONE!!! You can game on whichever console or PC setup you wish. Enjoy your games no matter what! #PC #XboxSeriesX #PlayStation #PS5 #XboxSeriesS #Nintendo #StadiaPro #XboxSeries #Sony #GamersUnite #gamers #gaming #Atari #twitchaffiliate #twitchtv,,1,0,0,english
