username,datatime,tweet_text,retweeted_text,likes,retweets,comments,language
Go2Games,20210113,R E D W E D N E S D A Y Mortal Kombat 11 on Xbox Series X is todays deal! Get over heeere! @xboxuk @mortalkombat #dailydeal #ps4 #xboxone #ps #playstation #deal #buynow #gaming #go2gamer #games #game #go2gamers #treatyourself #gamergirls #gamerguys #seriesx #xboxone #xbox,,0,1,0,english
HOLYONE The Ultimate Gamer,20210113,"Be prepared for the gaming media to do a 180 and start saying ""hardware maters"" as soon as playstation starts announcing games. Stay tuned #PlayStation5 #PlayStation",,0,0,0,english
G4M3R UNPLUGG3D,20210113,HELLO PLATINUM N°35 Very proud of this one !! #Bloodborne #PlayStation #PS4 @SkaraBraen @DaveWi11is @EmmaLou38076160,,2,0,0,english
VeryStoned,20210113,True fact: You simply cannot be a PS fan if you don't own these lights #PS4 #PS5 #PlayStation,,0,0,0,english
HOLYONE The Ultimate Gamer,20210113,"Be careful of so called neutral passive aggressive ""gamers"" always looking for the negative more than positive with playstation exclusives. There part of that tribal mindset Phil Spencer was talking about. Terrible for gaming #PlayStation #PlayStation5",,0,0,0,english
Cult of Vergil,20210113,"“You’ve heard of it, haven’t you? The Legend of Sparda.” #DevilMayCry #Dante #Sparda #DMC #DMC5 #DMC5SE #PlayStation #PS5",,0,0,0,english
Stinky_Pole,20210113,Placide of The Voodo Dolls Game: @CyberpunkGame Developer: @CDPROJEKTRED . #Cyberpunk2077 #Cyberpunk #NightCity #Placide #Playstation #PlaystationAU #PS5 #Gamergram #Photomode #VirtualPhotography #Nextgen,,7,3,0,english
Gameplay,20210113,"Great titles available now for PS2, PS3, PS4, Wii, & Xbox One! Open everyday 11-7pm. (310) 842-7776 #wii #ps2 #ps3 #ps4 #xboxone #xbox #nintendo #playstation #finalfantasy #dragonballz #nintendowii #godofwar #buyselltrade #retrostore #gameplayla #la #losangeles",,0,0,0,english
Barbados Black,20210113,Power to the Player @PlayStation @MichaelKors #PlayStation #PlayStation5 #designer #model #barbadosblack,,2,0,0,english
Mando,20210113,What gaming console do ya’ll play on? Right now my main is PS but i just got the series X and need peeps to play GOW or Destiny online #playstation #Xbox #Sony #Microsoft #PS5 #GearsOfWar #XboxSeriesX #Destiny2,,3,1,0,english
Rus Weeks,20210113,Why is it that the most relatable character is a four-armed cantankerous and curmudgeonly midget? #TrophyHunter #PlayStation #PlayStation5 #PS5 #Gamer #Gamers #GamersUnite #StarWars #JediFallenOrder,,0,1,0,english
S A M | The Book in Hand_,20210113,I am dying to play this game!! The Pathless is developed by those who made the magic that was Abzu and... IT LOOKS AMAZING! #ps4 #PlayStation #ThePathless #GiantSquid,,18,2,3,english
CoalaTV ,20210113,The World of Cyberpunk 2077 Pt 4 #Cyberpunk2077 #PlayStation5 #PlayStation,,148,16,3,english
Sean LeeRoy,20210113,"#playstation4 #playstation has banned me again, and I have not even used anything in a few days to a week sine being unbanned. and not allowed to request for assistnce through playsation website. #classactionlawsuit",,0,0,1,english
"3Doug & his 3Droid ""RAYTRACING IS BIGGER THAN U""",20210113,Lovely #Ikaruga #retrogaming #shmup #arcade #videogames #PS4 #PlayStation by @PikiiGK,,21,6,1,english
Jedner,20210113,"360s, 720s, no scopes, quickscopes, you name it, its all here at JednerGaming... a look at what goes on daily in the PuckU Clan, we don't lose and we don't give up. Our All-Star player: Jedner. #gaming #game #playstation #xbox #callofduty #gtav #sony #ps4 #ps5 #pcgame",,3,0,0,english
matt borjes.,20210113,Which comes first? Metal Gear Solid: The Movie or Metal Gear Solid Remake #MetalGearSolid #PlayStation #PS5,,0,0,1,english
QuimicoGamer,20210113,Noche de Bullying! #residentevil #residentevilresistance #remake #re #ps5 streams en las noches por #fblive #biohazard #ps #capcom #jillvalentine #playstation #gamer #gaming #chrisredfield #leonkennedy #adawong #videogames #nemesis #umbrellacorporation,,2,0,0,spanish
Just Add Monsters,20210113,What do you think of the news from Lucasfilm games? Are you excited for a new Indiana Jones adventure? What about an Ubisoft Star Wars game? #gaming #StarWarsTheHighRepublic #IndianaJones #PlayStation #Ubisoft #Playstation4 #LucasfilmGames #Lucasfilm,,5,3,0,english
AFuzzyRainbow,20210113,EA will no longer have exclusive access to the #StarWars franchise! Lucasfilm Games will be working with more and more devs across different companies to bring a wider variety of games across the Starwars universe. #Xbox #XboxSeriesX #PS5 #PlayStation,,3,0,2,english
Destiny,20210113,Can anyone recommend me some good playstation games? #ps4 #PlayStation,,0,0,0,english
TimdyGaming,20210113,"Hey, ich bin Tim. #PS5 #Dualsense #PlayStation #Playstation5 #nanoleafs",,1,0,0,german
Rebekah,20210113,"@AskPlayStation #devtalk here me out #PlayStation, what if you made custom side panels for the #PS5 sold with the game as a bundle!! Could even be sold with #customcontroller. That would be lit!!! A #MilesMorales #PS5 with control, #takemymoney !!!",,0,0,0,english
snazzyAI,20210113,This is how I hope The Last Guardian will look on PS5 if it gets a bespoke PS5 release :) #lastguardian #thelastguardian #PS5 #PlayStation5 #PlayStation #teamico #ICO,,0,0,0,english
Alexander Da Mota,20210113,"<-- #DaMotaGaming #FrostPunk I didn't buy it yet, but as a fan of This War of Mine, I'd like to try it. #youtubegaming #gaming #gamer #game #videogame #videogaming #ps4 #playstation4 #playstation",,0,0,0,chinese (simplified)
Delirium Blackgate Studio,20210113,"Greetings, young delirians! He's the one who is doing the OST of the game, are you excited to listen the full song? Just wait a little for it #PSTalents #PlayStation #videogames #devfromspain #gamedev #indiegames #indiedev #Music #OST #PS4 #PS5 #Deliriumbg",Fernando CabreraFernando Cabrera@cabreracomposerJan 13Sneak peek of what’s coming up next @delirium_bg@delirium_bg #GameAudio#GameAudio,5,4,0,english
Gamers Going Big,20210113,Lol leon wouldve had a blast hahah #gamer #gamersgoingbig #videogames #pokemon #nintendo #nintendoswitch #playstation #legendofzelda #xbox #ps5 #marvel #dc #mario #xboxseriesx #godofwar #supersmashbrosultimate #metroid #megaman #mariokart #RE4,,2,1,0,english
Boss Level Games  P5 Royal,20210113,Today's pick up. Another of those that I traded in the past but want for the shelf! #dragonage #ps4 #bioware #draginageinquisition #gamescollector #gamescollection #playstation #onefortheshelf,,1,0,0,english
The Guardian of the North,20210113,From the Winter Wolf to The Red Ranger #Destiny2 #PlayStation5 #PS5 #PlayStation #TheGuardianoftheNorth,,2,0,0,english
WolfJillyJill/BLM,20210113,The entire view. #TheLastofUsPartII #tlou2 #Ellie #elliewilliams #YouCantStopThis #PS4 #PlayStation #naughtydog #finalfantasy #finalfantasy7 #finalfantasy7remake #clerith #CloudStrife #aerithgainsborough,,11,2,1,english
WolfJillyJill/BLM,20210113,My collection is finally complete & my display has reached maximum greatness. #TheLastofUsPartII #tlou2 #Ellie #elliewilliams #YouCantStopThis #PS4 #PlayStation #NaughtyDog,,33,2,6,english
@Zuby_Tech,20210113,And Updated 2021 Game Dates: #PS5 #PlayStation5 #PlayHasNoLimits #DualSense #SIE #PlayStation,,25,4,4,english
@Zuby_Tech,20210113,"Possible PlayStation Road Map: Game release's dates prediction on previously released games and dates. Reminder PlayStation Studio's has almost 3,000 Developer's Worldwide. #PS5 #PlayStation5 #PlayHasNoLimits #DualSense #SIE #PlayStation",,56,9,7,english
Hairspray2000,20210113,Currently looking into filing a lawsuit against #PLAYSTATION #askplaystation for banning my PS5 account without explanation. I received zero emails about the reason. I do not have PS+ account or an inappropriate handle. DO NOT BUY THE PS5. THIS MAY HAPPEN TO YOU.,,0,0,0,english
Blindyetti,20210113,I got a PS5 bundle preordered last week through GameStop expected to ship by the 29th but this morning I looked and it said it’s “preparing for shipment” should I be excited that it’s going to ship early or is this just gonna sit like that till the 29th? #Playstation #gamestop,,2,0,1,english
Hritwik Raj,20210113,"#PS5IndiaRelianceDigitalPreorderMess #PS5 #PlayStation5 #PlayStation Once again, Reliance Digital has cancelled the preorders of people who successfully paid for the product. Now you all know - where not to go for your next pre-order.",,6,3,0,english
Gamers Going Big,20210113,Lol looks different #gamer #gamersgoingbig #videogames #pokemon #nintendo #nintendoswitch #playstation #legendofzelda #xbox #ps5 #marvel #dc #mario #xboxseriesx #godofwar #supersmashbrosultimate #metroid #megaman #mariokart #dbzfighterz #dragonballz,,0,1,0,english
WolfJillyJill/BLM,20210113,"Now whenever I do actually dust off my xbone & play it, I can do so comfortably with this far superior layout that doesn't trigger the pain in my wrists. #Xbox #XboxController #Thrustmaster #CustomController #PlayStation #PlaystationController #PS5 #Dualsense #XboxOneX",,4,0,1,english
NeoDIY.com,20210113,Aliens #PS5 #PlayStation5 #PlayStation #Returnal,,0,0,0,english
Simon Frs,20210113,@PlayStationFR @PlayStation Where is the Playstation 5 stock at? When can we expect some in France? Où sont les stocks de PS5 svp? #PS5 #PlayStation5 #ps5stock #PlayStation,,0,0,1,english
Falz,20210113,PlayStation games WE (me) would love to play .. A new 007 John Wick Medal of Honour (remastered) Rage Cage drinking game (VR edition) Indiana Jones (rumours of this happening) #PlayStation5 #PlayStation @IGN,,3,0,2,english
Ray,20210113,The Ultimate Nerd Car! #GranTurismo #granturismosport #racing #RacingGame #Ferrari #car #photography #videogamephotography #PhotoMode #ps4 #playstation #virtualphotography,,6,0,0,english
John Crist ,20210113,Yeah that wasn't so bad. The DLC is like 4 hours long. #SpiderManRemastered #PS5 #PlayStation5 #PlayStation #trophyhunting,,0,1,0,english
ingame.de,20210113,#PS5: Sony schaut sich neues Notiz-Feature bei Dark Souls ab #playstation #PlayStation5,,0,0,0,german
NeoDIY.com,20210113,Did #sony really thought of making #PS5 #PlayStation5 #PlayStation looks like this before? They say it's one of the dev kit model. It looks really cool though,,2,1,0,english
porterlone,20210113,■ life's a game #indieart #indie #Playstation #indieartist #japan #iridescent #matrix4 #artist #indiemusic #music #futurebass #undergroundart #lofi #musicians #songwriter #song #edmfamily #PS5 #visualartist #photoshop #fakereality #indiephotography,,2,0,0,english
Solidrak,20210113,"""THE CASTLE"" : #AssassinsCreedValhalla : @Ubisoft_Spain : #PS4 #LikeAViking #AssassinsCreed #Photography #PhotoMode #PhotoGame #VirtualPhotography #ArtistOfSociety #PhotographyIsArt #VGPUnite #TheCapturedCollective #Playstation #VPEclipse #WorldofVP #ACPhotoMode",,10,2,1,english
Jay Parks,20210113,Getting PS5 TODAY SO EXCITED!!!!! #ps5 #fortnite #PlayStation #FYP #FortniteSeason5 #FortniteNews,,2,0,0,english
Charlotte,20210113,I had a great time being able to take amazing screenshots in this game! Managed to get platinum for it too! #PS4 #Playstation #SpiritoftheNorth #Playstationscreenshots #Game #Gaming,,0,0,0,english
Terry ugly ahh,20210113,All the “Xbox is better than PlayStation “ people now coming over to the best side trying to join the wave #PlayStation5 #PlayStation #Xbox,,1,0,0,english
Static Multimedia,20210113,Hitman 3 Deluxe Edition Unboxing #videogames #playstation #PS4 #PS5,,0,0,0,english
simran mikhail,20210113,Looking for some friends to play nhl21 on PS4. Or call of duty warzone/ cold war #ps4 #PlayStation,,2,0,0,english
John Crist ,20210113,Unpopular Opinion: The #PlayStation5 #PS5 won't ever get VRR support. Sony just hasn't removed the verbiage like they did with the X900H 6 months after it released. #PlayStation,,0,0,1,english
PS5 Shots,20210113,"Just got 100% of the trophies for this amazing game, can’t wait for Forbidden West #HorizonZeroDawn #HorizonForbiddenWest #guerrillagames #playstation #ps5 @Guerrilla",,0,0,0,english
PS5 - Mania,20210113,13/01/2021 Sortie du Jour/ Release of the Day #ps5 : PSN : #neonchrome @10tonsLtd #FullsetPS5 #jeuxvideo #videogamecollection #collection #PlayStation5 #Sony #Playstation #gamecollection #gamecollecting #videogames #gamers #ps5collection,,2,0,0,french
Game Jungle,20210113,Need to get that PS5 so my brain will stop doing that thing with the thoughts and stuff. #meme #videogame #gamer #xbox #playstation #nintendo #sad,,0,0,0,english
Playstation El Clasico,20210113,Concrete Genie i wonderful #PS5 #PLAYSTATION,,1,0,0,english
Rob Heath,20210113, WIP of current #b3d project. #MetalGearSolid #PlayStation #PlayStation5 #PSN #solidsnake @DavidBHayter @HIDEO_KOJIMA_EN @Kojima_Hideo,,1,1,1,english
ayaan,20210113,#PlayStation bcz fortnite is getting dead and ps5 will give u best gaming experience,,0,0,0,english
Sphinx Computers Co.,20210113,What do you guys want to say? . . . . . #sphinxcomputers #videogame #winning #instagaming #videogames #playstation #xbox #onlinegaming #game #gaming #gamer #playinggames #online #play #games #playtime #player #gaminglife #playing #xboxone #players #playstation4,,0,1,0,english
Average Ant Games,20210113,Wall Market is here! Ep 5 pt1 up now! Hope you enjoy! #FinalFantasyVIIRemake #playthrough #ps5 #PlayStation,,0,0,0,english
Ping pong posse club,20210113,Fifa goals of the week @EASPORTS @EASPORTSFIFA #fifa #easports #FIFA21 #goalsoftheweek #goals #football #playstation #PlayStation5 #xbox #sony #Microsoft #gamer #videogames #whosmelody #pingongposseclub #goals,,1,1,0,irish
The Gaming Monkeys ,20210113,"@CallofDuty Black Ops #ColdWar #Zombies is free on #PlayStation, @Xbox, and PC TOMORROW'S Cold war was release just 2 months ago Enjoy! #PS5 #codzombie #ps4",,1,0,1,uzbek
Brandon muscle powa,20210113,Lord have mercy on the diamattis! #Warzone #CallofDuty #CallofDutyModernWarfare #ps5 #PlayStation #Warzoneclips #PCGaming,,6,0,0,english
Solidrak,20210113,"""A RAY OF HOPE"" : #AssassinsCreedValhalla : @Ubisoft_Spain : #PS4 #LikeAViking #AssassinsCreed #Photography #PhotoMode #PhotoGame #VirtualPhotography #ArtistOfSociety #PhotographyIsArt #VGPUnite #TheCapturedCollective #Playstation #VPEclipse #WorldofVP #ACPhotoMode",,8,3,1,english
8Bit | Gaming & Collecables,20210113,Every day I’m loving this view more and more. The green and purple is my thing right now #gamersetup #gamer #rgb #rgblights #rgblighting #rgbled #nerd #nerdsetup #collectables #8bit #8bitart #8bitgames #8bitgaming #royaltyrgb #playstation #ps5 #nintendo #themandalorian,,11,0,0,english
Aussie VP,20210113,Date Night @JC_Roundy @cyberpunkgame @cdpred @playstation #cyberpunk #cyberpunkart #cyberpunkaesthetic #sony #cyberpunkstyle #cyberpunkers #playstation #cosplay #scifi #cyberpunkcity #gaming #cyberpunkfashion #ps5 #virtualphotography #cdprojektred #gamer,,3,2,0,english
PS5 Stock+ Alert App,20210113,"Hi Beautiful people from #India, do you guys happen to have the direct PS5 amazon product links ? #technews #indianews #smartphones #latestnews #technologynews #ps5 #ps5pro #ps5memes #ps5games #ps5forsale #playstation5 #playstation #playstationindia #ps5reveal #instatech",,1,0,1,english
AY  ,20210113,When #PlayStation delayed the release of #PS5 (white) & introduced #black-themed #PS4 to support #BLM movement:,,0,0,1,english
Unclequan_thegamer,20210113,"I wake up every morning and think to myself, how far can I push myself in the next 24 hours #goodmorning #wednesdaythought #HorizonZeroDawn #PS5 #Playstation #ps4 #gaming #photooftheday #art @PlayStation @Guerrilla",,1,1,0,english
iVLOGYT,20210113,New Treyarch’s legendary Zombies mode will be available in Call of Duty: Cold War for free during Zombies Free Access Week #CallOfDuty #COD #ColdWar #CODColdWar #Xbox #PS #PlayStation #PS5 #XboxSeriesS #XboxSeriesX #XboxLive #XboxLiveGold,,2,1,0,english
Clownslice,20210113,"Its the year 2022, retailers finally have ps5 in stock 2 years after launch @PlayStationUK @PlayStation #ps5 #playstation",,0,0,0,english
Kevin Hudson,20210113,"@PlayStationUK @AskPS_UK any ideas why my upload speeds are stupidly lower than my download speeds, is there a fault with the socket on my PS5? Any help would be greatly appreciated #ps5 #PlayStation #InternetIssues",,0,0,2,english
Solidrak,20210113,"""GOOD MORNING"" : #AssassinsCreedValhalla : @Ubisoft_Spain : #PS4 #LikeAViking #AssassinsCreed #Photography #PhotoMode #PhotoGame #VirtualPhotography #ArtistOfSociety #PhotographyIsArt #VGPUnite #TheCapturedCollective #Playstation #VPEclipse #WorldofVP #ACPhotoMode",,11,2,1,english
PS5 News Update Nr.1,20210113,PS5 Digital and Disc in Stock at Target !!! Xbox also #ps5 #ps5amazon #PS5Updates #playstation #PlayStation5 #updates,,1,0,2,english
XNVR,20210113,How to fix FIFA 21 performance issues on PlayStation 5 #FIFA #FIFA21 #Glitch #Playstation #Playstation5 #EA,,0,0,0,english
Solaire Astora,20210113,Hmmm was soll ich spielen? #PlayStation #FinalFantasy #NieR #NieR_tokyo #SquareEnix #ps5 #game #action,,1,0,0,german
Goddess Hylia Zelda ,20210113,"Just bought some #Xbox Gear and #PlayStation #ps5 Gear!!!!! Got couple hoodies, a beanie hat, a PlayStation water bottle, PS5 joggers, Xbox hoodie, Xbox Shock Blue controller, and a PlayStation hooded helmet hoodie!",,1,0,0,english
Entertainment Junkie,20210113,Secured a #PS5 today. Now I have the best of both worlds. @PlayStation @Xbox #gaming #gamer #games #videogames #xboxseriesx #playstation5 #microsoft #sony #gamingconsole #nerd #selfie #entertainment #xbox #playstation #nextgeneration #nextgen #thewitcher3 #reddeadredemption2,,3,2,2,english
Dooka_TV,20210113,Streaming #HorizonZeroDawn right now side quest. Come say whats up! #PS5 #PS4 #twitchstreamer #PlayStation #PlayStation5 #Playstation4,,0,0,0,english
john paul vasquez,20210113,What a night. Playing @BendStudio Days Gone on the @Sony PS5 and harvesting my crops and @hayday in between cut scenes. It don't get much better than this. #ps5 #hayday #gamer #juggalo #gamerdad #daysgone #greatgame #PlayStation5 #PlayStation,,2,1,0,english
Justin Beale,20210113,Thinking about using this account to share gaming content like clips & pics.. here’s a recent shot from Uncharted: The Lost Legacy. #Uncharted #PlayStation5 #playstation #ps5,,0,0,0,english
David Drysdale,20210113,And I thought the 1st game was violent. This is on a whole different level #TheLastOfUsPart2 #PS4 #Playstation,,2,0,0,english
PSN modding Service! ,20210113,BO3 godmode done #psn #ps3 #ps4 #avi #avatar #hack #hacker #modded #cfw #playstation #bo3 #blackops3 #cod,,0,0,0,english
Sir_Liam The Legend,20210113,"Alrighty Day 2 of #weekofgeek by @teechudesigns & today theme is Childhood, basically the gaming console you grew up with; I’m a #Playstation boi so of course it’s the iconic #Playstation1 • • #PlayStation5 #Teechu #gaming #gamingcommunity #GamingLife #gaminglife #Twitter #lol",,1,1,1,english
John Kozuch,20210113,Cold War #CallOfDutyBlackOpsColdWar #BlackOpsColdWar #ColdWar #PS4 #PlayStation #Xbox,,3,0,0,english
Chandrashekhar B,20210113,"My #PS5 Orders, Thanks to @amazonIN & @cromaretail #PlayStation5 #ps5india #PlayStation @PlayStationIN",,0,0,2,english
TheFuriouswc,20210113,Iq gun takes up more space than van parking in 4 spaces. #rainbow #siege #six #rainbowsixsiege #ps4 #gaming #xboxone #ubisoft #xbox #playstation #rainbow6siege #games #r6 #sixpack #r6siege #r6s #clip #Rainbow6memes #r6smemes #rainbow6siegememes,,2,0,0,english
Blade Cook,20210113,"Soooo, is it just me or does anyone else want @Bungie/@DestinyTheGame to update D1 to 60fps around the board for the New Gen consoles??? I would pay for this to happen tbh. #bungie #Destiny #Destiny2 #destinythegame #PlayStation #PlayStation5 #Xbox #XboxSeriesX",,0,0,0,english
just_TRA,20210113,Solid Teamwork!!! Song: Maine Musik - Go Crazy #apex #apexlegends #apexlegendsclips #apexlegendscommunity #apexranked #6kills #playstation #playstationclips #playstationcommunity #Xbox #xboxclips #xboxonex #xboxseriesx #ps4 #ps5,,1,1,0,english
Bring Back Transit,20210113,@Treyarch BRING BACK TRANSIT ZOMBIES WE WILL ALL LOVE YOU FOREVER #cod #CallofDuty #coldwarzombies #ColdWar #XboxSeriesX #Xbox #PlayStation #PlayStation5 #gaming #MessageToGOT7,,3,2,1,english
Uncharted Land,20210113,Euro Training! #CharlieCutter #Uncharted #Uncharted4 #UC #UC4 #PlayStation #PlayStation4 #PS4 #チャーリー・カッター #アンチャーテッド #アンチャーテッド4 #アンチャーテッド海賊王と最後の秘宝 #プレイステーション #プレイステーション4,,2,0,0,english
WarhammerDave,20210113,"Doesn't need to go to #Playstation to play it either as you can play it on your smartphone and tablet, soon smart TV, internet browser not to mention you can even use ps5 controller with #Xbox #CloudGaming Its about time #Xbox has big exclusives #Ps5 has an insane amount",,1,0,0,english
Symmantrix,20210113,Noice! #activision #CallOfDutyBlackOpsColdWar #CallOfDuty #BlackOpsColdWar #gamer #gaming #PlayStation #pc #xbox #Warzone #SeasonOne #BattleRoyale #ModernWarfare #cod #PS4 #ps5 #XboxSeriesX #rebirthisland,,3,2,0,swedish
Super Average Gaming,20210113,"The Super Average Gaming team talk Sony discontinuing #PS4 models, what it means for #PS4, #PS5, and how it breaks from previous console cycles! Full pod out on Apple, Spotify, Google & Stitcher! #videogames #gamingpodcast #videogamepodcast #playstation",,4,1,0,english
Caroline LeVere-Williams,20210113,**** 2 PS5 Raffle's**** $25 for Console & $20 for Digital both include a $25 giftcard to Gamestop. #raffle #ps #playstation #xbox #gaming #gamer #games #xboxone #xboxseriesx #game #videogames #fortnite #pc #memes #gta #sony #fifa #k #pro #nba #callofduty #nintendo #gamers,,5,3,1,english
Red Dead DAN,20210113,What y'all playing on? #PlayStation #XboxSeriesX #Xbox #PS5 #PlayStation5,,2,1,1,english
John Crist ,20210113,"""Wireless controller battery is low."" - #PlayStation5 #PS5 #PlayStation #Dualsense",,0,0,0,english
gabriella ferri ,20210113,"i know this information is about men, my husband and PS4, and if anyone wants to play with him on Line the name and mine. Gabriella Ferri “di. Miao-rimasto” #PlayStation",,1,0,0,english
VideogamesHub,20210113,"Personally, after seeing what they were able to achieve with Sadie Adler in #RedDeadRedemption2 i am extremely curious to see what they came up with if this turns out to be true... #PS5 #XboxSeriesX #GTA6 #GTAVI #Xbox #PlayStation5 #PlayStation #RedDeadRedemption #RedDeadOnline",VideogamesHubVideogamesHub@VG_HUB_Jan 13According to some rumors going around the internet these days the next GTA will feature a female protagonist for the first time in the history of the franchise #GTA6#GTA6 #GTAVI#GTAVI #GTAOnline#GTAOnline #PS5#PS5 #XboxSeriesX#XboxSeriesX #Xbox#Xbox #PlayStation5#PlayStation5,1,2,0,english
KennyWonKenOhBe,20210112,@bestbuy came through two days early for my pick-up of my #ps5 !!!!!!!! Time to be very irresponsible for the rest of the night by gaming and putting work to the side. This is the way. #gamer #gaming #ps5 #playstation #ftw,,1,0,0,english
Subnation,20210112,PS5 owners hoping that #Microsoft allows Bethesda to release the next Indy game on #Playstation ,,3,2,0,english
Sac City Gaming,20210112,"My #PlayStation5 Media remote was just delivered. Can't wait to open and set it up, the wait was worth it. #playstation5mediaremote #PlayStation #sony #videogames.",,0,0,0,english
Salt Squad One,20210112,Spider-Man: Miles Morales PS5 Credits 4K60FPS (I'm Ready By Jaden Smith) #SaltSquadOne #facebooklive #facebookgaming #ps5 #playstationasia #playstation #ps5live #gamer #gaming #spidermanmilesmorales #spiderman #playhasnolimits #fbgg #FacebookGaming,,0,0,0,english
Gaz,20210112,Sweet Mary Beth #rdr2 #reddeadredemption2 #arthurmorgan #gamingphotography #photomode #sadieadler #johnmarston #abigailroberts #micahbell #dutchvanderlinde #gta #gta5 #gtaonline #virtualphotography #digitalphotography #reddeadonline #rdo #xbox #playstation #ps5 #xboxseriesx,,17,2,0,english
RedSquirrel,20210112,Horizon Zero Dawn: The Movie #HorizonForbiddenWest #HorizonZeroDawn #horizon #Ps4Pro #ps4 #PlayStation5 #PlayStation,,0,0,0,english
@Zuby_Tech,20210112,#DualSense taken apart! #PS5 #PlayHasNoLimits #PlayStation5 #DualSense #PlayStation,,7,2,0,english
PS5 News Update Nr.1,20210112,Amazon expects the consoles to sell in the course of calendar week 3. Source: Gameswirtschaft #PS5 #ps5restock #ps5amazon #amazon #PlayStation5 #PlayStation #PlayStation5restock,,2,0,1,english
Kyle Smith,20210112,Nerd self was super pumped to find this on marketplace today always wanted to give it a shot! #playstation #playstationmove #ps3,,3,0,1,english
damiandrew,20210112,Ahhh sweet memories... #PlayStation #PS5,,2,0,0,english
yuhoki,20210112,All we want is an 4-door Squaddie. @RockstarGames @RockstarSupport #GTAOnline #PlayStation5 #PlayStation #PC #XboxSeriesX #PS4 #RockStar #rockstargames #GrandTheftAutoV #GTAV #GTA #,,3,0,0,english
Alexander,20210112,"Can I use Playstation VR on the new PS5? Please let me know, thank you! @PlayStation #playstation #playstationVR #help #helpplease #playstationsupport #likeToShare",,0,0,0,english
Black Jack,20210112," Whenever you say ‘Spider-Man,’ you always mean the other one. YOU’RE Spider-Man. You can fix this. #SpiderManMilesMorales #MilesMorales #BeGreater #BeYourself #PhotoMode #PS5 #PS4 #PlayStation...",,0,0,0,english
Tom L | TJL93 ,20210112,"As a primary PS4 and Switch player, Xbox can have Indiana Jones. We good. #NintendoSwitch #PlayStation #Xbox",,4,0,2,english
VPSharingPanda,20210112,"WHIPLASH Here some Blade of Chaos for you, ENJOY! #kratos #bladeofchaos #santamonicaatudio #playstation #playstation5 #ps5",,0,1,0,english
