name,score,title,place,date,verified purch,text,upvotes,language
Jessica,5,nan,the United States ,20201112,True,  Great system.,0,english
Reyes,5,Goodbye ps4....,the United States ,20201209,True,  Amazing console love it,0,english
Ruby,5,Great,the United States ,20201230,True,  Best thing I bought on Amazon,0,english
LPoole,5,PS5 ,the United States ,20201228,True,  Love my system!,0,english
Amaurys Vargas,5,Arrived on launch day! Works no issues!,the United States ,20201112,True,  Thank you Sony ! And Thank you Amazon !,0,english
Steve Givens,5,Awesome Upgrade,the United States ,20201217,True,  The PS5 is an excellent upgrade from the ps4.,0,english
Siraj,5,it was great work and fast ship,the United States ,20210115,True,  i love it,0,english
Matthew Cantellano,5,Great!,the United States ,20201127,True,  The PS5 is just great. I love the new triggers!!!,0,english
Youcef Taleb,5,Literally defies the next generation. ,the United States ,20210103,True,  Literally defines the next generation. ,0,english
Tyler B,5,Awesome!!!,the United States ,20210103,True,"  Instant load times, and amazing graphics!",0,english
Brush,5,We love it!,the United States ,20210117,True,  Awesome,0,english
Wayne,5,True Next Gen,the United States ,20201112,True,  This console is just amazing and crazy innovative,0,english
stephen j mcgowen,5,Easiest website to cop on,the United States ,20201113,True,  Cleanest website to cop it on. Thank you amazon!!!,0,english
Quan,5,Great console,the United States ,20201228,True,  Amazing fast shipping and great console,0,english
Rafi,5,Nice,the United States ,20210116,True,  Nice,0,english
Amazon Customer,5,Day 1 owner,the United States ,20201114,True,  Thank you! Thank you! Thank you!,0,english
anthony mercado,5,All,the United States ,20210104,True,  Was what was expected.,0,english
Brandon Big Soldier,5,It’s a ps5 and it’s great.,the United States ,20201114,True,  I absolutely love this console.,0,english
Zagamusic,5,PS5 is worth it! Next gen is here!,the United States ,20201116,True,  Amazing system. So amazing I had to get 6!!!,0,english
Leo,5,Amazon fast shipping!,the United States ,20210122,True,  Fast shipping great console !,0,english
Gui,5,Nice!,the United States ,20210102,True,  Very nice. Love it!,0,english
Matt stark,5,ps5,the United States ,20201224,True,  best console ever,0,english
Stanislav Z.,5,great!,the United States ,20201130,True,  thank you amazon for making me happy,0,english
Cole Banuelos,5,Great system,the United States ,20201114,True,"  Very quiet, fast load times, graphics",0,english
Francisco,5,Worth the price,the United States ,20201114,True,  Amazing gaming experience,0,english
Darren stokes,5,It’s amazing,the United States ,20201216,True,  It’s amazing thank you Amazon,0,english
Abel Dagne,5,Great Console,the United States ,20201205,True,  Its just a really good console!,0,english
Kendall Gardner,5,It is amazing.,the United States ,20201216,True,  Great system. no complaints.,0,english
Bernard paramore,5,Tempting,the United States ,20210107,True,  So much fun,0,english
Wood,5,Great system but hard to get,the United States ,20210119,True,  Great,0,english
Mane043,5,Delivery Safe!,the United States ,20201124,True,  The product is safe and working!,0,english
orlando,5,Ps5,the United States ,20210112,True,  Sweet,0,english
Mhmoud,5,10/10,the United States ,20201123,True,  10/10,0,chinese (simplified)
Duncan King,5,Good improvments,the United States ,20201216,True,  Really enjoy the console,0,english
letier santana,5,amazing,the United States ,20201119,True,  so excited to finally to play.,0,english
David,5,Ps5 Gamer,the United States ,20201112,True,  Amazing just absolutely amazing,0,english
Irtiza Choudhry,5,PS5,the United States ,20201214,True,  CANT GO WRONG WITH SONY,0,english
Thuy,5,Verry good,the United States ,20210102,True,  Good,0,english
garygary,5,greatest console ever.,the United States ,20201213,True,  greatest console ever.,0,english
Adam koper,5,It sells,the United States ,20210130,True,  Great product,0,english
Victor ,5,Better then expected,the United States ,20201130,True,  Next Gen!,0,english
Daylon Holmes,5,OMG!!!,the United States ,20201120,True,  Love the PS5 5 mins in!!!,0,english
Edgar R.,5,Was a great choice! happy,the United States ,20210105,True,  Best thing ever,0,english
lothar590,5,Good,the United States ,20201119,True,  No issues,0,english
Salar Qureshi,5,"Fast, safe, accurate ",the United States ,20201213,True,  Love it thank you,0,english
Nero Angelo,5,disc version,the United States ,20201113,True,  Love it.,0,english
Ben,5,very nice,the United States ,20201115,True,  Awesome,0,english
baxter,5,Ps5 on top,the United States ,20201113,True,  Greatest Thing Ever.,0,english
Erick Suarez,5,Box handling could be better,the United States ,20210111,True,  AMAZING!,0,english
Diego Castillo,5,Awesome,the United States ,20201229,True,  Awesome!,0,english
Neftali,5,Great,the United States ,20210111,True,  Great !,0,english
Diego Perez,5,Beast,the United States ,20201223,True,  It’s lit.,0,english
Johnathan,5,NEXT GEN!,the United States ,20210105,True,  Love it!,0,english
Christian McBrayer,5,That delivery day was my Xmas,the United States ,20201214,True,  Glorious ,0,english
David John,5,Amazing,the United States ,20201229,True,  Awesome,0,english
Andres,5,Great Consol,the United States ,20201201,True,  It’s amazing,0,english
gabe huff,5,Amazing,the United States ,20201112,True,  Life changing,0,english
Kash,5,Great Console,the United States ,20201116,True,  Perfection,0,english
Jackie Stallard,5,no problems at all,the United States ,20201115,True,  perfection,0,english
Fantasyxo ,5,Yessir,the United States ,20201113,True,  ,0,english
delano t.,5,ITS LITT,the United States ,20201114,True,  ITS LIT,0,english
Rich,1,nan,the United States ,20201112,False,  NA,19,bulgarian
Rudy,1,Not worth it,the United States ,20201113,False,"  Who would pay almost $1,300 for a $500 console?",20,english
Narek,1,Can not even grab one,the United States ,20201113,False,"  Really do not understand why they made so little most people want it and can not get it do they not want to sell more, I just do not understand why they are doing this it’s ridiculous.",19,english
moghraby,1,OVERCHARGED,the United States ,20201113,False,  700 dollars more . RIDICULOUS,20,english
BleeKasHell,1,Microsoft anyone?,the United States ,20201117,False,  This is ridiculous. Why wouldn't you want to get this into the hands of the folks with a verified PSN account? You know the people that have supported Sony by not only buying the PS4 but having a plus membership and have spent thousands of dollars in games too!? Sounds like an easy way of taking care of your loyal customers to me! Instead let's sell thousands to bots who have no reason to buy one other than to turn around and sell them @ eye watering amounts! Saw one sell for  $3200.00. F.U Sony! None of you care as long as they are flying off the shelves... not real shelves but virtual. Wait... you don't even need virtual shelves!? More like virtual pallets where you can't even get the virtual shrink rap off before people start fighting to get at them....virtually. Yes I'm a little salty.... F.U. Sony!P.S.- it is nice that plus members get free rush shipping on the new console.... you know..... the one that's impossible to buy!? Lot of good that's doing!,14,english
Darren,1,Start releasing stuff and not putting a release time out,the United States ,20201114,False,  Just release the product randomly so everyone could have a shot. I wasting to buy one for my son. He can wait though before i give somebody on FB marketplace or offer 1200. The one star is not against amazon or the product. The rating is solely for the way the release went down.,16,english
Jose Garcia,1,Don’t even know about the console.,the United States ,20201113,False,"  Didn’t even get to make a purchase because of Amazon. I’m sure it’s a great console, but Amazon can go suck themselves.",17,english
AmberG.,1,Don't reward scalping,the United States ,20201113,False,  Don't reward scalping,19,english
Kindle Customer,1,Poor quality & execution,the United States ,20201117,False,"  Sony and the major retailers have very little integrity and may not understand the consumer backlash and brand damage they are doing with botched launches and flat out lying to the consumer.  On top of the horrendous consumer respect, the PS5 is already seeing a list of hardware and software defects and bugs.  The bad corporate policies matched with the poor product quality is not a good sign for business health.",15,english
A. Jani,1,SCALPERS,the United States ,20201117,False,  This is the biggest con! Scalpers use bots to buy consoles within seconds when they go out for release then charge inflated prices to actual gamers who want to buy it! I hope NO ONE BUYS from scalpers and they are stuck with the consoles now until their is actually decent stock next year... PLEASE DON'T BUY FROM SCALPERS PEOPLE...,17,english
Marty,1,LOL,the United States ,20201113,False,  I mean it’s a scalped console why else would I rate it 1 star,19,english
William A.,1,Flawed system red of rings,the United States ,20201113,False,  Another unit with day one issues red of rings already,17,english
joseph,1,Too expensive,the United States ,20201113,False,  Not worth the time it takes to try and find one that's not at scalper price. This is one of the worst products I have had to deal with as far as availability goes. They could have done any number of things to prevent scalpers from taking it from people that want a console to actually play.,17,english
Taf,1,What's the point?,the United States ,20201113,False,  Can't get one. What's the point of all this?,17,english
James Thomas,1,"Junk, overpriced",the United States ,20201113,False,"  Junk. Constant overheats, takes forever to load. Save your money and get the version 2 once they can get quality components again.",17,english
Haya,1,CRUSHED HEARTS AND SPIRITS!!,the United States ,20201116,False,"  I'm a grandma. I've got 3 boys who worked, hard, even found jobs to buy this PS5. They nursed their PS3 as long as they could then someone upgraded a PS4, and I litterally took it to the shop 3 times. Personally, I dont buy the hype. A huge bunch of BIG MAJOR NAMES that cant keep up with Demands? These 3 boys watched me on Walmart with the button saying ""ADD TO CART"" And it would not go. For 2 hours. Then it finally said sold out.As much money as I spend on Amazon yearly, and everything Microsoft. Sony with their 40 page sign this contract, Crap?I've got 2- 2012 pcs I've nursed and are all updated. I try to teach these boys, who were ABANDONED by their parents 9 years ago, that Education is key!Remember, MONEY BURNS, it's only paper.So all you BIG companies, you broke alot of hearts,  crushed alot of spirits,  in these kids comments!  FIX IT!!sincerely, HAYA",13,english
Azamat,1,Why,the United States ,20201113,False,"  Just buy WHY???  This is taking a advantage of people and I would never pay that much money for gaming console, I rather buy computer for this amount of money. If I could give zero star I would",17,english
Brenton,1,Frustrating,the United States ,20201113,False,  Don’t have one yet and at this rate probably won’t be able to get one. Please don’t buy the system from some scalper who raised the prices.,17,english
M.Machado,1,Total rip off,the United States ,20201113,False,  You suck,18,english
Dianne Washburn,1,What a joke this has become,the United States ,20201113,False,  Thanks for nothing..,18,english
chichichi,1,Scalper,the United States ,20201113,False,  This is a scalper...just wait for sony to release more to a big name company. Don't waste your money on this guy,17,english
Brian Bellamont,1,Down with sony. Down with consoles period.,the United States ,20201224,False,"  First and foremost. You, Reader. ARE a Special kind of Slow if you buy this or Any product for X5 the price off a Scalper.  Absolute Insanity.Pass the legislation. Scalping IS a Crime that Needs to be an Offical Capital Offense. with No parole.Consoles Should be sold and TRACKED. 1 - 2 PER Household. NOBODY needs More than that. Literally. Not even if you live in a house with 7 kids. everyone gets 2. The Fact Someone out there is able to buy 5 - 10 and Up by a bot tracker with no recoil. is Digustingly shameful.I Demand NO ONE Buy from Them. Period. They NEED to Lose Money and go broke homeless and Hungry for their Idiocy. and Greeeed.If You Dare to spend Over 2,000 + $ on this new gen garbage from a grifter you are even More insane than they are. and that is not the kind of mad world i want to live in. Talk about Helping the rich Get richer. smh.Anyways. as for the Product itself Again i speak to the people.Enjoy your in home spy cams. because that's literally all this fancy box is.Not a conspiracy therorist. These is offical facts.for anyone whose actually read sonys new compliance policies. Best know to watch what they say and do while playing because they are keeping track. and will ban literally anyone at the drop of a hat.same goes for xbox lives speech enforcement.I will not endorse these fascist companies. as long as these ""rules' of theirs are in effect.Get a Pc. Join the Master race.",10,english
miltonbanks,1,Sony screwed up big time,the United States ,20201115,False,  Whats really sucks is there was literally a limited amount of product to pre-order so practically on 30 percent of gamers got the product and the rest of us have to wait till it officially comes out instead of this pre-order crap whens there's more systems available that you don't have to pre-order Sony screwed up big time,15,english
Socratez,1,What a Joke!,the United States ,20201226,False,  I have spent countless hours and days trying to buy 1 online for my home just to enjoy playing and have failed at every chance I’ve tried. It is extremely frustrating that scalpers can be allowed to use specific software to hog up these units for outrageous profits! There should be a limit put on these units to stop this ridiculous scheme. Yes I also blame Sony for contributing to this mess. They knew very well the demand would be high for these units. I am “not” going to pay 3x the amount for a unit and will just wait. I do not think it’s right to make people search + 100 hours and over a month just to try a buy a PS5 Unit! I’m sorry but it’s beyond ridiculous...,12,english
G Ninja,1,From a long time Sony fan,the United States ,20201118,False,"  Why does Sony choose to support scalpers and not fans? Fans just want to get their hands on it to play and enjoy it. We all know they create fake shortages to cause mass hysteria. Forget that, I've supported Sony games for a long time and won't participate in it this time around.",14,english
jason r.,1,Not worth the risk,the United States ,20201207,False,  Too high of a price for what could be a faulty unit. Seen too many issues people having with the ps5 from overheating to crashing to pay 1300.,15,english
Alec D. ,1,Don’t support these,the United States ,20210106,False,  Do not buy these. If you do that just enables this behavior. This is borderline unethical and greedy. I hope everyone agrees with this and forces these people to make a reasonable offer or just straight up stick these people with some nice new decor.,13,english
Brian B.,1,Shame,the United States ,20201113,False,  Shame on you America.,16,english
Titus,1,Impossible to get/ Lack of information,the United States ,20201116,False,  I had it in my cart 5 times on launch day. No luck. They also give little to no information about stock and just want you to waste your time staring at a screen and refreshing their website. They were aware of scalpers but barely made any attempts to combat that. It was a brutal free fall all with people who aren't even loyal sony customer selling the PS5 for 3 times the price!,13,english
James,1,I'm waiting until next year to get one.,the United States ,20201117,False,  I pre-ordered and the second I got the email I logged into Amzon. Where I learned  I could not buy it.  I mean literally when I got onto the page to purchase and put in my cart by the time I pushed the purchase button and pay for it it was gone. I I'll just wait til after the 1st. I'm not a gamer at all but like to to the campaigns. Or play split screen. WILL NEVER PAY OVER $500 for this item.,11,english
JEAN MARIE LAURORE,1,dumb scaplers,the United States ,20201208,False,  this is the lowest of low dont go for it,14,english
Dragvinity,1,Dont buy it rip off,the United States ,20201117,False,"  Just great the only time I get to actually add one in my cart and it’s worth 3x the price.Well then I’m done, keep your system and watch Sony lose out on PlayStation store and PlayStation plus subscriptions. I don’t think PlayStation did their math correctly, yes they made their money this year because all ps5 have been sold out to very few and a lot of scalpers but next year there will be a big drop in online player base and subscription. Also thanks Amazon for letting this happen. Just not going to get one and get a PC. DO NOT BUY these ps5 at 3x price. Regardless the ps5 will forever be going to be release for the next 7yrs until ps6 lol. Patient is key on buying a console. There is no good game on ps5 anyways beside if you would like to play these new games you can buy them for your pc right now and runs better looks better.",11,english
Kobraki,1,What a joke,the United States ,20201113,False,"  What a joke, once again Sony is a complete failure. Time to switch permanently to Microsoft.",14,english
Amazon Customer,1,Sony treats customers like swamp trash.,the United States ,20201118,False,"  See that lovely empty space on top? Thats where a PS5 should be! Sony is an absolute joke! It is apparent they could care less about loyal Playstation supporters. The preorders were straight consumed by scalpers. Now at launch retailers have less than scraps. Then theres playstation direct online. Youd think was the best way to procure a console direct from as Sony? Wrong again!!!! They go online at any random hour of the day with no prewarning. You sit in a que for 45 min only to be greeted with the same OUT OF STOCK messege you started with. I have done this 4 times and counting. Want to reach an actual person at Sony. They make that impossible as they know people are VERY upset about this. So you tell me you produce millions of consoles knowing demand is up in a pandemic, and previous launch shortage failures, and still botch a release? This is so intentional. You want to tell me with todays tech you cant see exactly which people were in your online que failing to get a console and you cant contact them and take the order directly? Sony is messy and sloppy as it gets.",10,english
Michael C. Davis II,5,STOP CRYING,the United States ,20201220,False,"  I'm sorry but the amount of crying over folks selling the PS5 and/or Xbox Series X for more than what its sold for in stores is ridiculous. It's simple economics. Supply is low, and demand is high, therefore markup is inevitable. There's price inflation on EVERYTHING WE PURCHASE. Most of you are paying a mortgage and paying 3 times more than what the actual house is worth. You are wearing shoes that cost 5 times more than it took to actually make the shoe. Hell, the food you eat is way overpriced but you pay for it. It's simple. Either complain about everything being overpriced or shut up. You're simply mad that you didn't get one.....PLAIN AND SIMPLE. If you were fortunate enough to get one you wouldn't be here complaining about the inflated price, and instead would be sitting in front of the TV enjoying your new purchase. So sick of you crying, OVERPRIVILEDGED BRATS!!!!!",9,english
nosympathy,1,Failures all around,the United States ,20201119,False,"  There are a few tech companies that handle releases of new products very well. Like Apple for instance. They usually do a pretty good job even though I'm not a fan.This has been terrible. Not a single place has used any form of anti-bot tech at all. Notifications are never on time, if you can even get notified. It's 2020, things should not be this bad. Other smaller businesses for years have required captchas to place orders. Not any of the big guys!Maybe even with a captcha in place, i'd still get beat out for one. Which would be fine, at least it would feel like I had a fair chance. Right now, I doubt there are many people feeling this way. The ones who do manage to snag a console are just super lucky or they are scalpers.This big retailers don't care, but scalpers are the worst people to exist right now. Seeing these units go for $1800+ in some areas (like mine)  and as some other reviews mentioned, $1800+ can build a realllllly nice PC that will make the PS5 look like garbage. There is no way I'd buy a PS5 for that, it's just counter productive at that point. It's a really nice machine for $400-500, but that's where it stops.",8,english
Daniel Herrmann,1,Just another irritated shopper,the United States ,20201116,False,  I signed up for all the alerts and emails and notifications and didn't get any notifications. Stayed up til 3 am for days on Hope's and rumors of the possibility to secure a unit again with no luck! This has been the most horrible console release in history! I am not paying scalpers 3x or more for a unit that cost $499 no way ever! Sony and Microsoft are seriously hurting their fan base as are the retailers like Amazon and best buy and target and Walmart. Absolutely garbage!!! Normal folks will be lucky to get a unit by summer 2021,11,english
Jorge,1,1 star because of Sony's terrible launch,the United States ,20201117,False,"  At this point, it's pretty clear that both Sony and Amazon reward bots and scalpers over true, genuine customers. This situation was entirely foreseeable at launch and yet, there was nothing done or attempted to resolve or mitigate it.",12,english
Manny,1,Gaystation,the United States ,20201113,False,  Xbox is better,14,english
Conrado Bautista,1,Sony dropped the ball,the United States ,20201117,False,"  They allowed certain people to buy so many so that they could resell later at 2 times the value.  While, others count buy them.  Just frustrating!  Shame on Sony",11,english
Anonimoose,1,Why Are There No Playstations Ever?,the United States ,20201116,False,  I have been waiting for a solid 2 weeks checking day in day out for when the PS5 would come out and it did but half of the sites are botted by scalpers who want almost millions just for the frickin controller. Nobody can get a PS5 other than influencers and scalper. Man PC lookin alot better.,10,english
Renza ,1,You people should be ashamed of yourselves.,the United States ,20210106,False,  This is absolutely sickening. I hope not a single one of these sell. There’s no reason these prices should be this high. There are children that are going without the gift they wanted for Christmas because of people like this.,11,english
Will,1,disgrunted consumer,the United States ,20201117,False,"  Its ridiculous that Sony couldn't make enough or plan for the demand when the gaming market is at an all time high. We have been waiting for these consoles for years only to not get notified for preorders, not get notified when in stock or even be given and eta on more systems. I love my PS4, but Im trying to give my money to Amazon or whatever company that can get one. These things are not worth 1200, 1500, or 2500 dollars. Im more or less disgusted by the fact the retailers have let people buy multiple systems at once. Take a not from the gun market limits need to be in place.",10,english
chandler collins,1,Sony,the United States ,20201119,False,  Sony is getting absolutely nothing done and is very unprepared for their own launch of ps5.... must be all Democrats at Sony,13,english
Amazon Customer,1,Shame & Disgrace To Manufacturers of P. Station,the United States ,20201118,False,  It’s a shame how a company like Sony can’t manage their product launch. Big disgrace to them to see people selling PS5 for $1350 when it was launch this same week. Shame to Sony.,12,english
Zachary costa,1,Can’t buy the console so 1 star,the United States ,20201117,False,  I don’t understand why I can’t buy the console considering the hype up of the next gen consoles you would think you made more then 100 but thank you Sony now I can’t even buy my kids a ps5 for Christmas I’m not so happy about this. Kind of straight crap,12,english
Brandon,1,AMAZON YOU FAILED!!! 1 PS5 PER HOUSEHOLD ADDRESS ITS SIMPLE!!,the United States ,20210103,False,  ITS SIMPLE JUST SELL IT 1 PER VERIFIED HOUSEHOLD ADDRESS / ID VERIFICATION. JUST LIKE TOILET PAPER DID IN STORES YOU PEOPLE CANT DO ANYTHING RIGHT. GOODBYE AMAZON PRIME! I WILL BE BUYING THE PS5 FROM PS DIRECT THEY HAVE 1 PER HOUSEHOLD/ 1 PER ACCOUNT USER FOR SALES OPTIONS.,9,english
Sumit Purkayastha,1,Worst launch in the history,the United States ,20201229,False,"  Shame on Sony. Such a famous tech company and they had 7 years to prepare for the unleashing of PS5 and they produced such a small number of consoles that we are trying for months and waking up at 5 in the morning, refreshing the pages over and over again. Still we can't get one. Even I could get into the Target drop and added to cart and everything, still at the end it failed because of selling out. I mean, what a joke. Such a big company and they knew that the demand would be high, why didn't they produce enough number of ps5s, or they wanted to make the scalpers profitable? Some people are getting 2-3 or even more - disc, digital both and we keep refreshing the pages and waiting to see any notification and still can't get one even after getting into the order page. Worst launch of all time!!",8,english
