name,score,title,place,date,verified purch,text,upvotes,language
Scott Holm,5,Great next step!,the United States ,20201202,True,"  The power in the new Xbox is amazing. It almost instantly boots up, and getting into a new game is so quick. We haven’t been able to see much of the power of this system yet, but it’s great so far!",0,english
Ouija,4,Damaged box,the United States ,20201110,True,"  Been using amazon for quite sometime now but the total lack of respect for a $500 console is mind boggling. The console may be damaged, and the box itself is a collectors item. Now it’s completely damaged.",1,english
3DTech,5,Xbox Series X is just fast,the United States ,20210121,True,  I moved from the OG fat Xbox one to the Series X and wow the speeds on this is unreal. i love the quick resume feature and the 4K gaming ability. The games look so much better on the new console.,0,english
giovanni ,5,Amazing so happy with it,the United States ,20201111,True,  Upgraded from a xbox one s games look so much nicer system is so quite everythings so smooth not 1 problem highly reccomend,1,english
"CF from Warren, MI",5,"Amazing. Fast, Powerful, Lots of games.",the United States ,20201114,True,  Get Game Pass day 1 if you don't have it already.,1,english
Leonel,5,Buy It,the United States ,20201112,True,  Your browser does not support HTML5 video.   It truly is the most powerful console ever made.,1,english
manuel duval,5,Received it on time,the United States ,20201111,True,  My Xbox series X came on time on the release date packaging was good secured nothing wrong,1,english
Scooba,5,Big and heavy to pack all that huge graphic engine!,the United States ,20201220,True,  This thing is big and heavy and its needed to pack all of this fps goodness! Purchased directly from Amazon at regular retail priced and received it faster than expected.,0,english
DTM,5,Halo Infinite is coming,the United States ,20201113,True,  It's an amazing piece of hardware that is going to have some amazing games on it in the next couple of years. Halo Infinite's delay definitely hurts the launch lineup but this console will have so many reasons to lay on it in 1-2 years time. Halo Infinite is 343's Halo 3.,0,english
Fred Roach,5,Awesome,the United States ,20201110,True,  AWESOME THANKS AMAZON :D,1,english
A.M.,5,Huge upgrade,the United States ,20201111,True,"  This thing is a HUGE upgrade from the Xbox One. The 120 FPS is a big deal, even if you have poor internet, it helps make up for that. Definitely a buy for the gamer in your life.",1,english
Shawn D Hamerlinck,1,Add more padding,the United States ,20201127,True,  This is how Amazon pads their electronic shipments. This is Christmas gift so lets hope it works in 3 weeks when it's opened.....,2,english
Cameron Hendricks,1,Don’t get it early,the United States ,20201217,True,  I disliked that I played it for a few weeks and now i am sending it back to be looked at / repaired because there seems to be a Graphic Card issue inside the Xbox,2,english
Josue,5,Excited!,the United States ,20201110,True,"  Everything is awesome, only thing that sucks is that I have to re-install my games again.",2,english
JOHN FINES JR,5,The future is here!!,the United States ,20201114,True,  Pretty big but surprisingly quiet and amazing new controller!! Best system on the market!!,1,english
LB Moreno,5,A life saver for a birthday gift,the United States ,20201216,True,  When the Xbox series X was a super tough item to purchase this Covid year. We found fast service and are very happy with the results for a deserving recipient.,0,english
Rob R.,5,Worth it!,the United States ,20201111,True,"  It runs Destiny 2 as smoothly and as quickly as it runs on PC. It's fast, quiet and the new controller feels great. I know supply is limited right now, but if you have a chance to get one, do it!",0,english
Cole,5,The load times alone make it worth every penny,the United States ,20201123,True,"  Having owned all but one Xbox generation on release day, I can honestly say that the Series X feels far more finished than the 360 or One did at launch. Everything works as intended. The UI, although not shiny and new, works flawlessly. The graphics are awesome, it’s quiet, it runs cooler than its predecessor, and load times are a fraction of what they used to me. I might be in love with a gaming console.",1,english
Ismatu Koroma,5,Better than PS5,the United States ,20201219,True,"  Fortunate for me I have both the playstation 5 and the xbox, and I can say I prefer the xbox over the playstation. Although both systems are similar, the xbox is faster. Downloads and load time are crazy, and when the controller turns on it turns on quickly as well. The graphics are amazing as well. I cant wait until more games come out so we can see what xbox can really do.",0,english
Sam,5,Best console ever.,the United States ,20201218,True,"  I love it, never going back to Playstation. I have only ever owned Nintendo and Sony until this generation, but I have had it with Sony's BS. I was lucky enough to get a Series X pre order and I could not be happier. All my friends are jealous and the ones that had Playstation 4s are now switching back to Xbox after seeing this in person. Blind brand loyalty aside, this is the greatest console of this generation hands down.",0,english
Ariel,5,Thought it wasn’t coming until after Xmas!,the United States ,20201201,True,"  After preordering and getting the email that I would not come until Dec 31st, I panicked and looked for restocks everywhere. I then received a notification the next day that it shipped and low and behold it was here a few days later. No complaints, great system!",0,english
Brandon Oravec,5,Load times are insanely fast,the United States ,20201110,True,"  So far amazing! Load times are non-existent on MW, and 2k21 Next Gen feels so smooth! This generation is gonna be exciting!",2,english
Brah Dude,5,Best console ever!,the United States ,20201217,True,"  What a fantastic console. Does everything right and the value is insane. I have this and the PS5, but I’m on this one most of the time.",0,english
Haley,5,Love!,the United States ,20201117,True,  Love it so far. It is pretty tall (as expected). Looks really great and runs perfectly. Definitely a nice upgrade from previous generations.,0,english
Linsey Payne,5,Why wouldn't u buy this lol,the United States ,20201110,True,  Amazing,1,english
Axel Laza,5,Order was confirmed and Amazon was on point excellent transaction.,the United States ,20201128,True,  Very good to have a product that's hard to find. Enjoyed playing and love the beautiful style of this console.Spiderman game is awesome!,0,english
Roman Anthony Flores Jr,5,GREAT XBOX UPGRADE,the United States ,20201229,True,"  The Xbox Series X is a very fast console and great upgrade from my previous Xbox One (day one console). If you’re looking to get the same experience from last Gen but upgraded, this console is definitely a huge upgrade. You can still talk to people from other Xbox One consoles.You’re paying for the quick resume feature, extremely fast load times, & the 144 hz and 4K experience. (Not every game can run at 144z and 4K yet)",0,english
Michael Joseph Radel,5,Incredible!,the United States ,20201128,True,  Upgraded from a One X to Series X and the difference is incredible. Next to no load times and 4k at 60 fps is a game changer.,1,english
Guy,5,4th Generation = Best Generation,the United States ,20201110,True,  Awesome. SSD and Quick Resume are game changers. Everything thing you love about Xbox but faster and prettier. Can’t wait to see what the first party studios create!,1,english
Michael Montanez,5,This thing is powerful!!!!!,the United States ,20201114,True,"  Got the console day one and it's been great! it's quiet, doesn't get too hot, quick resume is great and with Xbox Game Pass I can play hundreds of games on this console...and some of them even have Series X updates to take advantage of the console. LOVING IT SO FAR.",1,english
BrettP,5,Great console,the United States ,20201119,True,"  Great new console.  Works great a much improved console.  I have always owned both Xbox and Playstation and always will, but I am very impressed with the new Xbox",0,english
EdEddandEdge,5,"Worth every penny, next generation is here",the United States ,20201118,True,  The series x has exceeded my expectations.  Super quiet.  About as loud as a field mouse pissing on cotton.  Picked up cod cold war and it is amazing.  Thank you amazon.  Do not pay scalpers for one.,0,english
Count Chocula,5,First!,the United States ,20201110,True,  First!,1,english
Bradley Ham,5,Apex Legends looks AMAZING!!!,the United States ,20201116,True,  Coming from Xbox One S I immediately saw an improvement on my LG OLED when I played Apex Legends on the Xbox Series X. Load times are incredibly faster and the graphics are night and day. Very very smoooooooooooth. Worth every penny for this alone. Very happy customer! ,0,english
anne,5,Fantastic service. Customer service,the United States ,20210105,True,  I loved on how fast this company responded how sincere they were. I definitely  loved my xbox series x.. something was rattling inside but it okay the system works... im happy  worth the wait.,0,english
Ameer Alghabra,5,Truly Next Gen,the United States ,20201207,True,"  This console is absolutely amazing. The lid first thing you notice when you boot it up are the smooth, crisp, and fast load times. The graphics are  on par with a high end PC in the optimized games. The console itself is beautiful. It is very modernistic and blends in well with it’s environment. I have not encountered any errors with it yet!",0,english
Vibhav Salgaonkar,5,Wohoo!!!,the United States ,20201110,True,  Next gen awaits! I was fortunate enough to get my preorder in and my order was delivered on time. I can't wait to boot up the console and play AC Valhalla!,1,english
tracy,1,Crashes,the United States ,20210105,True,  Freezes constantly with almost every game. My consul freezes more in half an hour than my Xbox One did the entire 7 years i had it. Unacceptable for how expensive and “high tech” it is.,1,english
Sean,4,Hardware Upgrade! Worth the $$,the United States ,20201123,True,"  Thrilled to own the Series X. Despite the lack of a diverse set of launch titles, I truly appreciate the time Microsoft took on this console. Feels like a PC due to being paired with a new LG OLED TV. High frames @ 120Hz without sacrificing picture quality.",0,english
MrEWhite,5,It's a great upgrade over the One X.,the United States ,20201111,True,"  Compared to the One X, this is a great upgrade. Some games that had slow downs (such as COD MW) are completely smooth on here. I also really like the controller, because, even compared to the Elite Series 2, the thumbsticks are better. I also like the expansion port over what the PS5 has, which is a much simpler card solution when compared to the M.2 SSD slot on the PS5 (which isn't even active at launch).",0,english
Brad Mills,5,Incredible graphics and speed.,the United States ,20201114,True,  This thing is fast. Definitely a generational leap in terms of speed and jumping around the UI. Games look incredible. The build quality is fantastic. It's all around an incredible package for the price. Highly recommend this to anyone.,1,english
cera maxie,5,Great purchase,the United States ,20201117,True,"  Amazon was the only place I had a chance Getting the Xbox. Once it was ordered, I was excited to get the Xbox on time and works great!",0,english
Kmak,5,A gamer's paradise.,the United States ,20210124,True,  A must buy for xbox fans and gamers alike. I am shocked as to how stunning beautiful the older games look as well.,0,english
Sage,4,"Such an Amazing Console, but....",the United States ,20201110,True,"  First off I just want to say that I love everything about this console. The controller, the load times, the graphics, the UI, everything. My main issue is that, Microsoft offers a lot of games in Games with Gold and Game Pass and the issue im having is that I dont have enough storage for the games that I want. I wish there were 2T versions, but I will deal with it until I can scrap together another $100 for a 4T Seagate.",0,english
Tomeeka barnett,5,Got on time,the United States ,20201110,True,  Got mine on time and cant wait to play on this thing for 5 plus years,2,english
Juan C. Ortiz Ares,5,Great Machine Not a Lot of Games,the United States ,20201116,True,  I love the possibilities on what can be done. Too bad there isn't a lot of new generation games for launch.,0,english
Devon,1,Terrible Start and Service,the United States ,20201206,True,"  I got it Super late when I preordered it Since September and when I got it The Xbox Series X has a WiFi Problem Lagging in Multiplayer games, Basically Making it unplayable Didn’t have this problem when using Xbox One. I guess I got it too Early.",1,english
Jake,5,It has games,the United States ,20201125,True,"  I'm am more than pleased with the new Xbox. Many are saying that the system does not have any games, but I believe it has to many to choose from. I was lucky to get one early but I hope all that truly wants one will get one before the year is out. You will not be disappointed!",0,english
Vik,2,Save your Money!,the United States ,20201216,True,  This product isn’t that great. The hype is too much for this. It’s the same as basically all of the other ones Microsoft has made. Save your money!,1,english
Michelle M,5,Fast shipping! Great Seller!!,the United States ,20201217,True,  I was extremely happy to fulfill my husband's Christmas present wish a little early this year! The seller immediately answered a question I had and shipped it to me before the date I was estimated. My husband has played it every single day since he has gotten it!! Thank you so much for making it quick and easy on me this year!!,0,english
Slowwpo,5,Met expectations,the United States ,20201210,True,  This item was awesome.,1,english
XDIEGenral - Elico,5,UNLIMITED POWER!!!,the United States ,20210124,True,  Really loving my Series X so far. I'll never regret staying up passed my sleep schedule to pre-order this bad boi. Absolutely love it and I'm proud to be an Xbox Fanboy,0,english
frankcoppolino,5,I love playstation but this xbox series x works great,the United States ,20201127,True,  It runs perfectly and you can barely hear the fan. So far no problem will update if I find one,0,english
KJ,5,Amazing!!!,the United States ,20201112,True,  Amazing every game is way faster and everything is super fast. Quick resume is awesome! Make sure you have a TV with 120hz though you get 120FPS!,0,english
Brian B,5,Series X Pre-order works awesome,the United States ,20201111,True,  I was lucky enough to get a pre-order for the series X. Everything was beautifully packaged and it hooked up/worked with no issue out of the box.,0,english
Enrique Solis,5,Sorprende cuan silenciosa y rápida es,the United States ,20201124,True,"  La nueva XBOX Series X es una consola de ultima generación con prestaciones en general muy buenas, la consola va fluida, no se calienta y es una gran compra, valió la pena la espera, contento con la compra",0,spanish
Arriel G.,5,It’s finally here!!!,the United States ,20201110,True,  Works like a charm. Everything is so beautiful. Nothing like playing GTA 5 online with no frame rate drop and not waiting for parts of the map to load in. 100% worth especially when I’m coming from the day one Xbox One.,1,english
bw,5,"Fast, quiet, fun! XBOX X is a powerhouse!",the United States ,20201121,True,"  The XBOX Series X is amazingly fast and super quiet!! I’ve had every version of XBOX and it goes without saying, this is the best system they’ve ever made!",1,english
Eddie Kim,4,"very powerful console, but lacks games for now",the United States ,20201123,True,"  love playing my old games on it, they all seem to perform much better.  I do wish there were more launch games",1,english
STEVEN,5,Awesome load times,the United States ,20201204,True,  Totally awesome. Fastest load times alone are worth the upgrade from an xbox one x.,0,english
Iamad Hamad,3,"Very fast, doesn't feel next gen",the United States ,20201224,True,"  The console is good, but it doesn't feel like a next gen console. The only difference is that I can notice that I am loading into games faster. Unfortunately, some games will freeze forcing me to exit out or restart the console, this could be a game issue and not a console issue. Overall, the system is good, but there is no need to rush until better optimized games are ready.",0,english
Richard Nanji,5,Great gift & video game system for teens.,the United States ,20210105,True,  My neice loves her Xbox. This is her first video game system in America. I was able to preorder the system for her and give it as a gift on Christmas. This was the ultimate blessing from Amazon for that opportunity. She is now using the systems to even speak with her mother overseas. She said the system runs great.,0,english
Andrew James Medanich,5,A literal game changer,the United States ,20201113,True,  Absolutely an amazing console that makes every single last gen game run at its fullest potential without any optimization. Everything takes less time and with the Xbox App you dont even have to be home to set up or install all of your games.,0,english
ERIC,5,Amazing Console,the United States ,20201114,True,  Amazing console. Games looks incredible. Load times are insanely fast.,0,english
Brandon Dominguez,5,Best Console Ever,the United States ,20201111,True,"  The Xbox Series X is amazing. Everything is very fast, games load faster, every game is at least 60 FPS, and some games such as Grand Theft Auto 5 are 4K. Games also download much faster, I currently download at 380 Mbps when it used to be 120 Mbps on my Xbox One X. Before I couldn’t play Modern Warfare, now I play with no lag, at a smooth consistent frame rate.",0,english
Connick Miller,5,Love xbox!,the United States ,20201204,True,"  This was so rediculously hard to get, but now that I finally have it. I love it. Quick resume is amazing and so is how fast games load!",0,english
slam sauce,5,Nice responsive system,the United States ,20201114,True,  Amazing so far. Don’t get much time to play but when I do it’s wikkid,0,english
Ryan Michaud,5,Xbox series x,the United States ,20201113,True,  So far so good can’t complain everything seems to be working fine now the long process of redownloading all my games hahah this should be fun,0,english
Matt,5,Simply amazing,the United States ,20201112,True,  Came same day as the release when I pre-ordered 2 months ago,0,english
JBH,5,Worth 500 dollars.,the United States ,20201110,True,"  This runs amazing, it runs games amazingly, the setup was a breeze, all my old accessories from my Xbox One work on it, I love this console.",1,english
Aleenat,2,Not much to do,the United States ,20201228,True,  The menu on this new Xbox is atrocious and annoying to navigate. Take me back to when the Xbox 360 menu was out before it also got ruined. The controller is the same as always and there’s not many exclusive games out there. I would recommend waiting to buy this or get a ps5,0,english
Melinda Smith,5,Works great!!!!,the United States ,20201210,True,  Came on time and worked great!,1,english
Donavan,5,Amazon and Microsoft efforts in trying to fulfill everyone's orders,the United States ,20201113,True,  Got my delivery Tuesday afternoon love the console...much respect to Amazon for doing all they could to make sure gamers receive there consoles so they can game..much respect to Microsoft for not dropping the ball on this generation of Xboxes,0,english
Shishka,5,Xbox VS PS5,the United States ,20201114,True,  Numbers don't lie better system then PS5 hands down. I know demand higher for PS5 because of todays youth are on the bandwagon. But for the money its a better system. No exclusives but they will have plenty coming i don't care about being spider man there's a reason no exclusives because they are gonna get it right not rush it out.,0,english
Amazon Customer,5,Auto HDR is great!,the United States ,20201115,True,  Games look and run better than ever before.,1,english
Devan Lee Giraud,5,Next Gen,the United States ,20201206,True,  Loving the Series X so far. Games look and feel amazing. Load times are fast. Can't wait to play a game that was built for it and takes advantage of the power behind it.,1,english
Dukes,5,Worth every penny,the United States ,20201114,True,  Delivered on release day and this console is better than I thought it would be. I'm blown away by the load times and graphics as well as refresh rate.,1,english
Gavin,5,New Gen!,the United States ,20201120,True,  Very happy to get this so early! Great system,0,english
Amazon Customer,5,Review,the United States ,20210102,True,  Great product but was over priced. Got it before Christmas as promised.,0,english
Daniel ,5,performance and style,the United States ,20201214,True,  Next gen gaming with the perfect style for my home decor. Loved the xbox one x and now I've upgraded to the series X.  There is a huge difference in performance but worth the wait and price. The new controller feels better in hand also. It's a great gaming purchase if you can get your hands on one.,0,english
Ira Lichtenstein,5,Must have for Xbox 360 owners and Xbox One owners,the United States ,20201119,True,  The worst part of playing video games is waiting for things to load.  Xbox X (not to be confused with Xbox One X) is pretty much perfect.  It loads super quickly.  Although I realized yesterday that it doesn't do 3d movies.  Glad I still have a working PS3.,0,english
Brent Harry,5,Series X,the United States ,20201124,True,  Worth every penny. Xbox manages to keep me in their circle for another generation and I’m looking forward to see more things the series X has to offer!,1,english
Amazon Customer,5,Series x is the future!,the United States ,20201111,True,"  A very good console. Immediately saw faster FPS and snappy interface. With gamepass, this console will make great strides in the future!",1,english
Linh N.,5,"Great system, bad shipping and handling",the United States ,20201117,True,  Who is the dingbat I owe my thanks for packaging this Xbox?The Xbox is great and fits into my media center. I love that it is very backwards compatible so my existing library moves with me. It doesn’t feel like I’ve lost my investment for the past few years.,0,english
Roger,5,Fast shipment,the United States ,20201119,True,  Came really fast? Everything perfect,0,english
Amazon Customer,5,Worth the wait,the United States ,20210105,True,"  Still no issues, still functioning great.",0,english
Cesar B,5,Powerful,the United States ,20201115,True,"  Very quick, great graphics, performance, and a major upgrade from my Xbox one S. Glad I was able to get my hands on it on release date as well!",1,english
Jacob,5,Great console.,the United States ,20201116,True,  Great console.,0,english
raymond johnson,5,Game pass is a game changer,the United States ,20201122,True,  Game pass is a amazing pair with any xbox console or pc and this console is a monster,0,english
vefe75,5,Great buy,the United States ,20201128,True,  Everything!,0,english
Anonymous,5,Best Xbox made,the United States ,20201111,True,  This is probably one of the best Xboxs made. I’ve had every generation and this is 100 times faster than the Xbox One X. Worth the money.,1,english
vasek povala,5,Xbox series x,the United States ,20201122,True,  Early and  no problems,0,english
Matthew Franks,5,Truly next gen!!!,the United States ,20201130,True,"  Truly a next generation experience. From the way the console loads games to the  graphics, this machine is an absolute monster in the best possible way. Haven't had any problems at all and simply cannot get enough of this console. 10/10 would recommend.",0,english
Jorge,5,NEXT GEN IS HERE,the United States ,20201205,True,  LOOOOOVE IT. I cant wait to see developers take advantage and use its full power. Amazon was great with the delivery/availability here,0,english
Austin B,5,Amazing upgrade,the United States ,20201111,True,  Great product for a great price. The SSD is extremely fast and graphics look amazing!,1,english
Mando,5,AWESOME!,the United States ,20201217,True,"  The Xbox Series X is superfast, quiet, and I have had no problems at all with it. I highly recommend.",0,english
Sam M,5,"All things considered, the system is a bargain",the United States ,20201118,True,"  Powerful, super fast load times, super fast startups, fast app switching, and the system is very quiet. Can’t get much better than that.",0,english
Dave,5,I got one and you didn’t!,the United States ,20201118,True,"  Love this machine, worth the hassle of getting it on preorder day!!",0,english
J. Cornish,5,Massive improvment.,the United States ,20201118,True,  The Series X is a massive improvement compared to Microsoft's last Gen TV box. AKA the Xbox One.,0,english
Robert T.,5,9th gen. Is here.,the United States ,20201120,True,"  Love the accessory backwards compatibility,  performance upgrades for catalog titles, inaudible cooling solution, and advanced hardware/software features which will require time for developers to fully exploit.",0,english
Michael,5,Best Xbox console,the United States ,20201112,True,  Really amazing console. It’s so quite and smooth. The load times are lighting fast and even older games like Gears of War ultimate edition look incredible.,0,english
Mark B,5,Perfect 5 out of 7,the United States ,20201111,True,"  Very xbox, much video games. Perfect 5 out of 7. It has the gb’s AND the fps’s! Wow it’s so delicious!",0,english
RTM,5,Beastly,the United States ,20201111,True,  Things a beast,1,english
