name,score,title,place,date,verified purch,text,upvotes,language
R.C. Davidson,5,A Great System (for $500),the United States ,20210124,False,"  Before I begin, while I find the Xbox Series X easier to buy than the PS5, it is no stranger to being scalped like it's Sony and Nintendo counterparts.  If you are having a hard time getting this system, please be patient and don't pay scalper prices on eBay and Amazon.Now, to start off this review, I wouldn't fight said scalpers for one reason, games.  As of now, most games coming to the system haven't had release dates yet, as far as I know, and I don't think the studios Microsoft have bought have released any details on games for the system.  However, if you're a long time Xbox player, I do think things like Game Pass and backwards compatibility offer pretty decent value for the system.  With Game Pass, it's already a great value with around a hundred games to play (and Xbox Live Gold is included), and the system is also compatible with four generations of games (with some Xbox One games having upgrades).  While not every game is compatible, I find Microsoft's way of handling backwards compatibility better than Sony's PS5, which is only compatible with PS4 and PS5 games.  Only issue with the hardware/software side is the Xbox Live Gold requirement for online play.  If you're on Game Pass, you don't have to worry since it's included, but even if other systems are doing it, it's a paywall that needs to go away.  As of writing, consumers prevented the service from going up in price, and now Gold isn't required for free-to-play title no more (like how they're not required on other systems), but an online multiplayer subscription will never be a good value unless they use dedicated servers, and let's admit this, some games still use peer-to-peer (or console-to-console).I also like the hardware Microsoft was able to create.  While people could say that the system is big, I can say as a person who built an ITX PC, I would've loved to have a case this small.  It's a sleek box that's just barely taller than two GameCubes that also ran pretty cool and quiet.  While the SSD is half the speed of the PS5's on paper, I found that the games still load rather quickly.  The one trick Xbox has vs PS5's speed is Quick Resume, which allows your games to pick up right from where you left off.  This works great when you're playing a game like Crash Bandicoot 4 and a friend invites you to a quick game online.  Just switch to that game, and when you're done, switch back, and it'll be like you never left the game.Next is the new controller, and while it isn't a massive departure from previous controllers, it's the best one Microsoft has produced.  First, let me say that if you don't like the new controller (some people do say it is a smaller than the One controller), the Xbox One controllers work just fine with the new system, which is actually pretty pro-consumer of them.  What I do like about this controller, however, is the new d-pad.  It is based off the Elite controllers, and your thumb can easily roll around on it.  The controller also has a nice textured back, which gives a bit more grip.  The only issues I have are that it's still the same Xbox controller from the Xbox One, more or less.  There is still no gyro control (which I think it needs since gyro is the closest thing consoles like PlayStation and Switch have to mouse controls) or anything like the DualSense's adaptive triggers, and why in the 2020s does a controller still use AA batteries?  I know people have strange opinions and that I can buy rechargeable batteries for the controller, which I have received as Christmas presents, but even a $50 Switch Pro alternative controller, 8BitDo's SN30 Pro+, still has gyro and a removable, rechargeable battery, but Microsoft charges $60-65 for a controller that uses AA batteries.  Don't get me wrong, it's still a fine controller, great even, but Microsoft needs to catch up with everyone else, because before long, their controllers will start to feel outdated.Overall, I think that the Xbox Series X is a great system with even greater potential.  If Microsoft can utilize the",0,english
Ryan M,5,Amazing! Best Console yet,the United States ,20201216,False,"  Amazing.  I held out on the One X because there had been whispers of this next gen console for several years, so I figured I would just go all in whenever it came out.  I was one of the fortunate few who were able to snag a pre order, and I have been playing daily since launch.  The performance is unbelievable.  There obviously isn't much in the way of Series X games yet, but I have been catching up on some Xbox One games I haven't played, notably Doom Eternal and Control so far.  If those are considered last gen games running on the Series X, I can't imagine how games could look or perform much better.  They look incredibly great, and load times are basically non-existent.  It's just a joy playing.Packaging and set up really feel top notch.  They went over the top with the packaging, it feels really nice opening.  Set up is very easy too, similar to setting up a google product.  You do it all through your phone, and it is very easy and painless.  I was worried when there were reports of it ""running hot like a furnace"" pre launch, but those reports are pretty laughable.  It doesn't get any hotter than any other console I've had, and it actually probably runs much cooler than my old OG Xbox 360 that bit the dust a while back.  The great thing that you wont notice as well, is that it is super quiet.  The only time I hear it is when its whirring whenever I power it on.The only minor negatives I have are that it is big, and IMO a little ugly.  However it is smaller and I think better looking than the PS5.  I have it set up horizontally on my entertainment center, and it doesn't look quite right.  Its obviously made to be set up vertically, but I don't know anyone who puts their consoles in a vertical position, and not to mention you can't really put it in an entertainment center that way.  But when you're playing, who cares how it looks?  The other thing is that quick resume is finicky.  It doesn't work ALL the time, but when it does it's amazing.  You can literally power on the console, and you're playing exactly where you left off last time in about 30 seconds.  I also wish there were an SPDIF out for my AV receiver.If you're a gamer and deciding between the Series X or the Series S, I think in the long run the Series X is absolutely a better bet.  The main thing that scared me off on the Series S is the memory, and the lack of a disc drive.  The cost of the expandable storage is exorbitantly expensive, and the 500GB will probably fill up fast on the Series S.  If you buy the S and the proprietary storage, you're already at the cost of the Series X.  However the 1 TB on the Series X is perfect.  I currently have 13 games, between One and 360 versions, with about 50% storage remaining.  However, I'm sure future games will take some more space.  Overall, I am overly happy with this, and has made my quarantine time actually enjoyable.  Just do not buy from resellers on ebay, as I am sure more are coming available very soon.",0,english
Blue Rondo ala Turk,1,Amazon is backwards and not interested in the consumer getting a fair deal,the United States ,20210101,False,  Amazon is very stupid about marketing the Xbox series X scalping an illegal scalping shouldn’t be a policy on fire on Amazon,4,english
Stephen,1,Amazon supports this type of behavior?,the United States ,20201209,False,  $499,6,chinese (simplified)
S.,1,Terrible company. Inhumane practices.,the United States ,20201230,False,  Hype a game system up all year and then don't deliver it. No excuses. That's just POS behavior. Microsoft and Sony should suffer for this.,3,english
leah erickson,3,"Quality Hardware, Firmware needs some help",the United States ,20201209,False,"  The difference in game quality both graphically and responsiveness was night and day from my Xbox One. The console powers on and delivers me to the hone screen in less than 2 seconds, and boots games in a similar timeframe.One major issue Microsoft needs to address, but probably won't, is the fact that many gaming monitors aren't compatible with the xbox at 1440p 120hz. These monitors can run these specs over hdmi 2.0, but don't conform to the standard VESA timings, which is all Microsoft uses. This limits many high end gaming monitors to 1080p 120hz, or 1440p 60hz, which is unfortunate. If you plan to upgrade your tv or monitor, make sure you do considerable research into which model will actually work like it should with the Series X.",1,english
A. Monkey,2,Disappointed so far,the United States ,20201227,False,"  I was really looking forward to the series X, and was excited when I managed to get one in a Wal-Mart drop.  So far it has been nothing but frustration.  There is no optical port, which is bad since my receiver doesn't take HDMI.  The worst part is it won't connect wired.  My Xbox One and TV are the only things in my house I don't do wireless, and I would strongly prefer the series X be wired as well.  Support has been absolutely no help whatsoever.",1,english
John M. Brady,5,Fast and quiet,the United States ,20201211,False,"  I received my Xbox Series X direct from Microsoft on launch day.  Two observations, it's incredibly faster than my Xbox One X and extremely quiet considering how big the cooling fan is.  The game quick start feature is similar to unpausing the game but doing it when the console is off.  One concern I did have, is that when the console is on it's side it get's incredibly hot.  Nothing happened but I moved it vertical to be proactive.",1,english
Anthony Ryhal,1,ABSOLUTE PRICE GOUGING!,the United States ,20210120,False,"  If I could give this one star I would, regular pricing from manufacture itself aka Microsoft is $499.99 how can you over price it this much. In my opinion I hope no one buys these because at this point it’s not worth it.",3,english
Jan,1,"Don't fall for it, way overprized.",the United States ,20201221,False,"  $250 more for an Xbox series X, hopefully people are smart enough not to buy!!!",2,english
Amazon Customer,1,Garbage,the United States ,20201223,False,  You probably got your hands on hand sanitizer and masks a year ago also. Pos,3,english
Amazon Customer,5,Amazing Console for all Gamers,the United States ,20210105,False,"  Although an upgrade to a PS4 and XBONE are not completely necessary at this time, this console is  amazing. Since I have my One X, in the living room, and the Series X in the game room, I get to see the difference in visual quality and performance of games first hand.  I considered the PS5 but I hardly used my Ps4 and most of the games form last generation were purchased on the Xbox ecosystem so this made alot more sense. Having gamepass and back compatibility is a huge plus as well. Overall, I am so happy I bought this gaming machine. Again, you can wait a while as buying it now isn't a must just yet but ehen you do, you will appreciate the leap forward.",0,english
Nolan Jorgensen,5,Scalpers,the United States ,20210126,False,  Oh sure wish I could buy one at $499.99 but Amazon's only allowing scalpers to sell the Xbox series x I see!,2,english
Nolan,1,Overpriced,the United States ,20201220,False,  Overpriced. Don’t pay over $500 for this.,3,english
Scott Reviews,1,Poor unethical Launch (READ),the United States ,20201215,False,"  This is a complete waste of time trying to find one here, might as well look for one in the ocean instead.",2,english
Yusef,1,Don't have series x and can't get a series X,the United States ,20201214,False,  Amizon need double authentication for larger purchases over 499.99 dallars,2,english
Dean J,1,Ridiculous,the United States ,20201115,False,  That’s sad that you are trying to ripe people off!,3,english
Anne Cannon,5,Worth it.,the United States ,20210116,False,  Bit of a rocky start. Took a bit to get here. But once everything was hooked up ( new LG OLED tv from Amazon) and wireless headphones. Ahhhh gaming heaven. Worth it if and when you find one :),0,english
Mark Whitfield,1,Ha Ha Ha!!!,the United States ,20201215,False,"  You could build a bada@@ PC for the current pirated cost of this. I wanted one for my son for Christmas, but I could build him an awesome PC for same price. Good job Amazon.....",2,english
jackie m,1,All the hype was for nothing,the United States ,20201227,False,  Console shuts off every 5 minutes. Can't get any help from Microsoft of course,1,english
David Garcia,1,"Please have patience, people",the United States ,20201230,False,"  For that same price I just got mine with 2 years extended warranty, headphones with warranty, extra controller,  rechargeable batteries and had some money to spareGod, what a little patience can do",1,english
William Lamb,5,Perfect Console,the United States ,20210101,False,"  Great Machine, Better then some high end PC's. And a lot less in price. Well unless you're buying from a scalper. Never BuY from a scalper. Chances are the machine is a brick and your money will be good bye forever.",1,english
VwDad,1,Insanely priced. Wait for the coming release!,the United States ,20201208,False,  Don't buy this overpriced bs. Wait for stock to come soon!,2,english
Farman Khan,1,Ps5 is just better I’m just speaking facts,the United States ,20210101,False,  Your browser does not support HTML5 video.   As you can see x box the ps5 controller is just superior to the same old Xbox controller PlayStation really went all out and Xbox didn’t even try in conclusion if ur looking for a new console ps5 is the way to go ( ͡° ͜ʖ ͡°),1,english
R. Michael Raab,1,stupid...,the United States ,20201219,False,  I'm switching to PS---xBox can't deliver their new game set for the holidays....,2,english
Argue88,1,I thought amazon was better,the United States ,20201229,False,  Expected better standards from Amazon.,2,english
Amazon Customer,1,How can you advertise a product you will more than likely never going to have?,the United States ,20210112,False,  Would give 5 stars. Never available too buy. Not a good product if you can’t get it.,2,english
Dmc919,1,"It's broken, unless you connect to the internet",the United States ,20201209,False,  I bought this and took it to my man cave/cabin. Couldn't even play it because it requires internet. Thanks Microsoft,1,english
Gabriel,1,Overpriced,the United States ,20201228,False,  Overpriced,2,english
Trypticon,5,Best console ever!,the United States ,20201213,False,"  The Xbox Series X has better and more powerful CPU and GPU, it's more quiet, it's smaller than the PoS5 and has QuickResume, Auto HDR, can do 1440P, has lightyears better game subscription service and it can actually do 4K with 60FPS/120FPS and last but least XSX’s SDD is way way faster than the Sh!tstation 5’s  glorified HDD.",0,english
James m. Moore,1,Why are you Making people wait?,the United States ,20201210,False,  You need to drop that price down to 700,2,english
Carlos pagan,1,Fallo Xbox series x,the United States ,20201217,False,  Solo 3 dias de uso y se daño,2,spanish
Lebo Smithsonian,5,"An Absolute BEAST of a system, too overpriced on Amazon!!!",the United States ,20210119,False,"  The Xbox Series X, like it's predecessor, are great systems to game on. However, Amazon needs t STOP letting sellers selling it overpriced!! Not cool, man.",0,english
Amazon Customer,1,Way to much,the United States ,20201216,False,  Scalper,2,english
mary seaton,3,Will cost for new upgrades,the United States ,20201213,False,  I’m a fan of Xbox but not impressed they took out the Kinect factor so I can’t monitor what is being said while my grandson is playing also storage cost is unreal this little box can turn into a money pit if not careful love my old Xbox x,0,english
Bennie,1,No way,the United States ,20210125,False,"  I tell you  like the rock say take the xbox tune sideways in put it up your you no $1,000 for game you",1,english
Unknown ,1,Great console but way overpriced from the original price,the United States ,20210126,False,"  This is a great console that Microsoft has created for the community to use and enjoy but the one thing is why is it overpriced from the regular price? I'm not paying 900 - 1100 dollars for a console that's supposed to be $499 plus tax, why would amazon allow this?",0,english
joanna Jagodka,1,CROOK,the United States ,20201210,False,  Crook,1,english
Shannon Thompson,3,"Wait till next year, cause you ain’t getting one",the United States ,20201209,False,"  Haven’t got one because of scalpers but I know it’s great, it would be great if companies like this one would actually do something about them.Great console, horrible distribution and execution.",0,english
Helen Gross,1,Dirtbag scalpers,the United States ,20210122,False,  Scalpers,1,english
Amazon Customer,5,Love it,the United States ,20201214,False,  Got on launch day at my work it’s big works great sow far no problems with it plays all my disc games 360 Xbox one games and dvd movies,0,english
Soozie Lee,5,Very much worth 500$,the United States ,20210119,False,"  Your browser does not support HTML5 video.   I can't believe i snatched one of these bsfore the demand became so high! the size of the series x is perfect, especially playing on 4k 120 fps! would high recommend!!!",0,english
Saucy Mac ,1,Pig Nose,the United States ,20210126,False,"  I bet you have pigs feet, you hog !!!",1,english
Patrick Loney,1,"$1,000?",the United States ,20210126,False,  You're supposed to take a hit on the consoles and make bank on the games. Why you trying to do it backwards? But then again... Why are people STILL paying this much?,0,english
Cody Lanier,1,Amazon shouldn't allow this,the United States ,20210128,False,  Hope they collect dust,0,english
Brandon,1,WARNING!,the United States ,20201210,False,  Msrp 499.99 dont pay more,1,english
Graham,1,They are absolutely despicable for this,the United States ,20210128,False,  This is ridiculous to put such a mark up on the price you have to be the absolute dumpster water of society,0,english
Emily Wells,1,Scum bags,the United States ,20210128,False,  Literally the worst humanity has to offer the frack is the reason for this? I hope you have to sell them at a loss when stock renews,0,english
Christian Johnson,1,scam,the United States ,20210127,False,"  $1,000 for a xbox. First off, xbox sucks so it shouldn't even be $500. Second, worst deal ever.",0,english
Amazon Customer,5,THE BEST CONSOLE EVER,the United States ,20201221,False,"  Beautiful design, powerful, fast and that quick resume... AWESOME!!!",0,english
Shaun Mayes,1,3rd is just disgusting,the United States ,20210126,False,  Its people lime you that are ruining gaming. You shod be ashamed of yourself,0,english
Jamar Trisvan,1,Still over price,the United States ,20210127,False,  Still way over priced bring the price down to 660 and you got a deal,0,english
Wes,1,Rip off,the United States ,20210127,False,  What a rip off. They should be ashamed of themselves.,0,english
Melissa,5,Lol,the United States ,20210119,False,  Omg so good a lot better then ps5,0,english
Amazon Customer,1,Sad this is going on,the United States ,20210126,False,  Pathetic,0,english
Robert,1,That sums it up....,the United States ,20210124,False,  What crackheads suck a sock,0,english
edward eric roberts,1,Overpriced,the United States ,20201110,False,  999$? You’ve got to be kidding. No one is going to pay 500 more than retail value.,425,english
Samuel Gunn,5,It is worth the money. But needs more games.,the United States ,20201118,True,  I love it,0,english
Bill Bixby,2,"I'm honestly disappointed, doesn't really feel next gen.",the United States ,20201221,False,"  My honest non biased critique on the xsx DiscussionHonestly this system has been very disappointing for me. I have been a gamer all of my life, and never been a fanboy of the big 3. I game to game, and mainly get all 3 systems each gen. This isn't for the people who can't counter my points in a constructive way, and will just lazily label me a troll or some garbage. I currently have every Microsoft system hooked up, minus my og xbox which is put away. I only bought it because I still wanted to play true crime nyc, mech assault, and Def Jam fight for NY. I am upgrading from an xbox one slim to the series x.Onto the critiques:The network adapter is worse than the xbox one slim one. I have tested this mutliple times. I have downloaded a game on my one slim and a game update(Haven 1.66gb) on the xsx, the one slim downloaded quicker.Also it random disconnects for no reason. Since I got my xsx on 12/15 I have ran the system by itself and no other system, and I have run it along with my slim(I have to do something else with all these huge updates and upgrades going on). Due to it randomly disconnecting, it would cause freezing and system issues. I go to play said games, long system freezes and crashes. Disconnect, then immediately reconnect and then retry to play the said game. Then be told of a huge update file 3 times back to back(glitching due to disconnection), then it finally starts updating and upgrading finally.The huge update and upgrades. OH MY GOD!!!!!!! I swear this was the first thing to almost make me ragequit all future Microsoft consoles, and to sell my xsx for a ps5. I copied over some games from my external hdd. Think I would just get a upgrade to xsx version and be done with it? Nope!!!!!! You have to update huge files , only to be told you need to upgrade with 55gb+ sized files(Destiny 2 upgrade was 70gbs) on top of that. I don't feel like I bought a game system but a non stop updating and upgrading system. Boy do I feel for the people with data caps and restrictions.External Harddrive issues. I am using a wd 4tb passport extrnal drive on my one slim & xsx, pretty good brand. I bought it a year ago. I have 415 games on it digitally when I plug it into my one slim, however when I plug it into my xsx I have 385 digitally on it. What happened to those other 30 games? I have restarted both systems and then tried the external harddrive on both multiple times. I am at a lost.Downloading is really bad. When I initially saw the slower speeds and longer download times, I took to google and discovered via youtube you can't have games opened while downloading or otherwise you get slower speeds. On my one slim, I could download a game, watch youtube, and run rewards or gamepass and still get good speeds. On the xsx, that isn't happening unless you want your downloads to crawl to a snail's pace. I don't see how this is next gen, and previous gen could do better. This basically nullifies any value quick resume has.Auto Hdr. Why not make it to where you can turn off the auto hdr in each game individually? Why must it be either off or on? Some games can look good with auto hdr, while others like scarygirl looks weird with auto hdr. I am forced to cut it off and not enjoy the games that will benefit from it, or leave it on and play great games that visually look bad or weird due to auto hdr. No middle ground or compromise.Visual difference. Having upgraded from an one slim & nice 4k uhd tv, I barely see any real difference visually. From 4k blu ray movies to games, I see no real difference. I was expecting to be blown away since I was constantly told native 4k was so much better than upscaled 4k. I have tested out movies and games on the xsx, nothing has made me say yes this is worth owning a $540 system over lol.In Closing: Even at the moment of writing this, I am using my one slim to do youtube while my xsx updates and upgrades(66.13gb for forza horizon 4) to avoid slow down. I paid $250-$275 out of pocket(the rest in rewards points) for this system and I am severely disappointed by it. My one slim can do almost everything the xsx can do, if not some things better. I am not impressed. I wish I had waited 2 years.",1,english
Chad,5,"Great Console, Sad Resells",the United States ,20201210,False,  The xbox itself is great but the amount of people who are re-selling it for 1000+ dollars makes it very difficult to find a standard product.,1,english
Alex Bareis,1,no,the United States ,20201207,False,  no,1,english
sambadshaw@gmail.com,5,,Canada ,20201112,True,  To start off with I see a lot of post that say this is a scam etc. To clear the air. There are people that can resell through amazon just be weary of who you're purchasing from. I purchased this directly from Microsoft throguh amazon at 599$ CAD. I did also have to purchase a tv for the full experience samsung Q70 hdmi 4 supports 2.1 hdmi and 4k. The Q80 &Q90 do support this also if you were wondering.The xbox does give calibration options for your TV.The walk through at the beginning is really key for the experience.Yes we were short handed because xbox delayed all their new game releases but system functionality wise SO FAR is great. I will Update this once I've played some games just to advise of my full experience.,74,english
TDot2020,5,,Canada ,20201112,True,  Incredible machine. Sets up in a flash. The App is key for easy set up. Feels so smooth. HDR is incredible for upscaling games. Nice to have 800gb and purchasable expandable memory now.Obvious drawback are games. We need more. BUT the upscaling with game pass and HDR allows you to rediscover old games which is awesome.Playing the Xbox Series X with the Elite 2 controller and Arctis SteelSeries 9X is a transcendent experience. Truly the Ferrari of gaming.And it’s not THAT big compared to a Day 1 Xbox One.,26,english
amrit,5,,Canada ,20201111,True,  Microsoft killed it this time around. Compete focus on the gamer. And gamepass is a steal,23,english
