name,score,title,place,date,verified purch,text,upvotes,language
Amazon Customer,1,Third is wrong,the United States ,20201125,False,  This should be illegal. What a scummy thing to do.,1418,english
duwyne,1,Horrible,the United States ,20201113,False,  Hope you never sell them,1734,english
Jose C,1,Wait for the stock to replenish,the United States ,20201114,False,"  Wait for the stock to replenish, all games are backwards compatible. don't feed the Trolls",1313,english
Dustwaj,1,Overpriced,the United States ,20201125,False,"  How dare you Amazon!  $1,500.00?  Thats not cool dude.",871,english
Jason Japa,1,Overpriced,the United States ,20201125,False,  annoying,793,english
SP,1,WE ARE THE BETA TESTERS,the United States ,20201125,False,"  I get it. Supply and demand, but seriously? Literally triple the price? PC master race... here I come... Get a nitro 5 instead of this deal. The entire reason consoles were so popular were the affordability. By all means, if you can buy it, it's a great machine. It seems like we are all beta testers and game companies are just releasing garbage games and fixing the issues on their time... simple fixes take months not days. Smh.",643,english
blake,1,How does amazon allow this?,the United States ,20201207,False,  $1400? Really? I hope you end up stuck with them.How does amazon allow this type of activity?,465,english
Stephen J Morley,5,"It’s huge, but it’s awesome.",the United States ,20201110,True,"  It’s a behemoth simple put. Besides that it is a really amazing console. Just setting it up and downloading a few games for my son, I could really notice the download speed and performance upgrades. Does not run hot so far it has been running terratech in 4K hdr for about half hour. See picture. The Xbox one x would easily hit 150 degrees Fahrenheit.",367,english
Meghan Pennington,5,I'm genuinely blown away.,the United States ,20201110,True,"  Let me start off by saying I am not an Xbox fan boy lol. I have mostly played PS4 and PC  in the past few years. I was very intrigued with Xbox series X because of the user experience. They really seem like they were listening with this generation and it shows. The UI interface is like butter it moves so quickly, with hardly any waiting. Game pass which is an amazing option only on Xbox and PC has an amazing selection of games right at my fingertips for a monthly fee. Xbox really got the user experience down I can honestly say that it was definitely worth it. I've been enjoying a lot of games that I played on PC and I am confident in saying that I have such a great experience on Xbox series X I'm blown away. It gets a little hot but I have it in a very breathable location. ( I would recommend that as well ) I'm excited to play all the Xbox one games I missed out on! (And new games of course) Overall I really recommend it.",174,english
Brenda H.,1,Should Be Illegal,the United States ,20201125,False,"  Microsoft should try to get control over this.  Should be illegal for one person to secure 7 and rip people off like this while everyone tries over and over to get one, but can't.",177,english
Taylor Kornberg,3,"New console, doesn’t feel next gen",the United States ,20201110,True,"  What the console can do is good, but there is no new exclusives games for launch. I feel that’s a huge loss for Microsoft. Not really any reason to get this console until sometime next year when there will be some exclusives. The looks of this console doesn’t feel next gen and not a fan of how the insides are built/put together. Going to be a massive pain to clean this thing.",139,english
Scott Dutton,1,Scummy,the United States ,20201125,False,  awful scam to run. Scummy people ruin things.,155,english
Gabriel,1,Insane price,the United States ,20201125,False,  A Xbox series x cost $499 not this crazy price.,148,english
Jpix,5,It does everything except clean the dishes,the United States ,20201110,True,  Tons of PowerGamepassHaloWhat more can a man want?We are living in trying times Xbox will help keep our minds busySolid build and lightening fast UIOri looks gorgeous!,122,english
tigmaster,1,Third party plague,the United States ,20201115,False,"  These people are the lowest of low,just praying on people the worst of humanity.",131,english
Kindle Customer,5,Xbox Series X Review,the United States ,20201110,True,"  To start off I would consider myself not a pro gamer, but definitely not a casual. I’m some where in between hardcore & Pro gamer. I got some insight on specs etc. This review will not be about the specs because we already know it’s damn better than last gen console Xbox One X.After a terrible, terrible, terrible...... the worst preorder experience of my life. I’m not joking. This generation of consoles preorders will go down in gaming history infamy because how bad it was, especially during our pandemic. I was as excited as I ever could be to receive this item as if I was a child all over again. And to top it all off it came 9 hours earlier on release day! I call that a significant win for preorder delivery, since this is my first time preordering a console online.Now for what your really here for, the console review. Personally, I love it. Load times are significantly faster! Games look so damn good! And total backwards compatibility with this console made me cry tears of joy. A true 4k experience. Something last generation promised us that didn’t happen.Now not anything is perfect. The one huge downside is there are no new games for this system yet. Usually there will be about 5 to 10 day one (some exclusive only to console) games. This year there’s basically 0. Yes, the positive spin on this is you have a while back catalog of older games you can play on this newer system and see the graphics ramped up. But as an avid gamer I am a Little disappointed that Microsoft the back big time even during pandemic that they couldn’t even offer at least 3 day one games. Sony is the same. These consoles will not have new games coming out day 1 unfortunately. We’ll have to wait till a little more in 2021 to expect the games we really want.If you want a more in-depth review you can head right on over to my YouTube channel where you can see an extensive review on the console today at 8pm central standard time. My dad and puppy will be on. It’l is going to be hilarious and cute. My channels name is Clive Childress. Come check it out of your interested to know more.All in all though this console is stellar. And I can’t fault the company for the pandemic situations. So with all that said this is a pretty great console.",92,english
Code Missing,1,Scalpers should not be rewarded.,the United States ,20201209,False,  This is way more than the item sells for.,102,english
Nick M.,1,Shouldn’t even be legal to do this.,the United States ,20201115,False,  Absolutely a complete rip off!!,93,english
Brian A Offord,5,Totally worth it,the United States ,20201110,True,  Preorders were a mess but did you really expect them not to be? With that being said this thing is amazing totally worth it,64,english
Customer ,1,Absurd Price,the United States ,20201115,False,  What a rip off for the price. Not worth the money.,80,english
E.S.,1,Rip off,the United States ,20201115,False,  Seems dishonest,77,english
Neal B,1,seriously?,the United States ,20201209,False,  3x....pls don't fall for these scams.,75,english
A. Yates,1,Lemon,the United States ,20201113,True,"  Sad to give this a poor review.  I received a launch day unit which worked for three days and apparently died overnight.  No obvious reason for the death of the system but it simply won't turn on again.  MS support is sadly poor - just a circular loop back to the same canned and deficient ""support"" page, and an option to request a repair on the unit.  Says there's 24 hour online support, but I can't actually get it for this issue.  Likely returning it instead of requesting a repair.Prior to the hardware failure I was happy with the system.  As expected, load times were quite good, games looked great and were fluid.",34,english
Amazon Customer,1,Stopped working less than 4hrs after got it.,the United States ,20201111,True,  Everything was great then it just turned off and now it will not come back on. Called Microsoft and they were no help at all. I have always had Xbox and have not had any real issues until now.Now when looking online you can find all kinds of people with the same issue.,35,english
Shawn P Vigneri,1,Launch day console = expensive brick,the United States ,20201111,True,"  I was very excited to receive my console on launch day after waiting 2 months from the pre-order. I was able to setup the console but it quickly died. The screen started flashing green then it shut off. After that it would either boot and then shut off after a minute or not boot at all. Lesson learned, don't buy the first generation of Microsoft's products!",30,english
Kris W,1,Don't buy digital games. Not possible for kids to play while I am.,the United States ,20201123,True,"  Over the years, I've invested in digital licenses for games.  felt like the future.  When the series x came out, I decided to give my xbox one S to my kids so they could play their games.  If we try to play at the same time, even though it is not the same game, we aren't allowed.  Okay... surely it will work if I sign in with my Kid's xbox live account that is connected to mine through family controls right?  Nope.  Maybe there is a way to loan the game or transfer the license?  Nope.  Basically I'm SOL, and will be looking for physical used games this holiday season for my kids.  The technology is ready for digital licensing, but MS is not.  I suggest buying physical (preferably used so it hurts their bottom line) until they empower digital owners.The series x itself has been fine.  Crashing a fair amount, but for now I blame that on COD:Cold War",26,english
Ian,5,Will only get better with software updates.,the United States ,20201110,True,"  The size of the console is so compact, it runs whisper quiet and improves upon most backward compatible titles.4K HDR, 120 FPS, 1440P support, even Dolby vision is supported on the console.You will get about 800GB usable space from the SSD for your games. Eventually you may have to spill for the 1TB sea gate expansion card. However, the best thing to do is use a USB 3.0 external HDD for your older games and put the new games on your main SSD.Currently there is an issue with VRR via HDMI at 4K. Variable refresh rate on certain TVs like LG and Panasonic. Microsoft is aware and will patch this via a software update. In the meantime, you can either turn VRR off on your Xbox video settings or run it at 1440p/1080p which works fine.Gamepass is the best value in gaming right now, Destiny 2 and the new expansion are on it.UI is running butter smooth and games are launching instantly. Right now there aren’t many new releases of games, but as time goes on there will be more titles to take advantage of this beast.Microsoft made an amazing console that will only age better over time.",24,english
Chris Stewart,1,Bricked,the United States ,20201111,True,"  Console bricked in less than 5 hours, already have it on its way to MS for replacement. Truly “Next Gen” ",26,english
Yoal,1,Dont buy,the United States ,20201209,False,  Dont buy,47,english
Jocelyn Rodriguez,1,Not worth it!!,the United States ,20201110,True,"  Ewww i cant believe i acctually got this , its heavy and slow and is not worth it!! I honestly just threw it away could not handle this",23,english
Tom,1,Very disappointed. Major issues causing some games to be unplayable. Stutters and shuts down,the United States ,20201114,True,"  Have had major problems with this console. The disc drive doesn’t read discs after u turn the console off unless u eject and reinsert. Games like COD MW and Cold War lag incredibly bad to the point it’s unplayable due to the stuttering, yet when I try my Xbox one on the same tittles there is no lag at all. Lastly, my Xbox series x shuts completely down randomly in the middle of games - it’s done it 5 times sometimes back to back.Would not recommend buying until they patch all these problems (hopefully they can be patched",20,english
Zack Rowe,1,I wish I could give it 5 star but...,the United States ,20201118,True,"  Your browser does not support HTML5 video.   I wish I was able to give the Series X 5 stars but Microsoft customer service has killed it for me.A couple hours after receiving my Xbox it froze and after rebooting small pixel sized green squares littered the screen. I attempted swapping cables, changing TVs, and performing factory resets. In the end the issue would not go away.I decided to see if I could get a replacement through Amazon. Unfortunately they are currently out of stock. So the only option they provided was a refund or gift card.So I decided to give Microsoft support a shot, hoping that I could send it in for repair and get a replacement. This is where my journey of jumping hoops began.Microsoft only option for phone support is to fill out a form to have them call you, which is fine most of the time. After completing the form I was told I would receive a call in 90 minutes. 3 hours later I receive a call that the queue is full and my request was canceled. I would need to try again the next day.Next morning at 7am I refill out the form and receive a call from a human 2 minutes later. Woohoo! I explain my issues and the steps I took to trouble shoot. The service agent sets up a service request and says that I'll receive an email with what to do next.After hanging up and waiting a bit of time I receive the email and my shipping address is completely wrong from what I had told him on the phone....... So I hop online and resubmit the form to be called and I'm told it will be a 90 minute wait this time. 3 hours later I receive a call from a rep. I explain the mistake that was made on my address and he says that he needs to put me on hold so that he can escalate the issue. After being put on hold for 30 minutes  I abruptly get hung up on.After waiting to see if I would get a call back with no success I resubmit a request to be called online again. 4 hours later I get a call that the queue is full and my request has been canceled. I will need to try again tomorrow. I've owned every Xbox console that's been release and I would consider myself a bit of a fan boy. I shouldn't be required to jump through hoops like this when something doesn't work properly. This is EXTREMELY frustrating as a customer and has soured me a bit on the release of this console that I was super excited for a few months back.",20,english
The Du,1,Power cord does not work!,the United States ,20201110,True,  Release day. Power cord doesn’t event work. Power cycles on and off for 3 seconds. Used old power cord and it works fine.Garbage.,22,english
SHA,1,Crashes!,the United States ,20201112,True,  My series X keeps crashing after a few mins of being turned on. I can just power it up and let it sit and it will power off completely without notice. Basically I have a very expensive paper weight! Smh!,19,english
Trenton P Mongillo,5,Amazing new gaming all in one system from Microsoft.,the United States ,20201110,True,"  Everything youve come to expect in a console launch. Polished hardware, subtle redesign of the included controller (1). Comes with a high speed hdmi 2.1 cable. The power brick is all internal and has a normal cable for power supply. If you are giving this as a holiday gift, consider powering it up before hand, it has approximately 900MB update to do right out of the box. The controller needs to be updated as well. You can use a smart phone and the xbox app to set up profiles and settings from your previous xbox one. You can also transfer your digital games from your xbox one over your own network instead of downloading them all from the xbox servers. Be warned! Digital game downloads can take hours to install depending on your internet connection.Great tech in this product. I like the future proof cables for when I decide to upgrade. Awesome form factor and it runs quiet and stays cool.Game pass is a must for xbox. Save thousands on games and have so many to choose from. With the latest additions of EA Play and Disney+ there is too much value for the consumer to pass up.",14,english
Amazon Customer,1,Crap product,the United States ,20201110,True,  It doesn’t even turn on played for 20 min then the power button doesn’t work whatsoever,20,english
Irving Orozco,1,Sad,the United States ,20201113,True,  I pre order this item and once received two days later after release day I was really disappointed it would turn off on me out of nowhere and would not turn back on at all. I had to shipped out to Microsoft so they could take a look at it but really disappointed how I didn’t get to enjoy my brand new Xbox and even worse I have to wait even longer now.,18,english
Henry,1,Dead after 6 hours of use,the United States ,20201118,True,  Your browser does not support HTML5 video.   Was working fine on the 1st day I got it. Used it for about 6 hours and I’ll say this console is a beast. Woke up the next day the console wouldn’t turn on at all tried all the troubleshooting steps and nothing. Decided to return it for my money back. Will wait until all the bugs are fixed with future series x consoles.,15,english
Thuy,1,Defective consoles rumor is true...,the United States ,20201122,True,  Console is defective. Turned it on to play for a few hours and it stopped working. Unplugged console for 30 mins and still the same problem.  Going to wait a day to see if there’s any change but this is ridiculous.,16,english
DoggyDog420,1,Pair button to connect controller doesn’t work,the United States ,20201111,True,  Broken out of the box and no way to talk to anyone to troubleshoot it. This world is a mess if you need customer service these days. There’s no one there to help. Will be returning. Pretty worthless if you can’t connect a controller.,13,english
Anthony,5,Powerful and Quiet Console but don't buy from a scalper just wait,the United States ,20201111,True,"  Great console, easy to set up (it's fast if you use the Xbox App didn't try the other normal way). If you're an everyday Xbox player, once set up, everything is familiar and ready to go. Truly feels like a PC upgrade more than a console upgrade with how smooth everything is.Also don't buy from scalpers, just wait, you're not missing anything even remotely worth the price they are charging.",12,english
David,1,Do not pay this amount,the United States ,20201209,False,  Scalper this product is not worth this.,36,english
