name,score,title,place,date,verified purch,text,upvotes,language
whiskeyfoy,4,7 hours of pure Joy.. Until it wasn't. c'est la vie,the United States ,20201112,True,"  I will start by stating I know the risks of being one of the first to get new tech.  So take my review with a grain of salt.  If you are reading this 6 months from now you probably are fine.  I am giving 4 stars because I feel the early release pains are more on the company and not the product.My review is that the Xbox delivers on what it said it would.  It is crazy powerful and just runs games beautifully.... For the short amount of time it did that.  There I was, in the middle of a 10 kill Warzone Trios making sick comms, about to secure another W all while saying ""If they only knew it was on the new Xbox"" then all of a sudden... bewp... Series X Series-ly shut down out of no where.  Not just a casual bye, no, like an angry significant other coming in and saying ""You're still playing that game?!?"" and slamming the door in your face.  I tried a number of things to get the Xbox to come back to me.  I sang it a song, tucked it in, promised I would buy every Microsoft exclusive game.  But alas nothing worked.  I now have a very, plain looking, desk weight.  Now I get to go through the fun and lengthy warranty return process with good ol big brother Microsoft.  I will take solace in the few short hours I got to brag and make fun of the ""one'ers"" who couldn't get their hands on one, but will likely have a working console before I get my replacement.  C'EST LA VIE",1,english
Frank,4,Xbox,the United States ,20201111,True,  Heavy unit and big! But not as big as I imagined (pc gamer usually). Runs games smooth and responsive. The UI is much quicker than xbox one.Yakuza game looks beautiful on it. And waiting for cyber punk. The new controller doesn't work with some of my older recharge xbox one battery packs. Luckily. I have rechargeable AAs.Def feels like a nice upgrade from xbox one but if you dont have the money. Don't rush into buying one yet.,3,english
Mario,3,Got a dud,the United States ,20201202,True,"  My XBSX had trouble connecting to 5Ghz wifi and would turn off on its own after just minutes of gameplay on any game. Really sucks, sent it in for repair/replacement this morning.Also, i dont like how it doesnt feel like an upgrade cause of the UI. I understand the xbox team has constantly been working on the XB1 UI to what they considered perfection but i dont know, i just wish the experience felt more new.Overrall i’m very happy for my purchase, i know im just an unlucky one",3,english
FloridaJay!,4,Meh.. just another Xbox...,the United States ,20201112,True,"  So far not super impressed with this new Xbox. Yes it’s a sexy piece of electronic and seems built solid but the lack of launch games is disappointing. I also don’t see that much of a performance difference between my Xbox one x and this as far as speed etc. maybe because it’s due to lack of games but right now, they are way behind PS5 launch. Very disappointed and not so sure it’s worth the hype..",3,english
Trkoyse,5,Next-gen in Subtle ways (as of right now),the United States ,20201205,True,"  Coming from an Xbox One X I can say this does feel like a next-gen leap, albeit not a huge one as of yet.The console is quiet, and the use of an SSD this generation means a very responsive UI and faster load times for games. There are a handful of Series X optimized games available but not a bunch. I bought Devil May Cry 5 Special Edition to go with this and the differences are noticeable. In addition to improved graphics and faster load times the Series X also beings Ray Tracing which made this particular game look even better.To summarize the console delivers on bringing a next-gen feel and if you have a One X already there are differences that make the purchase feel welcome. Granted, with the short supply of games out there using this to its fullest at this time, you would be forgiven for waiting a little longer to buy this. But for those that buy it now or plan to buy it, I can definitely recommend this.",1,english
Keith M,5,Lots of potential.,the United States ,20201121,True,"  I'm one of those gamers that buys both Sony and Microsoft systems each go 'round. With the XSX, presentation was everything. From opening up the box and seeing how MS wrapped the XSX, it felt like I bought a premium product. Power up your new system, and you can transfer your existing content over in a flash. I love the SSD, and how quickly everything boots up compared to the previous  One X/S...Seeing NBA 2K21 upgraded is amazing! It's like a totally new game from the One X/S version I was playing. The XSX is whisper quiet..You'll barely notice it's on. Gamepass ultimate is an amazing bargin! My only wish is that MS had some New launch games, but with 2020 being what it is, I understand...I'll still enjoy the games I recently purchased, and the upgraded games like MK11, NBA 2K21, MADDEN 21, COD MW, ORI, AND FORZA HORIZON 4..The future is bright .",1,english
Maria,5,"Fast, quiet, powerful! What more can you ask for? Better design maybe. Best console ever made?",the United States ,20201113,True,"  Excellent is the best word to describe this xbox series x. I been a gamer since the 1980s and this is by far the best console ever created. Lets take a look at some pros and cons and also why I think its better then ps5.ProsIts fast! When I say fast I really mean FAST. Loads games in 5 seconds flat, menu system is snappy etc.It's powerful! The few games available to try right now that are optimized for the series x look very good and you can tell the future will bring alot of good high end graphics to consoles finally!Great selection of games thru game pass. And its backwards compatible with all Xbox games from previous consoles.ConsSo far there's only 2.1. I think they could of did better with the controller.  Although I still believe xbox controller is better then the competition in layout and thumb sticks etc. the plastic just feels cheap. The better grip and dpad is nice but the overall feel is cheap. Theres a small lip at the top that gives it a unfinished feeling. Also no rechargeable battery is a bummer as well.. Ps5 controller just looks way better and more of a future look to it.2. The system is bulky and looks like a fridge or just a big black box. The insides alot of work went into to develop a closed system with good cooling and a monster fan which is quiet and I appreciate that but the design is not good.Ps5 design is definitely better.Now why do I feel the series x is better then ps5. It all comes down to a few things.1. It's a bit more powerful2. Better online game library with gamepass.3. Better mobile play options with being able to play straight on your mobile phone or laptop or pc gives the xbox an advantage.If you always been a Playstation guy and all your friends are on there I can see sticking with ps5. But if you don't care about friends and want a bit better experience with ability to play your games even on the go then xbox is the moveI know this is a long review but I feel microsoft deserved it since they did a hell of a job with this system and I highly recommend it to anyone.If your a gamer and thinking of switching from pc to a new console then this would be the one I recommend.",1,english
sue boyd,5,I must have been nicer than I thought....,the United States ,20201215,True,"  ...for Santa to let me buy this. First off, I understand that I got extremely lucky and happened to see a surprise shipment of these that Amazon got the first week of December. I was able to buy it at MSRP and received my series X the next day. And WOW. I love this console. The load times are non existent. I have a low latency 4k TV and the image is amazing! Even early Cyberpunk runs perfect with nearly no load times. I have been gaming since the first NES came out in the 80s and this is the most polished gaming console I've ever experienced. I know others may have issues and the war with PS5 will be brutal... but I am having a blast. So far there isn't a single thing I'd change. X Series and Gamepass is the best gaming value this year.",1,english
Gman,5,Most powerful Xbox I ever owned. Its a good system for retro Xbox gamers.,the United States ,20201122,True,"  I only had this for a few days and so far I love the system. It sits 6 feet away from me and I can not hear it. It is so quiet. I was originally was going to get the Xbox One X in 2018 to replace my Xbox One Launch version but so glad I held off as the XSX is able to run older games nearly at the intended locked framerate with rarely any drops like the Xbox One X. I pulled out some of my old favorite Original Xbox, Xbox 360 and Xbox one games and they all look better with a more stable framerate, a higher resolution with higher amounts of AF.All in all the system is lighting fast. Usually, with load screens, I would pull out my phone or walk away to do something else. With this system, you really cannot do that anymore due to the lightning-fast SSD. The Xbox dashboard is very snappy like modern high-end smartphones. I am very glad I didn't get the Xbox1x and got this. The controller is similar to the Xbox One controllers but it has a textured backside. The triggers also feel more solid.Lastly, I'm not one to do game subscriptions but GamePass is very enticing at $15 per month. I'm planning to sign up by the end of the month.All in all, it's a good value if you have a 4K display. Coming from a Steam PC gamer Im very impressed with the system.",1,english
Trevor D.,5,Like a cat at 3 A.M.,the United States ,20201112,True,"  The new Series X is absolutely amazing. It's super fast and responsive, makes everything look better on a 4k TV (even non-120Hz tv's), and was SUPER EASY TO SET UP via the Xbox app. Even progressing from the One X, it is very easy to see the difference. It's larger than I expected, but still fits nicely among the atmosphere. The quick resume feature lives up to its name, and I highly recommend it for anybody looking to upgrade their current Xbox experience.For those that were unfortunate enough to get screwed out of launch day pre-order, it is absolutely worth the struggle and frustration.Can't recommend enough! Just don't vape into it.",2,english
Lee,5,Worth every penny and more,the United States ,20201110,True,  I have zero complaints about this console and if you like the Xbox one x then you will absolutely love this Xbox. It is quieter and runs cooler while also being far more powerful. It runs games incredibly smooth so if you are thinking about getting one then I fully recommend it.,4,english
Mandie,5,Well worth it!,the United States ,20201127,True,"  Coming from the Xbox One X I have personally noticed a giant different in smoothness and image quality with Gears 5. I played in awe the entire way through the game on the Series X. It’s a beautiful machine that performs well, and it has surpassed all of my expectations. Assassins Creed Valhalla was the game that really impressed me the most on performance mode. Any worries about no true next gen games went right out the window after playing this game. All games load super fast and it is fantastic. I’m used to loading a game, picking my phone, up and scrolling through social media, etc. With the Series X a game will load so fast that by the time I pick my phone up and open an app that I put it down right away, because I’m in the game already. Each game differs in loading time but boy this machine is fast. Quick Resume works well on older games, and another added bonus. The 4K player plays my movies and they look and sound beautiful as well. It’s also silent to my ears and it lives up to its hype. This was also a preorder and Amazon delivered on launch day and even early in the day as well.",0,english
Nolan J.,3,Why,the United States ,20201111,True,  Consol works nice controller that came with it is giving a whole lot of feedback everyone sounds like poop and I sound like poop and I'm using an expensive headset that works fine on everything else including the Xbox one but for some reason it makes me sound like a robot on the series x,3,english
TJ,5,Team Xbox Delivers on the Series X,the United States ,20201111,True,"  Shipping and Delivery: My Series X came on launch day as promised. The main box was in a brown padded shipping box. Shout out for that to Amazon. It gives me faith in their shipping process, and with their shipping partner. In my case it was UPS. My personal experience anyways.The Gaming Experience: As for the console, it’s a real monster. It’s like upgrading your PC after 7 years. An instant feeling of power, speed snd graphical output. So yes, you will notice the difference in power, big time, going from the Xbox One to the Series X especially. It’s quick and snappy. The SSD delivers, giving an instant boot up and extremely quick loading times in titles across the generations, whether it’s from 5 years ago or this week. This holds true especially in Series X|S optimized games. I decided to break it in with two games AC: Valhalla and Doom Eternal. It’s as promised. Richer, more dynamic worlds. Fluid frame rates. I couldn’t praise it enough. Ever want to know what a game feels like on a top of the line gaming PC but through the console experience? Series X will deliver on that. I couldn’t be more pleased.The Build: Again, Team Xbox delivered. A solid 14 pounds. So no small console. But it’s top notch in build quality. Heavy, sturdy and striking. I personally believe it’s the finest looking piece of tech in my house. It keeps asking for me to appreciate it as it sits silently in the corner, and each time I turn my head to give it that appreciation. The Series X looks like the premium 500 dollar device it is marked as. Hands down.",1,english
Rodney Peterson,5,Next-Gen Done and Begun Right,the United States ,20201127,True,"  Back in 2013, both Microsoft and Sony launched the Xbox One and PlayStation 4 (respectively). Compared to the generation prior (Xbox 360 and PS3) and how those compared to current PC's of the day, the seventh console generation did not start well. From false promises from Mark Cerny about the PS4 hitting 1080p and 60FPS for every game, to Microsoft's loss of focus on gaming... couple that with the less than impressive comparison to PC's, and you would find the apology for sale a few years later with the PS4 Pro and Xbox One X. Those were what we should have gotten to kick of a generation.Now here we are in 2020. The only downside has been acquiring one of the consoles and the lack of supply due to COVID-19. The Xbox Series X (seriously, Microsoft needs to do something about the naming) is a great offering with great value tucked away inside of the Xbox service.Without getting deep into the technical specs, I will highlight some key differences between the Series X and the One X. The SSD is first. Fast load times across the board for games and the system itself. The 1TB is not what you get in full, but it is not an issue if you keep a small catalogue of installed games. Currently with 6 games installed (AC: Valhalla, Destiny 2 ((all expansions)), GTA V, Red Dead Redemption 2 and Watch Dogs Legion), i am sitting at 357.5GB of free space. The frame rates are great with the ability to keep a steady 60FPS and achieve up to 120FPS. 4K is glorious with HDR. The Ray Tracing that some games have is a really nice touch, but unless you stop to smell the roses (or in this case the, wander up and stare at them), it doesn't jump out at you.Otherwise the console is impressive. Not a single sound has come from the machine in my few hours (extended this evening) of play time. The start up speed is incredibly fast and this is both from a fresh boot, to the low-power mode, to the unplugging method. Quick Resume is something to appreciate as well. Being able to have a handful of games running at once is a nice feature especially if you are one who has game ADD, or want to hop back into a single-player game after having a multiplayer session with friends.The new controller is built on the old saying, ""If it ain't broke, don't fix it."" While Sony went with a new design and functionality for the PS5 with the DuelSense controller (seriously the haptic feedback is a cool addition, but I have a weird feeling it will fade out at some point), I can't help but feel Microsoft kinda missed a chance with the Series X controller, by not adding a similar feature. However, the controller feels lighter than the last, that could be due to the fact I am using batteries instead of a play and charge kit. It feels also, slightly slimmer all around, but the shape is still ergonomically pleasing for any hand to hold. I don't mind the absence of an internal battery pack. I find that the play and charge is a nice option, and that with batteries you never have to worry about being plugged in. The jump to USB type C is nice as well, as most of the devices I own use that port exclusively. Added on to the controller's body is a texture around the back of the hand grips and the tops of the triggers. My grip feels more stable and connected. Also, the addition of a share button is nice for two reasons. First it is a great way to capture what you want without sacrificing gameplay or being vulnerable in a multiplayer title. And 2, it allows for screenshots to now be captured that when being taken by hitting the Guide button, would sometimes cause elements to disappear.As for the value tucked away that I mentioned, that comes thanks to Game Pass. A service I was not fully sold on when it was announced, but as time went on, I became interested and am now a member. And now with them (Microsoft) partnering with EA to bring EA Access to game pass, it makes me wonder what the future holds.",1,english
Jesse W.,5,It's a great console,the United States ,20201116,True,"  I noticed the two reviews for this console are people that were upset that they didn't get one. Hopefully Amazon will remove these. I have purchased the Series X, and am very happy with what I got. The loading times are great, the games look and play great, and the console is super quiet. If you have Game Pass, you can't go wrong with this purchase, and if you don't, you should get Game Pass. It really is a great console, and I can't wait to see what games will be coming out for it in the future.",1,english
Juan,5,Operates really smooth with beautiful graphics!,the United States ,20201110,True,"  This console is so powerful it feels so nice, glad i bought a 4K TV to enjoy it even more!",5,english
Jay Gonzalez,5,"""Xbox and Microsoft did an amazing job with this console in every way."" 10 out of 10",the United States ,20201117,True,"  It is an amazing console... I find it ridiculous how some of the negative reviews are based on no exclusives at launch. Like didn't they know that before pre ordering?The fact that I still haven't played many titles due to my busy life, there are so may games I can play off the bat on day one with this console. The fact that every game I played on the Series X runs so fast with loading time, and higher and steadier frame rates impresses me. Definitely a great upgrade from my Xbox One X to the Series X.I was able to simply use the 2 hard drives I had on the One X to the Series X with no problem, but if I want to play a game where I would want the Series X to take advantage of speed and performance, I would have it in the Series X's Internal drive, or in the SSD Seagate 1TB that goes behind the console.$500 for what it includes on the specs alone is a heck of a deal.5/5 No doubt. Xbox and Microsoft did an amazing job witwith this console in every way.",0,english
Ron O.,5,"Older games look great, running 4k at 60fps",the United States ,20201111,True,"  Set up was a pain with a Gmail account for my Xbox account..but after that everything is great! 1tb fills up fast though! Forza Horizon 4 looks great, but can't wait to see cyberpunk on this!! The green showing from the top is just colored plastic, not a light (which I was concerned about)",2,english
MrSavoie2U,4,Best Xbox console to date however...,the United States ,20201212,True,"  This is above and beyond the best Xbox console to date, however there are system updates still needed to improve the overall performance in games. Due to the fact that Microsoft waited for AMD to finalize the RDNA 2 feature set so the Series consoles could have the entire feature set, the system is behind in terms of max performance capabilities. Once these system updates roll out and the system fully utilizes the full RDNA 2 feature set and games are taking full advantage of them, we should see the full potential of the console. Early on there seems to be some slight performance issues with the cross gen titles at least. Still very happy with Xbox and the direction it's going as a gaming platform.",0,english
Jesse,5,Xbox Series X is amazing!,the United States ,20201114,True,  Xbox Series X is everything I hope and dreamed it would be! The first game I played on it was Assassin's Creed:Valhalla! It looks absolutely amazing! 4k resolution at 60 frames per second! Load times are extremely quick thanks to the custom SSD Harddrive. The new Controller is pretty awesome too. It has new grips on the back of the controller and also on the triggers. There is also a new share button on it that allows you to take screenshots of the games you are playing. If you hold the button down it records a game clip. Xbox Game Pass Ultimate is really awesome with Xbox Series X. Xbox Game Pass Ultimate now includes EA play at no additional cost. EA Play contains over 70 games. I highly recommend getting an Xbox Series X if you want to experience true next gen gaming!,1,english
Berty Martinez,4,Next gen gaming,the United States ,20201202,True,"  Have had it for 2 weeks now. Gotta say that it's a pretty cool console. If you have an XONE or OneX you'll feel familiar with the ui since it's basically the same. Now there aren't that many games that scream Next gen yet. Though the upgrades for series x/s optimized games are very cool with more incoming. As it stands, besides things like quick resume(which has it's few issues like not working 100% of the time), faster loading times, this gen is barely starting. So don't fret if you haven't been able to get one yet. Another point with these new consoles (ps5 included) is that in order to play at 4k 120 frames per second you need a tv that has hdmi 2.1. I went with an LG un 65nano85una. Awesome tv and not as pricey as oleds.",1,english
Destiny martinez,3,...,the United States ,20201120,True,"  Super excited after waiting, I finally got it today! Maybe 2 to 3 hours of play it shut off on me completely with no warning! I was in the middle of a call of duty game and it just gave out! I turn it on again and sure enough it shut off on me an hour into my game play!",3,english
HiTechKoolAid,5,Loading times were worth the upgrade.,the United States ,20201126,True,"  I know most people will say there is no reason to upgrade at this time due to no exclusive content, but the loading times alone were worth it.  Borderlands 3 loading times are like 4 times faster.  Game loads in around 1 minute compared to 5 and fast travels are around 13 seconds compared to 1 minute.  Think of how much time people wasted farming on the Xbox One due to those horrendous loading times.  As they say ""Time is Money"" and this system will definitely save you time so you can do other things instead of wasting it on loading screens.",1,english
james,3,Crashes when Playing,the United States ,20201128,True,"  I bought this console for the next gens games but every time I try to play a next gen game my console turns off after 30 mins of playing. This only happens to next gen games. I paid good money for this Console and I expected great things, come on Microsoft smh. The game runs smoothly before the console turns off. Everything else works really good no overheating or anything.",3,english
kdont,5,"Great system, good build quality, fast load times",the United States ,20201125,True,"  Great Xbox and a seemingly good upgrade from the Xbox One. Build quality seems nice and durable. The footprint of the device is much different than the older versions, to be standing vertically instead of horizontally.Load times are blazing fast. I've been playing Gears Tactics on game pass lately and the load times are dropped by more than half. Don't know if I've tapped into the usefulness of my HDMI 2.1 TV but games look excellent on my Sony X90CH 65"" TV.Overall a worthy upgrade from the previous gen. I'm pretty excited to see how long this device will last me",0,english
Vinod,5,Amazing System,the United States ,20201116,True,"  I've never been so blown away by a console before, this system truly delivers on what Microsoft promised. Although there aren't many games that can truly take advantage of the hardware performance the series x offers, the games that are x/s enhanced are otherworldly. Silky smooth 4k HDR at 120fps is gorgeous and I'll never go back. And it's soooooo quiet! Quick resume and transfer speeds from/to the seagate drive are a game changer. I transferred 100 Gb in 3 minutes. Crazy! I'm so happy with this console and can't wait for the next generation of gaming!",2,english
jpot,4,Great so far,the United States ,20201207,True,  Exclusives aren’t there yet but the game pass ultimate subscription is a great value as had different games to try out.  Loading is a lot quicker too.My only complaint would be the guide is exactly the same and the controller feels identical which sucks as it doesn’t feel like a next gen but a refresh.  Wish they would have revamped both like sony did,1,english
