name,score,title,place,date,verified purch,text,upvotes,language
LoneWolf22,5,High Stress and terrible bots....,the United States ,20201115,True,"  First, I would like to say that it feels surreal to have been able to purchase a PS5 on launch day. I checked and checked obsessively only to get ""Out of Stock"" at the order review section. Not necessarily Amazon, but other sites. The whole reveal/pre-order was a debacle. Sloppy, sloppy sloppy. Thankfully, Amazon came through with their notification and it went through smoothly. Maybe its because everyone was focused on the Walmart promotion? Either way, glad it was the actual product.In terms of the system itself, it so quiet! I had it on all night (transferring PS4 data). My fan made more noise than this. The unit is HUGE. I had to clear out a section of my setup. My photo isn't doing this justice but if you look closely, the inside has small white playstion controller shape () details , which is awesome. The controller, WOW. Using it makes you feel like you're in the game. Although, it's only been 24 hours, I've been impressed so far. The only complaint so far is the travesty and headaches of trying to get ahead of the bots....",3,english
Brian Y,5,"The console is amazing, and the ordering process was easy per usual",the United States ,20201115,True,"  Was able to pre-order on the 1st day, was nervous due to all the pre-order issues happening EVERYWHERE, but just like my PS4 ordered from Amazon, the delivery was completed without a hitch. I know people are upset they couldn't get one, but it's not Amazon's fault, and largely not even Sony's fault, they had and sold more pre-order inventory than the PS4, one of the top selling consoles of all time, during a pandemic. Everyone who wants one will eventually get one, no need to review bomb for not getting one at launch.Now for the consoles. It's GREAT. Only a couple minor issues, which are widespread and will be fixed with an update. I'm coming from the OG PS4 so being able to take full advantage of my TV, plus the power of the PS5 has been amazing. The dual sense controller has to be used to truly understand the hype, which it actually exceeded for me. Yes the console is big, but we knew that, and I had adequate space in my entertainment center. I actually love the look of the console. It's got a cool unique look and it's a conversation piece for sure. Now I need to get that charging dock for the dual sense and I'm set.",3,english
Rene Delgado,5,"Other then Launch Issues, this console is awesome",the United States ,20201121,True,"  **Even though I was lucky enough to snag one for myself, I do hate that how this whole high supply demand issue happened bots shouldn't be able to clear out inventory that quick. We need a new 2VA for buying so the bots get cut out.**Official Review.It's an awesome piece of tech! I had every single ps console at one time and it gets better each time. The new updated controllers are comfortable in the hand. I like the mic in controllers, no more reason your team in any shooter game have no mic.The console itself is huge! Fast load ups. Heard of some systems had defects lucky for me I didn't have one. Sound coming off the system is non existent. Most all ps4 games can be played.  I connected my PSVr to it and it works smoothly as well. Highly recommend this console.",3,english
Jacinto Rodriguez Montoya,1,Don't by,the United States ,20201211,False,  Not cool,29,english
Johnebs,4,Well rounded console. But dont pay more than the MSRP.,the United States ,20201230,True,"  Great console in terms of power. Games look and run great. I like the design a lot but in my opinion it's too big.So far I've had no problem with the console but I really hate the shiny plastic. Mine has a very visible scratch already and I've only clean it once with a microfiber cloth.Is it worth the price? For a PlayStation fan or someone that wants to play the latest and greatest, absolutely. If you simply want a console to play modern games here and there, then get the cheaper Xbox Series S.Is it worth the scalpers price? Absolutely NOT. Do yourself a favor and wait.",3,english
William,5,Good stuff,the United States ,20201116,True,"  I gotta say, I wouldn't have got to order a PS5 on release day if it weren't for the snappy notification I got and 1 tap buying of Amazon being so swift. Walmart couldn't handle the traffic, but Amazon took it like a champ... But I digress, I'm here to talk about the PS5.The set up of the stand they give you is a little awkward to figure out, but it was an easy install. Other than that, it's as simple to set up as a PS4 was. Plug in the power and the HDMI cords, start up. It took me about 3 hours to update/transfer my system stuff. My one complaint on the PS5 homescreen stuff is that there currently isn't backgrounds/themes to select through, but whatever game/app/media you're highlighting will mostly be the background... So it's currently not a huge gripe. I'm sure there will be options in a future update.Now, how does it feel and play? For the most part... Good. I recommend the system's playhouse game to get you familiar with the many possible perks of the controller(s). As one big plus is that each controller has a mic right in them. At the moment I only have Bugsnax installed as a PS5 game, so I can't much comment on how their exclusive games are. (Bugsnax ia super childish, so it's not my cup of tea.) But I can confirm there are still are loading screens for PS4 games, but it feels MUCH less laggy with a PS5. I can't guarantee that you won't ever disconnect with it, but it seems to play online smoothly... Except games like EA's Starwars Battlefront 2, that game's still a laggy mess for me.It comes with about 800g memory free space when booted up, but I plugged in my 2T storage data I had for the PS4 and it didn't struggle to recognize what's on it after the data tranfer process. There's also 2 USB ports in thw back, which tells me if I run low on data for my 2T storage I have a second port for double the data right away... I'll look into that later.The only bug I've heard about the system is if you leave it in rest mode it may freeze or something, but Sony is aware of the issue and os already working on fixing it in a future update. So even with the tiny issues I discussed that's probably going to be resolved in future updates, I'm giving the PS5 a 5 star rating. I don't regret owning one. Good work, Sony! And good work Amazon! The delivery went smoothly as well.",3,english
Fonzin,5,You’ll get all the single moms for sure!,the United States ,20201213,True,"  What can I say it’s a game console from the gods. It’s a game console worthy of Chuck Norris using it. In fact it’s a game console that only Chuck Norris could’ve got his hands on. That was until amazon came though with the pre order!Not only has this game console made me the most popular person in my neighborhood, literally ladies have been throwing their bra and panties at me ever since I’ve purchased this. I am now on the road to have about nine baby mamas (from all the neighborhood kids throwing their moms at me so they can play Spider-Man on my PS5)  and will soon have to sell the PS5 to pay for all their child support.So good luck getting it since I know they are sold Out! However be weary of the consequences of having such a great power in your hands.Just as Spiderman said in the game I’m playing on this PS5: with great power comes great responsibility.So be sure to wrap it up when tapping all the single moms that are throwing themselves at you so you can let their kids use your console !",3,english
Jess,4,Highly Impressive,the United States ,20201202,True,"  This is my first time getting a Playstation near the release date. I didn't know what to expect, but after a few weeks, I really am impressed.For one, games barely take any time to load. The remote it comes with has a microphone built-in, which is really cool to me. The audio that comes from it is also clear and again, simply cool. It also lets you play most PS4 games, and if you have PS Plus, they give you a free PS4 collection. It includes games like Detroit: Become Human, Uncharted 4, Ratchet and Clank, and God of War. It's a sweet deal.My only complaint is Share Play. With the PS5 having limited availability, my friend still has the PS4. We often play together through Share Play, as certain games of ours don't have online multiplayer. One example would be LEGO: Harry Potter. Unfortunately, a PS5 and PS4 cannot Share Play with each other. I figured PS5 games couldn't be shared, but PS4 games can't either. Neither system is capable of sharing with the other. I really hope this is fixed in the future, as it blocks me from playing a lot of games with my friend.",2,english
Joshua Szpakowski,5,Big Upgrade from Previous Generation,the United States ,20201125,True,"  I got this system when Amazon sneakily put it up during a Walmart scheduled stock. I must say that this system is a tremendous upgrade from the previous generation of consoles. The controller with its updated rumble and the addition of adaptive triggers is fantastic to use! There is no real way to describe the triggers on it. The gameplay from COD and Miles Morales I have played looks and feels great. I have yet to find any downside during gaming. This is a monster in terms of size, so make sure you have a place to put it if you do find one!",3,english
Ridge  Tawdrous,3,Love the console but bad service,the United States ,20201114,True,"  Off the bat, the box is HUGE and heavy, not a great thing for a console, might as well get a PC. Secondly, I had a HORRIBLE experience with Amazon. Delayed shipping twice and the customer service manager did not even know why or when my shipment will be shipped or why it was delayed. Otherwise, I love the PS5 and it’s super high graphics is a really nice upgrade from the PS4 and the controller is sheesh amazing!!",6,english
Fro,4,"A Premium Console Experience that is Powerful, but that is just beginning to scratch its Potential",the United States ,20201112,True,"  [Initial Thoughts—Please stay tuned as I plan to add to this as I go]Opening the Box:Unboxing the PS5 reminded me of my first experience with Apple products years and years ago.  And if you are not an Apple fan, you might not realize, how, back in the dark ages, tech was haphazardly packaged or that everyone else largely does it the “Apple way” nowadays.  Needless to say, my experience was refined, not clunky, with the layout making sense, and very little wasted space.The Beast inside:The PS5 itself, is, well, massive.  It dwarfs the PS4 Pro, and hell, even the new options from Microsoft.  The styling of this hunk of plastic and metal is equally in your face.  There is no two ways about it, some will love it, others will hate it and pray for a refined “slim version” to come sooner than later.  I am more the former than the latter as I enjoy something a bit futuristic when it comes to my console experience.  In other words, I like that it looks like a vase, even if it has become the ridicule of many who make many phallic jokes about it.  That said, the disc drive version, which I have is a bit awkward at the base as it is a bit more “girthy” (Yeah, I know, I know.) than the digital edition.Setup:Setup experience is, well, exceptional.  Ladies and gentlemen, I have been gaming a long a** time.  My first console was an Atari 2600 and man, oh man, have we come a long way from that thing.  It is, and I will borrow the old catch phrase from Apple-land, “it just works”.  Transferring of games and save information over your router in between your two consoles is rather seamless but depending on how much you are shipping from your PS4 to your PS5, it might take a bit.  I had heard that there was a way to directly connect the two, however, I did not do so.*That said, COD: MW (2019) gave me a bit of trouble because of the sheer size, which led me to popping in the install disc to help speed it along.Noise level of the PS5:The PS5 is rather quiet, the loudest part, and it really is not that loud, per se, is the disc drive.  And, if you owned a PS4 or PS4 Pro, you would appreciate the fact that the 4k blu ray drive in this does not sound like you are opening and closing a 55’ Chevy Truck door.  It loads quietly, largely runs quietly, and ejects, quietly.  But what about the fan?  You can hear the fan's ""whirring"" sound if you get up close to it.  Apparently, Sony has the ability to send out firmware updates that can change how the sound works.  For you tin foil hat wearing folks, be ware, BIG BROTHER is watching you....and your PS5 fan.The UI:The UI, as much as the DualSense, is pretty much the talk of the town, right?  But, it is a bit disorienting until you start to learn it.  That said, as for speed and ease of navigation, I give the overall feel of it, a solid 8/10.  Why not a perfect score, well, because nothing is perfect and I feel as if it almost a mix of the Switch’s UI and the PS4 and while I think it looks great, runs great, but I am not sure I fully love it, yet.  For instance, some functions, feel buried, but they are not really, it is just how you access them that has changed, which means, you and I have to change.  Do note, I am not saying this is for the better, I am saying this is how it is.Storage:The Elephant in the room.  Storage.  Storage is limited.  There is really no other way to say it.  For instance, after installing Fall Guys, COD: Modern Warfare (2019) and keeping Astro's Playroom installed, I had roughly 300gbs of space left.  Now, not everyone happens to like having a catalog of games on their drive, which is fine.  But many do.  And with Sony releasing a digital edition, one would think that they would, custom drive not withstanding, given a bit more.  Further, Sony does not have or has not yet released a list of drives that can populate the extra M.2 port that can take advantage of PS5s incredibly speedy architecture.  This problem is further compounded because currently, you cannot offload games onto a USB attached storage drive.  For this reason, I have adjusted my score to four stars.  4/5The Controller:The DualSense, without any game play, feels nice and hefty.  Though, I will note the D-Pad feels a bit “squishy” to me.  When playing games with it, it feels good.  I have average hands, maybe a tad small (HEY!  They are mighty hands, you leave me be!) and I did not experience any discomfort.  In games where the DualSense is programed for, you will feel things differently as you play.  It really is a step forward in that regards.  In games, however, that are not setup for it, you essentially get the feel of rumble, all day, everyday.  However, I encourage you to play Astro's playroom or Spiderman MM to get a good feel of its potential.The Games:At launch, Sony has a slight advantage with games--but not with subscription service.  Whether they are all new, Demon's Souls, for instance, is another issue.  As for playing games, I tried a couple of ""older"" titles, ""Fall Guys""  and ""COD: Modern Warfare (2019)""--most notalby, Warzone.  Both displayed improved load times, especially for the latter title.  MW had a graphical and textural pack applied to it and while it helped some, I did not feel it made that much of a difference on the newer system as compared to when I played it on my old PS4 Pro.  Indeed, it looked a bit more washed out, but consider, I had switched over from ""Fall Guys"", which is a cornucopia of colors that vary the spectrum or simply, it is like playing a game inside a bag of Skittles.  You get my point.But where this thing shines, frankly, and everyone has told you this-- and they ain't lyin' brosephus and sistersephus-- is with games built for it.  On the PS5 the best examples of this are going to be ""Demon's Souls"" and ""Spiderman: Miles Morales"" and ""Astro's Playroom"".  As of this writing, I have only really had time to play one of the three: ""Demon's Souls""--for a full review of this game and my thoughts about it, click on my name and follow the link to the review.  What can I say about the hauntingly beautiful remake of a cult classic that I hadn't said in my review?  How about this:  As good as the game is, as true as it is to the original, it should be seen as a beginning tutorial in the awesome potential of this generation of gaming, in particular, on the Playstation 5.Spiderman: MM thoughts--Depending on the version you get (launch vs ultimate), you can, for about 20 bucks more (ultimate), secure a copy of Spiderman:Remastered, which includes all the DLC of the original and has been improved to take advantage of the PS5 Ray Tracing abilities.  For those of you that played the previous versions, whether launch or GOY edition, you should find this to be a worthy ""ultimate edition"" of the game.  I enjoyed swinging around NY--especially since I had not finished all the DLC--and felt it was worth the investment to pick up this refined version of the game.  Did I mention that it loaded ridiculously fast?  You also have a choice to play this in fidelity (pretties turned on and locked at 30fps) or performance (60FPS) mode.  For me, I wanted to enjoy the glorious beauty of the game, so I stayed in fidelity mode.MM--Main game thoughts (coming soon)",2,english
dartamu02,3,"After the wait, I hope it works",the United States ,20201113,True,  Waited two months for this? Can't replace it because it is out of stock. I hope it works. Damage went all the way through to the insulated wrap. We have never bought game systems through amazon. Lesson learned.,7,english
Drew,5,Finally got one!!!,the United States ,20201212,True,"  This was not easy to secure, pure luck on 11th 3am drop. Def worth the trouble tho this baby plays real nice with my lg cx. I love how much faster it is although i guess you’d get that from up-to-date specs lol. Actually plays cyberpunk now and soon even better with free nextgen update in 2021! The UI will take some getting used as it’s different then last gen but everything is really good in regards to graphics and new dualsense  controller. Next gens here!",4,english
cyko79,4,It's a playstation,the United States ,20201221,True,"  It's taking some time for compatible software and hardware to become available, so this is from playing Assassin's Creed Valhalla and some PS4 games on it. First major compliant is that it keeps shutting off when I put it in rest mode. This causes the console to search for errors and then lecture you about turning it off properly. It also prevents itself from letting the controller turn it back on when this happens, you have get up off the couch, walk all the way over there, then push the button on console itself. It's getting really annoying. Hope there's an update to fix that soon. Load times are WAY down, I don't even have time to check facebook on my phone during load screens any more. The controller doesn't feel as large as it looks, which is nice. Takes a while to charge, but can be played while charging if your cord is long enough. And finally, it's big. Like, you'll probably need to declutter your TV area and get rid of stuff that don't spark joy, big. But it works well, glad I got it.",1,english
E. Seekford,4,The Playstation 5 is a very good console with a few problems...,the United States ,20201118,True,"  Overall I am happy with my purchase of the Playstation 5, but there are some problems with the console. The console is fast and responsive and most things work fine. However, the new UI is not nearly as good as the PS4 and many things need to be updated soon. It is more difficult to navigate the menus and find exactly what you want. I hate not having a long press on the PS5 logo on the controller like the PS4 had before. I do not like that they have trophies further hidden in the system which makes it harder to get to them. The SSD is super fast, but there is nowhere near enough storage and there is currently no way to expand that storage. The built in Astro's Playroom game is very fun and is a great way to show off the system and controller. Again, I am happy with the purchase but Sony has a lot of things to fix over the next 6 months to a year to make it a better experience.",2,english
Courtney,5,"Runs amazing, got it on release day for $500",the United States ,20201127,True,"  Noticed a lot of 1 star reviews from people who didn't get the product. I got this for $500, I saw it randomly get stock for $1,600 on release day and figured it was someone trying to resell their stock, maybe by someone who got their pre-order. I got lucky and while fighting with walmarts website I happened to check Amazon and saw it on sale for $500 and got it on release day. It arrived not even 2 days later (I have prime).The product itself is wonderful, runs fast and smoothly, I'm in love with the remote, and been trying to find an excuse to play it everyday. Love that I can play ps4 games on it cause there aren't a lot of ps5 games out yet, so if you didn't get the ps5 yet, don't worry, breathe, you're not missing a ton of games so far.",3,english
Glenn,2,"can not sit on side, overheats, limited games as of 1/5/2021",the United States ,20210105,True,"  I wanted to like it, I rally did.  Personnel taste, it is ugly.  It's an example of ""style"" over functionality.  The PS5 can not be set on it's side securely and has to stand up - limiting where you can place it.  Another serious design flaw is while it is standing up the vents are on the bottom of the PS5 and the vent holes are too small for adequate cooling of the CPU/GPU (APU since it is an AMD).  I am very disappointed in the Sony PS5, I would not recommend when you have Micro$oft X Box and Nintendo switch.  At this time (1/5/2021) due to the limited games, my family is still buying switch games, and trying to find used PS4 games to play on the PS5 - Why have a PS5 then?  Yes the graphics are great - but it has horrible cooling design flaws, personally I believe it is ugly, it can not be secured to sit on its side, and the game selection is bad.  Astrobot is a cool game... OK we have one we play.",1,english
NegroISO,4,Backwards Compatibility - Launch Quarter Window,the United States ,20201117,True,"  As of November 17, 2020 the PS5 Disc edition is nice. It has some cool horsepower behind it making games that were either patched post-launch or pre-launch fun to play again.Days Gone got a 25gb patch to give us 60fps and a bit better textures.Ghosts of Tsushima got a patch to give us full 4K and 60fps.Last of Us II got a patch, hoping for Uncharted series.Over-all I would say PS5 is what PS4 should have been at 1080p.. meaning they should have shot for 1080p/60 vs 4K/30, but that's every console generation, one step behind and 3 more steps behind after that.Just waiting on more titles to get some post-launch patching so I can replay my PS4 library... At this point if you don't have a PS5 and are only wanting one  for new games, might as well wait. All the games out now are cross-generation meaning they probably aren't taking full advantage of either Xbox or PS5 hardware.",1,english
Ashlee Collins,1,DO NOT BUY MARKED UP PS5's!,the United States ,20201118,False,"  I beg you, do NOT buy these PS5's for the steep price of $1500 and up.  You are promoting the problem!  I agree with those who say that Playstation handled this poorly (because it's true!)...but if everyone continues to buy the marked up consoles, the bots win and will continue to buy up all available stock as soon as it hits the sites.  Just sit back, and wait.  Keep trying to buy consoles for the regular price.  Lets force these companies to figure out a better way to sell these products.  Make them work for your hard-earned money!",26,english
Terrence,5,The wait is over!!!,the United States ,20210127,True,"  Finally got my PS5!  Everything I imagined and more.  Going from a basic PS4 to this has been a dream.  Playing Cyberpunk and Star Wars Jedi Fallen Order with a stable 60fps is beyond awesome.  MK 11 plus the other 2 games I mentioned load so incredibly fast.My Pros:- The best controller I've ever held in my hands.  Guys/Gals with big hands will fall in love with this controller.- The battery life feels like it last forever.  Nice to have your controller running for hours without having to worry about a charge.- Menu is easy to navigate and I love the UI.  Just sucks there arent any themes yet.  Hope they get added down the line!- Was very happy and pleasantly surprised when I could hook up the stand for my SkullCandy PLYR 1 headset and they worked like a charm and still sounded great.  Made sure to turn off 3D audio because that headset doesnt have that feature.- This system is beautiful.  Some people hate it but I fell in love with the design.Cons:Really, my only complaint is that this system is huge lol and I didnt fully understand when people said this until I got mine.  Definitely a big boy.  Not really a negative for me but if I had to complain about something that's it.Extra info:Was delivered in pristine condition.  No dents or dings even on the outside box.  Also I heard that some had issues with the sleep mode.  I've had none.  Not saying it doesnt exsist but personally I have had no problems with it.  However i have heard about people with external hard drives that have an issue with putting your PS5 in sleep mode with the external hard drive attached.  Dont have any info on that but I would look up info on the subject just to be on the safe side of things.  Havent tested the haptic feedback yet, so I cant give my thought on that yet.I'm completely satisfied with this purchase and it went beyond my expectations.",1,english
