name,score,title,place,date,verified purch,text,upvotes,language
Alwaysinit,1,This is not a behavior that we should support; Playstation,the United States ,20201112,False,"  This will no doubt come off as someone who is bitter because they could not get a PS5. That is part of it, but hear me out. This is a company that knew very well, that the demand for this product would be high. They had experience with almost every console release in their history being a problem at retail. Now, in the year 2020, where console sales are at an all time high- they chose to roll the dice again on consumer trust.I was there on pre-sale - no dice. I was there on every mailing list, notification, reddit thread- no dice. On launch day imagine staying up trying to hit every single retail outlet drop and still failing. Not even failing in any way that I could blame myself for, but failing because the way they sell these units is completely corrupt and disingenuous.So you spend all this time hunting a unit, failing, watching people get 2, 3, 4 units to sell as resellers. One has to ask what responsibility does Sony have in all this? My guess is, a lot. They are toying with their consumers. They are teasing us. They are making the experience worse. And I have to say at this point I am ready to boycott.This isn't the kind of attitude that I would support in any product offering.Not only one of the most expensive systems released during the cusp of a world wide economic depression, but now a phony scarcity structure rewarding resellers over real customers who go above and beyond to give you their money? No thanks.",15372,english
Amazon Customer,1,Rip off.,the United States ,20201114,False,  Taking advantage of high demand,5868,english
Chase T.,1,Why?,the United States ,20201112,False,  I wait all night just to purchase the ps5 and its gone within milliseconds? Who the heck wants to pay $2500 for a console that is worth $500? My pc is $1500 and its better than the ps5?,7593,english
Pipes 69,1,Worse Launch In Game History,the United States ,20201112,False,"  Between Nvidia, Sony and Microsoft,  They all suck at launching new products,  Will never ever preorder crap from them.",4147,english
anonymous,1,Too expensive,the United States ,20201118,False,  $1666That is harsh4x the price,3792,english
Amazon Customer,1,Poor production by Sony,the United States ,20201112,False,"  I've been a PlayStation guy for a long time, but at this point I'm really considering spending double for a PC.  How can you release a console and not have enough inventory released to supply the demand?  It'll easily be after January 1 before the majority of the fan base actually gets a console.  Really poor business by Sony.",3774,english
Breanna,1,Bad business,the United States ,20201119,False,  Go play the console stop being such a bottom feeder,2887,english
Matthew Witmer,1,Garbage,the United States ,20201112,False,"  Makes websites crash, can't purchase under a G, i'm over it and you dirbag scalpers. I'm going to start bidding and not buying ;) good luck and I hope you all get stuck with 5 ps5's",1831,english
Living in Glitter,1,Don't Give In,the United States ,20201129,False,  Don't give in to the jerks who found a way to buy a bunch to sell for double. I hope they all get stuck with a bunch of machines they can't sell.,1273,english
Steve L,1,$1500 = Robbery,the United States ,20201127,False,  Price... thumbs down,937,english
Vincent,5,"Next Gen PlayStation, Controller",the United States ,20201112,False,"  Going over hardware and software. Not going over the every exact technical specs as you can easily look that up. Software can change overtime, this is review of software at launch. If any hardware hiccups or failures in near future I'll update this review--Hardware:Physical:Looks futuristic yet tacky. In my personal opinion, looks doesn't really matter as long it can play next gen games wellLarge console. Standing up it's the tallest home video console.A lot of air-vents throughout making it aerodynamic, cool, quiet, and does not overheat or get hot with consecutive gameplay hours. This may change in the future if games require more performance out of the system, with similar fate like the PS4 where it was whisper quiet in beginning and became louder over the years with more graphical intensive games.Has LED lights giving it a PC look (?)Face plate easy to take out for future customization options (?).667of 820gb of free download space in consoleSwapping SDD is not as easy as Xbox Series X (with it's plug and play method) as you have to remove some screws. Upside is that it's standard and not a propriety SDD.PS5 is compatible with most PS4 games. If you have an external SDD from PS4 it's just plug and transfer to PS5 internal storageComes with stand. Console is not entirely flat, so stand is required for horizontal position. You have console in vertical position without stand, but does not have grip (rubber feet) so may slide if bumped into or during an earthquakeFront of console: USB-C, USB-A, power, and eject buttonBack of console: Two USB-A (Super Speed), LAN port, HDMI, and power portWished it had more USB-C ports to be future proof, but guess they kept USB-A for some current accessories to be backwards compatible. Disappointed the PS5 official 3D pulse headset and camera uses USB-A. Also no optical audio port means i can't use some of my surround sound headsets.Load times for PS5 games are instantaneous. Ps4 games will load much faster, even without optimized patch.Ps5 have ray tracing giving games realistic lighting effects-Controller:Console comes with one controllerPhysically larger than past DuelShock controllers. Great for those with adult sized handsGreat tech demo included with 'Astro's Playroom'. Haptic feedback. Similar to Nintendo Switch HD rumble, but more apparent.  Not sure if developers will implement in future their games. Even with Nintendo first party; only '1-2 Switch' and 'Mario Party' from what I recall used HD rumble at great extent and it dropped off after that.Adaptive triggers. Will feel resistance/push back on triggers if developers implement it in game.Hope both Haptic feedback and Adaptive triggers say the entire lifespan and transfer to PS6 instead of dropping off like the six axis on PS3 and light bar in PS4Has built in mic. Sound quality is similar to current smart phone on speaker. Has mute buttonSimilar to PS4, it has speaker and touch pad. Touch pad is more sensitive this time aroundAbout double battery life of Ps4 controller. Able to get in 10 consecutive hoursWished it came with back paddle buttons. Hopefully they release a DualSense Back Button Attachment like they did the DualShock 4You can play PS4 games with DualShock 4 or DualSense . PS5 games only can be played with DualSense--SoftwareUI, OS is the similar to PS4 with scrolling apps/games (left, right, up, down)There's an activity row where you can track your progress on gamesOther rows are News and PSN storeThere are notifications popups, but you can turn on 'Do Not Disturb' modeSimilar to phone's swipe down tool bar for basic profile (trophy list, avatar, user info,etc), accessibility options, sound,  Game Base, internet wifi select, controllers (see connected controllers), etc on home screen for easy access.'Game Base' section is where you make party with friends and chat with them, view friend requests.Share button this time around will pull up menu to take snap shot, record video, or save video previously played game session for up to 60minsThere's an 'Your Accolades' feature where you give props to other players. Reminds me of how to give endorsements (Sportsmanship, Good Teammate, Shot Caller) in Overwatch to encourage positivity in online community. For PS5 has Helpful, Welcoming, and Good SportThere are accessibility options/preferences you can setup that transfers to your gamesThere's a 'Switcher' option where you can change games on the fly, but unlike the Xbox Series X's 'quick resume' does not leave where you left off, and will boot you back to the home screen of that gamePicture-in-picture mode if you want friends to help show you how to get through levelsPS4 games load faster on PS5 if downloaded to SSD. Graphical upgrade depends on publisher if they implement a 'PS5 upgrade"" patch-For PS5 trophies.Trophies that have collectables there is a progress bar showing how much left to collect.There are also tutorial videos for some games that implement it.Some trophies once selected will drop you into the level/section where you can obtain the trophy. Again depends on game developer if they implement it.PS4 trophies on PS5 act the sameBase price for games are $70 ($10 more than last gen); Excluding Special/Collector's editions, DLC, micro-transactions, loot crates, and surprise mechanicsOverall, aside from some odd design choices very capable next gen system. There are some features especially on the controller that developers have to utilize and may not be present in all games. If anything like the PS3 and PS4, going to have thousands of gameplay hours on this system",795,english
Latoya curry,1,Price,the United States ,20201130,False,  Heck no people should be ashamed this price is ridiculous,731,english
Holly Binswanger,1,SCALPER,the United States ,20201227,False,  Total Scam!!!,645,english
Justin g.,1,Garbage,the United States ,20201202,False,  What a POS. I hate whoever created bots!,612,english
Darth Báäl,1,$$$ick,the United States ,20201129,False,  Lol. Sham at this price.,599,english
KeithAnn,1,Scalper No Scalping,the United States ,20201210,False,"  1,449$ for just a console!! Lmao... I’d rather buy 1,449 dollars worth of lottery tickets than this bogus price PS5. For all we know, it might be faulty and probably won’t even come with a warranty smh...",487,english
R. Ace,1,Please do not buy.,the United States ,20201209,False,"  No, just no.",456,english
Franklin Urdiales,2,Pricey,the United States ,20201227,False,  Costs to much,437,english
dan,1,No golden ticket here....,the United States ,20201112,False,  Well I'm gonna give this a one star. Mostly because I can't buy one.,450,english
Roberto Rosario,1,Don’t buy for overpriced consoles!,the United States ,20201209,False,  No excuses for this pricing,426,english
David A ,1,Ps5 rip off,the United States ,20201210,False,  Scam very over priced,418,english
MurrDurr666,1,Good luck getting one,the United States ,20201112,False,  Launch is a nightmare. Terrible.,409,english
muthanna Alhamadani,1,Crazy price,the United States ,20201209,False,"  This is crazy , 3 times the price paid for the device",382,english
Amazonlifer,1,No common sense-at all!,the United States ,20201112,False,"  Its very easy...you have a product, you have demand for said product.... take the money (we're basically throwing the money to the manufacture)  and send the product!!! I cannot be that hard....Sony knew everyone and their everyone's would want it... the product should have been in full production with back stock ready to be completed for said pre-orders..duh the holidays or even the hype of a newer version... how in the world are these companies still in business...is completely beyond my comprehension! I AM IN THE WRONG BUSINESS....",368,english
Eddie Conrad,1,Blessed?,the United States ,20201202,False,  Did God bless this ps5?,335,english
655321Amazon Customer655321,1,PS5 is a buggy mess that crashes within 5 minutes!,the United States ,20201113,True,"  Sadly, my PS5 is faulty.  It won’t play any PS5 games for longe than 5 minutes without crashing.  Sony has been completely unhelpful in trying to fix this issue.  I now own a $500 piece of modern art that belongs in a garbage bin.  Do not buy this until Sony addresses the myriad of bugs and learns how to treat its customers with a modicum of respect.",317,english
Jo,5,Truly Amazing,the United States ,20201112,True,"  Absolutely incredible, the haptic feedback from the controller is out of this world. I'm 30+ years old and as excited as a little kid on Christmas",273,english
Shirley,1,Overprice,the United States ,20201211,False,  How can amazon allow this.  This an outrage,282,english
Alejandrita,1,DO NOT BUY!!!,the United States ,20201211,False,  DO NOT BUY!!!!Most consoles are faulty and buying from a reseller voids all warranties. Wait for a retailer... it's worth the wait.,273,english
Mike,1,Supply and demand baby!,the United States ,20201113,False,"  Epic articifial demand created by Sony, as usual. Sony exec: ""okay, 40,000,000 people want the console, so let's produce 10,000 in the first run.""",276,english
Andy,1,No PS5 For You,the United States ,20201113,False,"  This launch release is plagued like 2020 itself.Only scalpers, bots, and select few were able to get their hands on this.",247,english
Amazon Customer,1,PS5 NOT WORKING,the United States ,20201113,True,"  After waiting a whole month.. I have received a defective item. The PS5 constantly turns off and on outta nowhere. I'm also getting constant Glitch GPU patterns. I already contacted Amazon, they said they don’t have any left, I will have to wait for restock and there’s no date for when will be available again. It’s very frustrating knowing now I’m $550 less, no ps5, no option to get a new one from Amazon.",216,english
HONEST REVIEW ,1,GARBAGE,the United States ,20201112,False,"  I dislike your app, it kept saying my internet didn't work!!!!! Wouldn't let me add it to my cart then it did then it said sold out",217,english
SunnyTop Contributor: Calligraphy,1,Nope,the United States ,20201228,False,  Do not buy for this price. Buy a warranted device from Amazon or a store. You want to make sure your device has a warranty since it is a new release,201,english
Daanish Fiaz,1,PS5 is Dead and won't turn on.,the United States ,20201114,True,"  Purchased ps5, played 1.5 hours, console shuts off on me randomly and now won't turn on. Contacted both Sony and amazon and neither one is able to provide me with a replacement yet. Extremely disappointed and saddened by what has happened to my system. Absolutely dreadful experience.",182,english
Christopher Brian Jones,1,Stupid,the United States ,20201228,False,"  I agree with the other review. People that will actually pay this price are stupid. $499 PS5 for over a grand, come on. Just do the leg work and look for one or wait a month or two.",176,english
cory james muehlebach,1,A joke,the United States ,20201113,False,"  I understand it’s a hot item and seeks out fast, but if it’s in my cart, it should be mine at that point.#stopscalping",179,english
Mr. & Mrs. Kelley,1,"Console good, sales management TERRIBLE",the United States ,20201113,False,"  The console itself is well made but the process Sony puts everyone through to buy one is ridiculous. Sold out in seconds everywhere, all online stores that had/have pre-sales are so bogged down that it doesn’t move at all. There should be no reason why there isn’t a “Get in Line” system where anyone and everyone can pre-order, take a spot in line and as they ship the fulfill them in the order the customers were in. All this crazy minimal release tactics to raise hype ultimately is annoying and just pisses everyone off. Makes me feel like I’m buying from companies who don’t deserve the business they have.",171,english
ErinE,1,Broken,the United States ,20201113,True,"  PS5 has faulty HDMI. Been trying to contact support and when you do there is no ""queue"" due to the amounts of issues that Sony has going on right now.",153,english
Jacqueline Parlanti,1,Good luck getting a ps5 for under $1000,the United States ,20201113,False,"  Sony is trash.  Y’all allowing bots to pick pocket your fan base and do nothing about it.  Maybe your new slogan should be “Ps5, limited by poor distribution”",168,english
ddavis,1,Shame on you Sony and AMAZON,the United States ,20201114,False,"  I know this make me sound ticked off... And well.. I am. I did everything I was supposed to do... Signed up for notifications from here on Amazon... None came.. When I called customer service as to why my notifications never came through the explanation was a a ""glitch"" in the system.Due to health reasons... This could well be my last Christmas with my son who is 14... I cannot afford the ridiculous amounts the resellers are asking... I had planned on using my Amazon rewards dollars to purchase this.. Apparently that isn't going to happen. The way this entire roll out has been handled by the largest media company in the world and the largest retailer in the world is a travesty. This is personal and yes.. It hurts.Shame on me for assuming it would be handled in an orderly manner. Selling prior to the release time.. Then no e available when it comes as supposed to be... Even the playstation direct site only says check back tomorrow for additional units... That didn't happen either and it's not like I can be held hostage staring at my phone or a computer screen for hours. I got into the que on the 13th and when I was down to a 2 minute wait Sony logged me out and back to an hour wait which by then of course it was sold out again. They said more units to drop on the 14th... Didn't happen.Great loyalty to long time users while resellers are now charging well over 1k per unit.",149,english
JC,1,Beware of hardware failures!  Error CE-108255-1,the United States ,20201117,True,"  I ordered this through Amazon on 11/12.  Every game I play gives error code CE-108255-1 and crashes within one minute.It is most likely a hardware failure.  Who knows how many bad systems are being sold?The system does not play games at all.  If I could give zero stars, I would.",120,english
Gökhan,1,SELLING POLICY IS REALLY BAD,the United States ,20201112,False,"  Although the expectation is known, I do not understand why so few of them are produced and distributed. You may have built a good device, but your sales policy is absolutely awful. x box is the leader in this",129,english
Kiabe,1,Rude,the United States ,20201225,False,  Scalper no scalping,117,english
komark,1,Play has limits,the United States ,20201112,False,"  Not only are the specs inferior to Xbox, it would appear so is Sony's supply chain management",124,english
Keith Streeter,1,"SCAM, DON'T BUY",the United States ,20201225,False,  DO NOT BUY OVER RETAIL. ITS A SCAM!,115,english
Laura E.T.,1,"$1,177.00????",the United States ,20201228,False,"  Wow, that mark up.",112,english
Amazon Customer,1,The price is too high!!!,the United States ,20201203,False,  Just wait a few weeks and buy it at suggested retail price. The money you save will make the wait worthwhile.,110,english
Amzn Cust,4,Extremely Disappointed then Pleasantly Surprised,the United States ,20201115,True,"  I was so excited to have been able to order one for delivery on release day. System looked and worked beautifully until I got to the Home Screen at which point the GPU started going crazy throwing bad lines of pixels all over the place after about 20 seconds of being on. After over 5 hours of actively trying to call Sony support, I finally got through for them to say the only option to to send it in to their repair center. This involves a 3-5 day delay for them to ship me a box, then 3-5 days back to the service center. Once they receive it, 10-15 days to repair/replace my unit. Lastly, 3-5 days back to me. At this point I’ll be lucky to get one by Christmas. I wish you luck that you don’t end up with a defective unit but my advice would be to wait until the initial batch issues are fixed and/or Sony at least has a better repair process.UPDATE: Yesterday I was notified Sony had sent me a package overnight. When I opened the package today, they sent a letter apologizing and acknowledging how frustrating it must be to get a defective unit. The best part, they sent me a NEW unit in the box with instructions to return my defective one. I can’t say how surprised I was and happy to have a working PS5. Their customer service really came through and I appreciate the effort here. Best of luck to you all finding a unit!",88,english
rigoberto  revilla,1,Caro,the United States ,20201228,False,  Mejor me espero en unos dias ya estara en todas partes por menos precio,106,spanish
Randy Costa,1,Scalped,the United States ,20201228,False,"  Scalped product, don’t buy.",102,english
Ashante,1,Price,the United States ,20201228,False,  Way too overpriced,103,english
David Khan,1,Everything is temporary,the United States ,20201226,False,"  Be patient and wait for the legitimate, fair, Sony priced. Pretty soon it’s going to be a thing of the past. Be one of the one’s that say I didn’t give in to a scalper and bought mine when it became available. It’s just a material item. It’ll be something new in a few years so control your urges towards the temporary high of buying something new. Everything is temporary.",93,english
paul,1,Open box,the United States ,20201113,True,  Got it like this. Someone tampered with it??,83,english
Justin,1,Scum of the earth,the United States ,20201203,False,  Dont fall for the scam,96,english
Rax,1,Censorship machine,the United States ,20201113,True,  with small ssd,77,english
Fake item reporter,1,This item is illegal,the United States ,20201225,False,  The person whom named themselves Sony PlayStation is not actually related to Sony at all in fact what they are currently doing is illegal as they are creating monopoly on a product and charging more than the original owners do not buy from here make sure you get a real ps5,89,english
LJ,1,Crashed,the United States ,20201116,True,  Don't buy. For 500 dollars i expext it to last more than 5 days. It crashed and won't turn back on,74,english
nonyourbusiness,1,Broken Controller,the United States ,20201117,True,"  After a lengthy troubleshooting session with Playstation tech support, they determined the controller is not operating correctly.  They want me to pay to send it in to be repaired, which will take 3 weeks.  Very unhappy that i cant play my system for 3 weeks. Also unhappy to have a repaired controller, rather than a new working controller.  They also wanted copy of my invoice to prove the controller is within the warranty period.  (hint...every PS5 controller on the planet is currently within the warranty period right now).  So frustrating.",69,english
Justin,1,Perfect example of failing industry practices. But they don't care,the United States ,20201113,False,  All sold. All being sold now for way overprice. This has been consistently happening for every major tech release. Hopefully this encourages people not to buy into the the scheme big tech has created. They preach they want to help us and the environment. Then why is everything outdated and quickly needs replacing. Thanks big business and to the scalpers that will help us quit our addiction to new shiny things,85,english
Johnny Clayton,1,Worthless!!!,the United States ,20201203,False,  What a piece of crap ,84,english
JD,1,DO NOT BUY AT 1100 DOLLARS,the United States ,20201226,False,  Charing 3 times the price of the item is disgusting gouging.  Do not support any company that marks something up 3 times the original amount.,81,english
Raul,1,Asking to much,the United States ,20201225,False,  Way to much not paying a 1000 dollars for a ps 5,80,english
Drew,1,scalpers price.,the United States ,20201203,False,  the digital is originally $400.,79,english
JG,1,Scalpers joy launch,the United States ,20201113,False,"  I understand that so many people are excited to get their hands on one of these. But when retailers allow you to purchase 20 at a time, there is something wrong there. No capcha during launch day, buggy servers (like no one was expecting this console to be popular, based on a fact as many preorders got sold in a first DAY to 12 WEEKS of PS4 during launch).I am reconsidering my choices, and might rather build PC later on. Who in their right mind pay $1500 for one of these?!",80,english
Andres Builes,1,Rip-off,the United States ,20201225,False,  Garbage!,76,english
Damion Jackson,1,Trash price,the United States ,20201203,False,  Trash price,77,english
Chris S,1,Never Buying A Console From Amazon Again,the United States ,20201123,True,"  I was lucky enough to get a pre-order for a PS5 and was obviously excited to get it on launch day, but that went down the drain when I received the order. First of all, when it was delivered, the box was WIDE OPEN. Second, it has NO PROTECTION around it. It was just a brand new PS5 in a big, banged-up box that was on a delivery truck more than likely moving around for 2 days. After seeing all that, I setup the PS5 and everything seems to be working fine, and then I see pixels all over the screen and I can no longer run any games. I don't know if it was a result of how bad the protection was or if my PS5 console just had issues out the box, but I basically had a busted PS5 for the entire weekend. Trying to figure this out, I told Amazon and everyone I talked to was very unwilling to help. I basically had to keep calling PlayStation support until someone helped me fix the issue (which was send it in for repairs). What should have been an awesome weekend turned into what felt like a $500+ mistake and I will never buy a launch console from here again since that's how they treat their Prime customer.",50,english
