name,score,title,place,date,verified purch,text,upvotes,language
Cassandra Davenport,5,PS5 is the way to go,the United States ,20201219,True,"  Love my PS5! The graphics are amazing, and the controller is so comfortable to hold. The only issue I have is the white stains easily from usage.",1,english
Professor,5,8K,the United States ,20201121,True,  Let’s go PS5! Super nice graphics!,2,english
Simon,5,Must buy,the United States ,20201118,True,"  Fantastic console, the new controller is very comfortable which old PS pads definitely struggled with and the launch line up is top notch.Amazon delivery on launch day made it super easy and despite all the complaining it was incredibly easy to preorder on here.",1,english
Linkinpark3407,5,Super quick and tons of potential.,the United States ,20201115,True,  Was able to preorder this back on 9/16. Amazon delivered it on day 1 no issues. Console is super fast and very quiet. Games look stellar and can't wait to see how new exclusives take advantage of this hardware. The dual sense is easily my favorite controller now. I was apprehensive when it was announced but after holding the controller in my hand I can definitely say this is easily Sonys best.,1,english
CommonConsumer,5,This is the beginning of something incredible...,the United States ,20201113,True,"  This product is not a gimmick let’s establish that baseline. The graphics are phenomenal, very comparable to PC. I’m excited to see where Sony and game developers take this.",1,english
Linda Farrell,5,I AM SO HAPPY!!!,the United States ,20210126,True,"  Despite all the resellers and waiting months, I finally secured one early in the morning. Out of all the sites, amazon was by far the easiest. Love how fast everything load & how clear the games are compared to the ps4.",2,english
WindFishTokes,5,Awesome Christmas Gift,the United States ,20210113,True,"  Arrived on time, and in great condition. Kept updated via the website to ensure someone would be home to get the package off the porch to avoid thievery. The box was pristine, the system works great- no issues. Husband loved the surprise! The preordering fiasco is one memory I'll never forget.",0,english
nicole s.,5,Playstation 5 Duh!,the United States ,20201116,True,"  Stunning picture, crisp, smooth gameplay. Alsoplays every PS4 I threw at it better than before.DualSense is incredible, game changer.",1,english
Roland Mayer,5,"Incredible Console, Excellent Controller",the United States ,20201117,True,  Incredible. I cannot speak highly enough of the quality and fun. It’s truly an amazing console and an amazing experience. However I urge anyone interested to not pay over retail price.,1,english
Joshua Powers,5,Godlike,the United States ,20201113,True,  This next gen console puts its competitor to shame. Beautiful. Fast. Best game lineup. If you can get your hands on one you should!,1,english
Almeida,5,The Most Exciting Console Ever,the United States ,20201113,True,  The console was manufactured for speed and reliability. The dualsense controller is revolutionary piece of tech to hold and the haptics are truly an immersive experience. Play Has No Limits.,1,english
Viju,5,The next-gen gaming system you need,the United States ,20201112,True,  Absolutely stunning. Getting back into gaming after the PS3 and it’s just breathtaking. The controller is revolutionary and everything is just so fast. Graphics will blow your mind away. Absolutely recommend,2,english
Aucifer,5,Its everything you would expect coming from ps4,the United States ,20201114,True,  been a few hours into testing and i have zero complaints. will be purchasing 2 more when available . purchase COD with it.,1,english
James,4,Big Console Big Games,the United States ,20201114,True,"  Every thing worked fine out of the box, they're is some issues with backwards compatible games. Modern Warfare aearzone has some issues.The console is a monstrosity. And the console is horizontal orientation is a bit awkward looking.The controller is much more comfortable for big hands guys.",0,english
H12,5,The upgrade we needed,the United States ,20201226,True,"  I love the PS5, simply due to taking all the downsides of the PS4 Pro and correcting them.  The unit runs nearly silently (my PS4 Pro sounded like a jet engine).  The load times are great, keeping you in the game instead of waiting.  The new UI takes a minute to get used to, but it is also a huge upgrade and again makes it quicker and easier to get around.",0,english
Bola,5,Next gen graphics and non existent load times!,the United States ,20201229,True,  The PlayStation 5 is everything a gamer can dream of.  With that said the Xbox series X does garner better components than it's counter part.  However the PS5 exclusives really put the PS5 ahead of the Xbox for me!  Happy gaming y'all!,1,english
Amazon Customer,1,Sucks sucks sucks,the United States ,20201113,False,  I can’t get one  really really sucks . Why not be open with times . Scalpers are gonna camp your website anyway atleast a few of us will have a shot with times announced  nobody wants to refresh your page 24 hours a day when we have lives to live . I commend Walmart even though it’s almost impossible to get one atleast there was a chance !,23,english
Kenny,5,Awesome console!,the United States ,20201113,True,"  Great console, os is snappy, downloads fast and controller is great! Good next Gen games, Demon Souls is a sight to see.",1,english
Kenny,5,PS5? Worth every penny!!!,the United States ,20201127,True,"  I've been gaming for 30 years! So it's no surprise that I sat up on pre-order night refreshing my my browser. I got the disc version, charging station and COD CW. PS5 is awesome on our 55"" 4k LG OLED TV @120hz (see screenshot for proof). The controller is amazing. The operating system gives PC like options. You can change performance settings, etc. This blows away my expectations. It is work $500 easily! #deathofPCgaming",0,english
dan,5,Oh yea! Backwards compatibility,the United States ,20201113,True,  Sold my ps4 pro to offset the cost. This monster is backwards compatible!!!! Get you one when you have the chance to!,1,english
Prince Malcolm,5,Great system but the hype was a little bit overkill. Don’t break your bank wait for it.,the United States ,20201226,True,  What’s there to say?! Do not believe the hype with the overheating systems and or the glitches coming from the folk that are not technologically savvy or the casual gamer. The hype for the system was a little bit overkill but it’s well worth the $500. Delivery was up exceptional. Don’t kill yourself Or try to rob anyone for this. Wait for it next year when a plethora of new games were arrive to the system.,1,english
Leonardo Canela,5,Fast ship great product!,the United States ,20210126,True,  Ps5 can’t believe finally got it my whole family love it now I see why is a lot hype totally worth it in my opinion can’t wait for all new games coming out.,1,english
Derek P,5,Impressive upgrade from PS4 Pro,the United States ,20201117,True,  If you're lucky enough to purchase one at retail price you will not be disappointed. Demon Aouls and Astros Playroom two of the best release day titles I've ever played. The new dual sense controller with haptic feedback is game changing. Future is bright for Sony Playstation enthusiasts!,1,english
Zia Khwaja,4,Great Console,the United States ,20210119,True,  I love the new console from sony. Super fast load times and almost no bugs. The new UI system is a bit different but it will take some time to get used to. Other than that great buy!,2,english
RICK,5,The Future is Now,the United States ,20201222,True,  The GOAT of gaming consoles and it’s only just begun. Load times... what’s load times? Incredible.. they’ve finally done it. Controllers are OUTSTANDING. Well done Sony .. very well done.,1,english
Chivas Kimber,5,Woooooooooooow!,the United States ,20201113,True,  This thing is incredible! Its like night and day from my ps4 and I'm so happy to have it! I hope everyone that didn't get one gets it fast because it's a game changer!,1,english
Igotmine,5,So happy I got one,the United States ,20201206,True,  The reviews from people who are mad they didn't get one are hilarious!!! This thing is the best system I've ever owned!!,1,english
Anthony,5,Great !!!,the United States ,20201217,True,"  Its really amazing. Easy set up, software is different from ps4. I love the USB ports. It runs fast, looks nice. Only downfall it is as big as the OG Xbox. We have had no issues. The controller charging is super fast, they work really great. Downloading games is fast. Just the overall speed on it, is incredible.",0,english
Robert Fugate,5,The perfect time killer in quarantine,the United States ,20201118,True,"  Can’t believe I scored one of these! Tbh, the step up from the PS4 isn’t that insane. Biggest differences are graphics, old times and controller. Very happy I got one but overall nothing to freak out over if you already own a PS4.",2,english
Alpgkatl,5,Next Gen has arrived,the United States ,20201115,True,"  Amazing console, Super quiet and overall great design with white plate. It fits perfectly with my TV stand. Next Gen is here guys! Get ready!!!",1,english
Angel,1,BS Boycott PS5,the United States ,20201114,False,  BS Sony releasing this in such limited supply making it unnecessary difficult and time wasting to Try and buy.  Boycott PS5,24,english
J. Manon,5,Love my PS5,the United States ,20201121,True,  Perfect piece of machinery. And Amazon made my pre order a smooth process 3rd console I pre ordered from them that I received at launch day,1,english
Leonardo Contreras,4,Great device,the United States ,20201122,True,  I love my PS5 but I was never given an option from Amazon to purchase insurance or protection plan for my device. Is it still possible to get it?,1,english
Jaime Rodriguez,5,I really love it and you will too.,the United States ,20201119,True,"  One of the best console for gaming. Everything so far has been super,from the graphics and performance (fps and speed). If you have one congratulations to be one of the few to get it at launch or little after.now for those that are are still waiting just be patience because you will get one eventually. I know it's painful to wait but it will come back in-stock for you guys.Happy gaming everyone ;)",1,english
Mattatoullie,5,Great.,the United States ,20201116,True,"  This truly feels like a next gen console. So many improvements in the user experience, controller, load times etc.",1,english
Paul,5,Dream come true,the United States ,20201115,True,  I am still amazed that I was about to get a PS5 2 days ago. I had lost hope but Amazon pulled through. Another reason I'll keep using Amazon and prime. You have my business forevermore,1,english
Froylan Perez,5,Love it,the United States ,20210127,True,  It's great a playstation can say I finally got it box was In perfect condition,1,english
Ryan PeckTop Contributor: Batman,5,Amazing.  Really feels and looks next gen,the United States ,20210102,True,  Love it.  I've had the ps5 for a month 1/2 and no problems.  The new duel sense controller feels great.  Everything really feels next gen.  Demon Souls is the best looking console game I've ever seen.  Have my ps5 paired with a Samsung 65in KS8000,0,english
nguyen duy lam,5,The best console ever!!!,the United States ,20201219,True,  Perfect Christmas gift for my son. He played all day,3,english
James & Tina,5,So far so good!,the United States ,20201209,True,  A welcome step up in capabilities from my legacy PS4.  If you have a PS4 pro then you of course wont notice as much improvement.  The controller is awesome.  Highly recommend the sony 3D headphones if you can find them.  There are times I literally turn my head around thinking my wife is whispering behind me but its just game voices.The console is BIG.  The HDMI 2.1 cable needs to be about 4 feet longer if you're installing on flush wall-mounted TV so you may need a longer HDMI 2.1 cable.,0,english
Austin Le,5,Amazing is an understatement,the United States ,20210130,True,  This thing is such a huge upgrade from the ps4 base to the ps5 you’ll not regret dropping 500$ for this. Very big size difference the base is sturdy and will not make your ps5 fall over unless you force it to fall down.,0,english
Dr A,5,Worth the hype! PS5 is the real deal,the United States ,20201217,True,  This is the best next-gen gaming system on the market right now. I was lucky enough to get one of these with prime shipping before the new year. I love the speed of the menu and the look of the new controller. Blown away by the graphics and gameplay and currently playing NBA 2k21 and Spiderman but can't wait to see the new games that come out for the PS5 in 2021. The controler took me a bit to get used to since I came from Xbox but the learning curve is small and I'm really happy I decided to purchase a new gaming system and not a PC.,0,english
J. Mulkey,1,PS BS,the United States ,20201114,False,"  Forget it, I'll just drop some money into my PC. Sony knew this would happen and still let it.",23,english
Maverick ,5,Sony Has Done It Again!,the United States ,20201219,True,  What to say? It is AWESOME! Truly next level gaming at it's finest by the best in the business. Quality is crisp! Make sure you have a viable 4K TV to play this on and not some cheap low quality trash like ONN.,2,english
jesse ,5,PS5,the United States ,20210123,True,  I love it!  So glad I got my hands on this console for retail price... I LOVE YOU AMAZON.  Xbox series x has nothing on this!!!,1,english
Raymond,4,Great console but not worth the price as of now..,the United States ,20201228,True,"  The PS5 over the past few months has been near impossible to buy for retail. I had the chance to get it and to be frank, I’m not that stoked about it. I bought and played spiderman miles as well as the remastered but once I played those two games, I was somewhat just stuck with the console. IMO, besides spiderman, there are no good games out for the PS5. I say to hold on until next year for new games to come out if you’re considering buying it from a reseller, or even for retail. You can definitely save those 600 dollars and save it, especially during a time like this.",0,english
Fox Die,5,Worth the purchase..if you get that far atleast.,the United States ,20210108,True,"  So far the system runs great playing both PS4 and PS5 games, definitely worth the purchase and a noticeable improvement over both PS4 Pro and XB1X(not to be confused with Series X, don't have one or really care about getting one anytime soon to compare) if you ever get the chance to actually get the thing.Minor complaint is with the shipping, I got it a day late and was told I'd have $10 in-store credit that I just tried to use when checking out which wasn't there but other than that I'm satisfied with the system and Amazon getting it to me within a week.",0,english
Alicebroussard7,5,Wow the difference between Ps4 and Ps5 is night and day glad i was able to grab one with no issues,the United States ,20210106,True,  Incredible graphics really does live up to the hype oh and dont change shipping speed i changed mine from 5 day to 2 day and shipping time was extended by 2 days double check for free 2 day shipping quickly before checkout .,0,english
KC,5,Great Console!,the United States ,20201224,True,"  Was pretty tough to get, but luckily I saw it in stock in the middle of the night and was able to get this amazing console. The technology in the controller, and the high quality that this console can push out made my playing experience wonderful. PS5 is better than XBOX all day.",1,english
Denys Hluskyi,5,Your wife will not be happy,the United States ,20201218,True,"  Everything running smoothly, but my wife became unhappy and started to complain that I'm spending a lot of time with my precious.Can recommend for non-married persons.",1,english
crystal,5,11yr old Over The Moon happy!,the United States ,20201218,True,"  My son received this for excellent grades, to say the least since Winter Break started he has been on it nonstop. He loves it, after upgrading from a PS3. The graphics are “out of this world”. He has indicated that some download issues have occurred, but were resolved very quickly. I am pleased/grateful that I was able to purchase this from Amazon, as ALL other outlets were sold out from the beginning.",0,english
marszciano,5,Pure speed,the United States ,20210106,True,"  True upgrade over PS4.. lighting fast, can deliver 4k 60 frames. Can even do 120 frames. Already a ton of great games due to back compat. More classics surely to come as well. If you can get one it’s well worth every cent.",0,english
Konrad Patrzalek,4,"This console is a beast, but not really any new next gen title.",the United States ,20210121,True,"  I got this because I wanted something new, and next gen. I also wanted to play cyber punk, but turns out the game is hot garbage for the game. My PS5 is constantly locking up, especially when I play spiderman, if the system goes to sleep while paused, I will have to retart and rebuild. Gets kinda annoying maybe it will be good once they get the kinks out.",0,english
TreQuan Chavis,4,It real!!!,the United States ,20201230,True,  It’s not a scam I feel bad I payed this much for it but I got it for those thinking about getting it either you can try harder next year or take a chance now they are going to come out with a black one anyways and their is 10000000000000 people who still are trying to get it if you wanna wait by all means but it’s real!!!I got mines,1,english
Ahmad Elhajomar,5,Ps5 love it thank you Amazon,the United States ,20210129,True,  Got lucky with this one. Got it for $499 disc . Love it super hard to get will worth it . Amazon shipping next day no extra charge . Love it good lucky getting one,1,english
Jorge Chavez Jerez,5,Amazing!,the United States ,20210101,True,"  Amazing, without a doubt the BEST console Sony has released. The resolution will blow you away and the way it plays is amazing. I was lucky enough to get one on pre-order, shoutout to Amazon!",0,english
Jessica,5,AMAZING!,the United States ,20201231,True,"  Overall this product is worth the hype. Only down fall is the amount of storage is low to me, it’s a little under 700 GB but expected for the 1st model of PS5 that came out. Definitely worth the buy !",0,english
Alvin Merino,5,Amazing,the United States ,20201127,True,  What an amazing console!!! Technology keeps getting better and it shows!!!!,1,english
Heri,5,The controller A1!,the United States ,20201218,True,  Honestly the best part about this is the controller. Very interactive and has good feedback. The console specs are good but is lacking a larger selection of next gen games. Obviously that will be remedied with time,1,english
Thomasbusacca,4,85% good 15% decent,the United States ,20210106,True,"  Fun console, great remote, lightning fast, small storage.  My only problems are that the games all have a good amount of glitches and could all be tweaked and the console is huge but besides that everything is great!",0,english
Sharikh Y Khan,5,SO HAPPY!,the United States ,20201229,True,  This was a great purchase for me. Especially with Amazon Prime. I got it in time for Christmas and was able to gift it to my younger brother. He was so happy with this surprise!,0,english
Shanice,5,Worth every penny!,the United States ,20210103,True,  For those who were able to get their hands on the Ps5 know this is definitely worth every penny. The dualsense controller is a game changer and I really hope they keep incorporating its potential for future games. Don't lose hope in trying to get one for those who are still struggling and DEFINITELY DO NOT give into the scalpers it's just not worth it. Patience is a virtue ,0,english
Lou,5,Worth buying,the United States ,20210105,True,  Definitely worth the wait. I for mine almost 2 months after release and it took some time to do but the console and the games are absolutely amazing. I'd definitely recommend to a playstation fan or to someone who hasn't had a playstation before or in a while. The playstation plus collection and ps+ is a good way to get some of the last gens best games and it's all for a playstation plus subscription. Lots of fun.,0,english
LaSelle,5,Big difference from PS4 to PS5,the United States ,20210110,True,"  Looks good, feels good, plays great! Load times are much faster especially with Destiny 2. Can’t wait to play more games down the line. ",2,english
Jeff A. Elder,5,Definitely faster than the PS4,the United States ,20201224,True,  The PS5 is a console that has lots of speed and intelligence that makes gaming very enjoyable. The fast start up and smooth gameplay puts gaming laptops to shame finally. A must have console,0,english
Frank,4,Almost dead,the United States ,20201112,True,  It's been great so far except for the fact that it all of a sudden stopped working and my controller stopped working as well and I had to unplug it to make it shut off and then come back on and it worked fine for me after that but still was kinda scary that it happened hopefully it doesn't happen again,1,english
dabuereto,5,Great console (if you can get your hands on it),the United States ,20210108,True,"  Everything works amazing, great console if you could avoid scalpers and get it for retail. Everything came as described although the delivery took around 1-2 weeks. The controller is honestly my favorite controller I’ve held and the game selection although small, comes out swinging.",1,english
Austin G,5,Exceeded my expectations,the United States ,20201222,True,  Totally exceeded my expectations! Awesome machine and at the hight of a game the console runs so smooth and quiet. PS4 games run way smoother and PS5 games will blow you away and so so quite compared to my PS4 Pro it barley buzzes the disk rpm is louder than the system that's how quite it is,0,english
Mohammad F Ghauri,5,Well worth the purchase,the United States ,20201205,True,"  Your browser does not support HTML5 video.   Thank you amazon came through with my purchase.. no problems with the unit works great , the controller is revolutionary with its haptic feedback,and fits perfectly, definitely premium quality build.",1,english
veritech_13Top Contributor: Boxing,5,AMAZING GRAPHICS!,the United States ,20210118,True,  I received this 2 days after i ordered it. The graphics are amazing and the design is very large but that does not bother me.  AMAZING NEXT GEN GAMING!,0,english
Trusty Rombone,5,plays netflix good,the United States ,20201204,True,  plays youtube good too,1,english
Mark D,5,The bomb,the United States ,20201204,True,"  I have always had xboxes and figured I would switch it up for this nextgen. This thing is so incredible. It's fast, great picture quality and the controller is the best.",0,english
Kindle Customer,4,"Good console, decent ""PC"" type quality.",the United States ,20201218,True,"  It's the new PS5, not a whole lot i can say that hasn't been covered dozens of times in reveiws. The design is nice, sort of grows on you. The quality of the games I have played so far are rather nice and comparable to a decent mid ranged gaming pc. I wouldn't call it a PC Killer, but one heck of an upgrade for couch gaming!",0,english
Steven G,4,Solid Console but...,the United States ,20201117,True,"  The console is well made, and solid but a number of issues that will likely be fixed in later firmware updates make the current product 4 instead of 5 stars. Data transfer issues, external hard drives potentially causing corruption issues, rest mode sometimes causing corruption issues all of which have a tiny chance of bricking your new console are just no good.",0,english
Noah Maples,5,The next generation of gaming is here!,the United States ,20201207,True,"  Awesome console. The graphics are really nice, the Dualsense adaptive feedback and Haptic triggers add immersion to the gameplay. Miles Morales Spider man is a lot of fun and trims our some of the fat of the original and Astros Playroom is an excellent controller showpiece. It also plays ps4 game greats and makes your games look a little nicer if you never owned a ps4 pro like me. The console is totally worth the $500 if you can find one lol.",0,english
Derron,1,The disappointment I have for SCE is beyond words.,the United States ,20201115,False,"  Wow. Just wow, Sony. You hype up and CONTINUE to hype up a console that admittedly looks amazing, yet most of the population who want one can't even GET one. Let alone multiple. And Amazon, you're just as at fault, with your terrible ""notification"" system that never EVER worked ONCE. God, this is pitiful, but why should the companies care? They get money one way or another so who cares, right?",22,english
Elmino Jose Pereira Figueira,5,The best console,the United States ,20210108,True,  The best console ever! Very fast and the controller is amazing!,1,english
william gerber,4,My thoughts,the United States ,20201209,True,  I like the speed of downloads and the new controller. I don't like the fact that they don't have many new games to play. It kind of sucks to be playing old games on a new system.,1,english
Ken Compton,5,Its one very nice machine.,the United States ,20210130,True,"  Not going to write a long review, but if you are on the fence, just get it, it is very next gen nice.I am going to have to get another one, since I can't get any time on it.",0,english
Michael Shankle,4,"Hulking beast of a console, runs great, missing features, and crap dashboard and store",the United States ,20201231,True,"  Gigantic console, about 2 PS4s! It runs fast, my unit is very quiet. Is missing some advertised features like VRR, and the HDMI 2.1 is gimped. The new dashboard and store is flat out awful.",1,english
