username,datatime,tweet_text,retweeted_text,likes,retweets,comments,language,is a question,tweet wout hashtag,retweet wout hashtag,sentiment analysis
Gonzalo Gonzales,20201117,when best bud decid get play ps5 first game #ghostoftsushimalegend platform #ps5 other dood :@ tommyj 3425 #virtualphotographi #playstat #thephotomod @captured_collec @vgpnetwork @vgpunit @gamergram_gg,,3,0,1,english,False,when best bud decid get play ps5 first game  platform  other dood : tommyj 3425       ,,1
Over30Clan,20201117,hey #playstat #xbox peopl one question end debat do game monitor tv #ps5 #xboxseriesx,,2,0,2,english,False,hey   peopl one question end debat do game monitor tv  ,,-1
Maikol  TDC,20201117,done @scottzilwarrior @davidgokhshtein friend @yessica_yori @londresgp @holaeskaren #ps5 #playstat #ps5,,0,0,0,english,False,done   friend      ,,1
Michael Cwick,20201117,where #ps5 end end #playstat,,2,0,1,english,False,where  end end ,,-1
Stuart McNab,20201117,isol #thelastofuspartii #thelastofus #tlou2 #tlou #playstation4 #playstat #ps4 #photomod #virtualphotographi #virtualphotograph #vgp #vgpunit #photographi #photograph #lev #seraphit #scar #portrait #portraitphotographi,,5,1,0,english,False,isol                   ,,-1
Game1name,20201117,anyon got info ps5 drop #ps5 #ps5launch #ps4 #soni #playstat #twitter #microsoft #xbox #xboxon #xboxseriesx,,1,1,1,english,True,anyon got info ps5 drop          ,,0
Stuart McNab,20201117,alon #thelastofuspartii #thelastofus #tlou2 #tlou #playstation4 #playstat #ps4 #photomod #virtualphotographi #virtualphotograph #vgp #vgpunit #photographi #photograph #lev #seraphit #scar #portrait #portraitphotographi #archer,,2,1,0,english,False,alon                    ,,-1
Mcz_drawings,20201117,look like i gonna get #playstation5 ok thank @playstat make someth hype realli hard find without overpay not insult btw #anim #sketch #anim #playstat #scalper #art #cri,,9,1,1,english,False,look like i gonna get  ok thank  make someth hype realli hard find without overpay not insult btw       ,,1
Stuart McNab,20201117,dual #thelastofuspartii #thelastofus #tlou2 #tlou #playstation4 #playstat #ps4 #photomod #virtualphotographi #virtualphotograph #vgp #vgpunit #photographi #photograph #abbi #seraphit #boss #bossfight,,1,0,0,english,False,dual                  ,,-1
Stuart McNab,20201117,brutish #thelastofuspartii #thelastofus #tlou2 #tlou #playstation4 #playstat #ps4 #photomod #virtualphotographi #virtualphotograph #vgp #vgpunit #photographi #photograph #seraphit #boss #bossfight #portrait #portraitphotographi,,1,0,0,english,False,brutish                   ,,-1
Stuart McNab,20201117,attack #thelastofuspartii #thelastofus #tlou2 #tlou #playstation4 #playstat #ps4 #photomod #virtualphotographi #virtualphotograph #vgp #vgpunit #photographi #photograph #seraphit #boss #portrait #portraitphotographi,,3,1,0,english,False,attack                  ,,-1
Stuart McNab,20201117,shock #thelastofuspartii #thelastofus #tlou2 #tlou #playstation4 #playstat #ps4 #photomod #virtualphotographi #virtualphotograph #vgp #vgpunit #photographi #photograph #abbi #wlf #portrait #portraitphotographi #naughtydog,,3,1,0,english,False,shock                   ,,-1
L A,20201117,it someth that sleek nice look not someth hide tv stand #ps5 #playstat,,60,2,9,english,False,it someth that sleek nice look not someth hide tv stand  ,,1
Sylvain Houde,20201117,hello ffvii remak seem possibl access summon dlc cactuar carbuncl chocobo chick play ps5 think updat adjust issu #playstat #ps5 #finalfantasyviiremak #finalfantasy7remak #ff7r #ffviir,,0,0,0,english,True,hello ffvii remak seem possibl access summon dlc cactuar carbuncl chocobo chick play ps5 think updat adjust issu      ,,0
Peter Parker,20201117,@playstat us talk robo chat give us number support team number tell take call i wanna return valhalla shit liter unplay ps4 #playstat #playstationsupport,,0,0,0,english,True, us talk robo chat give us number support team number tell take call i wanna return valhalla shit liter unplay ps4  ,,0
palometa team,20201117,rt play station 5 mg xbox seri x #tagsforlik #happi #beauti #ps4 #game #callofduti #gamer #xbox #videogam #xboxon #playstat #meme #funni #bo3 #xbox360 #gta5 #game #pc #overwatch #bo2 #ps5 #warzonecod #playstation5 #xboxseriesx #psx #juego #hoy,,0,2,0,english,False,rt play station 5 mg xbox seri x                           ,,1
danger wank,20201117,call all gamer anyon know time #ps5 get releas uk i havent preorder one #ps5 #playstation5 #playstat,,0,0,1,english,False,call all gamer anyon know time  get releas uk i havent preorder one   ,,-1
Aidan (Crisis),20201117,this consol generat for #playstat probabl disappoint you ca even get your hand #ps5 desper one take risk buy spam websit game i interest #milesmoralesps5 #ragnarok,,0,0,0,english,False,this consol generat for  probabl disappoint you ca even get your hand  desper one take risk buy spam websit game i interest  ,,-1
Scott Chilton,20201117,@amazon need end scalper #playstation5 #playstat #ps5forsal,,0,0,0,english,False, need end scalper   ,,-1
socialtopia,20201117,we new #techupd after much anticip wait #playstat final drop #ps5 game system have gotten hand one yet if think #gamingsystem #technologyupd #socialmediamanag #socialtopia,,0,1,0,english,False,we new  after much anticip wait  final drop  game system have gotten hand one yet if think    ,,-1
ライオンハート • Aaron Stafford,20201117,alway thought white colour #ps5 suck so i took matter hand #playstation5 #playstat #videogam #game #gamer,,1,1,1,english,False,alway thought white colour  suck so i took matter hand     ,,-1
CDF Gaming,20201117,minecraft the mandalorian #minecraft #themandalorian #yoda #starwar #minecraftvr #minecraftcavesandcliff #esport #hardcor #playstat #gamer #game #noticia #ps4 #ps5 #steam #pc #fps #scifi #juego #videojuego #xbox #xboxseriesx #xboxon #nintendo #switch,,1,0,0,english,False,minecraft the mandalorian                         ,,-1
Twitchy T,20201117,the ps5 control die soooo quick i would glad give built mic haptic longer batteri life #ps5 #playstat,,0,0,0,english,False,the ps5 control die soooo quick i would glad give built mic haptic longer batteri life  ,,-1
Cesar Rodriguez B,20201117,the circl complet #playstat #playstation2 #playstation3 #playstation4 #playstation5 #playstationmagazin @hideo_kojima #deathstrand #metargearsolid,,1,1,0,english,False,the circl complet         ,,-1
TheXboxHub,20201117,mortal kombat 11 ultim bring fight #xbox #xboxseriesx #ps5 #playstat #mk11 #mortalkombat,,1,1,0,english,False,mortal kombat 11 ultim bring fight      ,,-1
GameFragger,20201117,70 price tag justifi by hour of entertain provid by playstat 5 game say playstat ceo #playstat #playstation5 @playstat,,0,0,0,english,False,70 price tag justifi by hour of entertain provid by playstat 5 game say playstat ceo   ,,1
Jack Love,20201117,the ps5 load faster run 3rd parti game better has better 1st parti exclus has better control overal next gen experi #playstation5 #ps5 #playstat,woolleygam @tsgp panel member #ps5woolleygam @tsgp panel member #ps5 @woolley_gamernov 16 2020this pretti awesom see #ps5 #ps5 #xboxseriesx #xboxseriesxshow thread,0,0,0,english,False,the ps5 load faster run 3rd parti game better has better 1st parti exclus has better control overal next gen experi   ,woolleygam  panel member   panel member   16 2020this pretti awesom see     thread,1
@Zuby_Tech,20201117,2 day russia #ps5 #playhasnolimit #playstation5 #dualsens #playstat,,17,0,0,english,False,2 day russia     ,,-1
Retro Inebriation,20201117,now class #microsoft #xbox #xboxseriesx #xboxseriess #soni #playstat #playstation5,,0,0,0,english,False,now class       ,,-1
#Falso o #Positivo,20201117,which one would you choos con qued #ps5 #playstation5 #playstation #sony #ps5can,,1,0,1,spanish,True,which one would you choos con qued     ,,0
MollyThePlug,20201117,need sold quick im manger #ps5 #psnrestock #playstat #nextgen #ps5resel #quicksal #targetps5 #game #ps5forsal #ps5preorder #ps5launch #gamer #game #playstationdirect contact first come first serv,,2,0,1,english,False,need sold quick im manger               contact first come first serv,,-1
dailycarblog.com,20201117,playstat 5 news a histori gran turismo explain #playstation5 #playstat #ps5 #ps5new,,0,0,0,english,False,playstat 5 news a histori gran turismo explain    ,,-1
@Zuby_Tech,20201117,on day 14 year ago playstat 3 launch na the greatest consol design time a soc far far ahead time #playb3yond #playbeyond #thisisliv @playstat #ps5 #playhasnolimit #greatnessawait #4theplay #ps3 #playstat #playstation3,,17,3,1,english,False,on day 14 year ago playstat 3 launch na the greatest consol design time a soc far far ahead time           ,,1
Etherfield Games,20201117,3 day #ps5 premier intern what third playstat #ps3 #ps5 #pixelart #pixel #game #game #art #playstat #histori,,7,0,0,english,False,3 day  premier intern what third playstat         ,,-1
Dr.Kendo,20201117,play limit know asid shortag #playstation5 #playstat,,3,1,0,english,False,play limit know asid shortag  ,,1
HALLOWEEN N'AT ,20201117,alway like play game #bubblebobbl #bubblebobble4friend #ps4 #playstat #game,nostalg gamernostalg gamer @16bitnostalgianov 17 2020it bubbl bobbl 4 releas day ps4 i get teeth morn i say cute af review come soon @thumb_cultur @thumb_cultur #retrogam #retrogam #game #game #bubblebobbl #bubblebobbl #ps4 #ps4,2,0,0,english,False,alway like play game     ,nostalg gamernostalg gamer  17 2020it bubbl bobbl 4 releas day ps4 i get teeth morn i say cute af review come soon          ,1
Kūru Media,20201117,the big fat geek week episod 9 this one for player avail #spotifi @gardencity_dan @mrsamydallen @whatever_man @gbotaku82 talk releas #soni #ps5 reminisc #playstat year,,3,2,0,english,False,the big fat geek week episod 9 this one for player avail      talk releas   reminisc  year,,-1
Sonic Bloom,20201117,the 8th #videogam consol generat end let take look game #innov defin 2 part think piec let us know #game thought defin gen #ps4 #playstat #xbox #xboxon,,1,0,0,english,False,the 8th  consol generat end let take look game  defin 2 part think piec let us know  thought defin gen    ,,-1
Jack Griffiths,20201117,get #ps5 thursday i wait game i day one spiderman mm spiderman remast dmc 5 ac valhalla cod multiplay purpos bugsnax ps plus then i get paid i pick demon soul freak wait #playstat #gamersunit,,2,0,1,english,False,get  thursday i wait game i day one spiderman mm spiderman remast dmc 5 ac valhalla cod multiplay purpos bugsnax ps plus then i get paid i pick demon soul freak wait  ,,1
BLACKSTAR,20201117,doe anyon know time ps direct might drop today #playstation5 #playstat #playstationdirect,,0,0,0,english,True,doe anyon know time ps direct might drop today   ,,0
Flying Eze,20201117,alatreon soar monster hunter world iceborn this may #ps4 #monster #hunter #world #iceborn #playstat #game #ps4,,1,0,0,english,False,alatreon soar monster hunter world iceborn this may        ,,-1
Colin Eedy,20201117,launch day order ps5 receiv #ps5 #playstat #kindafunni,,1,0,0,english,False,launch day order ps5 receiv   ,,-1
Machine Gun Jimmy,20201117,i abl snap day forgot post i truli enjoy #ps5 i cant wait see futur hold store game look better better #playstation5 #playstat #game #studio,,3,1,0,english,False,i abl snap day forgot post i truli enjoy  i cant wait see futur hold store game look better better    ,,1
Gautier,20201117,ca commenc a arriv #ps5 #playstat,,0,0,0,french,False,ca commenc a arriv  ,,-1
Dragon Shed Games,20201117,now need #playstation5 roll thursday 19th can wait play #milesmoral #spiderman #spidermanmilesmoral #ps5 #playstat #begreat,,3,0,1,english,False,now need  roll thursday 19th can wait play      ,,1
TS Warrior Player,20201117,fight futur #tswarriorplay #controlyourgam #giftidea #geeki #gamer #customcontrol #birthdaygift #customcontrol #playstat #ps4 #control #soni #ps4customcontrol #ps4pro #ps4control #ps4gamer #ps4game #game #overwatch,,1,0,0,english,False,fight futur                   ,,-1
First International Play Money Exchange,20201117,did get sold #ps5 #game #espot #playstat #cod #spiderman,,3,1,0,english,True,did get sold      ,,0
MollyThePlug,20201117,my target 10 truck lol i took 4 #ps5 #psnrestock #playstat #nextgen #ps5resel #quicksal #targetps5 #game #ps5forsal #ps5preorder #ps5launch #gamer #game #playstationdirect contact first come first serv,,0,0,0,english,False,my target 10 truck lol i took 4               contact first come first serv,,1
The_Drake_Equation,20201117,the last us the last us 2 greatest game time #ps4 #lou2 #playstat #playstation5,,1,1,1,english,False,the last us the last us 2 greatest game time    ,,1
Coinsuggest,20201117,playstat 5 will be avail in india nov 19 #ps5 #ps5india #playstationindia #playstat,,2,0,0,english,False,playstat 5 will be avail in india nov 19    ,,-1
Mori of Tsushima,20201117,two day #playstation5 #playstat,,0,0,0,english,False,two day  ,,-1
The Spanish Navigator,20201117,these also top 10 game 2020 #ps4 #ps5 #playstat #top10 #game #gamer,hunter hunter @nextgenplayernov 17 2020mi updat top 10 game 2020 the last us part 2 demon soul ghost tsushima mile moral persona 5 royal nioh 2 final fantasi vii remak hade mafia definit astro playroom #ps5 #ps5 #ps4 #ps4 #pc #pc #nintendoswitch #nintendoswitch #xbox #xbox,0,0,0,english,False,these also top 10 game 2020      ,hunter hunter  17 2020mi updat top 10 game 2020 the last us part 2 demon soul ghost tsushima mile moral persona 5 royal nioh 2 final fantasi vii remak hade mafia definit astro playroom          ,1
Brand New PS5 for sale,20201117,satisfi custom stop shop grab deliv doorstep how fun christma #ps5 #playstation5 #playstat,,3,1,0,english,False,satisfi custom stop shop grab deliv doorstep how fun christma   ,,1
Kaico Labs,20201117,what favourit ps3 game #retro #game #retrogam #shop #gamerguy #gamergirl #gamersunit #soni #playstat 3 #ps3 #kaico,,9,6,8,english,True,what favourit ps3 game          3  ,,0
Andrew Martin,20201117,hi emma websit say differ lack inform misinform truli dishearten #playstation5 #playstat #angri #dreamswithin #stayconnect,,1,1,1,english,False,hi emma websit say differ lack inform misinform truli dishearten     ,,-1
ReignSupremeGaming,20201117,realli sure happen #game #pcgame #pcgamer #videogam #xbox #xboxon #callofduti #callofdutymodernwarfar #callofdutycoldwar #playstat #ps5 #sniper #clip #callofdutyclip #knife #knive #modernwarfareclip #codmw #codclip #explor #explorepag,,1,2,0,english,False,realli sure happen                     ,,-1
Smasher,20201117,playstat camera adapt arriv today germani 2 day till ps5 arriv #playstat #vr @tidux,,0,0,0,english,False,playstat camera adapt arriv today germani 2 day till ps5 arriv   ,,-1
Noir Roex,20201117,i think peopl tri prove wrong @playstationuk we want peopl care know insid vs surfac let face surfac look like router lucki ps #playstat #gamer #soni #ps5 #ps5meme #ps5launch #hardwar #game #gamergirl,playstat ukplayst uk @playstationuknov 17 2020psa you cannot marri ps5,1,0,0,english,False,i think peopl tri prove wrong  we want peopl care know insid vs surfac let face surfac look like router lucki ps         ,playstat ukplayst uk  17 2020psa you cannot marri ps5,1
kej,20201117,um i blue team though #ps5 #playstat #xbox,,4,0,1,english,False,um i blue team though   ,,-1
@Zuby_Tech,20201117,control launch collect #ps5 #playhasnolimit #playstation5 #dualsens #playstat #dualshock #sixaxi,,35,4,2,english,False,control launch collect       ,,-1
@Zuby_Tech,20201117,new softwar updat #ps5 hope fix alot bug #ps5 #playhasnolimit #playstation5 #dualsens #playstat,,23,2,0,english,False,new softwar updat  hope fix alot bug     ,,1
John Cleber,20201117,port chav #ps5 #playstation #control,,1,0,0,portuguese,False,port chav   ,,-1
ShotByAScot,20201117,playstat camera adaptor arriv i pickup ps5 thursday thank soni if vr older camera upgrad ps5 forget need order free adaptor playstat websit #ps5 #psvr #playstat,,0,0,0,english,False,playstat camera adaptor arriv i pickup ps5 thursday thank soni if vr older camera upgrad ps5 forget need order free adaptor playstat websit   ,,1
PS5 - Mania,20201117,2020 sort jour releas of the day #ps5 boit box #mortalkombat11ultimat #fortnit #fullsetps5 #jeuxvideo #videogamecollect #collect #playstation5 #sony #playstat #gamecollect #gamecollecting #collector #videogam #gamer #ps5collect,,1,0,0,french,False,2020 sort jour releas of the day  boit box               ,,-1
Boom Channel,20201117,who still wait #ps5 releas did manag bag preorder wait #playstation5 #soni #playstat #nextgener #nextgen #consol,,2,1,1,english,False,who still wait  releas did manag bag preorder wait      ,,-1
Unclequan_thegamer,20201117,courag thing first qualiti warrior karl von clausewitz good morn fam happi tuesday hope guy safe product day #goodmorn #tuesdaymotiv #ghostoftsushima #ps5 #playstation5 #playstat #game #gamingcommun,,0,0,0,english,False,courag thing first qualiti warrior karl von clausewitz good morn fam happi tuesday hope guy safe product day        ,,1
@Zuby_Tech,20201117,look good #ps5 #playhasnolimit #playstation5 #dualsens #playstat,,5,0,0,english,False,look good     ,,1
jamar,20201117,no thing friend fire your enemi lol shoot site @aridmari #codmodernwarfar #gamerlif #gamertalk #videogam #soni #modernwarfare2 #callofdutymodernwarfare3 #xbox #xbox1 #playstat #playstation3 #playstation4 #gamergirl,,2,0,2,english,False,no thing friend fire your enemi lol shoot site              ,,-1
itnow,20201117,you start order game consol all avail itnow #ps5 #ps4 #playstat #game #callofduti #pes #fifa #itnow #lago #tuesdayvib #tuesdaythought #tuesdaymotiv #itflow #blackfriday,,3,0,1,english,False,you start order game consol all avail itnow              ,,-1
jakealawson,20201117,anyon els gonna wait midnight hope order ps5 releas day #ps5 #playstation5 #playstat #playstationuk #alt #altboy #fanboy #gamerboy #gamer,,26,0,0,english,True,anyon els gonna wait midnight hope order ps5 releas day         ,,0
Flying Eze,20201117,interact horror man medan get free friend pass start today #ps4 #bandai #namco #man #of #medan #playstat #game #ps4 #supermass #game,,0,0,0,english,False,interact horror man medan get free friend pass start today           ,,-1
jamar,20201117,kill comfirm shotgun someth reckon @aridmari #codcoldwar #codmodernwarfar #gamerlif #gamertalk #videogam #soni #modernwarfare2 #callofdutymodernwarfare3 #xboxseriesx #xbox1 #playstat #playstation3 #playstation4 #gamergirl,,1,1,1,english,False,kill comfirm shotgun someth reckon               ,,-1
GodKnows,20201117,the bureau indian standard approv playstat 5 playstat 5 digit edit india #ps5 #ps5india #playstat #gaminglif #,,6,0,1,english,False,the bureau indian standard approv playstat 5 playstat 5 digit edit india     ,,1
Social Media Network Worldwide,20201117,bestel ps5 hog korting digital ps5 kost 399 bestel 250 order your ps5 now with a high discount the digital ps5 cost 399 order it now for 250 #ps5 #ps5preorder #playstation #ps5games #nl #uk #usa #games #worldwid,,0,0,0,dutch,False,bestel ps5 hog korting digital ps5 kost 399 bestel 250 order your ps5 now with a high discount the digital ps5 cost 399 order it now for 250         ,,-1
john josiah,20201117,work @playstat awesom i learnt much short time everyon super friend convers game rad p s pun intend swag world class #ps5 #playstat,,3,0,2,english,False,work  awesom i learnt much short time everyon super friend convers game rad p s pun intend swag world class  ,,1
Bradr11,20201117,which @playstat emoji favourit i vote control #ps5 #playstat #playstation5 #soni,playstat ukplayst uk @playstationuknov 16 2020final round last chanc vote next ps5 hashtag emoji show poll,0,1,0,english,True,which  emoji favourit i vote control    ,playstat ukplayst uk  16 2020final round last chanc vote next ps5 hashtag emoji show poll,0
Hot Tamales ,20201117,this background kind bad white text white #psn #ps4 #playstat #ubisoft #assassinscreedvalhalla,,0,0,0,english,False,this background kind bad white text white     ,,-1
Malek Soliman,20201117,48hrs left start watchlist abl get ps5 friday abl play weekend you definit regret #soni #playstation5 #playstat #ps5 #preorder #tesco #game #releas #uk #england #english,,0,1,0,english,False,48hrs left start watchlist abl get ps5 friday abl play weekend you definit regret           ,,1
ShotsFromTheStation,20201117,hellblad sacrific ps4 #ninjatheori #hellblad #hellbladesenuassacrific #senua #senuassacrific #senuassaga #hellbladegam #playstat #ps4 #ps #playstation4 #playstation4gam #game #videogam #gamer #game #screen #virtualphotographi #photomod #vpgamer #soni,,5,0,0,latin,False,hellblad sacrific ps4                     ,,-1
Dark ,20201117,great game masterpiec #unchart #playstat #ps3 #naughtydog,,5,2,0,english,False,great game masterpiec    ,,1
Retro Gamer Guy,20201117,@ubisoftanz alway fantast job cannot wait multiplay aspect come onlin decemb #watchdogslegion #watchdog #ubisoft #keepcalmandresist #jointhelegion #jointheresist #ps4 #ps5 #playstat #aussiegam #gamerlif #gamesroom #dualsens,,1,0,0,english,False, alway fantast job cannot wait multiplay aspect come onlin decemb             ,,1
PHONEZIPPY.IN,20201117,are team playstat team xbox @playstat @playstationin @xbox #playstat #playstation5 #ps5 #xbox #xboxx #phonezippi,,2,0,0,english,True,are team playstat team xbox         ,,0
jagodziak,20201117,discov ubisoft stat last 5 year surpris surpris #playstat #playstation5 #ubisoftconnectwrapup,,0,0,0,english,False,discov ubisoft stat last 5 year surpris surpris   ,,1
Greg “R3M1X” M.,20201117,number 42 1st platinum #playstation5 #astrosplayroom #teamasobi #ps5 #playstat #trophyhunt #platinumhunt #platinumtrophi #soni,,2,0,0,english,False,number 42 1st platinum         ,,1
Taejong,20201117,@mkbhd what ps5 intent big ps5 slim look tini compar og ps5 thus big brain market move made #ps5 #playstation5 #playstat,,0,0,0,english,True, what ps5 intent big ps5 slim look tini compar og ps5 thus big brain market move made   ,,0
MollyThePlug,20201117,#ps5 #psnrestock #playstat #nextgen #ps5resel #quicksal #targetps5 #game #ps5forsal #ps5preorder #ps5launch #gamer #game #playstationdirect contact first come first serv,,1,0,0,english,False,              contact first come first serv,,-1
Ketchup san,20201117,@playstat i want buy ps5 that cool i cash spend scalper spent x900h #playstat,,0,0,0,english,True, i want buy ps5 that cool i cash spend scalper spent x900h ,,0
Flying Eze,20201117,no man sky synthesi updat drop tomorrow #ps4 #hello #game #no #man #ski #playstat #game #ps4,,0,0,0,english,False,no man sky synthesi updat drop tomorrow         ,,-1
Flying Eze,20201117,build meaning connect hell peopl afterparti #ps4 #afterparti #night #school #studio #playstat #game #ps4,,0,0,0,english,False,build meaning connect hell peopl afterparti        ,,1
Leevil,20201117,it psxmas eve eve #psxmasev #playstation5 #playstat,,1,0,0,english,False,it psxmas eve eve   ,,-1
newsneycom,20201117,#destruction_all-star #playstat #ps5,,0,0,0,english,False,-star  ,,-1
Zach Lowe,20201117,ok hear i know long shot i gonna call the 3rd game playstat mark word #spiderman #playstat #ps5,,0,0,0,english,False,ok hear i know long shot i gonna call the 3rd game playstat mark word   ,,1
Nema,20201117,xbox fan so how that piec of crap you call a consol playstat for life #playstation5 #ps5 #playstat #xbox #xboxseriesx,playstationplayst @playstationnov 11 2020the next generat play light around globe #ps5 #ps5,0,1,1,english,False,xbox fan so how that piec of crap you call a consol playstat for life     ,playstationplayst  11 2020the next generat play light around globe  ,-1
Mr.E Roch,20201117,consol war like i got xbox 12 teraflop better ps5 vaccin war like that pfizer junk 90 effect got moderna shot that stone cold 95 #covidvaccin #xbox #playstat,,0,1,0,english,False,consol war like i got xbox 12 teraflop better ps5 vaccin war like that pfizer junk 90 effect got moderna shot that stone cold 95   ,,1
Monad Sh,20201117,ps5 sure #ps5 #playstation5 #playstat,,0,1,0,english,False,ps5 sure   ,,1
BangPow Gaming,20201117,quick drop night dive #sackboyabigadventur tomorrow system #ps5 game #milesmoralesps5 studio @insomniacgam #photomod #playstat #playstation5 #virtualphotographi #thecapturedcollect #saturdayvib #game #thephotomod #vpgamer #vgpunit,,11,4,1,english,False,quick drop night dive  tomorrow system  game  studio           ,,-1
PSV_MMXX,20201117,if account like mine bring gamer back playstat struggl next gen consol get then extrem happi help regret buy greatest consol ever fantast game #ps5 #playhasnolimit #playstat,,9,3,0,english,False,if account like mine bring gamer back playstat struggl next gen consol get then extrem happi help regret buy greatest consol ever fantast game   ,,1
UPDATE COMING SOON,20201117,so anyon els troubl play zombi control like disconnect connect back #coldwarzombi #coldwarzombi #coldwar #playstat #playstation4,,1,0,0,english,False,so anyon els troubl play zombi control like disconnect connect back     ,,1
Chuckbuck__,20201117,i swear i gas #apexlegend #apex #mixer #callofdutycoldwar #trade #vote #amazon #playapex #etsyfind #smallbusi #biden #microsoft #trump2020 #vaccin #playstat #trump #amazonfind #ps5 #amaz #musthav #callofduti #gamingsetup #entrepreneur #appl #googl,,3,1,0,english,False,i swear i gas                         ,,-1
boogeymanplays1,20201117,boom #reddeadredemption2 #reddeadonlin #reddeadonlineclip #twistedfir #rockstargam #onlinegam #playstat #playstation5 #playstation4 #videogam @reddeadvib @rockstargam,,1,0,0,english,False,boom            ,,-1
