username,datatime,tweet_text,retweeted_text,likes,retweets,comments,language,is a question,tweet wout hashtag,retweet wout hashtag,sentiment analysis
michel fts,20171107,halo 5 first #xboxonexenhanc game #freecodemondaycontest #xboxonex #xbox @xbox #feeltrueemojipow,,0,0,0,english,False,halo 5 first  game     ,,-1
Luke,20171107,i would play horizon #xboxonexenhanc game #freecodemondaycontest #xboxonex #xbox @xbox #feeltrueemojipow,,0,0,0,english,False,i would play horizon  game     ,,1
GoofballWEBB,20171107,group 1 i readi #xboxonex let goooo @gamestop #xboxon #xboxon #xbox,,0,1,0,english,False,group 1 i readi  let goooo    ,,1
Nyambi Nyambi,20171107,excit spend even friend @xbox tonight what favorit game play #xbox #xboxonex,,15,1,1,english,False,excit spend even friend  tonight what favorit game play  ,,1
Ben mallinson,20171107,ohh shit time #xboxonex #finallyher #xbox,,1,1,0,english,False,ohh shit time   ,,-1
Nicolas Hendriks,20171107,gear war #freecodemondaycontest #xboxonex #xbox @xbox,,0,0,0,english,False,gear war    ,,-1
SkyEatsBrandon,20171107,most like forza 7 go look even amaz #freecodemondaycontest #xboxonexenhanc #xbox #xboxonex,,0,0,0,english,False,most like forza 7 go look even amaz    ,,1
Ben,20171107,i would play @elderscrol game first #xboxonexenhanc game #freecodemondaycontest #xboxonex #xbox @xbox,,0,0,0,english,False,i would play  game first  game    ,,1
Dennis,20171107,i check @xbox one x launch local @microsoft store @fashionshowlv las vega nv #xbox #xboxon #xboxonex,,0,0,2,english,False,i check  one x launch local  store  las vega nv   ,,-1
Dobbson-Kanu,20171107,i think @gearsofwar 4 would first #xboxonexenhanc titl #freecodemondaycontest #xboxonex #xbox @xbox,,0,0,0,english,False,i think  4 would first  titl    ,,-1
BryNowPayLater ,20171107,hello pretti #xbox #xboxon #xboxonex @xboxuk,,1,0,0,english,False,hello pretti    ,,1
Carlos Flores,20171107,i need play ac origin #xboxonexenhanc game #freecodemondaycontest #xboxonex #xbox @xbox,,0,0,0,english,False,i need play ac origin  game    ,,1
Joe,20171107,papa got brand new bag game #projectscorpio #xboxonex #xbox @majornelson,,0,0,0,english,False,papa got brand new bag game    ,,-1
The VR Realm,20171107,home readi play thank @gameboro midnight launch #xboxonex #xboxonexprojectscorpioedit #xbox #game #geek @xbox,,1,0,0,english,False,home readi play thank  midnight launch      ,,1
𝘿𝙅𝙍𝙚𝙙𝙘𝙖𝙥,20171107,day one lift day one show true power #xbox #xboxonex #projectscorpio,,0,0,0,english,False,day one lift day one show true power   ,,1
Satch XP,20171107,sweeeeeeeet #xboxonex #xboxon #xbox #projectscorpio,,2,0,0,english,False,sweeeeeeeet    ,,-1
James Porter,20171107,oh god look i grab #xboxonex #projectscorpio #xbox,,0,1,0,english,False,oh god look i grab   ,,1
Jordan Evans,20171106,i get 3 day xox consol releas ik i #xbox #xboxonex #xb1,,0,0,0,english,False,i get 3 day xox consol releas ik i   ,,-1
SwampDonkey,20171106,the xbox one x ship it way ca wait get hand #xboxonex #xbox,,4,1,0,english,False,the xbox one x ship it way ca wait get hand  ,,-1
OGCryptor,20171106,great see updat app #xbox hope 3rd parti servic come this way make #xboxon center entertain,,0,0,1,english,False,great see updat app  hope 3rd parti servic come this way make  center entertain,,1
KVN,20171106,the beast arriv #xboxonex #projectscorpio #xboxon #xbox @microsoft_ch @xboxdach @majornelson @xboxp3,,1,1,0,english,False,the beast arriv        ,,-1
Xbox DACH,20171106,omg omg omg #xboxonex #xbox #xboxon,,229,30,30,norwegian,False,omg omg omg   ,,-1
C ,20171106,#play door stopper bore sometim #xboxonex #xbox #iphonex #mondaymotiv,,0,0,0,english,False, door stopper bore sometim    ,,1
Carlo Carrasco,20171106,final fantasi xv look play best xbox one x #finalfantasyxv #xbox #xboxonex #geek #nerd #game #gamer #fantasi #jrpg,final fantasi xvfinal fantasi xv @ffxvennov 6 2017ffxv #xboxonex #xboxonex support ad readi go everyon get one tomorrow we hope enjoy ffxv even higher qualiti show thread,1,0,0,english,False,final fantasi xv look play best xbox one x         ,final fantasi xvfinal fantasi xv  6 2017ffxv   support ad readi go everyon get one tomorrow we hope enjoy ffxv even higher qualiti show thread,1
getGamechat,20171106,xbox one x #xbox #xboxon #xboxonex,,0,0,0,english,False,xbox one x   ,,-1
Shabbie,20171106,my reaction i see first 4k hdr game tomorrow #xboxonex #xbox #game,,2,3,0,english,False,my reaction i see first 4k hdr game tomorrow   ,,-1
The LBG | #BLM,20171106,sigh freak relief see x day #xboxonex #projectscorpio #heartattackavert #xbox,,67,5,12,english,False,sigh freak relief see x day    ,,-1
DS Nahogara,20171106,meet gaiaman 77 new teak compos #videogam #indiedev #indiegam #indiedevhour #fight #gamejolt #ign #xboxonex #xbox #halloween,,1,1,0,english,False,meet gaiaman 77 new teak compos          ,,-1
VΞRDICT4489,20171106,are get #xboxonex tomorrow #xbox #microsoft,,2,5,3,english,False,are get  tomorrow  ,,-1
Star Tours,20171106,hey #teamemmmmsi #xboxonex #xbox @xboxp3 @ign @dnr_crew pick copi xbox one x tomorrow,,0,0,0,english,False,hey       pick copi xbox one x tomorrow,,-1
ᵗᵃʳˡˢ,20171106,i kind big deal #xboxonex #microsoft #xbox,,24,7,3,english,False,i kind big deal   ,,-1
GAME Barnsley,20171106,just quick head there no midnight launch tonight #xboxonex pleas make trip see tomorrow #xbox,,0,0,0,english,False,just quick head there no midnight launch tonight  pleas make trip see tomorrow ,,1
Ryan Daws ,20171106,ponder whether move go quicker long next 24 hour go feel #xboxonex #xbox #game,,1,0,0,english,False,ponder whether move go quicker long next 24 hour go feel   ,,-1
VΞRDICT4489,20171106,this i play #xboxonex rest 2017 1 day #xbox,,13,1,7,english,False,this i play  rest 2017 1 day ,,1
Inflikted,20171106,shadow war wolfenstein ii the evil within 2 show enhanc #xbox #xboxonex,,2,0,0,english,False,shadow war wolfenstein ii the evil within 2 show enhanc  ,,-1
Draco,20171106,cod ww2 bundl #callofdutywwii #callofduti #xbox #xboxonex,,1,0,1,english,True,cod ww2 bundl    ,,0
Belong Tyneside Guardians,20171106,all about #xbox join us #xboxonex midnight launch microsoft communiti night show us think xbox best,,3,2,0,english,False,all about  join us  midnight launch microsoft communiti night show us think xbox best,,1
eGgBeRtEgG,20171106,happi #nationalprojectxday #xbox @xbox cant wait get mine 8hrs @ebgamesaus #xboxonex,,1,0,0,english,False,happi    cant wait get mine 8hrs  ,,1
Remembering Cougar,20171106,it night #xbox communiti the power x unleash gamer readi real great still await great #xboxonex,,0,0,0,english,False,it night  communiti the power x unleash gamer readi real great still await great ,,1
DeviantZeal,20171106,@halo 5 #xboxon vs #xboxonex thank you @xbox #343industries #xbox,,1,0,0,finnish,False, 5  vs  thank you   ,,1
Ian Bleach,20171106,who excit #xboxonex tomorrow i dispatch email feel excit #xbox #tech #microsoft #game #consol,,0,0,0,english,False,who excit  tomorrow i dispatch email feel excit     ,,1
thedark1ord211,20171106,yessir #destiny2 #gamerlif #thedark1ord211 #xboxonex #xbox #destinyhardhead,,1,0,0,english,False,yessir      ,,-1
thedark1ord211,20171106,my whole squad 305 final lol #destinyhardhead #destiny2 #gamerlif #thedark1ord211 #xboxonex #xbox,,0,0,0,english,False,my whole squad 305 final lol      ,,1
Patrick Fox ,20171106,will see 4k updat #gtav @xbox one @rockstargam #xboxon #gtav #4k #xbox,,0,1,0,english,False,will see 4k updat   one     ,,-1
Rhys,20171106,it time #xboxonex #projectscorpio #xbox,,5,2,0,english,False,it time   ,,-1
Deaks ,20171106,@gamedigit lot disappoint today #game sent inform #xboxonex deliveri @dpd_uk earli #uk #game #xbox,,1,0,0,english,False, lot disappoint today  sent inform  deliveri  earli   ,,-1
Julien,20171106,yyyeesssss #xbox #xboxonex #xboxfranc,,2,1,1,english,False,yyyeesssss   ,,-1
Io Chip oI,20171106,thank @xbox get babi load tonight #xbox #xboxonex,,5,1,0,english,False,thank  get babi load tonight  ,,1
Zachmangaart,20171106,when see @xbox one x come tomorrow #xboxonex @microsoft #xbox,,0,0,0,english,False,when see  one x come tomorrow   ,,-1
The VR Realm,20171106,so excit roll midnight @gameboro #xboxonex #xboxonexprojectscorpio #xboxon #xbox #game #geek #excit #1moreday #countdown @xbox,,2,0,0,english,False,so excit roll midnight           ,,1
Backudog,20171106,scorpio edit is on it way glad book 2morrow work #xbox #xboxonex,,3,1,0,english,False,scorpio edit is on it way glad book 2morrow work  ,,1
Austin,20171106,xbox @xbox #xboxon #xbox,,1,0,0,english,False,xbox   ,,-1
Richard Ripley,20171106,is next one go xboxonexbox #xbox #xboxonex #logic,,1,1,0,english,True,is next one go xboxonexbox   ,,0
Korbi,20171106,omg omg omg @xboxdach @xbox #xboxonex #projectscorpio #xbox #cantwaitforit,,0,0,0,english,False,omg omg omg      ,,-1
UnknownGamer,20171106,can anyon recommend 4k tv game new #xboxonex #xbox #4k,,0,0,0,english,False,can anyon recommend 4k tv game new   ,,1
Mark Vernon,20171106,no sleep #xboxonex #xbox #xboxon,,0,0,0,english,False,no sleep   ,,-1
Uninterred,20171106,happi #xboxonex eve gamer #xbox #microsoft,,3,1,1,english,False,happi  eve gamer  ,,1
GAME Lewisham,20171106,countdown #xboxonex near pre order custom complet #trade ask team bundl save #xbox,,1,0,0,english,False,countdown  near pre order custom complet  ask team bundl save ,,-1
Hellavator,20171106,kick novemb new #gameswithgold #xbox #xboxon #trackmaniaturbo #talesfromtheborderland #nightsintodream #deadfalladventur,,0,2,0,english,False,kick novemb new       ,,-1
Sirko,20171106,should i get ps4 stick xbox one all wwii #callofdutywwii #cod #ps4 #xboxon #xbox #playstat #pcgamer #twitchkitten,,3,1,0,english,True,should i get ps4 stick xbox one all wwii        ,,0
Alex Parntaprasert,20171106,@xbox @xboxp3 #backwardcompat #xbox hulk mayb mak deal w @marvel 2 mak new hulk game exclus #xboxon,,0,0,0,english,False,    hulk mayb mak deal w  2 mak new hulk game exclus ,,1
Chris(WonderingGolem),20171106,damn i want xbox one x i wanna cool kid #xboxonex #xbox,,0,1,0,english,False,damn i want xbox one x i wanna cool kid  ,,-1
𝘿𝙅𝙍𝙚𝙙𝙘𝙖𝙥,20171106,the messag ive wait day close #xbox #projectscorpio #xboxonex,,3,0,1,english,False,the messag ive wait day close   ,,-1
DarkToolBelT,20171106,#xboxonex anoth #1080x1080 fit perfect #gamerp circl squar app #xbox,,1,0,0,english,False, anoth  fit perfect  circl squar app ,,1
DarkToolBelT,20171106,#xboxon @xbox @xboxp3you hype #xboxonex like #xbox #halo back day #1080x1080 #gamerp,,0,0,0,english,False,   hype  like   back day  ,,1
Colton Mays,20171106,boo ya it took four day final got lol @typicalgam @mystic7 #xboxon #xbox #fortnitebattleroyal,,6,0,0,english,False,boo ya it took four day final got lol     ,,1
Slim Charles 919,20171106,is x box one x worth the price vote facebook goggl @slimcharles919 #gamer #4k #videogam #xbox #xbox360 #xboxonex #microsoft,,0,0,0,english,True,is x box one x worth the price vote facebook goggl        ,,0
LumeniaTech,20171106,pleas bring fight night round 3 #xbox backward compat @xboxp3 @majornelson @easport #xboxon #xboxon #xboxonex #fightnight,,0,1,0,english,False,pleas bring fight night round 3  backward compat       ,,-1
PooleyPops,20171105,get xbox one x tomorrow excit #xbox #xboxonex,,1,0,0,english,False,get xbox one x tomorrow excit  ,,1
Trzarector: Black Myth-Wu Kong,20171105,ani test #mafia3 #xboxonex #xbox,,0,0,0,english,False,ani test   ,,-1
Jak,20171105,continu black mission 5 tivliz asylum #black #xboxon #xbox #eagam #gameut,,0,1,0,english,False,continu black mission 5 tivliz asylum     ,,-1
Anna,20171105,art naughti time #xboxon #evilwithin2 #lovethegam #game #xbox,,2,0,0,english,False,art naughti time     ,,-1
Backudog,20171105,not long get use custom control got specif 1x #xboxonex #xbox,,0,0,0,english,False,not long get use custom control got specif 1x  ,,-1
One Stop Game Shop,20171105,#xboxonex tue one stop game shop ltd qti avail #microsoft #xbox #xboxon #gamer #onlin #gameday #gameplay #gameov #play,,3,7,0,english,False, tue one stop game shop ltd qti avail         ,,-1
supadryz,20171105,have clear came across issu 1 360gamer #xbox #xbox360,,6,0,0,english,False,have clear came across issu 1 360gamer  ,,1
Zen -  ”King of the Cookies” ,20171105,ever sinc announc i unsur i preorder happen #e32017 lol #xboxonex #xboxuk #xboxon #xbox #teamsupstream,xbox ukxbox uk @xboxukoct 25 2017brace the world power consol almost today,0,0,0,english,False,ever sinc announc i unsur i preorder happen  lol     ,xbox ukxbox uk  25 2017brace the world power consol almost today,1
Aidszy,20171105,onli 28 hour i hand world power consol #xbox #xboxonex,,0,0,1,english,False,onli 28 hour i hand world power consol  ,,1
Revelbots,20171105,the master chief cool halo wallpap wait next game #halo #masterchief #videogam #xboxonex #xbox,,0,0,0,english,False,the master chief cool halo wallpap wait next game     ,,1
Gaing_forever #XboxSeriesX 25tflops RDNA2 8K/120,20171105,rememb #xbox insid regist #xboxonex preview program carri automat unfortun,,4,0,2,english,False,rememb  insid regist  preview program carri automat unfortun,,-1
Eric Upstate NY.,20171105,play @xbox version #game @xboxsupport #xbox #xbox360 #xboxon #xboxonex #bombassshit wait @realdonaldtrump,xboxxbox @xboxoct 27 2017more fun thrill true 4k world power consol play novemb 7,1,1,0,english,False,play  version        wait ,xboxxbox  27 2017more fun thrill true 4k world power consol play novemb 7,1
The VR Realm,20171105,so close wait i pick mine i want #xboxonex #xboxonexprojectscorpio #xbox #exit #game #geek #2moreday @xbox,,1,0,0,english,False,so close wait i pick mine i want        ,,1
ZakBabyTV,20171105,xboxon els #xboxon #xbox #gamer,,0,0,0,english,False,xboxon els   ,,-1
TeamProPainIRL,20171105,our new project almost done cant wait show #minecraft #minecraftpixelart #minecraftart #xbox #xboxon #xboxliv,,2,3,0,english,False,our new project almost done cant wait show      ,,-1
kirachem,20171105,which novemb releas get gotten #xboxon #xboxon #xboxonex #codwwii #needforspe #lanoir #starwar #xbox,,0,1,0,english,False,which novemb releas get gotten        ,,-1
Console Credit,20171105,step by step #xboxuk #xbox #xboxon #xboxonex #android #googleplay,,0,0,0,english,False,step by step      ,,-1
TripleUPlay,20171105,more video post today make sure subscrib #brand #xbox #xboxonex #sundaymorn,,0,0,0,english,False,more video post today make sure subscrib    ,,1
Jed Mahoney,20171105,@bungi thank continu make #xbox #destini player feel like matter @microsoft i excit #xboxonex #corporategre,,0,0,0,english,False, thank continu make   player feel like matter  i excit  ,,1
Ask Yer Ma,20171105,that even sort #codww2 #codwwii #xboxon #xbox,,0,0,0,english,False,that even sort    ,,-1
The Fallen Xiles,20171105,the fallen xile offici #twitter #xboxon #xbox #game #gamingcommun #xboxonex #rainbowsixsieg #callofdutywwii #pubg,,2,0,0,english,False,the fallen xile offici         ,,-1
Cravendale Knight,20171105,sold #xboxon make way #xboxonex meantim go old school #xbox #bethesda,,1,0,0,english,False,sold  make way  meantim go old school  ,,-1
UGN Online,20171105,hand get hand one beauti 2 day time #xbox #xboxon #game #gamer #ugn #xboxonex,,0,0,0,english,False,hand get hand one beauti 2 day time      ,,1
Belong Tyneside Guardians,20171105,we know hype releas #xboxonex unit tuesday play game made choos #xbox @xboxuk,,1,0,0,english,False,we know hype releas  unit tuesday play game made choos  ,,1
DS Nahogara,20171105,my favorit enemi whola game haha #videogam #indiedev #indiegam #indiedevhour #fight #gamejolt #ign #xboxonex #xbox #halloween,,2,2,0,english,False,my favorit enemi whola game haha          ,,1
Xbox One Reddit,20171105,best buy #xbox one x order final show action move prepar stage morn #xboxon,,2,0,0,english,False,best buy  one x order final show action move prepar stage morn ,,1
Tagify.io,20171105,relat instagram tag #collectorsedit #videogam #ps4 #limitededit #collect #collector #steelbook #xboxon #gamer #xbox,,0,0,0,english,False,relat instagram tag          ,,-1
XboxSeriesX/S,20171105,2 day #xboxonex releas @xboxp3 @xbox @xboxcanada @xboxuk @xboxdvr @id_xbox #xbox #projectscorpio #xboxon #xbox @xboxstor,,0,1,0,english,False,2 day  releas           ,,-1
Joe,20171105,my time favorit achiev #halo3 #xbox #xboxon #xbox360,,0,0,0,english,False,my time favorit achiev    ,,1
LasseMars,20171105,#xboxon test continu now instal #knightsoftheoldrepubl #xbox i hope work game great gb need,,0,0,1,english,False, test continu now instal   i hope work game great gb need,,1
Connor Higgins,20171105,final new hous get game room set #ps1 #ps2 #ps3 #xbox #xbox360 #xboxon #segamegadr #gamecub,,17,0,2,english,False,final new hous get game room set        ,,-1
WarHead ,20171105,#xboxonex enhanc updat start appear #xbox #xboxon,,1,1,0,english,False, enhanc updat start appear  ,,-1
Omer Bener,20171105,thank @xboxaustralia rest team amaz #xboxonex #staynplay #xbox #event can wait collect #scorpio edit,,18,2,3,english,False,thank  rest team amaz     can wait collect  edit,,1
Robin McGovern,20171105,sat watch pacif sherlock wait tuesday xbox one x arriv #xbox #xboxonex,,1,1,1,english,False,sat watch pacif sherlock wait tuesday xbox one x arriv  ,,-1
Retro Game Rater,20171105,the og #xbox has a bigg library than most realis ther are many great gam that need to com to #xboxon #gaming #retrogaming,,7,3,1,norwegian,False,the og  has a bigg library than most realis ther are many great gam that need to com to   ,,1
Xbox One Reddit,20171105,gta iv #xbox one x #xboxon,,0,0,0,english,False,gta iv  one x ,,-1
Get Motivated,20171105,novemb 7th worth #xboxonex # 499 #xbox #microsoft,,0,1,0,english,False,novemb 7th worth   499  ,,1
kel· bin,20171105,anybodi tri parti add xbox barrennin #callofdutyworldwar2 #callofdutyww2 #callofduti #codwwii #xbox #xboxon #codwii,,2,0,0,english,False,anybodi tri parti add xbox barrennin       ,,1
Pixel Party ,20171105,we surpris @pikalew love new #xboxonex lot #xbox stream incom,lewi vaughanlewi vaughan @pikalewnov 5 2017mi short #xboxonex #xboxonex thought best way experi game consol far i genuin blown away perform show thread,2,0,0,english,False,we surpris  love new  lot  stream incom,lewi vaughanlewi vaughan  5 2017mi short   thought best way experi game consol far i genuin blown away perform show thread,1
TheFatJuice,20171105,ghost recon wildland xbox one i glanc mini map bad #ghostrecon #wildland #ubisoft #xbox #xboxon #gamer #mybad,,0,0,0,english,False,ghost recon wildland xbox one i glanc mini map bad       ,,-1
DCMT,20171105,kill first capitol ship #elitedanger rip flagship thunder #xbox #xboxon,,0,0,0,english,False,kill first capitol ship  rip flagship thunder  ,,-1
DCMT,20171105,civil war home system enjoy view join fight #elitedanger #xbox #xboxon,,1,0,0,english,False,civil war home system enjoy view join fight   ,,-1
ArkXbox,20171105,have #xbox #xboxon,,2,0,0,english,False,have  ,,-1
CloudFootStudio,20171105,you know say serv two master gotta game gotta game #ps4 #xbox #xboxon #gamer #game #logitech,,2,0,0,english,False,you know say serv two master gotta game gotta game      ,,-1
Kieran ,20171104,am i bad person remov hdmi sticker front #xboxon own two year still @xbox #xbox,,4,1,0,english,False,am i bad person remov hdmi sticker front  own two year still  ,,-1
Ashipedia,20171104,tonight mixer broadcast start 8p ohio time u want gta parti messag xbox #mixer #gta #gtav #gta5 #xbox #xbox1,,9,6,0,english,False,tonight mixer broadcast start 8p ohio time u want gta parti messag xbox      ,,1
Funge1988,20171104,this epic #xbox #xboxonex #gamerlif,,0,0,0,english,False,this epic   ,,-1
Bug Catcher Riss,20171104,3 day #xboxonex releas ca wait get project scorpio edit #projectscorpio #microsoft #xbox #xboxon,,0,0,0,english,False,3 day  releas ca wait get project scorpio edit    ,,-1
jp,20171104,who els play #callofdutywwii play #xboxon #playstat #game #xbox #ps4 #callofduti #doublexp,,0,0,0,english,False,who els play  play       ,,1
Patrick Fox ,20171104,#codwwii expens @xbox store local game shop make sens #xbox #xboxon @philspenc23,,0,0,0,english,False, expens  store local game shop make sens   ,,-1
GhoSst,20171104,the big unbox #xboxonex #microsoft #xbox #amazon #unbox,,80,38,2,english,False,the big unbox     ,,-1
Khaleesi Reign,20171104,@callofduti fix god damn server i swear #sledgehamm #activis #xboxon #xbox,,0,0,0,english,False, fix god damn server i swear    ,,-1
Shaun W.,20171104,the #xbox store keep crash refus open #xboxon anybodi els troubl,,0,0,0,english,False,the  store keep crash refus open  anybodi els troubl,,-1
Trae,20171104,me ima take work play #codwwii #codww2 server go play outsid nice #xbox #xboxonex #ps4,,5,2,0,english,False,me ima take work play   server go play outsid nice   ,,1
Morgen C. Ruth ,20171104,xbox one x 3 day @xbox #xboxonex #xbox #xxx,,0,0,0,english,False,xbox one x 3 day    ,,-1
Aste,20171104,who got 1 month #xboxliv gold thank advanc #xboxon #gold #xbox,,0,0,0,english,False,who got 1 month  gold thank advanc   ,,1
Matt,20171104,i pretti happi say i star war game generat xbox #xbox #xbox360 #xboxon #starwar,,0,0,0,english,False,i pretti happi say i star war game generat xbox    ,,1
Matt,20171104,let #starwar #xbox #xboxon,,1,1,0,english,False,let   ,,-1
Lee Popey,20171104,the moment resi 6 accident becom much better resi 7 #residentevil7 #residentevil6 #residentevil #xboxon #xbox,,0,0,0,english,False,the moment resi 6 accident becom much better resi 7     ,,1
MadTrackZ,20171104,so first time 15 year i #xbox less that 4 #scorpio edit #xboxonex,,0,0,0,english,False,so first time 15 year i  less that 4  edit ,,-1
Sam Aguiar,20171104,who need #xboxonex #xboxon #microsoft best exclus also #steam pc and i rare play game pc #cuphead #xbox,,1,0,0,english,False,who need    best exclus also  pc and i rare play game pc  ,,1
International Gamer Pubcast,20171104,it good time kill nazi #wolfenstein2 @wolfenstein #callofdutywwii #callofdutyww2 #callofduti #xboxonex #xbox @xbox #xboxon,,2,0,0,english,False,it good time kill nazi         ,,-1
Medoks127,20171104,new ac readi start #assassincreedorigin #xbox #xboxon #ubisoft,,0,0,0,english,False,new ac readi start    ,,1
The VR Realm,20171104,get closer #xboxonex #xboxonexprojectscorpioedit #xbox #coutdown #3moreday #excit #game #geek @xbox,,2,0,0,english,False,get closer         ,,-1
Carlo Carrasco,20171104,xbox one x look realli excit use 4k tv owner #xbox #xboxonex #geek #nerd,,0,0,0,english,False,xbox one x look realli excit use 4k tv owner    ,,1
Contraplays,20171104,and i got birthday present #xboxon #xboxonex #xbox,,2,1,0,english,False,and i got birthday present   ,,-1
supadryz,20171104,quick question anyon know xbox 1 month game pass stackabl #xbox #xboxonex #xboxgamepass,,1,0,2,english,True,quick question anyon know xbox 1 month game pass stackabl   ,,0
Kev,20171104,want donat #xboxonex would etern grateful #xbox #donat #greatcaus #gamer,,0,0,0,english,False,want donat  would etern grateful    ,,-1
Nils Rinker,20171104,onli day left #xboxonex #xbox @majornelson @aarongreenberg,,0,0,0,english,False,onli day left    ,,-1
B NIGHT,20171104,do i #codww2 #callofduti #cod #playstat #xbox come find onlin let fun #brunom @callofduti #ps4 #xboxonex,,0,0,0,english,False,do i      come find onlin let fun    ,,1
 Popcultured4 ,20171104,what great month bit game #xbox #xboxonex sooon,,1,1,0,english,False,what great month bit game   sooon,,1
Fher Baez,20171104,yeahh termin @doom #doom #xbox #xboxon,,0,0,0,english,False,yeahh termin    ,,-1
Bob Evans,20171104,i excit i hide my new love life tuesday tell wife though #xboxonex #xbox #love #saddo,,0,0,0,english,False,i excit i hide my new love life tuesday tell wife though    ,,1
Micheal,20171104,i want xbox one x bad have scorpio edit preorder amazon cancel car shop #xboxonex #xbox,mike ybarramik ybarra @qwiknov 3 2017amaz graphic thing get xbox one x trueachiev outlin incred 22 44 faster load time gain #xbox #xbox,0,0,0,english,False,i want xbox one x bad have scorpio edit preorder amazon cancel car shop  ,mike ybarramik ybarra  3 2017amaz graphic thing get xbox one x trueachiev outlin incred 22 44 faster load time gain  ,-1
Ben Rappaport,20171104,thank @microsoft @xbox ca wait play #xboxonex #xbox #newtoy,,7,1,0,english,False,thank   ca wait play   ,,1
STX,20171104,#greenbak @xbox status #xbox #xbox360 #xboxon #xboxonex mia sinc 2015,,0,0,1,english,False,  status     mia sinc 2015,,-1
Stephanie Owens,20171104,two one night #friday13thgam #gamergirl #ps4share #xboxon #jasonvoorhe #xbox #playstation4 #playstat #pamelatap,,1,1,0,english,False,two one night         ,,-1
XxKomebackKidxX,20171104,beat cuphead normal collect everyth yep i die mani time #cuphead #xbox #xboxon #microsoft,,0,0,0,english,False,beat cuphead normal collect everyth yep i die mani time    ,,-1
Vekemans Bryan L,20171104,sorri xbox #xbox #xboxon #playstat #soni #codww2 #errorcode4128,,1,0,0,english,False,sorri xbox      ,,-1
Vekemans Bryan L,20171104,i think go battlefield #xbox #xboxon #codww2 #errorcode4128,,1,0,0,english,False,i think go battlefield    ,,-1
Vekemans Bryan L,20171104,1h30 server knock gg @atviassist #xbox #xboxon #codww2 #4128,,0,1,0,english,False,1h30 server knock gg     ,,1
Edwin Kalo,20171104,let go #codwwii #callofduti #wwii #xboxon #xbox,,1,0,0,english,False,let go     ,,-1
.,20171104,rise of the tomb raider is now xbox one x enhanc #xboxonexenhanc #xboxonex #xbox #xboxliv #xboxon #xbox #xbl,,0,0,0,english,False,rise of the tomb raider is now xbox one x enhanc       ,,-1
Joshua,20171104,that detail titanfal 2 xbox one x #xboxonex #titanfall2 #itsamonst #xbox #nopowergreaterthanx #4kgame #microsoft #xboxon,,2,0,0,english,False,that detail titanfal 2 xbox one x        ,,-1
