username,datatime,tweet_text,retweeted_text,likes,retweets,comments,language,is a question,tweet wout hashtag,retweet wout hashtag,sentiment analysis
Trend cyborg,20201124,marvel aveng #game avail #playstat rs 1999 save rs 2000 actual cost the #discount offer en 1st dec 2020 #ps5 #blackfridayd #blackfriday2020 #ps4 #soni,,0,0,0,english,False,marvel aveng  avail  rs 1999 save rs 2000 actual cost the  offer en 1st dec 2020     ,,-1
Mansooryan,20201124,final #ps5 #playstation5 #game #playstat,,0,1,0,english,False,final    ,,-1
Catching Up With The Nerds,20201124,have great time ps5 us whi guy also indulg latest episod histori #soni #playstat from ps1 ps5 #playstation5 #ps4 #ps3 #ps2 #ps1,,3,4,0,english,True,have great time ps5 us whi guy also indulg latest episod histori   from ps1 ps5     ,,0
Neostriker by J. D. Nyle,20201124,note work game requir stream good number game allow download like dark cloud graviti rush tbf i probabl would ps3 game via pc bigger screen anyway i access ps4 #videogam #playstat,,0,0,0,english,False,note work game requir stream good number game allow download like dark cloud graviti rush tbf i probabl would ps3 game via pc bigger screen anyway i access ps4  ,,1
Owen The Truth Seeker & Dealer,20201124,play limit except choic lock new 30fps limit fidel 60fps yeah inde limit #ps5 #playstation5 #soni #playstat,,0,1,1,english,False,play limit except choic lock new 30fps limit fidel 60fps yeah inde limit    ,,1
Zapumal,20201124,for guy worri play station price got damn cheaper #playstation5 #ps5 #playstat,crypto randcrypto rand @crypto_randnov 23 2020keep simpl hold #bitcoin #bitcoin,1,2,0,english,False,for guy worri play station price got damn cheaper   ,crypto randcrypto rand  23 2020keep simpl hold  ,-1
The Revival of Dothack (bringbackdothack),20201124,for newcom know jrpg seri hack multimedia franchis develop cyberconnect 2 publish bandai namco entertain creator hiroshi matsuyama #dothackreviv #dothack #bringbackdothack #ps5 #game #playstat #rpg #jrpg,,1,0,1,english,False,for newcom know jrpg seri hack multimedia franchis develop cyberconnect 2 publish bandai namco entertain creator hiroshi matsuyama        ,,1
Kenice Ukpai,20201124,nigerian use ps5 afford n65 000 veri clean serious buyer #ps5 #playstat #meme,,0,0,0,english,False,nigerian use ps5 afford n65 000 veri clean serious buyer   ,,1
Tinder Corporation,20201124,more game consol #techtuesday #internet #it #comput #technolog #tech #mobilecommerc #mobil #itsupport #cloud #data #cybersecur #bigdata #playstation5 #playstat #ps5,,2,5,0,english,False,more game consol                ,,-1
Felipe Wagner,20201124,and begin #playstation5 #playstat #playhasnolimit #ps5,,5,1,1,english,False,and begin    ,,-1
codezap,20201124,#ps5uk xboxx seri bundl game 665 deliveri 20 go got one trolley buy dose look good ps5 xmass #ps5stock #ps5launch #ps5uk #ps5preorder #playstat,,0,0,0,english,False, xboxx seri bundl game 665 deliveri 20 go got one trolley buy dose look good ps5 xmass     ,,-1
Ade Adepitan,20201124,i wish nope i #playstation5 i first #playstat advert back 90 mayb tweet saw hope well tho,,1,0,0,english,False,i wish nope i  i first  advert back 90 mayb tweet saw hope well tho,,1
Josh,20201124,day 6 struggl continu get @gamehelp @askps_uk replac broken #ps5 have reinforc hdmi cabl faulti port mask tape #playstation5 #broken #hdmi #playstat #soni #game #ps5uk,,0,0,2,english,False,day 6 struggl continu get   replac broken  have reinforc hdmi cabl faulti port mask tape       ,,-1
R3 Factory,20201124,want repair #ps4control simpli r3 #r3factory4al #r3it #repair #ps4 #ps #playstat #xbox #gamer #game #videogam #ps4updat #ps4game #ps4game #ps4gamer #ps4repair #laptop #game #servicecent #fix #abuhail #sparepart #speaker #softwar #mydubai #uae,,3,2,1,english,False,want repair  simpli r3                         ,,1
J.Alio,20201124,thank #playstat #ps5,,0,0,0,english,False,thank  ,,1
Marcus Lee Here,20201124,this i look ps4 #game #playstat #playstation5 #gamer,,0,2,0,english,False,this i look ps4    ,,-1
Zorins TV,20201124,soni confirm variabl refresh rate come ps5 futur updat #soni #playstat #game #vr #technolog #entertain,,0,0,0,english,False,soni confirm variabl refresh rate come ps5 futur updat      ,,-1
Dr Shahabaz,20201124,the guy respons trademark ps5 culprit delay you becom villain #ps5 #ps5india #playstat #trademark hope get serious stick gamer,,1,0,0,english,False,the guy respons trademark ps5 culprit delay you becom villain     hope get serious stick gamer,,-1
"VGP²aradise ""V""",20201124,#bendstudio #daysgoneps5 #daysgon #ps5 #playstation5 #playstation4 #playstat just day dreamin bout #daysgon,,6,1,0,english,False,       just day dreamin bout ,,-1
PS5 - Mania,20201124,2020 sort jour releas of the day #ps5 box #overcooked #watchdogslegion #justdance2021 psn #teslaforc @10tonsltd #fullsetps5 #jeuxvideo #videogamecollect #playstation5 #sony #playstat #gamecollect #gamecollecting #videogam #gamer #ps5collect,,1,1,0,french,False,2020 sort jour releas of the day  box    psn             ,,-1
Channel Of Kool,20201124,ps5 bombshel soni boss say no more playstat 5 #playstation5 #playstat #updat #holiday #blog,,0,0,0,english,False,ps5 bombshel soni boss say no more playstat 5     ,,-1
Quintin Quarantino,20201124,my man @emmanuelfin i mean i without fail #gamer #gamer #nerd #geek #pcgame #pcgamer #consol #playstat #ps #playstation3 #playstation4 #deadspace3,don litter don litter @emmanuelfinernov 23 2020 @gedaffa_koff @gedaffa_koff biggest geek i know he go guy recommend best game given time #giftagam #giftagam,1,0,0,english,False,my man  i mean i without fail            ,don litter don litter  23 2020   biggest geek i know he go guy recommend best game given time  ,1
Eghosa Sunny-Omoike,20201124,memori servic playstat rip #playstation5 #playstat #gamer #tech,,1,0,0,english,False,memori servic playstat rip    ,,-1
Siddharth Vaidya,20201124,intens experi play the last us #tlou #naughtydog #soni #playstat #ps3,,3,0,0,english,False,intens experi play the last us     ,,1
Hanatoz_eks,20201124,1st time play ghost tsushima ps4 type night #ghostoftsusima #ps4 #playstat,,0,0,0,english,False,1st time play ghost tsushima ps4 type night   ,,-1
Observer,20201124,live glori past way get kill aloy despit nora #horizonzerodawn #horizonforbiddenwest #aloy #guerrillagam #soni #playstat #playstation5 #decimaengin #kojimaproduct,,0,0,0,english,False,live glori past way get kill aloy despit nora         ,,-1
D A N N Y Y N N A D ,20201124,ps4 #playstat #ps4,d a n n y y n n a d d a n n y y n n a d @livinginmuricanov 24 2020look peopl start madden 21 onlin fantasi draft franchis mode interest dm i give detail retweet like pleas #madden21 #madden21 #nfl #nfl #franchisemod #franchisemod #madden #madden,0,0,0,english,False,ps4  ,d a n n y y n n a d d a n n y y n n a d  24 2020look peopl start madden 21 onlin fantasi draft franchis mode interest dm i give detail retweet like pleas        ,-1
ice cream,20201124,good game awesom #playstat #ps5 #game,,2,1,0,english,False,good game awesom   ,,1
The Spanish Collector,20201124,old memori #gta #gta3 #grandtheftauto #colección #ps2 #ps #playstat #ps4 #ps5 #soni #oldtim #game #gamer #ikea #videogam #gamecollect #retro #collector #collect #game #gamingroom #set #gameroom #gamingsetup #instagam #top #game #wow #gamingcommun,,1,0,0,english,False,old memori                             ,,-1
MrSiemasz,20201124,back first one #darksoul #demonssoul #ps3 #playstat @playstationuk @playstationeu @playstationpl @bandainamcouk,,0,0,0,english,False,back first one        ,,-1
Photomode of Tsushima,20201124,aloy atop mountain game #horizonzerodawn dev @guerrilla #photomod #gametographi #vgpunit #virtualphotographi #game #playstat #ps4 #thecapturedcollect #gamergram #thephotomod #shareoftheweek #vpcontext #hzd #horizonforbiddenwest,,59,8,2,english,False,aloy atop mountain game  dev               ,,-1
J blueberry,20201124,i exit ps5 i get decemb #playstat #ps5 #8k #milesmoralesps5 #demonssoulsps5 #godfallps5 #sackboyabigadventur #astrosplayroom #bugsnax,,0,0,0,english,False,i exit ps5 i get decemb         ,,-1
A Taskmaster,20201124,my girlfriend ask i check bj ps5 i said i damn desper yet #playstat #gamestop,,0,0,0,english,False,my girlfriend ask i check bj ps5 i said i damn desper yet  ,,1
Mohammed Salih,20201124,i want know wheather ps5 compat 4k tv monitor #playstat #playstation5 @playstat #playstaion,,0,1,0,english,False,i want know wheather ps5 compat 4k tv monitor    ,,1
Deezizz 4real,20201124,ur teammat fkup #warzoneseason6 #warzoneclip #warzon #ps4 #playstat #modernwarfar #game #callofdutymodernwarfar #battleroyal #callofduti #cod,,4,1,0,english,False,ur teammat fkup           ,,-1
John Fisher,20201124,just keep run #spiderman #spidermanps5 #doppelgam #ps5hare #psblog #ps5 #psshare #virtualphotographi #vpgamer #vgpunit #playstat #marvel #insomniacgam #gametographi #ingamephotographi #societyofvirtualphotograph #photomod #game #gamingphotographi #game,,11,2,0,english,False,just keep run                    ,,-1
Jimmie Bitcoin,20201124,got finger cross hope time wont get play i believ deliv #ps5 #gamestop #soni #playstat,,0,1,1,english,False,got finger cross hope time wont get play i believ deliv    ,,1
Taylor,20201124,reason i get ps5 bug plus i got babi hand #playstat,,0,1,0,english,False,reason i get ps5 bug plus i got babi hand ,,-1
ichi,20201124,scorpina avail 2 week great chanc new player join #battleforthegrid alreadi #playstat #ps5 #nintendoswitch #xbox #pcgame #googlestadia #ps4 #xboxon #bftg #fgc #indiefight,uchiuchi @uchigangnov 23 202015 day arenotreadi #battleforthegrid #battleforthegrid @battle4thegrid @battle4thegrid,2,1,0,english,False,scorpina avail 2 week great chanc new player join  alreadi           ,uchiuchi  23 202015 day arenotreadi    ,1
The Gaming Noisemakers,20201124,i complet #astrobotsplayroom #ps5 incred introduct #haptic #dualsens remind awesom beauti #playstat histori thankyou #soni good job #gamer,,0,0,0,english,False,i complet   incred introduct   remind awesom beauti  histori thankyou  good job ,,1
Abel TV Games,20201124,@realpabgam still get mine i 1 control headset charger 4 game remot i need 1 consol #bestbuy #gamestop #soni #playstation5 #playstat #walmart #newegg #target,,1,1,1,english,False, still get mine i 1 control headset charger 4 game remot i need 1 consol        ,,-1
Dead-Bunny,20201124,ok @gamestop websit crash #ps5 #playstat #playstation5 #xboxseriesx #xboxseriess #xbox #gamestop,,1,1,2,english,False,ok  websit crash       ,,-1
Shannon Laree,20201124,my cat #mrjaxgrey love #ps5 #playstation5 @playstat @soni #playstat #gamer #gamergirl #catsofthequarantin #cat,,4,1,1,english,False,my cat  love         ,,1
Mark Victor Ferrer,20201124,it happen everi #playstat generat sinc ps2 anyon link bunch ps5 make supercomput,,0,0,0,english,False,it happen everi  generat sinc ps2 anyon link bunch ps5 make supercomput,,-1
FumingTy,20201124,@playstat seven fail attempt get ps5 i offici given i want money #playstation5 #soni #takemymoney #playstat,,1,0,0,english,False, seven fail attempt get ps5 i offici given i want money    ,,-1
Richard 'EternalDreadLord' Ingham,20201124,when doubt use type charger cabl power ps5 control even one use charg phone #ps5 #playstation5 #playstat #thegameaward #thegameawards2020 #ps5consol,,1,0,0,english,False,when doubt use type charger cabl power ps5 control even one use charg phone      ,,-1
DripMN,20201124,whi hard get damn ps5 #ps5 #playstat,,1,0,0,english,False,whi hard get damn ps5  ,,-1
champloosloppy,20201124,i hit lick get money back either lol #ps5 #playstation5 #playstat,,2,0,0,english,False,i hit lick get money back either lol   ,,1
I--FIRE--I ,20201124,good morn #battlefieldfamili #fireun #friend i wish great tuesday without stress work good game platform #pc #xbox #playstat #ps5 much fun my #ps5 arriv today yeah #bcitw #bffi #gc #battlefieldfriend #dicefriend,,16,1,1,english,False,good morn    i wish great tuesday without stress work good game platform     much fun my  arriv today yeah     ,,1
Martin Craw,20201124,i think playstat much better xbox #playstation5 #playstat #xbox #game,,0,0,0,english,False,i think playstat much better xbox    ,,1
CODE GAMINGFFCTWITCH ,20201124,hoooooooooooooow mani time do i report game crash 4 time #ps4 enquiri delt #playstat,,0,0,0,english,False,hoooooooooooooow mani time do i report game crash 4 time  enquiri delt ,,-1
Elkdude (God's Geeks),20201124,for say aim feel weird black op chang set dynam aim exact like modern warfar #callofduti #blackopscoldwar #xbox #playstat #xboxseriesx #xboxseriess #ps5,,6,1,0,english,False,for say aim feel weird black op chang set dynam aim exact like modern warfar       ,,1
Leo C.,20201124,doe anyon els rememb fun black op 2 if i could i would go back heartbeat #blackopscoldwar #blackopscoldwarzombi #blackops2 #callofduti #playstation5 #playstat,,1,1,0,english,True,doe anyon els rememb fun black op 2 if i could i would go back heartbeat      ,,0
Mahmoud abdelhakam,20201124,#amazon #playstat #bestbuy #xbox i list detroit becom human ps4 sar via @amazon,,0,1,0,english,False,    i list detroit becom human ps4 sar via ,,-1
KENZAL KENDRIXX,20201124,how can you releas consol dure holiday season when there no consol 2 buy 4 @soni @playstat #playstat #soni #playhasnolimit #playstation5 #ps5 #ps5problem #ps5preorder #scalper #bot #gamer #ps5launch,,1,1,0,english,True,how can you releas consol dure holiday season when there no consol 2 buy 4             ,,0
JohnnyB,20201124,as soon oculus show vr porn one ad peopl forget #ps5 #soni #playstat,,3,1,0,english,False,as soon oculus show vr porn one ad peopl forget   ,,-1
Robert Alexander Scott,20201124,what fuck my game froze loud nois came tv good minut half ps5 shut what go soni #ps5 #playstat #soni #spiderman,,2,0,1,english,True,what fuck my game froze loud nois came tv good minut half ps5 shut what go soni    ,,0
ReignsHavok,20201124,damn covid 19 i miss go playstat experi psx that confer alway enjoy time if know i talk #playstat #playstationexperi #gamerlif #game #game #gamingcommun #videogam #ps5 #beforecovid,,0,0,0,english,False,damn covid 19 i miss go playstat experi psx that confer alway enjoy time if know i talk         ,,-1
JClawIntel,20201124,this day worst part father call homer life #ps5 #thesimpson #homer #playstat #playstation5 #waitingpati,,1,1,0,english,False,this day worst part father call homer life      ,,-1
George Maisey,20201124,@playstat @playstationuk @askps_uk #ps5uk #ps5 #playstat #playstation5 what disappoint even week i factori reset,,0,1,2,english,False,       what disappoint even week i factori reset,,-1
Photomode of Tsushima,20201124,inari friend game #ghostoftsushima dev @suckerpunchprod #photomod #gametographi #vgpunit #virtualphotographi #game #playstat #ps4 #thecapturedcollect #gamergram #thephotomod #shareoftheweek #goti #legend #vpcontext #ngplus,,35,6,2,english,False,inari friend game  dev                ,,1
Mike,20201124,it ship woke i order ps5 khol order cancel yet still might get i surpris #ps5 #khol #playstation5 #order #soni #playstat,,5,1,16,english,False,it ship woke i order ps5 khol order cancel yet still might get i surpris      ,,1
Tura ,20201124,jim ryan @jimryansi prove soni shitshow pr danc anoth playstat launch meanwhil retail get abus #playstat #ps5,,0,0,0,english,False,jim ryan  prove soni shitshow pr danc anoth playstat launch meanwhil retail get abus  ,,-1
Christian Jacobs,20201124,@verynetwork fantast servic manag preorder ps5 septemb kept post throughout transact deliv launch day veri happi definit shop #customerservic #ps5 #ps5uk #playstat,,0,0,0,english,False, fantast servic manag preorder ps5 septemb kept post throughout transact deliv launch day veri happi definit shop    ,,1
Twitch/OleMannLogan,20201124,my second ever platinum #playstat ecosystem first ever #playstation5 thank you @insomniacgam make best game #spidermanmilesmoral,,1,0,0,english,False,my second ever platinum  ecosystem first ever  thank you  make best game ,,1
Ravin Rathod,20201124,@playstat @soni jim ryan if provid genuin buyer stock stop scalper least allow current psplus user get psplus collect ps4 it fair #playstat #soni #psplus #pspluscollect,,0,0,0,english,False,  jim ryan if provid genuin buyer stock stop scalper least allow current psplus user get psplus collect ps4 it fair    ,,1
Suxor99,20201124,@askplayst world manag make wors phone app xbox ps store took 1000 step back complet unus ps5 can even search black friday deal ps5 #playstat #psn #soni,,0,0,0,english,False, world manag make wors phone app xbox ps store took 1000 step back complet unus ps5 can even search black friday deal ps5   ,,-1
InsideTechWorld,20201124,next go see #playstat #playstation5 fan come talk #xbox this war like #samsung #appl keep get better interest #gamer #playstation5 #gamingwar #gamergirl #appl #samsung #io #googl,astalast @astaranxnov 23 2020see even famous playstat hardcor fan @justanl @justanl give #ps5 #ps5 issu welcom #xbox #xbox #poweryourdream #poweryourdream man,1,1,0,english,False,next go see   fan come talk  this war like   keep get better interest        ,astalast  23 2020see even famous playstat hardcor fan   give   issu welcom     man,1
Gameplay,20201124,here year #blackfriday extend holiday hour we post #sale flyer soon keep look social media platform #xbox #ps5 #nintendoswitch #playstat #nintendo #xboxon #buyselltrad #retrostor #gameplayla,,2,2,0,english,False,here year  extend holiday hour we post  flyer soon keep look social media platform         ,,1
CandyCozzy,20201124,@minecraft hi troubl link sign #microsoft minecraft account ps4 know issu anyon help sort thank #help #playstat #minecraft,,0,1,0,english,False, hi troubl link sign  minecraft account ps4 know issu anyon help sort thank   ,,1
Gaming Enthusiasts #BeYourself,20201124,have finish mile moral game yet we thought great #spiderman #spidermanmilesmoral #milesmoral #milesmoralesps5 #ps5 #ps4 #playstation5 #marvel #insomniacgam #playstat,,0,0,0,english,True,have finish mile moral game yet we thought great          ,,0
King of Clubs,20201124,your moment zen #indi #indiegam #indiegam #indiegamedev #indiedev #gamedev #game #game #gamer #gamer #game #gamingcommun #videogam #videogam #pc #pcgame #pcgamer #pcgamer #linux #ps5 #ps4 #ps3 #playstat #xboxseriesx #xboxseriess #xbox #retro #retrogam,videogam failsvideogam fail @videogamefaiisnov 3 2020everyth look normal wait,11,7,0,english,False,your moment zen                            ,videogam failsvideogam fail  3 2020everyth look normal wait,-1
ARK SURVIVAL EVOLVED,20201124,color for day #arksurvivalevolv #arksurviv #playark #ps4 #pvp #playstat,,0,0,0,english,False,color for day      ,,-1
Uncharted Land,20201123,hmm chloe love nate cologn even wear #harryflynn #unchart #uncharted2 #uc #uc2 #playstat #playstation4 #ps4 # 2 # # # # 4,,2,0,1,english,False,hmm chloe love nate cologn even wear          2     4,,1
Uncharted Land,20201123,what if harry accepts to be cuck e harry aceit ser cuck #chloefraz #uncharted2 #uc #uc2 #playstation #playstation4 #ps4 # # # 2 # # # 4,,1,0,0,portuguese,True,what if harry accepts to be cuck e harry aceit ser cuck           2    4,,0
nani ,20201123,this wholesom #playstation5 #playstat,,0,0,0,english,False,this wholesom  ,,-1
 ƛƛƦƠƝ ƬƖЄƦƝЄƳ ,20201123,it year ii brotherhood sinc i enjoy ac game so thank #ubisoft #assassinscreedvalhalla 25 hour i get enough #ps5 #playstat #playstation5,,1,0,0,english,False,it year ii brotherhood sinc i enjoy ac game so thank   25 hour i get enough   ,,1
Romelo.L,20201123,mile said say less lmaoooooo #ps5 #playstat #spiderman,,0,0,0,english,False,mile said say less lmaoooooo   ,,-1
Leszek 'VirtuaX' Szczepański,20201123,so #ps5 look like dark #soni #playstat #playstation5 @playstat @guerrilla,,1,0,0,english,False,so  look like dark     ,,1
Yogandalo,20201123,@netherrealm #mkultim #playstat #playstation5 got problem i bought mk11 ultim order get dlc i never bought origin mk11 payment went ps store but purchas show bank statement what go,,0,0,0,english,False,    got problem i bought mk11 ultim order get dlc i never bought origin mk11 payment went ps store but purchas show bank statement what go,,-1
Checkandplay,20201123,humild rtx 3080 #mem #mem #videojueg #humor #humorgam #ps4 #playstation #xbox #xboxon #pc #multijug #nintend #jueg #videogam #gam #jueg #infanci #mundogam #cuarenten #actual #videojuegoscolombi,,1,1,0,spanish,False,humild rtx 3080                     ,,-1
Matt ,20201123,complet game 2020 #14 mile moral even though short great game still plenti stori judg teas end go good one #spidermanmilesmoral #playstat #ps5 #completedgam,,1,0,0,english,False,complet game 2020  mile moral even though short great game still plenti stori judg teas end go good one    ,,1
Mo,20201123,i not gonna miss great game i prefer #xbox #playstat get #xboxseriesx first i final find one #godofwarragnarok i #ps5 owner,,5,1,1,english,False,i not gonna miss great game i prefer   get  first i final find one  i  owner,,1
eFCKNsports,20201123,now know #playstation2 #ps5 #playstat,,2,1,0,english,False,now know   ,,-1
J Playful,20201123,doe anyon know fix everi time i play black op 4 soon i start play multiplay control stuck aim mode but work fine menu option #playstat @chainfe @ @swagg ps4,,0,0,0,english,True,doe anyon know fix everi time i play black op 4 soon i start play multiplay control stuck aim mode but work fine menu option     ps4,,0
Jess Batley,20201123,i love glitch like #assassinscreedvalhalla #assassinscre #playstat #ps4,,1,0,0,english,False,i love glitch like    ,,1
Lewis Sluman,20201123,whi new ps store mobil desktop bad mobil slight better i least see price but favourit list keep track thing everi decis made wors #ps5 #playstat #psn,,0,0,0,english,True,whi new ps store mobil desktop bad mobil slight better i least see price but favourit list keep track thing everi decis made wors   ,,0
TackyNerdy,20201123,sell ps5 disc version anybodi miss pre order look one pleas let know or text phone ##ps5 #playstation5 #playstat #playstat 5 #playstationdirect #lookingforps5 #gamestopp,,0,1,0,english,False,sell ps5 disc version anybodi miss pre order look one pleas let know or text phone     5   ,,1
KJF,20201123,damn #modernwarfar #modernwarfareclip #modernwarfarewarzon #callofduti #callofdutymodernwarfar #callofdutywarzon #teamwip #facebookgam #gulag #xbox #playstat #cod #codwarzon #battleroyal #gamingclip #gamersofinstgram #codtopplay #warzon #ps4 #pc,,5,2,0,english,False,damn                    ,,-1
Junior Teles,20201123,pleas @naughty_dog us unchart 4 patch least 60fps #unchart #uncharted4 #uncharted3 #uncharted2 #ps5 #60fps #soni #playstation5 #playstat #playstationbr #playstation_br,,0,0,0,english,False,pleas  us unchart 4 patch least 60fps           ,,1
Chris Lemmon,20201123,when music move #milesmoralesps5 #milesmoral #spidermanmilesmoral #spidermanps5 #ps5uk #ps5 #playstation5 #playstat,,3,0,0,english,False,when music move        ,,-1
XxMajinBxX,20201123,#ps5 #xboxseriesx #xbox #playstat #crysisremast question to anyon own play crysi remast worth buy consol play pc,,0,0,0,english,False,     question to anyon own play crysi remast worth buy consol play pc,,1
@Zuby_Tech,20201123,peopl alreadi hype #ps6 the hype train stop #ps5 #playhasnolimit #playstation5 #dualsens #playstat,,15,0,0,english,False,peopl alreadi hype  the hype train stop     ,,1
TGIVargeson,20201123,i wait play @callofduti @playstat @soni @treyarch #playstation5 #playstat #callofdutyblackopscoldwar #cod #game #videogam #twitchaffili,,0,0,0,english,False,i wait play           ,,1
Melissa Jean ,20201123,i call #playstat custom support sinc friday everi hour hour yet high volum call call automat hang everi time this redicul their custom servic terribl #playstation4 #horrid #terribl,,0,0,1,english,False,i call  custom support sinc friday everi hour hour yet high volum call call automat hang everi time this redicul their custom servic terribl   ,,-1
Owohunwa Taiye Joseph,20201123,a game pad i design use blender softwar it emit light switch #blender3d #blender #sketchfab #3dmodel #3dmodel #ps5 #konami #playstation5 #playstat #gaminglaptop,,1,0,1,english,False,a game pad i design use blender softwar it emit light switch          ,,-1
petek,20201123,i know bit differ way which #ps5 game i game next i finish spiderman #playstation5 #playstat,,0,0,0,english,False,i know bit differ way which  game i game next i finish spiderman  ,,-1
Black Gaming League,20201123,we approv messag exact creat bgl #gamingroom #gamingforlif #pc #videogam #game #pcgame #gamer #gaminglif #xboxonex #gamer #consolegam #playstat #stream #streamer #playstation5 #blackgamingleagu #bgl,black girl gamersblack girl gamer @blackgirlgamersnov 23 2020we got next gen consol gonna next gen stori concept ip where new stori come becaus demograph i want,5,0,0,english,False,we approv messag exact creat bgl                 ,black girl gamersblack girl gamer  23 2020we got next gen consol gonna next gen stori concept ip where new stori come becaus demograph i want,1
 Tara Barker ,20201123,this would fantast win @swalk1977 @artyju #playstation5 #ps5 #playstat,,0,0,0,english,False,this would fantast win     ,,1
Csaba Handa,20201123,say #playstation5 big well #playstation2 #develop #tool bigger cours #playstat #ps5,,0,0,0,english,False,say  big well    bigger cours  ,,1
Rhod-Wulf Leon,20201123,the second sister #starwarsjedifallenord #playstation4 #starwar #psshare #playstat #photomod #psblog #virtualphotographi @eastarwar @starwar,,0,0,0,english,False,the second sister          ,,-1
