username,datatime,tweet_text,retweeted_text,likes,retweets,comments,language,is a question,tweet wout hashtag,retweet wout hashtag,sentiment analysis
Jaxn,20180104,funni i got two xbox one kinect adapt and free i think i go sell second one i rich wohaaa #xboxon #xbox,,0,0,0,english,False,funni i got two xbox one kinect adapt and free i think i go sell second one i rich wohaaa  ,,1
Bane the Brummie,20180104,mafia 3 terribl underr new bordeaux wonder craft well worth play last day sale want pick cheap #mafiall #xboxonex #xbox,,11,3,3,english,False,mafia 3 terribl underr new bordeaux wonder craft well worth play last day sale want pick cheap   ,,1
JUGERNAUGHTY,20180104,rampag #battlefield1 #cod #codww2 #bf1 #fps #callofduti #ww2 #battlefield #xbox #xboxon #mlg #wwii #instagam #onlinegam #destini,,2,1,0,english,False,rampag               ,,-1
Sionainn ,20180104,xbox add sionaaain #xboxon #xbox #xboxliv #xboxlivesess,,0,0,0,english,False,xbox add sionaaain    ,,-1
VΞRDICT4489,20180104,which lineup assum #xbox one real look appeal #playstat #xbox #ps4 #ps4pro #xboxon #xboxon #xboxonex,,53,15,63,english,False,which lineup assum  one real look appeal       ,,-1
Corvis,20180104,2018 game complet # 5 duke nukem 3d some good old nostalgia yes i old #xbox #xboxon #game,,0,0,0,english,False,2018 game complet  5 duke nukem 3d some good old nostalgia yes i old   ,,1
Rain,20180104,a skill master #blacksmithandr #darksouls3 #darksoul #andreofastora #gamersunit #xbox #xboxon,,1,0,0,english,False,a skill master       ,,-1
Hellavator,20180104,2018 start great game free gold member #theincredibleadventuresofvanhelsingiii #tombraiderunderworld #zombi #armyoftwo #ubisoft #crystaldynam #ea #xbox #xbox360 #xboxon #microsoft #gameswithgold #xboxgold #xboxliv,,1,0,0,english,False,2018 start great game free gold member              ,,1
JPSHRACER Gaming,20180104,late play kinect sport rival bowl rock climb soccer target shoot tenni wave race achiev definit earn rock climb wave race favorit actviti kinect sport rival #kinectsportsriv #kinect #xbox #xboxon,,0,0,0,english,False,late play kinect sport rival bowl rock climb soccer target shoot tenni wave race achiev definit earn rock climb wave race favorit actviti kinect sport rival    ,,1
JPSHRACER Gaming,20180104,monday play forza horizon 3 playerunknown battleground celebr new year eve it fun night game talk @ac_zach jack #forzahorizon3 #playerunknownsbattleground #pubg #xbox #xboxon #xboxonex #xboxonexenhanc #teamxbox,,2,0,0,english,False,monday play forza horizon 3 playerunknown battleground celebr new year eve it fun night game talk  jack        ,,1
Luke Telfer,20180104,a new fabl xbox teas #xboxon #fabl #xbox #microsoft,,2,0,0,english,False,a new fabl xbox teas    ,,-1
Sergiopgadh,20180103,en direct only streaming en direct #fortnit #fortniteps4 #fortnitebattleroyal #battleroyal #ps4 #playstation #gameplay #youtubegam #youtub #fif #fifa18 #xbox #xboxon #cod #codww2 #gam #serginh #team #supervivent #gaming #streaming #streamon,,2,2,0,spanish,False,en direct only streaming en direct                      ,,-1
Xbox One Reddit,20180103,tech #xbox one x frame rate issu not recognis fortnit hdr 70 lg ultra hd 4k tv 70uj675v #xboxon,,0,0,0,english,False,tech  one x frame rate issu not recognis fortnit hdr 70 lg ultra hd 4k tv 70uj675v ,,-1
Terrence McGee,20180103,had get new gamer tag wanna see 2k18 catch coop someth els getfaunki 13 #xboxon #xbox #2k18,,0,0,0,english,False,had get new gamer tag wanna see 2k18 catch coop someth els getfaunki 13   ,,-1
Marco Letona,20180103,final sonic adventur 2 battl xbox one s #xboxon #xboxon #xbox,,0,0,0,english,False,final sonic adventur 2 battl xbox one s   ,,-1
Xbox One Reddit,20180103,will microsoft make comeback next generat new #xbox versus ps5 #xboxon,,0,0,0,english,False,will microsoft make comeback next generat new  versus ps5 ,,-1
𝓓𝓸𝓬 𝓡𝓪 ,20180103,tri get guy level take bit #elderscrollsonlin #morrowind #sorcer #ebonheartpact #xboxonex #xbox #game #consol #aodinc #angelsofdeathinc,,1,0,0,english,False,tri get guy level take bit          ,,-1
VΞRDICT4489,20180103,the time almost upon us rais hand get #reddeadredemption2 #playstat #xbox #pc #ps4 #ps4pro #xboxon #xboxon #xboxonex,,32,8,10,english,False,the time almost upon us rais hand get         ,,1
Mark R. Jones,20180103,are retro yet set #xbox360 game room today look back #xbox,,3,0,3,english,True,are retro yet set  game room today look back ,,0
Ailene,20180103,37 day i meet best friend xbox first time ever 8 year onlin friend #xbox #xboxon #countdown #excit #cantwait #xboxfriend,,0,0,1,english,False,37 day i meet best friend xbox first time ever 8 year onlin friend      ,,1
RelaxedMrBaker,20180103,so peac #abzu #xbox #xboxonex,,0,0,0,english,False,so peac   ,,1
Bottomfeedernews,20180103,a littl #wednesdaywisdom trueli #playstation4 #xbox1 #xbox360 #playstat #xboxliv #onlin #game #videogam #xbox #videogam #playtim #gamingmem #vr,,0,0,0,english,False,a littl  trueli             ,,-1
Simpson5252,20180103,bust round quick lunch break #xboxcont #xboxcommun #videogam #gamer #xboxon #xbox #gamingcommun #gam,,1,0,0,english,False,bust round quick lunch break        ,,-1
EddieD80111 ,20180103,hey @fortnitegam pickax temporari mode would interest #gamer #ps4 #xbox #xboxon #xboxon #xboxonex,,0,0,0,english,False,hey  pickax temporari mode would interest      ,,1
A Wild Hanimal,20180103,when play #playerunknownsbattleground get last 2 fire game kick back titl screen #xbox #xboxon,,0,0,0,english,False,when play  get last 2 fire game kick back titl screen  ,,-1
VΞRDICT4489,20180103,best exclus gen #playstat #xbox #nintendo #pc #ps4 #ps4pro #xboxon #xboxon #xboxonex #nintendoswitch,,6,5,13,english,True,best exclus gen          ,,0
IrritatedJonny,20180103,xbox pubg then back futur #x3lcommun #twitchaffili #pubgxboxon #playerunknownsbattleground #pubg #xboxon #xbox #2018willbeknowna year irrit,,6,6,0,english,False,xbox pubg then back futur         year irrit,,-1
Gaing_forever #XboxSeriesX 25tflops RDNA2 8K/120,20180103,look forward #xbox #xboxonex exclus foremost day one also look forward play #spidermanps4 #godofwar,,3,0,0,english,False,look forward   exclus foremost day one also look forward play  ,,1
patrickmpage,20180103,ani #xbox #battlefront2 #callofduti player pleas add starkillerkilla #xboxon i need help i get,,0,0,0,english,False,ani    player pleas add starkillerkilla  i need help i get,,1
Ashton Busso,20180103,@pubattleground great game hope #xbox1 version come good soon i think lot #xboxon owner would appreci tini bit feedback regard stabil we all know preview get import feedback sure need 2 play without crash #xbox,,0,0,0,english,False, great game hope  version come good soon i think lot  owner would appreci tini bit feedback regard stabil we all know preview get import feedback sure need 2 play without crash ,,1
Carl Mess,20180103,#microsoft stop sell #xboxon #kinnect adapt #xbox #xboxon #xboxonex #gamer,,0,0,0,english,False, stop sell   adapt    ,,-1
Corvis,20180103,2018 game complet # 4 littl acr quick point click stylis game #xbox #xboxon #game,,0,0,0,english,False,2018 game complet  4 littl acr quick point click stylis game   ,,-1
lynseystuart,20180103,so gut complet resid evil biohazard one day anyon know decent game #xboxon #game #xbox #,,0,0,0,english,False,so gut complet resid evil biohazard one day anyon know decent game    ,,-1
mixer-Drayzor-_-,20180103,hit split quad feed play boy @s9tom nice littl turn #callofduti #cod #ww2 #gamer #xboxon #xbox #letsgetit #feed #clip,,0,0,0,english,False,hit split quad feed play boy  nice littl turn         ,,1
thedark1ord211,20180103,final my first guardian reach max light level #destinyhardhead #destiny2 #gamerlif #thedark1ord211 #xboxonex #xbox,,0,0,0,english,False,final my first guardian reach max light level      ,,1
JUGERNAUGHTY,20180103,pretti shotti start #battlefield1 #cod #codww2 #bf1 #fps #callofduti #ww2 #battlefield #xbox #xboxon #mlg #wwii #instagam #onlinegam,,7,2,1,english,False,pretti shotti start              ,,1
The LBG | #BLM,20180103,complet # 6 year #tacoma anoth game @fullbright pull start can wait see pull next #achievementhunt #achievementunlock #xbox #xboxon #gamerscor,,5,1,1,english,False,complet  6 year  anoth game  pull start can wait see pull next     ,,-1
El TuckerO,20180103,how start a hot drop round #pubg zero communic chao still believ i got win round #dinnerparti #xbox #xboxon #xboxpubg #chao #roadkil #part1,,1,0,0,english,False,how start a hot drop round  zero communic chao still believ i got win round       ,,-1
Lobster Fight ,20180103,light obsidian #minecraft #nether #game #gamer #pc #playstat #pcgame #xbox #xboxon #ps4 #msi #majong #herobrin #notch @minecraft @planetminecraft,,2,1,0,english,False,light obsidian                ,,-1
Lobster Fight ,20180103,who still continu build @garrysmodr #garrysmod #gmod #game #gamer #pc #pcgamer #pcgame #xbox #xboxonex #ps4 #nvidia #videogam #valv #halflif #gman,,3,1,0,english,True,who still continu build                ,,0
Andy aka Producer(BTW),20180103,so #mircrosoft pull plug #kinect now go collector item peopl street say kinect dealer hey man need kinect buyer take fuck money #rip #kinect #game #videogam #xboxonex #xboxon #xbox,,0,0,0,english,False,so  pull plug  now go collector item peopl street say kinect dealer hey man need kinect buyer take fuck money       ,,-1
Chris (BELL SYSTEM PROPERTY - NOT FOR SALE),20180103,also absolut hilari #xbox activ show use #hddvd player #xbox360,,0,0,1,english,False,also absolut hilari  activ show use  player ,,1
Mob Zombi,20180103,#xbox #xboxon #xboxliv you welcom,,8,2,1,english,False,   you welcom,,1
Roy Alexander Luke,20180103,add let play bf1 gta v fortnit xbox one gt ilovezendayam #fortnit #battlefield1 #xbox #xboxon,,1,0,0,english,False,add let play bf1 gta v fortnit xbox one gt ilovezendayam    ,,1
Johnny Neat,20180103,ridicul ms good thing i feel handl poor plus xbox one x buyer support one burnt a kinect serial number guarante one this make less like adopt futur experi ms #xboxonex #xbox #xboxon #xboxon #kinect,,2,0,0,english,False,ridicul ms good thing i feel handl poor plus xbox one x buyer support one burnt a kinect serial number guarante one this make less like adopt futur experi ms     ,,1
r3dskinn3rdud3,20180103,anybodi play the #jasonfridaythe13th #game #videogam #xbox #xbox1 #xboxon #fridaythe13th #fridaythe13thgam #jason #jasonvorhe hit me up,,1,0,0,english,False,anybodi play the           hit me up,,1
Richard Le Tourneau,20180103,time #forza7 #xboxon #xbox #game what fav car game,,1,0,0,english,False,time     what fav car game,,1
Xbox One Reddit,20180103,help gray screen #xbox one x #xboxon,,0,0,0,english,False,help gray screen  one x ,,1
JosephAnthony,20180103,all xbox one x enhanc game bad list #gamern #game #videogam #xbox #xboxonex #xboxonexenhanc,,3,0,0,english,False,all xbox one x enhanc game bad list      ,,1
ZonythePony,20180103,realli steph #nba #nba2k #basketbal #sport #game #game #game #gamer #gamer #gamerguy #videogam #videogam #playstat #playstation4 #ps4 #xbox #xboxon #funni #glitch #curri #stephcurri,,3,2,0,english,True,realli steph                     ,,0
Drippyist Collectibles,20180102,drippi #fortnitebattleroyal #fortnit #drippi #xbox #xboxon #xboxon #xboxonex #mixer,,0,0,0,english,False,drippi        ,,-1
Darth Gotham Knight,20180102,start 2017 160k goal 180k end year end 2017 211k 2018 year end goal 250k wish luck #xboxonex #xbox @xbox @xboxach @xboxlivereward #goal #game,,4,1,3,english,False,start 2017 160k goal 180k end year end 2017 211k 2018 year end goal 250k wish luck       ,,1
Obi Wan Panda △⃒⃘,20180102,hey add xbl my gt bigdaddyhybrid #xbox #xboxon #xboxliv #overwatch,,2,0,0,english,False,hey add xbl my gt bigdaddyhybrid    ,,1
Dave Slye ,20180102,#pubgxboxon patch plan announc soon let hope get someth juici next updat this game pure joy fun so happi see get amaz respons #xbox communiti #xboxon,,0,0,0,english,False, patch plan announc soon let hope get someth juici next updat this game pure joy fun so happi see get amaz respons  communiti ,,1
Game Infinite,20180102,when level 12 assassin simpl bow ask face god suggest level 40 let say bayek slaughter #assassinscre @assassinscre #assassinscreedorigin #ps4 #gamingnew #videogam #xbox #xboxon #xboxonex,,3,0,0,english,False,when level 12 assassin simpl bow ask face god suggest level 40 let say bayek slaughter         ,,1
HopeyScorpion,20180102,@xboxsupport4 @xboxonegb origin eaphon new turtl beach none mic work sinc #xboxon updat what can help #xboxearphon #xbox #turtlebeach #xboxsupport,,0,0,1,english,False,  origin eaphon new turtl beach none mic work sinc  updat what can help    ,,1
RelaxedMrBaker,20180102,hmm good cop bad cop #lanoir #xboxon #xbox,,1,0,1,english,False,hmm good cop bad cop   ,,-1
VΞRDICT4489,20180102,after take break halo past week time jump back #haloreach tonight #xboxonex #xbox,,1,0,1,english,False,after take break halo past week time jump back  tonight  ,,-1
Dan Laing,20180102,look forward go back childhood later @sega thank @donlewis83 brilliant xmas present #game #game #game #gametim #gamertim #gamerforlif #play #play #fun #instagam #guygam #xbox #xboxon #gamer #gameswithgold #game #achiev #retrogam,,0,0,0,english,False,look forward go back childhood later  thank  brilliant xmas present                  ,,1
Xbox One Reddit,20180102,tech i fix 102 error origin #xbox one #xboxon,,0,0,0,english,False,tech i fix 102 error origin  one ,,-1
Chris James 𓅓,20180102,first post morn pornhub work xbox one x oh god love internet #xboxonex #xbox #pornhub,,0,0,0,english,False,first post morn pornhub work xbox one x oh god love internet   ,,1
Mover,20180102,rt @dcfstudio wanna fight boy #dcfstudio #game #ps4 #playstat #soni #fight #fightgam #indi #indiedev #gamedev #gameplay #ufc #uniti #acb #acbmma #fightgam #box #mma #xbox #xboxon #xboxonex #steamgam #steamgam #steam add steam wis,,0,0,0,english,True,rt  wanna fight boy                         add steam wis,,0
Jason Muñoz,20180102,my son got #xbox1 #christma realiz #xbox still use batteri control year 1987 #ps4 much better need pay onlin use batteri big ass ugli control @playstat simpli better,,0,0,0,english,False,my son got   realiz  still use batteri control year 1987  much better need pay onlin use batteri big ass ugli control  simpli better,,-1
Dexter Lynch,20180102,need help microsoft movi tv i click refresh purchas histori account manag section delet half movi show how i get back #xbox #xbox360 #microsoft #microsoftmoviesandtv #xboxon,,0,0,0,english,True,need help microsoft movi tv i click refresh purchas histori account manag section delet half movi show how i get back     ,,0
Woodstock Production,20180102,rt dcfstudio wanna fight boy #dcfstudio #game #ps4 #playstat #soni #fight #fightgam #indi #indiedev #gamedev #gameplay #ufc #uniti #acb #acbmma #fightgam #box #mma #xbox #xboxon #xboxonex #steamgam #steamgam #steam add steam wishlist,,1,0,0,english,True,rt dcfstudio wanna fight boy                         add steam wishlist,,0
The LBG | #BLM,20180102,complet # 5 mr pumpkin adventur last one gonna get hrs z we roll #achievementhunt #achievementunlock #xbox #xboxon #gamerscor,,8,1,1,english,False,complet  5 mr pumpkin adventur last one gonna get hrs z we roll     ,,1
The LBG | #BLM,20180102,complet # 4 night duke nukem 3d 20th anni world tour #gamescor current #achievementhunt #achievementunlock #xbox #xboxon,,4,0,2,english,False,complet  4 night duke nukem 3d 20th anni world tour  current    ,,-1
Craig Leather,20180102,a niiiiic new year present #xboxon #xbox,,1,0,0,english,False,a niiiiic new year present  ,,-1
Dan Laing,20180102,few achiev unlock morn play #idarb @xbox gwg titl van hels iii now go cinema watch @jumanjimovi #game #game #game #gamerforlif #play #play #fun #guygam #xbox #xboxon #gamer #gameswithgold #game #achiev #achievementunlock,,1,0,1,english,False,few achiev unlock morn play   gwg titl van hels iii now go cinema watch                ,,1
CrYoGeNicK,20180102,xbox @bethesdastudio @fallout #khajiit #dragon #dovahkiin #falloutnv #xbox #xboxon #gamer #fallout4 #dragonborn #fallout3 #skyrim #bethesda #videogam #skyrimspecialedit #farcry3 #farcry4 #skyrimscreenshot #skyrim theelderscrol #falloutmem #skyrimmem,,0,0,0,english,False,xbox                     theelderscrol  ,,-1
Bernd,20180102,the power x #xb1 #xbox #xboxonex #game #noskillgam #xbo #berndspielt,,2,0,0,english,False,the power x       ,,-1
Salted,20180102,anyon boat stream #mixer straight #xboxon let know #streamer #newstream #xbox,,3,0,1,english,False,anyon boat stream  straight  let know   ,,1
The LBG | #BLM,20180102,complet # 3 black the fall way # 4 #achievementhunt #achievementunlock #xbox #xboxon,,2,0,0,english,False,complet  3 black the fall way  4    ,,-1
UGN Online,20180102,januari 2018 new select #gameswithgold avail anoth fair averag offer start year #xbox #xboxon #game #gamer #ugn #xboxonex,,0,0,0,english,False,januari 2018 new select  avail anoth fair averag offer start year      ,,-1
The LBG | #BLM,20180102,2nd complet black white bushido #achievementhunt #achievementunlock #xbox #xboxon,,8,1,1,english,False,2nd complet black white bushido    ,,-1
Godlyki,20180102,tag #pcgamer #gamerboy #game #gamer #gamer #pcgame #ps4 #battlefield #gta5 #gtav #gta #cod #xbox1 #grandtheftauto5 #csgo #pcgamer #xbox #meme #meme #game #game #noob #videogam #videogam #lol #lmao #pcso #starwarsthelastjedi #overwatch #dva,,0,2,0,english,False,tag                              ,,-1
Brooklyn Mat,20180102,close #pubg #xboxon #xbox,,0,0,0,english,False,close   ,,-1
Taylor ,20180102,i watch boyfriend play #pubg almost 6 hour no tv anyth watch play #xboxon #xbox #christma #present,,0,0,0,english,False,i watch boyfriend play  almost 6 hour no tv anyth watch play    ,,1
Daniel,20180102,hunter #destiny2 #bungi #xbox #xboxon,,0,0,0,english,False,hunter    ,,-1
OneEightySix_Twitch,20180102,armi two tomb raider underworld free 360 wednesday damn wet suit lara croft hello 2018 #xbox360 #xbox,,1,0,0,english,False,armi two tomb raider underworld free 360 wednesday damn wet suit lara croft hello 2018  ,,1
Daniel,20180102,warlock #destiny2 #bungi #xbox #xboxon,,1,0,0,english,False,warlock    ,,-1
#PinstripePride #TogetherBlue,20180102,so i bought xbox one last week i ps4 one add ps4 one xyankeesx 1325 #ps4 #xboxon #xbox,,0,0,0,english,False,so i bought xbox one last week i ps4 one add ps4 one xyankeesx 1325   ,,-1
TurboGamingUK,20180101,for #xboxon pc player window app ark version turbogaminguk communiti pvp server eu # # turbogaminguk pvp crossplay easi tame 10074 #xbox #arksurvivalevolv,,0,0,0,english,False,for  pc player window app ark version turbogaminguk communiti pvp server eu   turbogaminguk pvp crossplay easi tame 10074  ,,-1
Tawce,20180101,zofia 4k i got back first came #rainbow #rainbowsixsieg #rainbowsix #rainbowsixgam #sieg #six #rainbow6 #rainbowsixsieg #xbox #xboxon #cod #callofduti #wwii #esl #pro #proleagu #bloodorchid #friend #mlg #competit #gfuel #gammalab #clutch #xbox,,0,0,0,english,False,zofia 4k i got back first came                        ,,-1
Becca,20180101,so piss @activis server play ww2 zombi got part fuse kick us game happen sever time tonight @shgame @xbox @xboxsupport #xbox #xboxon #xboxliv #codzombi ##codww2 #codwwii,,1,0,0,english,False,so piss  server play ww2 zombi got part fuse kick us game happen sever time tonight         ,,-1
XPLootGaming,20180101,serious though #pcgame #gamer #pcgame #gamer #stream #pubg #xbox #xploot #gamergirl #xboxon #ny2018,,0,1,0,english,False,serious though           ,,-1
Anthony Aponte,20180101,my eye peel i hope repli sign thing come #xboxonex #xbox2018 #xbox,,0,0,0,english,False,my eye peel i hope repli sign thing come   ,,1
Dan Laing,20180101,#100kchalleng day 1 total jan spend 2 jan budget 25 gamerscor 470 jan gs target total gs target #blogger #blog #bloggerstyl #xbox #xboxon #gamer #game #gameswithgold #game #achiev #consol #linkinbio,,1,0,1,english,False, day 1 total jan spend 2 jan budget 25 gamerscor 470 jan gs target total gs target            ,,-1
ĐɎⱠ₳₦,20180101,i love peopl like #xbox #xboxon #xboxliv,,0,0,0,english,False,i love peopl like   ,,1
SIX3MAFIA,20180101,nsfw languag #destiny2 final got favorit #destini 1 exot helmet #stag #xbox #xboxon #63m #ps4share,,3,2,0,english,False,nsfw languag  final got favorit  1 exot helmet     ,,1
Gerrit,20180101,new game grander adventur inde 2018 chalk full game #xboxonex place play happi new year #xbox,,0,0,0,english,False,new game grander adventur inde 2018 chalk full game  place play happi new year ,,1
Jordan Evans,20180101,this year xbox gamerscor goal reach gs end 2018 sound imposs i think i make #xboxonex #xbox #xboxon @xbox @majornelson #mixer,,0,0,0,english,False,this year xbox gamerscor goal reach gs end 2018 sound imposs i think i make      ,,1
Sheridan Irvine,20180101,did someon say star war battlefront 2 instal xbox one #starwarsbattlefrontii #battlefront2 #xbox #xboxon #videogam,,1,0,0,english,True,did someon say star war battlefront 2 instal xbox one     ,,0
the cartoon gooner,20180101,anyon offer insight whether worth upgrad #xboxonex do 4k tv would upgrad futur #xbox #xboxonexenhanc,,0,0,0,english,False,anyon offer insight whether worth upgrad  do 4k tv would upgrad futur  ,,1
Becca,20180101,if anyon want play #codww2 zombi want complet mission pleas msg #cod #codwwii #xbox #xboxon #codzombi #gamertag #xboxliv #callofduti,,0,0,1,english,False,if anyon want play  zombi want complet mission pleas msg        ,,1
XPLootGaming,20180101,ea back #pcgame #gamer #pcgame #gamer #stream #pubg #xbox #xploot #gamergirl #xboxon #ny2018,,0,0,0,english,False,ea back           ,,-1
Jason Bouwmeester,20180101,been busi year game wise accord @trueachiev #xbox #xboxon #game #trueachiev,,0,0,0,english,False,been busi year game wise accord     ,,1
Corvis,20180101,1st 100 complet 2018 short walk sim great visual thought provok narrat #xbox #xboxon #complet #game,,1,0,0,english,False,1st 100 complet 2018 short walk sim great visual thought provok narrat    ,,1
🅢🅣🅡🅧🅣🅢🅨,20180101,11 kill solo game #playerunknownsbattleground #xbox #xboxpubg #xboxpubgdin #winnerwinnerchickendinn #11 #kill #solo #fortnit #pubg #xboxon #scar #win,,0,0,0,english,False,11 kill solo game             ,,-1
UsmanAliButt,20180101,1st januari 2018 great start year got xbox one x 4k setup complet @xbox @xboxp3 #xbox #xbox1x #xboxonex #microsoft #game,,1,0,1,english,False,1st januari 2018 great start year got xbox one x 4k setup complet       ,,1
Your Game Clips,20180101,happi new year everyon what game releas peopl look forward year #ps4 #playstat #xbox #xboxon #game #xboxliv #psn,,1,0,0,english,True,happi new year everyon what game releas peopl look forward year       ,,0
Tawce,20180101,my first gameclip post twitter echo 4k i lot come daili the journey start #rainbow #rainbowsixsieg #rainbowsix #rainbowsixgam #sieg #six #rainbow6 #rainbowsixsieg #xbox #xboxon #game #esl #pro #proleagu #bloodorchid,,0,0,0,english,False,my first gameclip post twitter echo 4k i lot come daili the journey start               ,,-1
xThe Zombie Bangx,20180101,play wolfenstein 2 time halo reach #xbox #xboxonex #halo #happynewyear2018,,0,0,0,english,False,play wolfenstein 2 time halo reach    ,,1
JUGERNAUGHTY,20180101,never say die #battlefield1 #cod #codww2 #bf1 #fps #callofduti #ww2 #battlefield #xbox #xboxon #mlg #wwii #instagam #onlinegam,,2,0,0,english,False,never say die              ,,1
Tech_Prophecy,20180101,the xbook one x xbox one x laptop #technolog #tech #technew #new #trend #latest #today #recent #microsoft #xbook #xbookon #xbookonex #laptop #xbox #xboxon #xboxonex #laptop #electron #electron #game #gamer #gamingnew #game #game,,1,1,0,english,False,the xbook one x xbox one x laptop                        ,,-1
Jek The Snek,20180101,i #darksouls3 #darksoul #xboxon #xbox #ps4,,0,0,0,english,False,i     ,,-1
AmazingDeadP00L,20180101,119 kill on gold damn #gearsofwar4 #kingofthehil #ravendown #xbox #xboxon,,3,0,0,english,False,119 kill on gold damn     ,,-1
Golden Gamer Graham ,20180101,come back rejoin #xbox communiti play cuphead record wine @pmaka1991 #destiny2 contest win #xboxonex chat men @dapper_tux @geordietommy_ @xboxkaneda @carmelo9313 bleed green great,,6,1,1,english,False,come back rejoin  communiti play cuphead record wine   contest win  chat men     bleed green great,,1
David Tinker,20180101,happi new year #game #callofdutyww2 #xbox #xboxonex #callofduti #newyear #newyear2018 #2018,,0,0,0,english,False,happi new year        ,,1
antonio,20171231,look group clan rainbow six sieg on xbox one someth competit activ matur #rainbowsixsieg #rainbowsixsiwgeclan #clan #clan #xboxon #xbox #competit,,3,0,1,english,False,look group clan rainbow six sieg on xbox one someth competit activ matur       ,,1
@XboxDIY,20171231,if still groov music got 6 hour download stuff microsoft shut server i knew garbag sinc day 1 #readyset #go #groovemus #xbox #xboxon #xboxon #xboxonex,,0,0,0,english,False,if still groov music got 6 hour download stuff microsoft shut server i knew garbag sinc day 1       ,,-1
  Digital Syrup  ,20171231,ring new year like #gamer #xboxon #xbox #playstat #ps4pro @xboxcanada @sony_canada,,4,0,0,english,False,ring new year like       ,,1
24/7 DEAL DONKEY retroGaming Nintendo Switch PS5,20171231,9 buck #lego #xbox #microsoft #deal #game #xbox #microsoft #deal #game #xboxon,,0,0,0,english,False,9 buck          ,,-1
oYIKEZo,20171231,my new year resolut to eat taco and play game #newyear #tacolov #gamerfuel #resolutions2018 #mixer #xbox #xboxon,,1,0,0,english,True,my new year resolut to eat taco and play game       ,,0
Big Wheat,20171231,i go find diamond #minecraft #mc #minecraftmem #xbox #xboxon,,0,0,0,english,False,i go find diamond     ,,-1
