username,datatime,tweet_text,retweeted_text,likes,retweets,comments,language,is a question,tweet wout hashtag,retweet wout hashtag,sentiment analysis
 Markare ,20180201,releas game due might help 2 month row gwg fail almost feb 2nd where new game #xboxon #xbox #missingsometh,,0,0,0,english,False,releas game due might help 2 month row gwg fail almost feb 2nd where new game   ,,-1
Spirits 94,20180201,cod wwii montag decent play feel free subscrib like see #codww2 #callofdutywwii #activis #gamer #game #xboxon #xbox,,3,1,0,english,False,cod wwii montag decent play feel free subscrib like see       ,,1
Xbox One X,20180201,i thought #madden18 infinit warfar gameplay the trip 70 @xbox @eamaddennfl #xboxonex #xbox #funnymo #nfl,,16,4,0,english,False,i thought  infinit warfar gameplay the trip 70      ,,1
KvSH,20180201,just made first @nba2k crew sinc switch xbox would againt crew #ps4share #xboxonex #xboxgamepass #xbox,,0,0,0,english,False,just made first  crew sinc switch xbox would againt crew    ,,-1
NPJ Productions,20180201,but mexico pay #meme #fortnit #fortnitemem #fortnitebattleroyal #fortnitebattleroyalemem #dankmem #battleroyal #pubg #clashroyal #gamestagram #gamer #game #gameon #game #pcmasterrac #xbox1 #xbox #xboxon #ps4 #playstat #pcgamer,,1,1,0,english,True,but mexico pay                     ,,0
|PuppetPlays|,20180201,if done yet favor play trust one these coupl favorit game #incred #bioshock #bioshock2 #bioshockinfinit #xboxon #xboxon #xboxonex #xbox #mixer #mixerstream #trustmeonthison #game,,1,1,1,english,False,if done yet favor play trust one these coupl favorit game            ,,1
David Burgess,20180201,do judg game i download look download speed #instagam #play #playtim #gaminglif #gamestagram #onlin #xbox #play #gamer #playdat #videogam #xboxon #game #xboxliv #videogameaddict #playstat #onlinegam #igaddict #xbox #videogam,,2,0,0,english,False,do judg game i download look download speed                    ,,-1
Garrett Savage,20180201,#gamer i need holla i alway #xbox guy i need know #xboxon #ps4,,0,0,1,english,False, i need holla i alway  guy i need know  ,,-1
𝕩𝕏𝔻𝕖𝕖ℕ𝕚𝕖𝕕𝕏𝕩 ,20180201,dear @xbox @xboxsupport how taken side we girl gamer report still there pleas stop keep predat untouch #makexboxsaf #protectgirlgam #xbox #xboxon #helpthevictimnottheproblem,,7,8,5,english,True,dear   how taken side we girl gamer report still there pleas stop keep predat untouch     ,,0
DanHayden1991,20180201,there appar known issu fix howev like sinc 8am gmt 12hrs later still hurri @xboxuk everyon wait #xbox 360 #gameswithgold #xboxon game,,2,0,0,english,False,there appar known issu fix howev like sinc 8am gmt 12hrs later still hurri  everyon wait  360   game,,1
NPJ Productions,20180201,nah sorri bro #meme #fortnit #fortnitemem #fortnitebattleroyal #fortnitebattleroyalemem #dankmem #battleroyal #pubg #clashroyal #gamestagram #gamer #game #gameon #game #pcmasterrac #xbox1 #xbox #xboxon #ps4 #playstat #pcgamer,,2,0,0,english,False,nah sorri bro                     ,,-1
Raffaele Angius,20180201,i wait @koeitecmoeurop @xboxitalia #aot2 #attackontitan2 #xbox #xboxon #xboxonex #xboxit,,0,0,0,english,False,i wait        ,,-1
Grimmers,20180201,xbox one x look much nicer #xboxonex #xbox,,1,1,2,english,False,xbox one x look much nicer  ,,1
Gaing_forever #XboxSeriesX 25tflops RDNA2 8K/120,20180201,there need bash #xboxonex #xbox matter buy one tri regret trust forget exclus bullshit plenti game play excus,,3,0,0,english,False,there need bash   matter buy one tri regret trust forget exclus bullshit plenti game play excus,,-1
Gaing_forever #XboxSeriesX 25tflops RDNA2 8K/120,20180201,i hope also #teamxbox @jbeaumont look implement dynam theme like ps4 cool get free theme game #xboxonex #xbox,,0,0,0,english,False,i hope also   look implement dynam theme like ps4 cool get free theme game  ,,1
viper1829,20180201,@weareplayground @turn10studiosar are wait @e3 announc next @xbox @forzamotorsport horizon game citi countri take place still hope japan thank #forzahorizon4 #forza #xbox #xboxon,,0,0,0,english,True,  are wait  announc next   horizon game citi countri take place still hope japan thank    ,,0
NPJ Productions,20180201,sick revolv doublekil #fortnit #gameplay #shortclip #fortnitebattleroyal #fortnitebattleroyalemem #dankmem #battleroyal #pubg #clashroyal #gamestagram #gamer #game #gameon #game #pcmasterrac #xbox1 #xbox #xboxon #ps4 #playstat #pcgamer,,0,0,0,english,False,sick revolv doublekil                     ,,-1
Desire Esports,20180201,head #xb1 #cod #destiny2 #rainbow6 #r6sproleagu #cwl #esport #competit #mlg #umg #gb #callofduti #clutch #rekt #bo2 #blackops2 #logic #xbox #xboxon #xbox360 #playstat #ps4 #mixtenergi #energi #desireesport,,1,1,0,english,False,head                         ,,-1
Ankit mohanty,20180201,let turn night green @xboxind @xboxqwik recommend good 4k game #xbox #xboxon #4k,,0,0,0,english,True,let turn night green   recommend good 4k game   ,,0
Leigh.David,20180201,if play pubg hit like button #pubg #xboxon #xbox #game #game #vintag,,0,1,0,english,False,if play pubg hit like button      ,,1
 Extreme Consoles ,20180201,vote favorit pirat theme xbox control make #pirat #pirategam #seaofthiev #skullnbonesgam #xbox #xboxon #xboxonex #gamer #game #customcontrol #customcontrol #controllermod #gamersunit #airbrush #creativ #rt,,67,28,30,english,False,vote favorit pirat theme xbox control make                ,,1
NPJ Productions,20180201,how squadmat see map #meme #fortnit #fortnitemem #fortnitebattleroyal #fortnitebattleroyalemem #dankmem #battleroyal #pubg #clashroyal #gamestagram #gamer #game #gameon #game #pcmasterrac #xbox1 #xbox #xboxon #ps4 #playstat #pcgamer,,1,0,0,english,False,how squadmat see map                     ,,-1
Karl Watson,20180201,had first play #recor today #xboxon brilliant right street #game #gamersunit #xbox #xbone #mixer #microsoft,,5,0,1,english,False,had first play  today  brilliant right street      ,,1
VΞRDICT4489,20180201,one franchis get stay three go forev #xbox #xboxon #xboxon #xboxonex,,25,31,48,english,False,one franchis get stay three go forev    ,,-1
MrJoshYO,20180201,new tank build time grind scrap #crossout #crossoutgam #crossoutbuild #tank #tank #xbox #xb1 #xboxon,,4,0,0,english,False,new tank build time grind scrap        ,,-1
Pest e-Seed,20180201,@harada_tekken @xboxp3 are final go get #xboxonex patch #tekken7 #xboxon #xbox,,0,0,0,english,False,  are final go get  patch   ,,-1
Jordan Evans,20180201,it offici today 21st #birthday twenti one year grow game come day i know i today i know one thing sure part day involv game #xbox #xboxon #xboxambassador @xbox #21stbirthday,,1,0,3,english,False,it offici today 21st  twenti one year grow game come day i know i today i know one thing sure part day involv game     ,,1
Ichiban Mime | 超サイヤ人ロぜ | 261018081119,20180201,xbox gold febrero @xboxarg #xbox #xboxon #xboxgold #goldfebrero,,2,0,0,english,False,xbox gold febrero     ,,-1
JUGERNAUGHTY,20180201,dream start #battlefield1 #cod #codww2 #bf1 #fps #callofduti #ww2 #battlefield #xbox #xboxon #mlg #wwii #instagam #onlinegam #game #videogam #playstat #playstation4 #starwar,,4,0,0,english,False,dream start                   ,,1
Xbox One X,20180201,my thought exact @xbox @callofduti @infinityward #xboxonex #cod2 #fps #ww2 #bc #backwardscompat #xbox #xb1 #veday,,5,3,0,english,False,my thought exact            ,,-1
Tagify.io,20180201,relat instagram tag #fortnit #game #ps4 #xbox #xboxon #pubg #playstat #cod #battlefield #gamer #callofduti #csgo #gta #gtav,,0,0,0,english,False,relat instagram tag              ,,-1
NPJ Productions,20180201,bush bush action #fortnit #gameplay #shortclip #fortnitebattleroyal #fortnitebattleroyalemem #dankmem #battleroyal #pubg #clashroyal #gamestagram #gamer #game #gameon #game #pcmasterrac #xbox1 #xbox #xboxon #ps4 #playstat #pcgamer,,3,0,0,english,False,bush bush action                     ,,-1
Xbox One X,20180201,danc gameplay mike 57000 @xbox @pubattleground #xboxonex #pubg #fps #sniper #xbox #vss,,5,2,0,english,False,danc gameplay mike 57000        ,,-1
Tagify.io,20180201,relat instagram tag #fortnit #game #meme #xbox #ps4 #fortnitebattleroyal #pubg #meme #xboxon #fortnitemem #gamer #game,,0,0,0,english,False,relat instagram tag            ,,-1
GiantMedal34756,20180201,when see day get imposs game xbox one #xbox #theimpossiblegam #xboxliv #xboxon #xboxonexenhanc,,1,0,1,english,True,when see day get imposs game xbox one     ,,0
Jonathan Carlyle,20180201,when guy go make ncaa game backward compat @easport #ncaafootball14 #xbox #xboxon,,0,0,0,english,True,when guy go make ncaa game backward compat    ,,0
DrWattZ214,20180201,ac headshot #assassinscreedorigin #ac #assassinscre #headshot #xboxonexenhanc #xboxonex #xboxon #xbox,,0,0,0,english,False,ac headshot        ,,-1
Fan Favourites,20180201,#halo anyon some great limit edit consol classic #xbox #xbox360 game go shelv today #tradeusyourgamesandmovi #fanfavourit #yyj #victoriabc,,0,0,0,english,False, anyon some great limit edit consol classic   game go shelv today    ,,1
The LBG | #BLM,20180201,final jan talli #gamerscor gain 1245 360 complet game 44 #achievementunlock 1025 almost halfway 2 g s @pmaka1991 guid @stallion83 @trueachiev @xboxach more cheevo 2 b pop #xbox #xboxon #achievementhunt #beastmod #xbl,,58,5,11,english,False,final jan talli  gain 1245 360 complet game 44  1025 almost halfway 2 g s  guid    more cheevo 2 b pop     ,,1
Richard Le Tourneau,20180131,#pubgxboxon #winnerwinnerchickendinn i got first win i ecstat heart race like crazi have upload last 5 minut snake grass gameplay #game #gamer #xboxon #xbox,,0,0,1,english,False,  i got first win i ecstat heart race like crazi have upload last 5 minut snake grass gameplay    ,,1
Martin's Games | kickflip at 30,20180131,realli love #monsterhunterworld #ps4 #monsterhunt #monster #hunter #game #game #gamersunit #gamerguy #gamergirl #playstation4 #playstat #xbox #xboxon,,16,4,1,english,False,realli love              ,,1
Emil Straher,20180131,forz flashback #13 #forzahorizon2 #fh2 #xbox #xboxon,,28,4,3,italian,False,forz flashback     ,,-1
|虎| TigerNemesis |✯|,20180131,pleas vote alreadi much appreci #vote #poll #gamer #game #game #videogam #playstat #xbox #soni #microsoft #nintendo #switch #xboxon #xboxonex #ps3 #ps4 #ps4pro,tigernemesi tigernemesi @thetigernemesisjan 27 2018look serious brutal honest opinion use next video what person thought process hate consol pc gamer game show poll,2,1,0,english,False,pleas vote alreadi much appreci                 ,tigernemesi tigernemesi  27 2018look serious brutal honest opinion use next video what person thought process hate consol pc gamer game show poll,1
LarZen ➐ ,20180131,is someth wrong #forzahorizon3 #xboxonex the imag dark even adjust describ set #xbox,,0,0,0,english,False,is someth wrong   the imag dark even adjust describ set ,,-1
Say It Loud....,20180131,@majornelson @xboxsupport @xboxp3 so i came across privat group @xbox communiti realli look i one report argu one freedom speech topic disturb #xboxonex #xboxon #xbox,,0,0,0,english,False,   so i came across privat group  communiti realli look i one report argu one freedom speech topic disturb   ,,-1
7rf,20180131,wait #seaofthiev #xboxgamepass #game #xbox #xboxon,,1,0,0,english,False,wait     ,,-1
Dan Laing,20180131,#100kchalleng day 31 month review friday link bio gamerscor total gs target total jan spend total year spend 23 61 #gamer #videogam #xboxon #game #xbox,,0,0,0,english,False, day 31 month review friday link bio gamerscor total gs target total jan spend total year spend 23 61     ,,-1
Josh•Hiam,20180131,my best yet close #xbox #xboxon #pubg,,1,0,0,english,False,my best yet close   ,,1
PZProLeague,20180131,zone man man defens #wbba #nba2k #2k18 #2kcommun #xbox #xbox1 #wbbaleagu #nba2k18,,1,0,0,english,True,zone man man defens        ,,0
Justin Riggins,20180131,yes plz #monsterhunterworld #mh #videogam #xbox #xboxon #game #monsterhunt #rpg #hunter #capcom #monster #monsterhunt,,2,2,1,english,False,yes plz            ,,1
Skill Games Zone,20180131,play call duti money onlin take part game real peopl prove win #cod #callofduti #blackops3 #xbox #ps4 #game #game #xboxon #videogam,,2,1,0,english,False,play call duti money onlin take part game real peopl prove win         ,,1
Luis Soto,20180131,can brother drink juic @cdnthe3rd @fortnitegam #epicgam #fortnit #gamer #mcmuffin236 #xbox #xboxon,,0,1,0,english,False,can brother drink juic        ,,-1
It's Leo!,20180131,if one franchis vanish game go forward old game gone would pick #xboxonex #xbox #ps4 #playstat #nintendo #nintendoswitch #game #game #pcgame,,21,9,30,english,True,if one franchis vanish game go forward old game gone would pick         ,,0
DarkToolBelT,20180131,request @madmac1177 @pubattleground gameplay #xboxon #xboxuk #xbox #gamepreview,,2,1,0,english,False,request   gameplay    ,,-1
Benhimself,20180131,the origin #xbox aloud rip cd hard drive play without disc instal ani chanc #xboxonex @xboxsupport,,0,0,1,english,False,the origin  aloud rip cd hard drive play without disc instal ani chanc  ,,1
CosmicPilsung,20180131,repost @sounza_offici some post xmas deal destini 2 pc 17 @bestbuy xbox one halo war 2 10 @woot realli want see d2 look 4k i ever build pc #gamern #game #videogam #pc #pcgame #xbox #xboxon #gamer #halowars2 #halowar,,0,0,1,english,False,repost  some post xmas deal destini 2 pc 17  xbox one halo war 2 10  realli want see d2 look 4k i ever build pc          ,,-1
Raffaele Angius,20180131,grazi per 30k bp grati thank 30k free battl point @aarongreenberg @xboxqwik @xboxp3 @gamespaladinsit @xboxitalia @xbox @pubattleground @playerunknown #winnerwinnerchickendinn #pubg #pubgxbox #pubgxboxon #xbox #xboxonex #xboxit,,14,8,2,english,False,grazi per 30k bp grati thank 30k free battl point               ,,1
Ains,20180131,here breakdown big #xboxgamepass announc microsoft last week @treb_sg i discuss mean publish develop rest industri #xboxon #xbox #seaofthiev,,1,1,0,english,False,here breakdown big  announc microsoft last week  i discuss mean publish develop rest industri   ,,-1
Xbox One Reddit,20180131,watch dog 2 still 900p 30fps #xbox one x #xboxon,,0,0,0,english,False,watch dog 2 still 900p 30fps  one x ,,-1
FTWchester,20180131,send gamertag let hunt gtag ftwchester #xbox #xboxon,,0,0,0,english,False,send gamertag let hunt gtag ftwchester  ,,-1
Team eBetFinder,20180131,i got right skill make sandwich #leet #1337 #leetoclock #cod #codskil #callofduti #gamingaddict #codmem #callofdutymem #lol #gamingmem #funnymem #funnymem #blackop #nochil #funnyaf #xbox #xbox360 #xboxliv #playstat,,1,0,0,english,False,i got right skill make sandwich                    ,,-1
Wallace,20180131,@xbox @xboxqwik @xboxp3 @majornelson #zxspectrum #amiga #pc #playstat #xbox #nintendoswitch highlight a 30 year love affair game stop time soon welcom famili #xboxonex,,1,0,1,english,False,          highlight a 30 year love affair game stop time soon welcom famili ,,1
Andrew,20180131,the new #monsterhunterworld pretti legit far #xboxon #xbox,,0,0,0,english,False,the new  pretti legit far  ,,1
UGN Online,20180131,hand excit find februari offer #xboxgamepass #gamepass #xbox #xboxliv #xboxon #game #gamer #ugn #xboxonex,,1,0,0,english,False,hand excit find februari offer         ,,1
UGN Online,20180131,fortnit player fear as compens recent time player receiv freebi thank patienc thendown time #fortnit #xbox #xboxliv #xboxon #game #gamer #ugn #xboxonex,,1,0,0,english,False,fortnit player fear as compens recent time player receiv freebi thank patienc thendown time        ,,1
UGN Online,20180131,along push back releas date anthem ea also confirm new battlefield titl come octob 2018 #battlefield #ea #eagam #xbox #xboxliv #xboxon #game #gamer #ugn #xboxonex,,1,0,0,english,False,along push back releas date anthem ea also confirm new battlefield titl come octob 2018          ,,-1
UGN Online,20180131,ea offici confirm anthem releas 2019 hope extra year allow ea make game incred hope #ea #eagam #anthem #anthemgam #xbox #xboxliv #xboxon #game #gamer #ugn #xboxonex,,1,0,0,english,False,ea offici confirm anthem releas 2019 hope extra year allow ea make game incred hope           ,,1
Richard Le Tourneau,20180131,complet firewatch last night even though short game much fun sceneri beauti the stori pull much i stop play 2am i want know end so worth #xbox #xboxon #game,,0,0,0,english,False,complet firewatch last night even though short game much fun sceneri beauti the stori pull much i stop play 2am i want know end so worth   ,,1
JUGERNAUGHTY,20180131,clean hous #battlefield1 #cod #codww2 #bf1 #fps #callofduti #ww2 #battlefield #xbox #xboxon #mlg #wwii #instagam #onlinegam #game #videogam #playstat #playstation4 #starwar,,5,2,0,english,False,clean hous                   ,,-1
davyd,20180131,the new #battlefield1 map gorgeous premium alway worth @battlefield @xbox #xboxliv skyeatsplan #battlefield #xbox #xboxon,,5,2,1,english,False,the new  map gorgeous premium alway worth    skyeatsplan   ,,1
Tagify.io,20180131,relat instagram tag #fortnit #game #ps4 #pubg #xbox #gamer #xboxon #playstat #callofduti #cod #playstation4 #battlefield,,0,0,0,english,False,relat instagram tag            ,,-1
Tagify.io,20180131,relat instagram tag #fortnit #game #ps4 #xbox #pubg #gamer #xboxon #playstat #callofduti #playstation4 #cod #gta5 #csgo,,0,0,0,english,False,relat instagram tag             ,,-1
 Brea J Carpenter ,20180131,alright latest creation game @paladinsgam #gamer #game #xbox #xboxon #art #paladin ying vivian,,0,0,0,english,False,alright latest creation game        ying vivian,,1
Steve Cancel,20180131,i play #oxenfre #xbox #xboxon realli cool game it older titl got free game gold love dialogu system veri immers def recommend play,,0,0,0,english,False,i play    realli cool game it older titl got free game gold love dialogu system veri immers def recommend play,,1
Amitav Bhattacharjee,20180131,the most import game platform 2018 via @statistachart #game #pc #xbox #xboxon #nintendoswitch #nintendo #ps4 #ps4pro #vrheadset #smartphon #tablet #arhearset #mac #appl #tech #technolog #ar #vr #mr #rt #mobil #mobilegam,,6,5,0,english,False,the most import game platform 2018 via                       ,,1
 Brea J Carpenter ,20180131,my #gta5 creation continu #art #game #gamer #xbox #xboxon @xbox @rockstargam,,0,1,0,english,False,my  creation continu       ,,1
Joeriety ,20180131,the crossbow op #game #xboxon #xbox pubg own own crossbow,,1,0,0,english,True,the crossbow op    pubg own own crossbow,,0
ShaNe☆Georgeson,20180131,which open world game think best #ps4share #ps4 #ps4game #gamer #xbox #xboxon #onlinegam #repost #rtz #rt,,3,0,0,english,True,which open world game think best          ,,0
CRoss,20180131,@fortnitegam join invit peopl xbox anyon els issu #fortnit #xbox #xboxon,,2,0,0,english,False, join invit peopl xbox anyon els issu   ,,1
Jaclyn Borland,20180131,if i could i would ps4 xbox one but i ps4 i happi mayb one day i get xbox one i system #gamer #playstation4 #playstationfour #playstat #xbox #xboxon,,2,0,0,english,False,if i could i would ps4 xbox one but i ps4 i happi mayb one day i get xbox one i system      ,,1
Ruben De La Cruz,20180131,tri git gud @fortnitegam battl royal ani suggest tip pointer ani would help #fortnit #fortnitebattleroyal #xbox #xboxonex,,0,0,0,english,True,tri git gud  battl royal ani suggest tip pointer ani would help    ,,0
WalkingThroughGames,20180131,@markdeer name still credit #fableanniversari #wtg #wtgpodcast #walkingthroughgam #walkingthroughgamespodcast #fabl #xbox #xboxon @xboxaustralia @xbox @lionheadstudio,,1,0,0,english,False, name still credit           ,,1
 Brea J Carpenter ,20180131,my #gtaonlin #gta5 creation #shelfi #game #gamer #cute #xboxon #xbox @rockstargam @xbox,,0,0,0,english,False,my   creation        ,,1
Kid Blogger,20180130,xbox smartglass #connect #xboxon 360 go veri use tri look profil look like #xbox #consol,,3,0,0,english,False,xbox smartglass   360 go veri use tri look profil look like  ,,1
Xbox Achievement Hunter,20180130,yes final 80 000 gamerscor forza horizon #xbox #xbox360,,3,0,0,english,False,yes final 80 000 gamerscor forza horizon  ,,1
The Repair Shack,20180130,could microsoft realli consid purchas ea #weveseenwors #anybrandanyproblem #microsoft #ea #buyout #game #xbox #xboxon,,1,1,0,english,True,could microsoft realli consid purchas ea        ,,0
Luciano ,20180130,credit @alixkew lucki nade #halo #halo5 #game #xbox #xboxon,,0,0,0,english,False,credit  lucki nade     ,,1
Goldstar Tech,20180130,februari right around corner perhap cupid arrow order gift sweeti week guarante deliveri 14th #goldstartech #savemoneylovelif #valentinesday #valentinesday2018 #xbox #xboxon #nintendo #appl #katespad #nomad #dell #asus,,1,0,0,english,False,februari right around corner perhap cupid arrow order gift sweeti week guarante deliveri 14th            ,,1
ShaLa Game Studio,20180130,build custom robot build your own robot byor featur multipl battl arena environ #game #gamer #game #gamerson #xboxon #gamerscor #gamersofinstagram #gamerlif #gaminglif #gamerguy #gamerselfi #xbox #gamerstyl #gamersguid #gamersknow,,1,0,0,english,False,build custom robot build your own robot byor featur multipl battl arena environ               ,,-1
StonedSnawley,20180130,hell yea went 0 7 last minut that fill stomach dank chicken #pubg #pubgxbox #xbox #xboxon #xboxonex #xboxon #pubgxboxon #xboxliv #game #gaminglif #gamingclip,,2,0,0,english,False,hell yea went 0 7 last minut that fill stomach dank chicken           ,,-1
AstroNaeNae,20180130,lmao i even #fornit #jimmybutl #xbox #videogam #lmao #xboxon #gamingforlif #lol,,8,1,1,english,True,lmao i even        ,,0
Aleksander Jeziorny,20180130,gonna buy xbox copi #xbox #xboxon #consolegam,,0,0,0,english,False,gonna buy xbox copi   ,,-1
Tagify.io,20180130,relat instagram tag #fortnit #fortnitebattleroyal #game #ps4 #xboxon #gamer #pubg #xbox #fortnitemem #fortnitebr #callofduti,,0,0,0,english,False,relat instagram tag           ,,-1
Atomiic Gary,20180130,#grenad best #bluehol #xboxon #microsoft #chickendinn #battleroyal #game #xbox #pc #ps4 #gamer #clutch #pubg #pubgxbox #levelup #squadrun #squad #doublekil,,0,0,0,english,False, best                 ,,1
Atomiic Gary,20180130,i love #glock #bluehol #xboxon #microsoft #chickendinn #battleroyal #game #xbox #pc #ps4 #gamer #clutch #pubg #pubgxbox #levelup #squadrun #squad #doublekil,,0,0,0,english,False,i love                  ,,1
Atomiic Gary,20180130,quick doubl #bluehol #xboxon #microsoft #chickendinn #battleroyal #game #xbox #pc #ps4 #gamer #clutch #pubg #pubgxbox #levelup #squadrun #squad #doublekil,,0,0,0,english,False,quick doubl                 ,,-1
Atomiic Gary,20180130,my boy got us #win #bluehol #xboxon #microsoft #chickendinn #battleroyal #game #xbox #pc #ps4 #gamer #clutch #pubg #pubgxbox #levelup #squadrun #squad,,0,0,0,english,False,my boy got us                 ,,-1
Atomiic Gary,20180130,#aveng #bluehol #xboxon #microsoft #chickendinn #battleroyal #game #xbox #pc #ps4 #gamer #clutch #pubg #pubgxbox #levelup #squadrun #squad #doublekil,,1,0,0,english,False,                 ,,-1
Xbox One X,20180130,experi quantum break way meant @xbox @quantumbreak #xboxonex #xbox #bethwild @thecourtneyhop,,11,2,3,english,False,experi quantum break way meant      ,,-1
Apps4Store,20180130,microsoft team announc plan major expans #xboxgamepass servic get unlimit access 100 #xboxon 360 #xbox game #xbox #game #consol #microsoftstor #goodday,,0,1,0,english,False,microsoft team announc plan major expans  servic get unlimit access 100  360  game     ,,-1
Tagify.io,20180130,relat instagram tag #fortnit #game #ps4 #playstat #xboxon #zocken #zocker #deutsch #xbox #gamer #pubg #callofduti #cod #gta5,,0,0,0,english,False,relat instagram tag              ,,-1
Jared Harrington,20180130,will recor 2 happen 1st one blast @majornelson @xboxp3 @microsoft @xbox #xboxon #xboxonex #xbox #microsoft,,0,0,0,english,True,will recor 2 happen 1st one blast        ,,0
Tagify.io,20180130,relat instagram tag #fortnit #game #xbox #gamer #ps4 #playstat #callofduti #cod #xboxon #pubg #fortnitebattleroyal #meme,,0,0,0,english,False,relat instagram tag            ,,-1
Tagify.io,20180130,relat instagram tag #fortnit #cod #gamer #callofduti #game #xbox #ps4 #playstat #gta #gta5 #pubg #csgo #bo3 #xboxon,,0,0,0,english,False,relat instagram tag              ,,-1
Jesse Beck,20180130,just enjoy morn grog beach @seaofthiev @majornelson #xbox #4k #hdr #xboxonex,,2,1,0,english,False,just enjoy morn grog beach      ,,1
Jessica Silverburgh,20180130,#skyrim bed i think #gamer #gamergirl #gamermommi #xbox #xbox360,,1,0,0,english,False, bed i think     ,,-1
Tagify.io,20180130,relat instagram tag #fortnit #ps4 #xbox #xboxon #game #fortnitebattleroyal #pc #pubg #gamer #victori #meme #battleroyal,,0,0,0,english,False,relat instagram tag            ,,-1
Ernesto Manuel Colon jr,20180130,the futur xbox exclus game wow top qauilti sure like sea theiv gear war #xbox #xboxon #xboxonex,,0,0,0,english,True,the futur xbox exclus game wow top qauilti sure like sea theiv gear war   ,,0
Young Kelz,20180130,steal pic @najeebaldwin #2kdraft #2kdraftm @walkonwarrior @ronnie2k @beluba i could sg center youngxgeez #xbox #xboxon @2ktvwow #2ktvwow @nba2kleagu @nba2k,,4,1,0,english,False,steal pic       i could sg center youngxgeez      ,,-1
Young Kelz,20180130,#2kdraft #2kdraftm i mind sixman year type player even thou i love start #xboxon #xbox youngxgeez,,2,0,0,english,False,  i mind sixman year type player even thou i love start   youngxgeez,,1
