username,datatime,tweet_text,retweeted_text,likes,retweets,comments,language,is a question,tweet wout hashtag,retweet wout hashtag,sentiment analysis
Play Station V Paradise,20201128,a whole new vibe they understand look done #playstation5 #playstation5skin #playstation5gam #playstation5control #playstat #playstation5new #play #playstation5rev #ps5pro #ps #ps5reveal #ps5game,,0,0,0,english,False,a whole new vibe they understand look done            ,,-1
Photomode of Tsushima,20201128,my girlfriend first foray photomod game #horizonzerodawn dev @guerrilla #photomod #gametographi #vgpunit #virtualphotographi #game #playstat #ps4 #thecapturedcollect #gamergram #thephotomod #shareoftheweek #vpcontext #hzd #horizonforbiddenwest,,38,3,2,english,False,my girlfriend first foray photomod game  dev               ,,-1
Photomode of Tsushima,20201128,one day i beat curs lol game #ghostoftsushima dev @suckerpunchprod #photomod #gametographi #vgpunit #virtualphotographi #game #playstat #ps4 #thecapturedcollect #gamergram #thephotomod #shareoftheweek #goti #vpcontext #ngplus #frailti #curs,,16,3,0,english,False,one day i beat curs lol game  dev                 ,,-1
Brittany Stanley,20201128,i went walmart pick @playstation5 i abl get one wednesday night my @walmart app state prepar order i still went got they store @playstat #walmart #playstat #playstation5 #secondwalmartscor,,3,0,5,english,False,i went walmart pick  i abl get one wednesday night my  app state prepar order i still went got they store     ,,-1
Play Station V Paradise,20201128,ask shall given unto ye playstat drip #playstation5 #playstation5skin #playstation5gam #playstation5control #playstat #playstation5new #play #playstation5rev #ps5pro #ps #ps5reveal #ps5game,,1,0,0,english,False,ask shall given unto ye playstat drip            ,,-1
Play Station V Paradise,20201128,massiv #playstation5 #playstation5skin #playstation5gam #playstation5control #playstat #playstation5new #play #playstation5rev #ps5pro #ps #ps5reveal #ps5game #ps5giveaway #ps5control arab road kubwa,,1,1,0,english,False,massiv               arab road kubwa,,-1
Mr Pinnington,20201128,i dead noth wrong thrifti dear #playstation5 #playstat #playstation5restock #psn @playstat @soni,,0,1,0,english,False,i dead noth wrong thrifti dear      ,,-1
𓄂 ʟᴀ ꜱᴘʜɪɴx 𓆃,20201128,mistress pond #virtualphotographi #photomod #thephotomod #playstat #ps4 #assassinscre #assassinscreedvalhalla #eivor #ubisoft #thecapturedcollect #vgpunit #societyofvirtualphotograph #artistofsocieti #vpgamer,,21,3,0,english,False,mistress pond              ,,-1
Angelina,20201128,dress christma miracl want we tri my attir work but girl dream right #playstation5 #fuckbot #playstat #jeffreestarapprov #jeffreestar,,1,1,0,english,True,dress christma miracl want we tri my attir work but girl dream right     ,,0
Pedro Carvalho,20201128,doesn anyon abl play ps4 demo ps5 #playstation5 #playstat #ps5,,0,1,0,english,True,doesn anyon abl play ps4 demo ps5   ,,0
Name,20201128,ladi gentlemen got em #playstation5 #ps5 #soni #playstation5 #ps5secur #playstat,,2,1,1,english,False,ladi gentlemen got em      ,,-1
Mo Sung,20201128,cut power help hope last mani glitch awesom game port seem faulti @askplayst @playstationd @playstat #spidermanps5 #ps5 #playstat #playstation5,,1,1,0,english,False,cut power help hope last mani glitch awesom game port seem faulti       ,,-1
Goffings,20201128,what happen back consol launch till well #ps5 gpu issu seam littl peopl issu #xbox #playstat issu disc drive make bang nois so say lot happen past week,,1,1,0,english,True,what happen back consol launch till well  gpu issu seam littl peopl issu   issu disc drive make bang nois so say lot happen past week,,0
Mmmkaylaah Only Fans Top 6%,20201128,bro do need ps5 need pus 5y #ps5 #xbox #playstat #cybermonday,,11,6,2,english,False,bro do need ps5 need pus 5y    ,,-1
Meppsic,20201128,ps4 user would like use dualsens control featur ps4 retweet #playstation5 #playstat #ps4,,0,1,0,english,True,ps4 user would like use dualsens control featur ps4 retweet   ,,0
Play Station V Paradise,20201128,all place the new life do feel #ps5pro #ps5reveal #ps5game #ps5giveaway #ps5giveaway #playstation5 #playstation5skin #playstation5control #playstation5rev #playstat #playstation5new arab road kubwa,,1,1,0,english,False,all place the new life do feel            arab road kubwa,,-1
L.I.V is a Relater ! ,20201128,when lost dark i hope enjoy favourit photo i creat sinc replay game #thelastofuspartii @naughty_dog @neil_druckmann @troybakerva @thevulcansalut @playstat #thelastofus #thelastofusphotomod #photomod #ps4 #playstat #tlou #tlou2,,0,0,0,english,False,when lost dark i hope enjoy favourit photo i creat sinc replay game             ,,1
G.I. Deon,20201128,final beat beast high recommend demon soul #ps5 #playstation5 #ps5launch #ps5game #playstat #demonssoul #demonssoulsps5 #fromsoftwar #gamersunit,,3,0,2,english,False,final beat beast high recommend demon soul         ,,1
That Weird Guy That Likes Ducks,20201128,was 10 best buy i final upgrad ps3 copi #ghostbust #ghostbustersthevideogam #ghostbustersthevideogameremast #videogam #game #playstat #playstation4 #ps4,,0,0,0,english,False,was 10 best buy i final upgrad ps3 copi        ,,1
Ryton Retro,20201128,rather stress get ps5 parent buy kid retro consol take way back start nes master system take year throw gameboy mix realli good #nintendo #sega #playstat,,10,2,2,english,True,rather stress get ps5 parent buy kid retro consol take way back start nes master system take year throw gameboy mix realli good   ,,0
Nobleshadow99,20201128,just think #lastofus2 can shock boom pow right ass need keep play #gamer #game #ps5 #playstat @naughty_dog,,1,0,0,english,False,just think  can shock boom pow right ass need keep play     ,,-1
MollyThePlug,20201128,#ps5 #psnrestock #playstat #nextgen #ps5resel #quicksal #targetps5 #game #ps5forsal #ps5preorder #ps5launch #gamer #game #playstationdirect #playstation5 #spiderman #milesmoral contact,,1,0,0,english,False,                 contact,,-1
Shack,20201128,and go first #ps5 platinum i love game fair play finish twice move #spiderman #milesmoral #spidermanmilesmoral #playstation5 #playstat #game #gamer @insomniacgam @playstat,,1,0,0,english,False,and go first  platinum i love game fair play finish twice move         ,,1
Observatório de Games,20201128,crossov #xbox #soni #joystick #microsoft #pilha #meme #xboxon #ps5 #playstat #playstation4 #ps4,,0,1,0,english,True,crossov           ,,0
AstraVex,20201128,be abl start #ps5 game #playstat app phone boot consol rest mode go straight game load menus etc insan brilliant eight second get rocket leagu what happen,,1,0,0,english,False,be abl start  game  app phone boot consol rest mode go straight game load menus etc insan brilliant eight second get rocket leagu what happen,,1
Stinky_Pole,20201128,slowli get hang light tool photomod game mile moral develop @insomniacgam @playstationau @playstat #spidermanmilemoral #spidermanps5 #milesmoral #playstat #playstationau #ps5 #photomod #insominacgam #gamergram,,4,1,0,english,False,slowli get hang light tool photomod game mile moral develop            ,,-1
Flying Eze,20201128,the dark crystal age resist tactic launch februari 4 2020 #ps4 #en #mass #entertain #playstat #game #ps4 #the #dark #crystal #age #of #resist #tactic,,0,1,0,english,False,the dark crystal age resist tactic launch februari 4 2020              ,,-1
Grigor Khachatryan,20201128,#ps5 craze video show black friday crowd shopper tumbl ground run #gamestop snag #playstat 5,,0,1,0,english,False, craze video show black friday crowd shopper tumbl ground run  snag  5,,-1
 Tara Barker ,20201128,amaz @emmalarkst @letmerideaway #ps5 #playstat #playstation5,,0,0,0,catalan,False,amaz     ,,1
Rhys Hobson,20201128,anyon know fix #ps4 #game #playstat #help,,0,0,0,english,True,anyon know fix    ,,0
Gamesharkz ,20201128,this return @ab clean #madden21 #madden #maddenmobil #eamadden #maddenclip #mut #touchdown #videogam #xbox #playstat #xboxseriesx #ps5 #playstation5,,3,2,0,english,False,this return  clean             ,,1
Daskillva_Games,20201128,when play someon bad call out #game #callofduti #warzon #microsoft #xbox #soni #funni #playstat #ps5 #xboxseriesx,,1,0,0,english,False,when play someon bad call out          ,,-1
Grace Parkes ,20201128,ok gamer friend what recommend ps4 play i face the last us 2 blue i start unchart 4 anyth ever #playstat #thelastofus2,,5,0,7,english,True,ok gamer friend what recommend ps4 play i face the last us 2 blue i start unchart 4 anyth ever  ,,0
Michael Wolfe,20201128,good afternoon @playstat i would like ensur wife great christma purchas #playstation5 here credenti i hope suffici #playstat #gamer #ps5,,1,1,0,english,False,good afternoon  i would like ensur wife great christma purchas  here credenti i hope suffici   ,,1
Jayy,20201128,did secur anoth p5 hit secur black friday #ps5 #playstat #ps5stock #bestbuy #gamestop,,6,1,4,english,False,did secur anoth p5 hit secur black friday     ,,1
TwoHosAndAConsole,20201128,interest number see #playstat remain king #ps5,oldschoolgam 1223oldschoolgamer1223 @kirkroosternov 28 2020ps5 xbox seri x sale numbersshow thread,0,0,0,english,False,interest number see  remain king ,oldschoolgam 1223oldschoolgamer1223  28 2020ps5 xbox seri x sale numbersshow thread,1
FRECKLESEM - TWITCH,20201128,what guy find better shoot dual sens ps5 control l1 r1 l2 r2 #dualsens #ps5 #coldwar #cod #playstat #gamer #game,,1,0,0,english,True,what guy find better shoot dual sens ps5 control l1 r1 l2 r2       ,,0
Jared Tyndall,20201128,game kid #ps5 #playstation5grati #playstat #playstation5,,0,0,0,english,False,game kid    ,,-1
Trevor #SacramentoProud #BLM #RipBrodieLee,20201128,anybodi nj need demon soul ps5 seal new 60 close i drop #demonssoul #ps5 #playstat,,1,0,0,english,True,anybodi nj need demon soul ps5 seal new 60 close i drop   ,,0
Mega Dads,20201128,catch latest #playstat news podcast playstat mega bit avail #ps5,,2,2,0,english,False,catch latest  news podcast playstat mega bit avail ,,-1
PakkmanGhost,20201128,i know i care anymor #cyberpunk2077 tbh i hope good tho idk #pcgamer # #game #ps4 #playstat #gamer #gamersunit,,0,0,0,english,False,i know i care anymor  tbh i hope good tho idk       ,,1
Kevin Shirzadian,20201128,third time charm call santa bring snow these resal go home lucki littl boy extra special holiday season #ps5 #ps5stock #ps5restock #playstat #playstation5,,0,1,0,english,False,third time charm call santa bring snow these resal go home lucki littl boy extra special holiday season     ,,1
Name cannot be blank,20201128,how ps5 make nois @soni @playstationuk @playstat #ps5 #playstat #soni #playstation5,,0,2,0,english,True,how ps5 make nois       ,,0
Curt,20201128,back black #playstat #ps5 #blackfriday #soni,,0,0,0,english,False,back black    ,,-1
TheMasshole,20201128,i wait @dellcar @dell #ps5 #playstat,ps5 restock drop spiel timesp 5 restock drop spiel time @spieltimesnov 28 2020walmart win #ps5 #ps5 credit @bucknell2016 @bucknell2016,0,0,0,english,False,i wait    ,ps5 restock drop spiel timesp 5 restock drop spiel time  28 2020walmart win   credit  ,-1
The Dual Sense Podcast,20201128,finish edit brand new episod look sunday podcast servic here sneak peek us discuss ea sport head anoth legal battl time fifa player #playstat #playstation5 #ps5 #ps4 #fifa21 #dualsens #podcast #podnat,,0,1,0,english,False,finish edit brand new episod look sunday podcast servic here sneak peek us discuss ea sport head anoth legal battl time fifa player        ,,1
Evan,20201128,switch consol pc big question day #ps5 #playstat #warzon #callofduti,,0,0,0,english,False,switch consol pc big question day    ,,-1
Unclequan_thegamer,20201128,in shadow #spiderman #milesmoralesps5 #ps5 #playstation5 #playstat #game #gamingcommun #soni #virtualphotographi #photooftheday #milesmoral @playstat @insomniacgam @marvel,,2,2,0,english,False,in shadow              ,,-1
I--FIRE--I ,20201128,and do forget the #scosaturday #battlefieldv @scohellfight @scocont #event @carpo_sco @misssannytat is run #pc #playstat #ps5 start 9pm cet i wish much fun #bcitw #bffi #gc #battlefieldfriend #dicefriend,,12,7,3,english,False,and do forget the        is run    start 9pm cet i wish much fun     ,,1
I--FIRE--I ,20201128,and good night #battlefieldfamili #fireun #friend i wish great game night platform #pc #xbox #playstat #ps5 much fun #bcitw #bffi #gc #battlefieldfriend #battlefieldcommun #gamerscommun #gamerscommun #dicefriend,,4,3,1,english,False,and good night    i wish great game night platform     much fun        ,,1
Caeman Amelio,20201128,my ps5 got deliv i still believ i manag get one #ps5 #playstation5 #playstat #soni,,0,0,0,english,False,my ps5 got deliv i still believ i manag get one    ,,-1
TaylorGangGaming YT,20201128,@walmart @walmarthelp lift ban damn consol man where ban pandem 1st start ppl stockpil toilet paper clorox smh ya care ppl scalp materi item necess #dobett #playstation5 #playstat #ps5,,0,0,1,english,True,  lift ban damn consol man where ban pandem 1st start ppl stockpil toilet paper clorox smh ya care ppl scalp materi item necess    ,,0
Schoenfelder,20201128,oh @sonyuk @playstat how time run yesterday play playstat one two lot peopl play 5th generat playstat #fortheplay #ps5 #playstat,schoenfelderschoenfeld @skuemynov 28 2020wenn man sich überlegt vor einem wohl nicht ganzen jahrzehnt kamen wir mit 8 megabyt aus jetzt speichern wir mittlerweil auf terabyt unglaublich aber wahr @playstationd @playstationd,0,0,0,english,False,oh   how time run yesterday play playstat one two lot peopl play 5th generat playstat   ,schoenfelderschoenfeld  28 2020wenn man sich überlegt vor einem wohl nicht ganzen jahrzehnt kamen wir mit 8 megabyt aus jetzt speichern wir mittlerweil auf terabyt unglaublich aber wahr  ,1
iamraena,20201128,ps5 wait in stock #ps5 #playstat #gamer,,0,0,0,english,False,ps5 wait in stock   ,,-1
M | K | B,20201128,such great game superb hero thank @insomniacgam creat best univers #ps5 #milesmoralesps5 #soni #playstat #platinumtrophi,,5,0,0,english,False,such great game superb hero thank  creat best univers     ,,1
Chewedpop,20201128,omg im love adapt trigger plus new rumbl ps5 amaz #inlov #playstation5 #playstat #soni #nolimit #feelthegam,,0,0,0,english,False,omg im love adapt trigger plus new rumbl ps5 amaz      ,,1
GamerMike,20201128,mile moral end spoiler ps5 #spiderman #milesmoral #ps5 #playstation5 #playstat @playstat @insomniacgam,,0,1,0,english,False,mile moral end spoiler ps5       ,,-1
Game Sapiens,20201128,trail werewolf the apocalyps earthblood dispon 4 febrer #gamesapiens #ps4 #playstation,,1,1,0,spanish,False,trail werewolf the apocalyps earthblood dispon 4 febrer   ,,-1
𝕊𝕦𝕫𝕒𝕟𝕟𝕖 ,20201128,my son would love ps5 new babi lot nappi buy instead @tracksuzuki @cleangymbag #playstat #playstation5 #ps5,,0,0,0,english,False,my son would love ps5 new babi lot nappi buy instead     ,,1
TechPlanet,20201128,ps5 vs xbox seri x how i choos #ps5 #xboxseriesx #playstat #playstation5 #xbox #game,,2,0,0,english,True,ps5 vs xbox seri x how i choos      ,,0
Pakmanjosh,20201128,fun fact ps4 first consol i got ps4 super late game i year but plus side load great game catch #playstat,,3,0,0,english,False,fun fact ps4 first consol i got ps4 super late game i year but plus side load great game catch ,,1
Jose,20201128,i finish #thelastofuspart2 yesterday that game amaz if action adventur game i recommend seri do know still worth 30 dollar #ps5 #playstat,,1,0,0,english,False,i finish  yesterday that game amaz if action adventur game i recommend seri do know still worth 30 dollar  ,,1
THANATOSEVIL18,20201128,prowl arma potent season prowl very powerful weapon in this session #apexlegends #apexlegendsclips #apexlegendscommunity #apexchampion #apexlegendsps4 #ps4 #playstation #apexlegendsgam #apexlegendsbattleroyal #apexlegendsedit #apexps4,,3,1,0,spanish,False,prowl arma potent season prowl very powerful weapon in this session           ,,1
Essential Nerds Productions,20201128,hmm lot cool lore cyberpunk wait dive game #cyberpunk2077 #playstat #xbox #playstation5 #xboxseriesx #cdprojectr #cyberpunk,ignign @ignnov 28 2020there near 100 year histori lead event cyberpunk 2077 strap samurai wild futurist brutal stori world cyberpunk far,0,0,0,english,False,hmm lot cool lore cyberpunk wait dive game       ,ignign  28 2020there near 100 year histori lead event cyberpunk 2077 strap samurai wild futurist brutal stori world cyberpunk far,1
THANATOSEVIL18,20201128,victori tri amig club victory in threesom with friends from the club #apexlegends #apexlegendsclips #apexlegendscommunity #apexchampion #apexlegendsps4 #ps4 #playstation #apexlegendsgam #apexlegendsbattleroyal #apexlegendsedit #apexps4,,4,1,0,spanish,False,victori tri amig club victory in threesom with friends from the club           ,,1
Colby,20201128,do love playstat take 15 minut still turn i swear pull appl tri get buy ps5 bout build pc though say fuck consol @playstat #playstat,,0,0,2,english,True,do love playstat take 15 minut still turn i swear pull appl tri get buy ps5 bout build pc though say fuck consol  ,,0
TaylorGangGaming YT,20201128,lie they not sell ps5 store stop tweet alreadi walmart #ps5 #playstation5 #playstation5restock #playstat #playstation5grati,,0,0,0,english,False,lie they not sell ps5 store stop tweet alreadi walmart     ,,-1
Chris,20201128,got today ps4 control look great half price game #ps4 #nintendoswitch #playstat,,0,1,0,english,False,got today ps4 control look great half price game   ,,1
Getting  #2021,20201128,new generat 4 5 #ps5 #ps5vsps4pro @playstat @playstationuk @playstationit @playstationeu #playstation5 #playstat #playstation4 #playstation4pro,,1,0,0,english,False,new generat 4 5          ,,-1
sam wren,20201128,just got phone @playstat appar system nois coil whine normal i guess i ride #ps5 @playstationuk say consol start smoke worri #playstation5 #playstat,,2,0,3,english,False,just got phone  appar system nois coil whine normal i guess i ride   say consol start smoke worri  ,,-1
Youngdonkeyy,20201128,i sick wait ps5 how long even gonna wait till get ps5 christma europ #ps5 #playstat #playstation5,,2,0,0,english,True,i sick wait ps5 how long even gonna wait till get ps5 christma europ   ,,0
David Drysdale,20201128,i actual rememb play game mani year ago psone i surpris get remast #sagafrontierremast #ps4 #playstat #nintendo #nintendoswitch,,2,1,0,english,False,i actual rememb play game mani year ago psone i surpris get remast     ,,1
Michael Andrews,20201128,hey @xbox lost xbox i borrow one day 10 ask #xbox #soni #playstation5 #xboxseriesx #playstat #microsoft,,0,2,0,english,False,hey  lost xbox i borrow one day 10 ask      ,,-1
TheRealRetroStoreONT,20201128,the origin #og #xbox360 #soni #playstat #ps3 #gta5 #storesign #toronto #retaillif #goat #smwto #christmas2020 #christmaswelov #torontolockdown open today 6pm #videogam #gamesystem #zelda #zeldafan #mariobro #pokemon #uber #loveafterlockup,,1,1,0,english,False,the origin               open today 6pm        ,,1
Melissa Heghinian,20201128,if anyon kohl cash earn buy playstat return plan use pleas send i use #kohlscash #ps5 #ps5kohl #kohlscashreturn #playstation5 #kohl #kohlsplaystation5 #playstat,,1,1,0,english,False,if anyon kohl cash earn buy playstat return plan use pleas send i use        ,,1
Michael Lambourne,20201128,if sent last us ps4 anonym thank much inde i heard amaz now i need ps4 play anyon #playstat #gener,,5,0,0,english,True,if sent last us ps4 anonym thank much inde i heard amaz now i need ps4 play anyon  ,,0
Omar of Tsushima ,20201128,spiderman remast ps5 gorgeous @insomniacgam #vgpwednesday #gamersunit #spidermanmilesmoral #virtualphotographi #photomod #vgpunit #gametographi #vgpnetwork #thephotomod #playstat #psblog #vpdivers #ps4 #ps5,omar tsushima omar tsushima @otahir96nov 28 2020 #ps5share #ps5share #marvelsspidermanremast #marvelsspidermanremast,10,1,0,english,False,spiderman remast ps5 gorgeous               ,omar tsushima omar tsushima  28 2020    ,1
Michael Andrews,20201128,hey @playstat sinc xbox would give new xbox i wonder u would give ps5 day one ask #xbox #soni #playstation5 #xboxseriesx #playstat #microsoft,,1,2,1,english,False,hey  sinc xbox would give new xbox i wonder u would give ps5 day one ask      ,,-1
MutCoinsExpress,20201128,mutcoin sale bulk deal avail consol xbox playstat #mut #madden21 #maddenfamili #mutcoin #m21 #madden #ps5 #xbox #playstat,,2,1,0,english,False,mutcoin sale bulk deal avail consol xbox playstat         ,,-1
bedlamp,20201128,what good websit ps4 digit top wallet fund #ps4 #playstat place stock,,0,0,0,english,False,what good websit ps4 digit top wallet fund   place stock,,1
Nathan Stevenson,20201128,when game night final fall asleep exhaust photo taken girlfriend @trixystarz #catsoftwitt #cat #ps4 #playstat #game #cutecat #cute #kitten,,3,1,0,english,False,when game night final fall asleep exhaust photo taken girlfriend         ,,-1
Sydney Simone,20201128,i know pandem probabl lot scarciti ps5 lowkey good market strategi the next time #playstat restock sale roof,,3,0,3,english,False,i know pandem probabl lot scarciti ps5 lowkey good market strategi the next time  restock sale roof,,1
Python Coffee,20201128,qualc screen demon s souls remak #ps5 #gaming #videogames #videogioc #playstation,,2,1,0,italian,False,qualc screen demon s souls remak     ,,-1
Gaming Rəborn,20201128,pick playstat 5 #ps5 #playstation5 #playstation5grati #playstat #newerabegin #final,,2,1,1,english,False,pick playstat 5      ,,-1
Ricky Spanish,20201128,heavi heavi heavi #aerosmith #meme #game #gamer #xbox #playstat #playstation5 #ps4 #ps5 #destiny2 #destini #hunter #destinyart #bungi,,1,1,0,english,False,heavi heavi heavi              ,,-1
Angelic Pickle,20201128,xbox seri x owner moan game look wors ps5 microsoft blame bug #xboxseri #sun #playstat,,0,0,0,english,False,xbox seri x owner moan game look wors ps5 microsoft blame bug   ,,-1
(NOT) QuinntonTV,20201128,veri much look forward #scarletnexus excit find #xbox #xboxseriesx #playstat #playstation5 #jrpg #action,,2,0,0,english,False,veri much look forward  excit find      ,,1
Rudee569,20201128,@soni @playstat complet sold everyth #scalper welcom #xbox #playstat #xboxseriesx #playstation5 #game #smh,,0,0,0,english,False,  complet sold everyth  welcom      ,,-1
Oates,20201128,new vita work like dream cloud save ps4 vita ps5 simpl seamless thank @cybertrongam #ps5 #ps4 #psvita #playstat #playstationplus,,0,0,0,english,False,new vita work like dream cloud save ps4 vita ps5 simpl seamless thank      ,,1
Chris Lemmon,20201128,and two #ps5 platinum alreadi #astrosplayroom perfect homag #playstat histori charm platform plus realli show #dualsens a must play anyon ps5 welldon team asobi @asobinico @playstat,,1,1,0,english,False,and two  platinum alreadi  perfect homag  histori charm platform plus realli show  a must play anyon ps5 welldon team asobi  ,,1
geovanny Arroyave,20201128,final play last us part 2 ps5 wow game look gorgeous #thelastofuspart2 #ps5 #playstation5 #playstat,,2,0,0,english,False,final play last us part 2 ps5 wow game look gorgeous    ,,1
Micaah Salazar,20201128,peopl do not buy ps5 scalper don give busi use bot buy ps5 pchsrge price pandem it right don give #ps5 #playstat #soni,,3,1,0,english,False,peopl do not buy ps5 scalper don give busi use bot buy ps5 pchsrge price pandem it right don give   ,,-1
PS5 Only ,20201128,#art berlin germani ratchet clank rift apart play has no limit ps5 mural #ps5 #deutschland #playstat #berlin,,89,23,3,english,False, berlin germani ratchet clank rift apart play has no limit ps5 mural    ,,1
PlugMolly,20201128,they go quick contact #ps5 #psnrestock #playstat #nextgen #ps5resel #quicksal #targetps5 #game #ps5forsal #ps5preorder #ps5launch #gamer #game #playstationdirect hmu first get first,,1,0,0,english,False,they go quick contact               hmu first get first,,-1
Daniel,20201128,and cours i got demon soul deck #playstation5 #playstat #demonssoul,,2,1,0,english,False,and cours i got demon soul deck   ,,-1
Tomáš Richter,20201128,@playstat @askplayst @playstationeu i want ask hell after 9 day play i move ps5 i clean tabl dirt ps5 i cant clean after unpack consol beauti white #playstation5 #ps5 #playstat,,1,0,0,english,True,   i want ask hell after 9 day play i move ps5 i clean tabl dirt ps5 i cant clean after unpack consol beauti white   ,,0
Unclequan_thegamer,20201128,the pessimist see difficulti in everi opportun the optimist see opportun in everi difficulti winston churchil #goodmorn #saturdayvib #assassinscre #assassinscreedvalhalla #ps5 #playstation5 #playstat #game #gamingcommun @playstat @ubisoft,,3,2,1,english,False,the pessimist see difficulti in everi opportun the optimist see opportun in everi difficulti winston churchil           ,,1
CMwalsh,20201128,#playstation5 extra #dualsens #dualsens dock #ps5 media remot #pspluscollect #ps4 bc #milesmoralesps5 #astrosplayroom #sackboy #thepathless #bugsnax #assassinscreedvalhalla rest of 2020 game sort #playstat #playhasnolimit,,2,1,0,english,False, extra   dock  media remot   bc       rest of 2020 game sort  ,,-1
PS5 Web - Deals / Giveaways / Stock Updates / News,20201128,are buy ps5 game accessori even though ps5 yet #playstation5 #ps5 #playstat #ps5deal #ps5restock #ps5launch #ps5stock #ps5updat #ps5amazon #blackfriday2020 #blackfridayd #blackfriday #ps4 #playstation4 #dualsens #cybermonday,,0,1,0,english,True,are buy ps5 game accessori even though ps5 yet                ,,0
