username,datatime,tweet_text,retweeted_text,likes,retweets,comments,language,is a question,tweet wout hashtag,retweet wout hashtag,sentiment analysis
PSMag,20201120,plan des test à venir sur psmag demon soul assassin creed valhalla sackboy a big adventur devil may cri 5 special edit warhamm chaosban call duti black op cold war marvel mile moral #playstat #ps5,,0,0,0,english,False,plan des test à venir sur psmag demon soul assassin creed valhalla sackboy a big adventur devil may cri 5 special edit warhamm chaosban call duti black op cold war marvel mile moral  ,,-1
Leon Lappies,20201120,first ps5 plat astro playroom amaz thank soni #ps5 #soni #playstat,,0,0,0,english,False,first ps5 plat astro playroom amaz thank soni   ,,1
Tom,20201120,best feel world open babi #playstation5 #ps5launch #playstat,,1,0,0,english,False,best feel world open babi   ,,1
MollyThePlug,20201120,you know mean #ps5 #psnrestock #playstat #nextgen #ps5resel #quicksal #targetps5 #game #ps5forsal #ps5preorder #ps5launch #gamer #game #playstationdirect contact first come first serv,,2,0,2,english,False,you know mean               contact first come first serv,,-1
hoarderscarboot,20201120,ps plus via playstat store #ps4 #psplus #ps5 #playstat i post earlier today amazon jb discount ps plus digit card well playstat store done simpli login,,0,0,0,english,False,ps plus via playstat store     i post earlier today amazon jb discount ps plus digit card well playstat store done simpli login,,1
James Whatley,20201120,hey new playstat owner shopto 12mths psplus normal 50 note direct soni go go go #ps5 #playstat #psplus,,3,0,1,english,False,hey new playstat owner shopto 12mths psplus normal 50 note direct soni go go go   ,,-1
★·. ṠṮṳḀṙṮ ẇḭḶṠṏṆ .·★,20201120,we soni fan boy girl honest everi generat #playstat go back first one i purchas back 1995 still work #playstation5 #ps5,,1,1,0,english,False,we soni fan boy girl honest everi generat  go back first one i purchas back 1995 still work  ,,1
Gareth,20201120,i would love thank chanc #playstat #playstation5 #ps5 @cleangymbag @suzzledmind,,0,1,0,english,False,i would love thank chanc     ,,1
"Homzie, Adam Whomes",20201120,compertit time first person buy ps5 win #ps5 #competit #win #playstation5 #playstat @playstat,,0,1,1,english,False,compertit time first person buy ps5 win      ,,1
Abbernaffy Customs,20201120,i get use quick ps5 load game i press start pick cup tea littl sip boom game alreadi load #ps5 #playstat #soni,,13,0,1,english,False,i get use quick ps5 load game i press start pick cup tea littl sip boom game alreadi load   ,,-1
Henry_.09,20201120,got ps5 ee well least i think i receiv email order number start xko order gone latest deliveri @ee #ps5 #playstation5 #playstat #soni #ps5uk #uk #ps,,1,1,2,english,False,got ps5 ee well least i think i receiv email order number start xko order gone latest deliveri        ,,1
Kain,20201120,despit mani attempt i unfortun manag get anoth ps5 for first time #playstat releas i get would worth consid sell playstat ps store and prefer ps plus member resel,,0,0,0,english,False,despit mani attempt i unfortun manag get anoth ps5 for first time  releas i get would worth consid sell playstat ps store and prefer ps plus member resel,,1
Lunny1686 ,20201120,#fifa21 35 ps store #playstation5 #ps5 #playstat,,0,1,1,english,False, 35 ps store   ,,-1
Nouveau Media UK,20201120,in honor @playstat 5 launch @soni temporarili transform oxford circus tube sign are dig #playstation5 #playstat #soni #oxfordcircus #tube #london #tfl #londonnew #digitalnew #london #secretlondon #londonlif #london,,2,1,1,english,True,in honor  5 launch  temporarili transform oxford circus tube sign are dig             ,,0
𝓗𝓲𝓸𝓾𝓰𝓲,20201120,playstat studio #playstat #playstation5 #ps5 @playstat @naughty_dog @suckerpunchprod @insomniacgam @sonysantamonica @guerrilla #thelastofuspartii #ghostoftsushima #marvelsspiderman #godofwar #horizon,,1,1,0,english,False,playstat studio              ,,-1
Gari Clark | ,20201120,astro playroom one greatest launch titl ever it fun charm addict full #playstat nostalgia fantast #astrosplayroom #ps5,,6,1,1,english,False,astro playroom one greatest launch titl ever it fun charm addict full  nostalgia fantast  ,,1
ʙʟᴀᴄᴋ ᴍᴀɢᴇ ᴠɪʟʟᴀɢᴇ ,20201120,happi birthday yuffi #finalfantasi #finalfantasyvii #finalfantasy7 #finalfantasyviiremak #squareenix #yuffi #yuffiekisaragi #retrogam #retrogam #retrogam #playstat #playstation4 #blackmagevillag,,1,0,0,english,False,happi birthday yuffi             ,,1
Utkarsh Bansal,20201120,@yosp @hermenhulst @playstationin @playstat @sidshuman @playstation_m #ps5 #playstation5 #ps5india #ps5forindia #playstat do someth,utkarsh bansalutkarsh bansal @utkarshbansal12nov 20 2020 @yosp @yosp @hermenhulst @hermenhulst @sidshuman @sidshuman #ps5india #ps5india #ps5forindia #ps5forindia #ps5 #ps5 @playstationin @playstationin @askplayst @askplayst @sony_india @sony_india @soni @soni @playstat @playstat @playstation_m @playstation_m we everyth now want help pleas help us get ps5 india,1,1,0,english,False,           do someth,utkarsh bansalutkarsh bansal  20 2020                         we everyth now want help pleas help us get ps5 india,-1
uniteagamer,20201120,me 2 #ps5s well close get bizarr ps one brought around 25 year ago curri @curryspcworld servic better year ago today #playstat #ps5,,1,0,0,english,False,me 2  well close get bizarr ps one brought around 25 year ago curri  servic better year ago today  ,,1
Atom Republic,20201120,30 cloth black friday weekend #atomuniverse_offici #blackfriday #playstat #ps4 #steam #gamer #virtualworld #game #freereward #freetoplay #socialgam #unrealengin #gamerguy #gamergirl #avatar #fashionavatar #gamedev #instagam #atomunivers,,10,2,0,english,False,30 cloth black friday weekend                   ,,-1
🆃🅷🅴 🆂🆁🅶🅴,20201120,it pre order ps5 behind door @playstat #ps5 #playstat #ps5restock,,0,0,0,english,False,it pre order ps5 behind door    ,,-1
Buhaira,20201120,let go @playstat @naughty_dog #thegameaward #thegameawards2020 #playstat #playstation5,,1,0,0,english,False,let go      ,,-1
Michael,20201120,what first ps5 game for demon soul #playstation5 #ps5 #playstat #demonssoul #demonssoulsremak #spyrothedragon #cableguy,,2,0,1,english,True,what first ps5 game for demon soul       ,,0
Michael,20201120,playstat 5 #ps5 #playstation5 #playstat #crashbandicoot #spyrothedragon #cableguy,,1,1,0,english,False,playstat 5      ,,-1
Panagiotis Mantis ,20201120,new generat begin #ps5 #playstat #playstationlab #dualsens #playhasnolimit @playstationgr @pslabgr,,0,0,0,english,False,new generat begin       ,,-1
admix,20201120,what game play new ps5 weekend we play new mile moral #ps5 #playstat #spiderman #milesmoral,,1,0,0,english,True,what game play new ps5 weekend we play new mile moral    ,,0
XERO121,20201120,playstat 5 sale got consol offici trash not play legit start turn return box look charg crazi amount open reason offer come spider man suicid squad #playstat #ps5 #ps5restock #ps5uk #ps5forsal,,2,0,5,english,False,playstat 5 sale got consol offici trash not play legit start turn return box look charg crazi amount open reason offer come spider man suicid squad     ,,-1
Flying Eze,20201120,strand deep land ps4 tomorrow #ps4 #beam #team #playstat #game #ps4 #strand #deep,,0,0,0,english,False,strand deep land ps4 tomorrow        ,,-1
Chloe,20201120,#acvalhalla #assassinscre #eivor #assassinscreedvalhalla #virtualphotographi #gamergram #ps4 #playstat #photomod,,8,3,0,english,False,        ,,-1
Gutsy Gundark,20201120,i mean honest it would rude right @playstationuk @playstat #playstation5 #ps5uk #playhasnolimit #playstat #playstationuk,,0,0,0,english,True,i mean honest it would rude right       ,,0
Leslie Chu,20201120,ps4 complet full consol cycl sinc day one hero upgrad #playstat #ps5 #nextgen,,1,1,0,english,False,ps4 complet full consol cycl sinc day one hero upgrad   ,,1
Pit2D,20201120,see peopl compar ps4 load time ps5 go omg ps4 sooo slow friend never own commodor 64 child toler shit #ps5uk #playstation5 #ps4 #gaminglif #playstat #playhasnolimit,,2,0,0,english,False,see peopl compar ps4 load time ps5 go omg ps4 sooo slow friend never own commodor 64 child toler shit      ,,-1
Kevin Rowe,20201120,#playstat folk i realli want ghost tsushima ps5 i get ps4 version like ps5 version point pleas #ps5,,0,0,0,english,False, folk i realli want ghost tsushima ps5 i get ps4 version like ps5 version point pleas ,,1
NU-London Design,20201120,have seen @playstat transform oxford circus tube station sure market perfect which hard come well done @playstat #playstat #playstation5 #market,,3,1,0,english,True,have seen  transform oxford circus tube station sure market perfect which hard come well done    ,,0
Mr. Shenanigans,20201120,24 hour multipl use rest mode #ps5 brick yet not sound come apart humong size unit i dont even notic #gamer #playstation5 #playhasnolimit #playstat #playstationuk #playstationlaunch #ps5launch #ps5preorderuk,,0,0,1,english,False,24 hour multipl use rest mode  brick yet not sound come apart humong size unit i dont even notic        ,,-1
fkenjimmy,20201120,here look babi #babi #babiesofinstagram #love #walmart #ps5 #xbox #microsoft #playstat,,0,1,0,english,False,here look babi        ,,-1
Michael,20201120,time set big lad #ps5 #ps5launch #dualsens #playstation5 #playhasnolimit #playstat #crashbandicoot,,2,0,0,english,False,time set big lad       ,,-1
AverageDadTech,20201120,after extrem long day wait #ps5 never came final van rout #playstation4 #playstation5 #playstat #ps5launch #soni #gamer #blogger #photooftheday #virtualphotographi @soni @playstationuk @playstat,,1,1,0,english,False,after extrem long day wait  never came final van rout            ,,-1
Wiredguytv,20201120,nice like mine #playstation5 #playhasnolimit #playstat #game,,0,0,0,english,False,nice like mine    ,,1
Benjamin Locke+ Cats!,20201120,up lark like kid christma #ps5 #playstation5 #playhasnolimit #playstat #gamer #gaminglif,,2,0,0,english,False,up lark like kid christma      ,,1
Kevin Cyrenne,20201120,@playstat playstat like play has no limit consol quantiti limit yes #playstation5 #ps5canada #playhasnolimit #playstat,,0,0,0,english,False, playstat like play has no limit consol quantiti limit yes    ,,1
Alejandro,20201120,probabl buy #ps5 anytim soon interest control stock may buy one within next month #game #gamer #game #game #videogam #videogam #gamingcommun #gaminglif #gamer #playstation5 #playstat,,2,2,0,english,False,probabl buy  anytim soon interest control stock may buy one within next month           ,,1
Newbish Gamer,20201120,if could choos would choos black white #ps5 #playstation5 #playstat,,0,1,1,english,True,if could choos would choos black white   ,,0
Dendisch1987,20201120,amaz control f cking awesom #playstation5 #playstat @playstationd @playstationeu @playstat,,0,1,0,english,False,amaz control f cking awesom     ,,1
Wiredguytv,20201120,just love idea can buy one #playstation5 #playhasnolimit #playstat,,0,1,0,english,True,just love idea can buy one   ,,0
SV VALITUTTO,20201120,@playstationd play has no limit soni limit stock ps5 #playstation5 #ps5 #playstat,,4,1,0,english,False, play has no limit soni limit stock ps5   ,,1
Wiredguytv,20201120,ps5 telli #playstation5 #playhasnolimit #playstat love brick,,0,1,0,english,False,ps5 telli    love brick,,1
muniymobile,20201120,ok gotten hand new ps5 #playstation5 #playstat #muniy #muniymobil #muniymobil #neobank #intern #internationalgam,,0,1,0,english,True,ok gotten hand new ps5        ,,0
Its Canon Podcast,20201120,if lucki enough get #ps5 play #milesmoral #callofduti listen it canon podcast #spotifi #playstat #videogam #geek #nerd #fridayvib #fridaymood #podcast #podcastersofinstagram #podcasthq #podcastlif #podernfamili,,2,2,0,english,False,if lucki enough get  play   listen it canon podcast            ,,1
HEARTBREAKONAFULLMOON888,20201120,laugh deal pain #ps5 #playstat #fuckyou #damnbot,,0,1,0,english,False,laugh deal pain    ,,-1
ZaMaZiNGo,20201120,i get rest mode ps5 i shut tv ps5 shut i search solut internet could find i want emerg help @playstationeu @soni @playstat @playstationtr #playstat #gamer,,0,1,1,english,False,i get rest mode ps5 i shut tv ps5 shut i search solut internet could find i want emerg help      ,,1
Thepaper,20201120,the nostalgia realli hit #playstat #astrosplayroom #ps5,,0,0,0,english,False,the nostalgia realli hit   ,,-1
I--FIRE--I ,20201120,and do forget today #fridaynightbattlefield #fnb #battlefieldv #ps4 #ps5 host @oleole56 meet @battlefield #playstat #commun part awesom #battlefieldfamili #bcitw #bffi #gc #battlefieldfriend #battlefieldcommun #dicefriend,,4,1,1,english,False,and do forget today      host  meet    part awesom       ,,1
I--FIRE--I ,20201120,good morn #battlefieldfamili #fireun #friend i wish great friday without stress work good game platform #pc #xbox #playstat #ps5 much fun #bcitw #bffi #gc #battlefieldfriend #battlefieldcommun #dicefriend,,29,5,2,english,False,good morn    i wish great friday without stress work good game platform     much fun      ,,1
Gaming w/ GM1980,20201120,ok year sinc i play cod pvp it feel bit refresh play i got rock end def went decent fight #ps5 #cod #coldwar #coldwarclip #callofduti #callofdutycoldwar #playstat #playstation5 #nextgengam,,11,1,1,english,False,ok year sinc i play cod pvp it feel bit refresh play i got rock end def went decent fight         ,,-1
Luke Robinson,20201120,whatev tug ps5 usb control charg cabl it caus ps5 jump forward stand horizont posit make sens see direct hook #playstation5 #playstat @eurogam @ign,,0,0,0,english,False,whatev tug ps5 usb control charg cabl it caus ps5 jump forward stand horizont posit make sens see direct hook    ,,-1
Alex Waldruff,20201120,like tweet #ps5 unplay due error ce @playstat @askplayst @soni #playstation5 #playstat,,19,0,3,english,False,like tweet  unplay due error ce     ,,-1
Flying Eze,20201120,planetsid 2 escal launch week ps4 #ps4 #planetsid # 2 #playstat #game #rogu #planet #game,,0,1,0,english,False,planetsid 2 escal launch week ps4    2     ,,-1
PS5 - Mania,20201120,2020 sort jour releas of the day psn #pokerclub #fullsetps5 #jeuxvideo #videogamecollect #collect #playstation5 #sony #playstat #gamecollect #gamecollecting #videogam #gamer #ps5collect,,0,0,0,french,False,2020 sort jour releas of the day psn             ,,-1
Josh Roberts,20201120,happi @playstat 5 day folk part 2 second time lucki edit #ps5launch #playstation5 #playhasnolimit #playstat,,1,0,0,english,False,happi  5 day folk part 2 second time lucki edit    ,,1
Flying Eze,20201120,rocket leagu goe free play summer #ps4 #playstat #game #psyonix #rocket #leagu,,0,0,1,english,False,rocket leagu goe free play summer      ,,1
AkoSiKitteh,20201120,man much chao right ps5 philippin if thought us bad man philippin wors thank good i hurri pick one time soon #ps5launch #ps5 #playstat,,0,1,0,english,False,man much chao right ps5 philippin if thought us bad man philippin wors thank good i hurri pick one time soon   ,,-1
JohnWhoAreYou,20201120,ghost tsushima 33 ps plus 12 month 25 ps store also purchas playstat plus card 12 month black friday period 3 month #playstat #playstation4 #blackfriday2020,,1,1,0,english,False,ghost tsushima 33 ps plus 12 month 25 ps store also purchas playstat plus card 12 month black friday period 3 month   ,,-1
Alpha Racing Team,20201120,time new cupboard new room i think wife get upset i look ps5 bare fit damn boi thicc #ps5 #playhasnolimit #playstat #ps1 #ps2 #ps3 #ps4,,7,0,0,english,False,time new cupboard new room i think wife get upset i look ps5 bare fit damn boi thicc       ,,-1
osmosis,20201120,#ps5restock #playstat #ps5 sell ps5s must buy 5 dollar membership first i massiv stock truli enorm just buy 5 dollar membership first scratch scratch,,0,0,1,english,False,   sell ps5s must buy 5 dollar membership first i massiv stock truli enorm just buy 5 dollar membership first scratch scratch,,1
PS5 Underground,20201120,what would pay scalper disc ps5 #playstat #playhasnolimit,,0,0,0,english,True,what would pay scalper disc ps5  ,,0
Timzster - Member of S.T.A.R.S ,20201120,5 year old still quit happi #ps4 machin good luck earli adopt shop #ps5 holiday season i wait til game i play system #playstat #playstation5 #ps5ph #batmanarkhamknight #timzster,,0,0,0,english,False,5 year old still quit happi  machin good luck earli adopt shop  holiday season i wait til game i play system     ,,1
Flying Eze,20201120,tee time tip golf with your friend put ps4 today #ps4 #blacklight #interact #golf #with #your #friend #playstat #game #ps4,,0,0,0,english,False,tee time tip golf with your friend put ps4 today          ,,1
gamersar.io,20201120,roll away celebr anniversari today 20 make 22 year sinc game origin launch #playstat #playstationnetwork ps3 #playstationnetwork psp,,0,0,0,english,False,roll away celebr anniversari today 20 make 22 year sinc game origin launch   ps3  psp,,1
coffey-senpai,20201120,where #soni #playstat #playhasnolimit #ps5 #videogam #wherearetheyatsoni,,0,0,0,english,True,where      ,,0
Erric,20201120,yall got ps5 #soni #ps5 #playstat,,0,0,0,english,False,yall got ps5   ,,-1
TheLauraGaming,20201120,i disappoint ps5 launch i get one pleas gift one #ps5launch #playstat,,1,0,0,english,False,i disappoint ps5 launch i get one pleas gift one  ,,1
tattooninjatv,20201120,us face difficulti restock #ps5 #soni #yesimsalti #ineedit #jknoidont #gamestop #playstat,ignign @ignnov 20 2020ps5 sale uk face difficulti one retail cancel,0,0,0,english,False,us face difficulti restock       ,ignign  20 2020ps5 sale uk face difficulti one retail cancel,-1
its_tito,20201120,tri hijack boat end like #game #gamer #cod #callofduti #callofdutyblackopscoldwar #xbox #game #ps4 #game #gaminglif #gamingcommun #playstat #pcgame #goodgam #gg #goodluck,,2,1,0,english,False,tri hijack boat end like                ,,1
Shinrai,20201120,#explor #gamer #ps4 #playstat #playstation4 #playstation5 #ps5 #xbox #xboxon #xboxon #cod #codbocw #blackop #codbo #pathtoaffili #streamer #modernwarfar #codmodernwarfar #callofduti #codmw ignor let hit harder everyday,,3,2,0,english,False,                    ignor let hit harder everyday,,-1
Retro Gamer Guy,20201120,rememb world thought design would next generat consol soni the left look like playdia right like wondermega #ps2 #ps5 #soni #playstat #playdia #wondermega #sega,,4,0,1,english,True,rememb world thought design would next generat consol soni the left look like playdia right like wondermega       ,,0
snakesayan,20201120,ani comrad want add playstat network psn id snakesayan #playstation5 #ps5 #playstat,,0,1,0,english,True,ani comrad want add playstat network psn id snakesayan   ,,0
#ArtsakhStrong,20201120,doe anyon know ps5 get restock 1am eastern bestbuy @bestbuy @soni #ps5 #playstat,,1,1,3,english,False,doe anyon know ps5 get restock 1am eastern bestbuy    ,,-1
Fredrick Saliu,20201120,for test experi which better #ps5 #playstat #playstationdirect #ps #ps5launch #playstationtrophi #xboxseriesx #xbox #xboxseriess #playstation5,,1,1,0,english,True,for test experi which better          ,,0
Cassie,20201120,ani loyal faith sugarbabi keep compani text hangout c4cassiekurt@gmail.com get spoil 500 week allow #ps5 #xbox #sugardaddyserio #sugarmummi #feetpic #playstat #sugardaddyneed #fashinova #collegegirl,,1,1,0,english,False,ani loyal faith sugarbabi keep compani text hangout c4cassiekurt.com get spoil 500 week allow         ,,1
Flying Eze,20201120,share week green #ps4 #playstat #game #ps4 #share #of #the #week,,0,0,0,english,False,share week green        ,,1
royal,20201120,everi time instal new game ps5 fan get loud 5 second is normal otherwis great product love #playstat,,0,0,0,english,True,everi time instal new game ps5 fan get loud 5 second is normal otherwis great product love ,,0
MarzXian,20201120,ps5s still might drop bjs tonight #ps5 #soni #playstat #xbox,,3,2,4,english,False,ps5s still might drop bjs tonight    ,,-1
KingGamingUnleashed,20201120,#assassinscreedvalhallagameplay #assassinscreedvalhalla #roleplay #vike #lol #pcgame #xbox #playstat #ps5 #rpg #videogam #gamer #videogameparl #newgam,,0,1,0,english,False,             ,,-1
Alex Nielson,20201120,damn i want soooo bad #playstat #ps5 #epic,,0,0,0,english,False,damn i want soooo bad   ,,-1
GOSNOW,20201120,woop woop let go ps5 wolrd launch final welcom gamer @playstat @playstationeu @playstationfr #ps5 #playstation5 #playstat,,0,0,0,english,False,woop woop let go ps5 wolrd launch final welcom gamer      ,,1
MadameEve,20201120,@playstat dude even put ring i want move come ps5 #ps5 #playstation5 #playstat,,0,0,0,english,False, dude even put ring i want move come ps5   ,,1
MadameEve,20201120,@playstat whi reject i love new look take next step come home pleas i make happi #ps5 #playstation5 #playstat,,0,0,0,english,False, whi reject i love new look take next step come home pleas i make happi   ,,1
pure gamer,20201120,look forward get new xbox playstat #xboxseriesx #xbox #playstation5 #playstat,,0,0,0,english,False,look forward get new xbox playstat    ,,-1
Carlos Carvajal M.,20201120,noch de capcom vs snk 2 mark millennium 2001 para #ps2 capcom fight evolut para #ps2 super street fighter ii turbo hd remix para #ps3 #playstat #capcom #snk #retrogam,,1,0,0,english,False,noch de capcom vs snk 2 mark millennium 2001 para  capcom fight evolut para  super street fighter ii turbo hd remix para     ,,1
Luis,20201120,over @premeprofit stay cook ws 5th ps5 all manual 3 resold 2 help friend famili #playstation5 #playstat #playhasnolimit,,0,0,0,english,False,over  stay cook ws 5th ps5 all manual 3 resold 2 help friend famili   ,,1
Randy Taylor,20201120,i freak put hashtag poll #recolor #reskin #ps5 #playstat #soni #playstation5 #poll #lavend #mermaidgreen,,0,0,0,english,False,i freak put hashtag poll         ,,-1
Solo-nite,20201120,i proud say i nakatomi plaza i mean #ps5 #gamersunit #playstat,,2,0,1,english,False,i proud say i nakatomi plaza i mean   ,,1
Skot Keller,20201120,hope fantasi i never get i want one bad #ps5 #playstat,,0,0,0,english,False,hope fantasi i never get i want one bad  ,,-1
Kinjoshinobi,20201120,combin elgato captur card ive got work cut #lob #playstation5 #playstat #playhasnolimit,,1,0,0,english,False,combin elgato captur card ive got work cut    ,,-1
Ed Gaymer,20201120,ps5 night mode iphon #ps5 #playstation5 #playstat #shotoniphon #nightmod,,5,1,0,english,False,ps5 night mode iphon     ,,-1
Spider-Man,20201120,first time ever go premium game glad mile moral amaz game much fun play thank @insomniacgam anoth amaz game #ps5 #playstat #milesmoralesps5,,0,0,1,english,False,first time ever go premium game glad mile moral amaz game much fun play thank  anoth amaz game   ,,1
Justin,20201120,everi sneakerhead right #sneakerhead #playstat #playstation5 #ps5restock #ps5launch @soleretriev @solelink @solef @thesitesuppli @snkr_twitr,,1,0,0,english,False,everi sneakerhead right          ,,-1
Vinny.Lam,20201120,someth wrong feel eminem 2013 #r6s #r6sieg #ps4 #ps5 #playstat,,1,0,0,english,False,someth wrong feel eminem 2013     ,,-1
Gareth,20201120,add playstat 5 g4r3th p1dg3 #playstation5 #ps5uk #playhasnolimit #playstat #gaymer,,0,0,0,english,False,add playstat 5 g4r3th p1dg3     ,,-1
The_Game_Nerd,20201120,@thedeependgam @amandasgardn @gameongardn @pinkygardn ani chanc sex mini game ask reason #ps5 #playstat #ps4 #playstation4 #switch #xboxseriess #xbox #bachelor #kickstart #limitedrungam,,2,0,0,english,False,    ani chanc sex mini game ask reason          ,,1
PS5 Web - Deals / Giveaways / Stock Updates / News,20201120,go bed everi night hope get ps5 next day #playstation5 #ps5 #playstat #ps5deal #ps5restock #ps5launch #ps5launchday #ps5launchnight #ps5stock #ps5updat #ps5amazon,,3,0,0,english,False,go bed everi night hope get ps5 next day           ,,1
TheRealMisterKlein,20201120,#lifeisstrang 2 gameplay walktrough part 7 fullgam #end #game #gamer #ps4 #game #videogam #game #retrogam #playstat #gamingheadset #playstationplus #sonyplayst #playstationexperi #gamereview #youtub #realmisterklein #love #new,,1,1,0,english,False, 2 gameplay walktrough part 7 fullgam                  ,,-1
GOSNOW,20201120,let gooo @playstat and special thank @wario64 help get one anoth special thank @linuswilson keep updat stock #playstation5 #playstat,,0,1,0,english,False,let gooo  and special thank  help get one anoth special thank  keep updat stock  ,,1
Rodz,20201120,good night famili i bring grau good precis weapon i ask tri #callofduti #warzon #callofdutymodernwarfar #game #ps4 #callofduti #playstat,,5,1,0,english,False,good night famili i bring grau good precis weapon i ask tri       ,,1
John Marcel,20201120,heh playstat lose custom @xbox rn peopl tri prevent get covidlol #xbox #playstation5 #xboxseriesx #playstat #walmart #nojok,,0,1,0,english,False,heh playstat lose custom  rn peopl tri prevent get covidlol      ,,-1
M!KE,20201120,i would like one ps5 pleas @playstat @soni #ps5 #playstat #soni,,0,0,0,english,False,i would like one ps5 pleas     ,,1
Pete,20201120,i play tack dlc enjoy new mile game i love stori much #playstation5 #playstat #ps5 #milesmoralesps5 #sonyps5,,0,1,0,english,False,i play tack dlc enjoy new mile game i love stori much     ,,1
Photomode of Tsushima,20201120,day day heaven strike game #ghostoftsushima dev @suckerpunchprod #photomod #gametographi #vgpunit #virtualphotographi #game #playstat #ps4 #thecapturedcollect #gamergram #thephotomod #shareoftheweek #goti #legend #vpcontext #frailti,,34,4,0,english,False,day day heaven strike game  dev                ,,1
Pengo,20201120,it super busi novemb #gamer #streamer #ps5 #playstat #xbox #iphone12pro,,0,0,0,english,True,it super busi novemb      ,,0
