username,datatime,tweet_text,retweeted_text,likes,retweets,comments,language,is a question,tweet wout hashtag,retweet wout hashtag,sentiment analysis
OGCryptor,20171204,i announc i play #teso #eso #xbox #xboxon soon #xboxonex outpour support posit allreadi i ever experienc love communiti game @tesonlin,,0,0,1,english,False,i announc i play     soon  outpour support posit allreadi i ever experienc love communiti game ,,1
 Pinche Amo ,20171204,some game play today #xbox #xboxonex #xboxfamili #gamer #destiny2,,1,0,0,english,False,some game play today     ,,1
|Spawnacus|,20171204,the feel look new control simpl enjoy expens requir #xbox #xboxon #mixerfam,,0,0,0,english,False,the feel look new control simpl enjoy expens requir   ,,1
Daⓥid,20171204,#fifa18 #squadbattl rank week 10 #xb1 #xboxon #xbox week 1 2 full releas,,2,0,0,english,False,  rank week 10    week 1 2 full releas,,-1
OutGunGaming,20171204,announc outgungam competit @rocketleagu team xboxon 15 minut #xbox #rocketleagu #game #esport,,0,2,0,english,False,announc outgungam competit  team xboxon 15 minut    ,,1
Kitty,20171203,about fuck #cod die lot #xbox #xboxon #gamer #gamergirl #gamersunit,,5,1,0,english,False,about fuck  die lot     ,,-1
The Minnesota Geek,20171203,tag best teammat #gamecollect #gamecollector #nintendoforlif #videogam #fortnight #callofduti #xboxonex #xbox #ps4 #nintendo #gamersunit #gamer #videogam #retrogam #retro #retrodesign #retrogam,,2,2,0,english,False,tag best teammat                 ,,1
Superjebb ,20171203,i play #layersoffear let load i uninstal @xboxsupport @xbox want buy veri #poor #xbox close complet well #xboxon #xboxgamepass,,0,0,0,english,False,i play  let load i uninstal   want buy veri   close complet well  ,,1
 Betterman77  BG4GHUB,20171203,ca wait till tuesday final get hand #xboxonex scorpio sat cupboard near month #hurryuptuesday #xbox,,0,0,0,english,False,ca wait till tuesday final get hand  scorpio sat cupboard near month  ,,1
Gaming Access Weekly,20171203,show us got #nintendo #nes #gamecub #3ds #switch #wii #wiiu #soni #ps2 #ps3 #psvita #ps4 #microsoft #xbox #xbox360 #xboxon #pc #sega #genesi,,0,0,0,english,False,show us got                   ,,-1
Duke Phillips,20171203,the @xbox @ford raptor #laautoshow #xboxonex #xbox #ford #raptor #forza7,,1,0,0,english,False,the   raptor      ,,-1
Andrew,20171203,call duti ww2 #xboxon anyon #xboxon #xbox #callofdutyww2 #xboxliv,,0,0,0,english,False,call duti ww2  anyon    ,,-1
Era Error,20171203,inform pertain anoth first parti control microsoft xbox pc leak #microsoft #xbox #control #game #xboxonex #videogam,,0,0,0,english,False,inform pertain anoth first parti control microsoft xbox pc leak      ,,1
JokerWolf,20171203,yes some cool real life other jerk cred @wrestling_memes_on #wwe #wwelif #wweliv #wwemem #wweraw #wwefunni #wrestl #wwenetwork #wwenxt #meme #funni #smackdown #xboxon #xbox #wwefan #myfan #nude #girl #powerwrestl #impactwrestl,,4,1,2,english,False,yes some cool real life other jerk cred                     ,,1
Caztecx,20171203,anyon @xbox play ww2 hmu save form trash team mate #ww2 #callofduti #xbox #xboxonex #callofdutyww2 #codww2 #help #trash,,0,0,0,english,False,anyon  play ww2 hmu save form trash team mate        ,,1
GamingLyfe Network,20171203,#qotd what favorit #game #trilog make sure comment tag friend daili shoutout #bioshock #bioshock2 #bioshockinfinit #2kgame #xbox #xboxon #consol,,5,0,0,english,False, what favorit   make sure comment tag friend daili shoutout       ,,1
LarZen ➐ ,20171203,is ani chanc get #alanwak enhanc #xboxonex via backward compat program @remedygam @samlakermd @xboxqwik @xboxp3 @xbox #xbox,,0,0,0,english,False,is ani chanc get  enhanc  via backward compat program      ,,1
Michelle Gee (Misha) ,20171203,so much game news go day outsid #destiny2 dlc peopl play let know #vote #poll #gamer #pc #playstat #ps4 #xbox #xboxon,,2,2,3,english,False,so much game news go day outsid  dlc peopl play let know        ,,1
PowderKegStand,20171203,i feel like i bought new @microsoft #xboxonex less featur last #xbox need special adapt #kinnect a year later still #snapmod sick system #toomani #essentialfeaturefail unaccept #xbox soo much potenti could sooo much better,,0,0,0,english,False,i feel like i bought new   less featur last  need special adapt  a year later still  sick system   unaccept  soo much potenti could sooo much better,,-1
Bog Standard Gamers,20171203,we find fortnit good practic battleground who els enjoy play moment #soni #ps4 #ps4slim #ps4pro #microsoft #xbox #xboxon #xboxon #xboxonex #fortnit #pubg,,1,1,0,english,True,we find fortnit good practic battleground who els enjoy play moment           ,,0
Louise Valentine,20171203,birthday present hubbi @brosonovitch #xboxon #xbox #gamer #mrsvalentin #pink #white #microsoft,,1,1,0,english,False,birthday present hubbi        ,,-1
Rick,20171203,sunday night chill 360 #gamer #gamerguy #gamerlad #gamenerd #gamergirl #gamergeek #retrogam #retrogam #retro #xbox #xbox360 #fabl #gamecollector #gamenight #girlgam #gamersthatlift #nintieskid #geek #geek #nerd #gamern #oldschoolgam #nevergrowup,,0,0,0,english,False,sunday night chill 360                       ,,-1
solid_slug,20171203,anybodi els xbox one x dashboard laggi last day #xboxonex #xbox,,0,0,1,english,True,anybodi els xbox one x dashboard laggi last day  ,,0
RŌWΛN ローワン,20171203,we refurnish restaur offer pristin fork spoon knive we forgot main dish enjoy side dish #xbox #xboxon #xboxonex,,0,0,0,english,False,we refurnish restaur offer pristin fork spoon knive we forgot main dish enjoy side dish   ,,1
Belong Cardiff Saints,20171203,cardiff arena open it quit busi today rememb book ahead decid come #sundayfunday just let guy know today last day tri new xbox free #xboxonex #microsoft #xbox,,1,0,0,english,False,cardiff arena open it quit busi today rememb book ahead decid come  just let guy know today last day tri new xbox free   ,,1
B2021,20171203,poor super craig #southpark #fracturedbutwhol #xboxon #xbox,,2,0,0,english,False,poor super craig    ,,1
SIX3MAFIA,20171203,me later tonight #destiny2 #raid #calus #destini #destiny2pc #wife #kid #benoit #chrisbenoit #ps4 #xbox #xboxon #xboxonex #leavemealon #six3mafia #63m #warlock #titan #hunter #curseofosiri #season2 #dlc #osiri #wwe #canada #leviathan #leviathanraid,,4,2,1,english,False,me later tonight                           ,,-1
 Michael ,20171203,when copi email via onlin order packag show #christma present #xbox #xboxonex #4k #4kultrahd,,0,0,0,english,False,when copi email via onlin order packag show  present    ,,-1
VΞRDICT4489,20171203,what anticip game #2018 #playstat #xbox #nintendo #pc #ps4 #ps4pro #xboxon #xboxon #xboxonex #nintendoswitch,,8,3,18,english,False,what anticip game           ,,-1
GamingPolls,20171202,which better #xbox #xboxon #xboxonex #playstat #playstation4 #playstation4pro #microsoft #soni #game #gamer #gamer,,1,0,0,english,True,which better           ,,0
Tiger,20171202,i got first tub second one way definit need fuel bout get overwatch join thank @gfuelenergi i love #microsoft #xbox #xboxon #blizzard #overwatch #overwatchorgin #game #game #onlinegam #onlinemultiplay,,2,0,0,english,False,i got first tub second one way definit need fuel bout get overwatch join thank  i love          ,,1
UNCLE CHUNT  Join the Chunt Corps!,20171202,so i spend sunday i okay #xbox #xboxon #xboxon #superman #dccomic #assassinscreedorigin @ubiaustralia #ubisoft #lg #collectorsedit #godsedit #gearsofwar4 @xboxaustralia @dccomic,,6,0,0,english,False,so i spend sunday i okay              ,,1
Rob,20171202,it hard take pictur justic new #xbox setup look like i spent 20 hour get setup rewir perfect past day i could happier i felt #xboxonex deserv best setup i could provid,,264,37,38,english,False,it hard take pictur justic new  setup look like i spent 20 hour get setup rewir perfect past day i could happier i felt  deserv best setup i could provid,,1
Warren (wf6@mastodon.social) still tweeting,20171202,@xboxsupport just order #xboxonex with #assassinscreedorigin bundl deal anticip deliveri howev i know x backward compat digit cd well i still origin #xbox hope play game xboxonex,,0,0,0,english,False, just order  with  bundl deal anticip deliveri howev i know x backward compat digit cd well i still origin  hope play game xboxonex,,1
GamingLyfe Network,20171202,#qotd what favorit #remast game make sure comment tag friend #halo #haloc #masterchief #haloceanniversari #microsoft #xbox #xboxon,,5,0,1,english,False, what favorit  game make sure comment tag friend       ,,1
VΞRDICT4489,20171202,best open world game #2017 graphic consol #playstat #xbox #ps4 #ps4pro #xboxon #xboxon #xboxonex,,14,11,9,english,False,best open world game  graphic consol       ,,1
 Ryan H ,20171202,serious wait play @monsterhunt @xbox one x it look amaz i go bit smeagol #xbox #xboxonex,,0,0,0,english,False,serious wait play   one x it look amaz i go bit smeagol  ,,1
VΞRDICT4489,20171202,what best look game graphic consol gen opinion #playstat #xbox #ps4 #ps4pro #xboxon #xboxon #xboxonex,,6,7,44,english,True,what best look game graphic consol gen opinion       ,,0
Rick,20171202,abit orginigs current gen stuff #gamer #gamern #gamersthatlift #playstation4 #xboxon #nintendo #xbox #gamenerd #gamergeek #geek #geek #retrogam #retrogam #retro #gamerlad #gamerguy #gamergirl #gamecollect #gamecollector #videogamecollect,,3,0,1,english,False,abit orginigs current gen stuff                    ,,-1
TRIPTONICS ZA,20171202,could cover girl @triptonics_za #sagam #codza #xbox #xboxon #photographi #blackandwhitephotographi #blackandwhit #blackandwhitephoto,,2,0,0,english,True,could cover girl         ,,0
LarZen ➐ ,20171202,#xbox rais bar #xboxonex that awesom but also make excit see come after consol it long ago end consol now consol futur promis ever,,1,0,0,english,False, rais bar  that awesom but also make excit see come after consol it long ago end consol now consol futur promis ever,,1
MrsKanine,20171202,my first full legendari set #shadowofwar #xbox #xboxon,,1,0,0,english,False,my first full legendari set   ,,-1
x519MaLoNeYx,20171202,just want share easi tip extra xp #bf1 especi 2xp weekend #battlefield1 #xboxon #xboxonex #ps4 #ps4pro #xbox #xboxliv #dice #ea,,1,0,0,english,False,just want share easi tip extra xp  especi 2xp weekend         ,,1
🅶🅴🅴🅺🆃🆆🅴🅴🆃,20171202,here go the #xboxonex forc run #pubg 30fps avoid advantag regular #xbox seem like @microsoft think one,,1,0,0,english,False,here go the  forc run  30fps avoid advantag regular  seem like  think one,,-1
x519MaLoNeYx,20171202,if anyon interest play #battlefield1 #xboxon 2xp weekend i 5 squad xp boost i will burn weekend hmu #xbox @ x519maloneyx,,0,0,0,english,False,if anyon interest play   2xp weekend i 5 squad xp boost i will burn weekend hmu   x519maloneyx,,1
Ernesto Manuel Colon jr,20171202,#xboxonex #xbox new storag x,,0,0,0,english,False,  new storag x,,-1
Lisa,20171202,my xbox broke #xbox #xbox360,,0,0,1,english,False,my xbox broke  ,,-1
Author/Recovering,20171202,fabl fortun is worth buy right i wait releas date and releas date #xbox #xboxon #fablefortun #beta #xboxstor #game,,0,0,0,english,True,fabl fortun is worth buy right i wait releas date and releas date      ,,0
GAME Hemel ,20171202,you pick #xboxonex extra control either #forza7 #halowars2 #onlyatgam get 20 back point #gameelit #xbox,,0,0,0,english,False,you pick  extra control either    get 20 back point  ,,-1
Backudog,20171202,got enough #xbox game last buy bit apart #pubg #xboxonex would rude instead slowli build #4kmovi collect,,11,1,2,english,False,got enough  game last buy bit apart   would rude instead slowli build  collect,,-1
BIG_HERM Twitch.tv,20171202,ok everyon comment #playstation4 like #xboxon i person #xbox far favorit,,1,0,0,english,False,ok everyon comment  like  i person  far favorit,,1
BIG_HERM Twitch.tv,20171202,who els excit #pubg #xbox #xboxonex #xboxon #epic #awesom #game,,1,0,0,english,True,who els excit       ,,0
BIG_HERM Twitch.tv,20171202,got 7 year old son christma #minecraftedu #minecraft #xboxon #xbox #game,,0,0,0,english,False,got 7 year old son christma     ,,-1
Warren (wf6@mastodon.social) still tweeting,20171202,@xboxaustralia just order #xboxonex with #assassinscreedorigin bundl deal anticip deliveri howev i know x backward compat digit cd well i still origin #xbox hope play game xboxx,,0,0,0,english,False, just order  with  bundl deal anticip deliveri howev i know x backward compat digit cd well i still origin  hope play game xboxx,,1
OGCryptor,20171202,my 6 year old son much higher game score #xboxon #xbox i torn whether mean i horribl #dad awesom one opinion vari quit bit household,,0,0,0,english,False,my 6 year old son much higher game score   i torn whether mean i horribl  awesom one opinion vari quit bit household,,-1
TaRgZ • INFP,20171202,i need help #christamsgift #xbox #xboxonex #nintendo #nintendoswitch,,0,0,0,english,False,i need help     ,,-1
Noob Skillz,20171202,which better #nintendo #playstat #xbox #xboxon #ps4 #nintendoswitch #xboxon #xboxonex #playstation4,,1,1,0,english,True,which better         ,,0
MF  ,20171202,this part communiti #toxicplay #toxic #abusiveplay #xboxon #xbox #report,,0,0,0,english,False,this part communiti      ,,-1
GAMELIFE.COM,20171201,grand theft auto gta v basebal bat rockstar game #golf #basebal #grandtheftauto #gta #rockstargam #videogam #collect #promo #gamelif #playstat #xbox #ps1 #ps2 #ps3 #xboxon #xboxliv,,1,0,0,english,False,grand theft auto gta v basebal bat rockstar game                ,,1
Samantha J. Foster Composer,20171201,the current game librari xbox one x #gamedev #xboxonex #xbox,,0,2,0,english,False,the current game librari xbox one x   ,,-1
GD,20171201,rain blob endi xbox one 12th start dec 20th releas #xbox #xboxon #monogam #indiegam #indiedev #gamedev #arcad #pixelart #anim #chiptun #localmultiplay,,1,2,0,english,False,rain blob endi xbox one 12th start dec 20th releas           ,,-1
Adam Lillyston,20171201,who play cuphead this game infuri i love much #cuphead #xboxon #game #life #happi #gamer #game #xbox #xboxon #cup #head #youdi #ps4 #playstat,,0,0,0,english,True,who play cuphead this game infuri i love much              ,,0
VΞRDICT4489,20171201,how mani copi #pubg expect sell #xbox #xboxon #xboxon #xboxonex,,1,1,0,english,False,how mani copi  expect sell    ,,-1
Endi,20171201,xbox one dec 12th start dec 20th releas #xbox #xboxon #monogam #indiegam #indiedev #gamedev #arcad #pixelart #anim #chiptun #localmultiplay @id_xbox,,38,36,3,english,False,xbox one dec 12th start dec 20th releas            ,,-1
Freddy Vasquez,20171201,#xboxonex #gtaonlin #xbox play 10 hour gta onlin add ill add back btw im win qled samsung tv,,0,0,0,english,False,   play 10 hour gta onlin add ill add back btw im win qled samsung tv,,1
VΞRDICT4489,20171201,i sure i forgot add hand ps4 game pretti much lineup hold till game 2018 beyond drop i beat like 90 ps4 game 90 xbox game still play #playstat #xbox #ps4 #xboxonex,,3,0,1,english,False,i sure i forgot add hand ps4 game pretti much lineup hold till game 2018 beyond drop i beat like 90 ps4 game 90 xbox game still play    ,,1
Wandering Dutch ᚴᚱᛁᛘᚠᚱᚬᛋᛏ,20171201,a s control complet collect how like #xbox #xboxon #xboxonex @xbox,,14,0,6,english,True,a s control complet collect how like    ,,0
fritzzes,20171201,christma present came earli #xboxonex #xbox #xboxon,,0,0,0,english,False,christma present came earli   ,,-1
Nitemare,20171201,just small 2 minut clip mad i caus tdm what wreckag i caus #wwii #codwwii #ww2 #game #xboxon #xbox #tdm #mad #iwentinlikeawreckingbal #damnrightiledmyteam,,1,0,0,english,False,just small 2 minut clip mad i caus tdm what wreckag i caus          ,,-1
Quisty⓯⓯⓯,20171201,@xboxuk i want #xbox #onesi pwetti pweas #xboxonex #xboxonexenhanc #forza7,,0,1,0,english,False, i want   pwetti pweas   ,,1
Gideon of Vita Island,20171201,i think seem wors right #xboxonex clear better system #ps4pro #playstat clear better game select #xbox so actual argu appl appl side respect hill die,,0,0,1,english,False,i think seem wors right  clear better system   clear better game select  so actual argu appl appl side respect hill die,,1
VΞRDICT4489,20171201,will still buy #pubg #xbox butthurt #xboxon #xboxon #xboxonex,,7,5,2,english,False,will still buy   butthurt   ,,-1
Stevie T13,20171201,#oriandtheblindforest complet start amaz get frustrat stun game #xboxon #xbox #game,,0,0,0,english,False, complet start amaz get frustrat stun game   ,,1
Andrei,20171201,latest acquisit #wwe #wwe2k18 #wwe2k #smackdownl #raw #nxt #2k #xboxon #xbox,,0,0,0,english,False,latest acquisit         ,,-1
Adam Badger,20171201,i #teamnostick babi #xboxon #xbox,,0,0,0,english,False,i  babi  ,,-1
GM,20171201,halo have great friday #pwnedgam #halo #halo3 #halo4 #bungi #xbox #microsoft #xbox360 #game #game #friday #gamingnight #capetown #southafrica,,1,0,0,english,False,halo have great friday              ,,1
VΞRDICT4489,20171201,if #microsoft announc game e3 i would pump hell #xbox #xboxon #xboxon #xboxonex 1 open world alien invas 2 fantasi rpg witcher fabl style 3 3rd p linear action adventur 4 forza horizon 4 5 og xbox bc game 6 ryse 2 7 halo 6,,10,6,5,english,False,if  announc game e3 i would pump hell     1 open world alien invas 2 fantasi rpg witcher fabl style 3 3rd p linear action adventur 4 forza horizon 4 5 og xbox bc game 6 ryse 2 7 halo 6,,1
Ryan Daws ,20171201,outcri #pubg like 30fps launch #xboxonex pubg enough need 60fps focus graphic deliv lock 30fps first make sens game dev know think better go #xbox #xboxon #game,,1,0,2,english,False,outcri  like 30fps launch  pubg enough need 60fps focus graphic deliv lock 30fps first make sens game dev know think better go   ,,-1
Dylan Graham,20171201,what would you @1vs100xboxliv came back @xbox #xbox #xboxsweepstak #xboxon #xboxonexenhanc #xboxlivesess #xboxlivegold #xbox1 #xboxliv,,1,0,0,english,True,what would you  came back         ,,0
Woodstock Production,20171201,rt dcfstudio do let past haunt #cruzbroth #dcfstudio #game #ps4 #playstat #soni #fight #fightgam #indi #indiedev #gamedev #gameplay #ufc #uniti #acb #acbmma #fightgam #box #mma #xbox #xboxon #xboxonex #steamgam #steam add wish list,,0,0,0,english,False,rt dcfstudio do let past haunt                         add wish list,,-1
Ernesto Manuel Colon jr,20171201,finish #xbox quest #xboxquest download log mixer got 400 gamerscor game #xboxonex,,0,0,0,english,False,finish  quest  download log mixer got 400 gamerscor game ,,-1
Nikkolai de Leon,20171201,semest done now let explor egypt #assassinscre #origin #acorigin #xbox #xboxon #game #gamer,,1,0,0,english,False,semest done now let explor egypt       ,,1
glenn,20171201,@xboxp3 @id_xbox @xboxstor @xboxliven 45 degre i pleas buy onesei #xbox #xboxon #cold,,0,0,0,english,True,    45 degre i pleas buy onesei   ,,0
El TuckerO,20171201,get close quarter million gamerscor one complet #250k #parti #cheevo #achievementunlock #game #xbox #complet #xboxon #achiev #boom,,0,0,0,english,False,get close quarter million gamerscor one complet          ,,-1
Electronic Gaming F.,20171201,#xbox #xboxon #game monster energi supercross the offici videogam championship trailer,,0,0,0,english,False,   monster energi supercross the offici videogam championship trailer,,1
Dave W,20171201,final 1st decemb time #doomvfr #xmas jumper 11 sleep until #pubg #xbox #xboxonex #xboxon #xboxon,game lutongam luton @gamelutonacnov 30 2017 #christmasjumperday #christmasjumperday fast approach guy girl we massiv rang #awesom #awesom #christmasjump #christmasjump stock friend @numskulldesign @numskulldesign come grab gone,1,1,0,english,False,final 1st decemb time   jumper 11 sleep until     ,game lutongam luton  30 2017   fast approach guy girl we massiv rang     stock friend   come grab gone,-1
bjorn,20171201,hey fellow gamer i need help i point i need buy xbox one x i wonder good run smooth everyth say pleas honest @xbox #xboxonex #gamer #xbox,,1,0,1,english,False,hey fellow gamer i need help i point i need buy xbox one x i wonder good run smooth everyth say pleas honest    ,,1
Gundam Jaeger,20171201,dig new hero moira #overwatch #xbox #xboxon #videogam @playoverwatch @unitlostgam,,2,0,0,english,False,dig new hero moira      ,,1
Zechariah Craig,20171201,enjoy @projectcarsgam #projectcars2 #projectcars2photomod #xbox #xboxonex #simrac,,5,2,0,english,False,enjoy      ,,1
Dallas Haselhorst ¯\_(ツ)_/¯,20171201,i play @xbox often time i sit i get updat instead serious deal gb consol updat night gb game updat tonight #xbox #xboxon #maybetomorrow,,0,0,0,english,True,i play  often time i sit i get updat instead serious deal gb consol updat night gb game updat tonight   ,,0
Ryan Orr,20171201,@xbox funni origin #xbox control indestruct i even get #xboxon control last 6 month #pathet,,0,0,0,english,False, funni origin  control indestruct i even get  control last 6 month ,,1
Game Infinite,20171201,after beat cod wwii want see older game look like 4k xbox one x halo 5 look better ever #halo #halo5 #halo5guardian #4kgame #feelthepow #xbox #xboxon #xboxonex #game #videogam,,7,1,1,english,False,after beat cod wwii want see older game look like 4k xbox one x halo 5 look better ever          ,,1
OGCryptor,20171130,my copi #teso #eso #xbox #xboxon arriv two day it year sinc i play i pc help guy class think i play someth fun i stick long term someth viabl pvp love pvp,,0,0,0,english,False,my copi     arriv two day it year sinc i play i pc help guy class think i play someth fun i stick long term someth viabl pvp love pvp,,1
Wolves of Amarok ™,20171130,repost @nerdlife1987 via @crowdfir game station #like4lik #pcgame #xbox #xboxon #xboxon #thewitcher3 #gamer #gamerlif,,0,0,0,english,False,repost  via  game station        ,,-1
VΞRDICT4489,20171130,these game i current #xbox i ad #pubg gonna own day 1 also #forzahorizon3 i forgot add #xboxonex,,20,2,6,english,False,these game i current  i ad  gonna own day 1 also  i forgot add ,,-1
Johan Andersson,20171130,my birthday today earli birthday present self launch 7th novemb #xbox #xboxsv #xboxonex,,2,0,3,english,False,my birthday today earli birthday present self launch 7th novemb   ,,-1
Donovan Bond,20171130,quick glanc ps2 fat #xboxonex #xboxon #xbox,,0,0,0,english,False,quick glanc ps2 fat   ,,-1
VΞRDICT4489,20171130,i person realli look forward i alway want good straight pirat game #seaofthiev #xbox #xboxonex,,15,3,3,english,False,i person realli look forward i alway want good straight pirat game   ,,1
Jason Price,20171130,if xbox one s xbox one x keep game use consol gamertag altern room #xbox #xboxon #xboxonex,,0,0,3,english,True,if xbox one s xbox one x keep game use consol gamertag altern room   ,,0
VΞRDICT4489,20171130,which one given bang buck #xboxonex #ps4pro #nintendoswitch #xbox #playstat #nintendo,,10,11,8,english,True,which one given bang buck      ,,0
Rewired ix,20171130,sinist kingz look hardcor search destroy player if least kd snd hit or find us xbox gt icon xv @icon_xv rewir ix @rewiredix #codwwii #cod #xbox #xboxon #xb1 #codww2,,1,0,0,english,False,sinist kingz look hardcor search destroy player if least kd snd hit or find us xbox gt icon xv  rewir ix       ,,-1
Travis Julian,20171130,new merch #codcamp #game #freund #zocker #gamer #game #mario #ps4 #playstat #playstation3 #playstation4 #xboxon #csgo #cod #gtav #gta5 #bo2 #bo3 #callofduti #minecraft #control #deutsch #xbox #fazeup,,0,0,0,english,False,new merch                        ,,-1
VΞRDICT4489,20171130,what kind game favorit #playstat #xbox #nintendo #pc #ps4 #ps4pro #xboxon #xboxon #xboxonex #nintendoswitch,,4,4,6,english,True,what kind game favorit          ,,0
Tyler Turcotte,20171130,this cuphead xbox one s coolest special version consol i ever seen i need #xbox #xboxon #cuphead,,0,0,0,english,False,this cuphead xbox one s coolest special version consol i ever seen i need   ,,1
VΞRDICT4489,20171130,your favorit #halo game #xbox #xboxon #xboxon #xboxonex,,2,1,2,english,False,your favorit  game    ,,1
Riccardo,20171130,@remedygam fix #quantumbreak visual bug #xboxonex pleas i love game much day one i want play one time best new #xbox consol,,0,0,0,english,False, fix  visual bug  pleas i love game much day one i want play one time best new  consol,,1
Alex Walls,20171130,anyon abl recommend good wireless headset #xboxon i look a50 id rather sell kidney also look @razer man war could find yes answer compat #xbox,,0,0,0,english,False,anyon abl recommend good wireless headset  i look a50 id rather sell kidney also look  man war could find yes answer compat ,,-1
GM,20171130,new arriv #pwnedgam #ps4 #playstation4 #xbox #xboxon #bubsi #zerotimedilemma #syberia3 #toysoldi #warchest #ubisoft #microid #accolad #aksysgam #game #game #gameshop #capetown #southafrica #newarriv,,1,0,0,english,False,new arriv                    ,,-1
qwertyuiop,20171130,instant classic #cuphead #xboxon #xbox,,0,0,0,english,False,instant classic   ,,-1
TheRealRetroStoreONT,20171130,we buy day long #throwbackthursday #xbox #xbox360 #xboxon #microsoft #fallout4 #toronto #miltonon #oakvill #brampton #mississauga #haltonhil,,2,0,0,english,False,we buy day long            ,,-1
VΞRDICT4489,20171130,for fun would pay play #worldofwarcraft #xbox #ps4 announc come consol #ps4 #ps4pro #xboxon #xboxon #xboxonex,,3,2,3,english,False,for fun would pay play    announc come consol     ,,1
A Wild Hanimal,20171130,@eaplaytest thank game test someth today #xbox #xboxon #starwarsbattlefrontii #starwar,,0,0,0,english,False, thank game test someth today    ,,1
VΞRDICT4489,20171130,would excit #microsoft made exclus open world alien invas game kinda like war world battl la i know i would #xbox #xboxon #xboxon #xboxonex,,6,5,7,english,False,would excit  made exclus open world alien invas game kinda like war world battl la i know i would    ,,1
